"Hi all,My friends and I have plan to visit India in next week. We're still discussing about transportation in Jaipur. We will be land by plane on 21 Mar 2020 around 6/7pm. We'll be staying in Tuk Tuk Hostel, if there's no change. We just have full day 22 Mar 2020 to explore Jaipur.So far our itineraries are:1. Nahargarh Fort (Sunrise)2. Amber Palace3. Amber Fort4. Stepwell*5. Jal Mahal6. Hawa Mahal7. City Palace (sightseeing)8. Jantar Mantar9. Albert Hall (Sunset)10. Sun Temple (Sunset)* *optionalHowever, I am looking at this option https://www.tripadvisor.com/AttractionProduc… somehow it is just not enough, most of packages starts from 8am, to get sunrise at least 5am should start to Nahagarh Fort.We hope it won't exceed 1500Rs for transportation, since any admission will be paid by us and it's around 500Rs per person.Our train will be 2am on 23 Mar 2020. Any help/ideas are welcome."
Tuk tuk is good option.and if you hire car then book one day before you have a list many monument so do fastThanksRuralindiavacations
"Namaste!Welcome to the forum post!!!Now presently all things are closed and transport too due to Covid 19 as we know that.Edited: 8:18 am, March 23, 2020 "
"-:- Message from Tripadvisor staff -:-Tripadvisor staff removed this post because it did not meet Tripadvisor's forum posting guidelines with prohibiting self-promotional advertising or solicitation.We ask all of our members to keep their forum messages free of self-promoting advertisements or solicitation of any kind - members affiliated with any tourism-related business should not include commercial contact information or URLs in their forum messages.To review the Tripadvisor Forums Posting Guidelines, please follow this link: http://www.tripadvisor.com/pages/forums_posting_guidelines.htmlWe remove posts that do not follow our posting guidelines, and we reserve the right to remove any post for any reason.Removed on: 9:20 am, April 12, 2020Edited: 9:20 am, April 12, 2020 "
"-:- Message from Tripadvisor staff -:-Tripadvisor staff removed this post because it did not meet Tripadvisor's forum posting guidelines with prohibiting self-promotional advertising or solicitation.We ask all of our members to keep their forum messages free of self-promoting advertisements or solicitation of any kind - members affiliated with any tourism-related business should not include commercial contact information or URLs in their forum messages.To review the Tripadvisor Forums Posting Guidelines, please follow this link: http://www.tripadvisor.com/pages/forums_posting_guidelines.htmlWe remove posts that do not follow our posting guidelines, and we reserve the right to remove any post for any reason.Removed on: 9:20 am, April 12, 2020"
I wil suggest to postpone your plan due to COVID-19
"-:- Message from Tripadvisor staff -:-Tripadvisor staff removed this post because it did not meet Tripadvisor's forum posting guidelines with prohibiting self-promotional advertising or solicitation.We ask all of our members to keep their forum messages free of self-promoting advertisements or solicitation of any kind - members affiliated with any tourism-related business should not include commercial contact information or URLs in their forum messages.To review the Tripadvisor Forums Posting Guidelines, please follow this link: http://www.tripadvisor.com/pages/forums_posting_guidelines.htmlWe remove posts that do not follow our posting guidelines, and we reserve the right to remove any post for any reason.Removed on: 6:56 am, April 10, 2020"
