"#81 - Thanks for sharing it. I, however, am as unconvinced by the ‘people overestimating risk and media hype’ crowd as I am by the ‘it is a pandemic’ crowd. The fact is that we do not know enough to know which is closer to the truth. It is considerably harder to estimate the growth as well as mortality rate at this stage. The NY Times article I shared in #44 is much more credible to the extent it points out what we do not know and is written by an epidemiologist engaged with this situation, whereas the #81 article is somewhat timeless observation about the irrationality in the human risk estimation and decision making. The two key issues are reproduction factor and mortality rate - and neither is totally clear. Sure we have seen one back-of-envelope logic right on this thread, but that’s all it is. The article in #44 points out that Sars virus mortality rate was underestimated due to poor math and the eventual mortality rate came to a much higher number. So, we know a lot but also too little at this stage. On one hand, the virus is largely limited to China and even more localized there. Yet, there remains a chance for it to become a pandemic as well. So, this remains a case of decision making under uncertainty - when the nature of the uncertainty remains, well, uncertain (with incomplete data to characterize it statistically). What is clear is that countries like Nepal are not particularly well placed to to handle it (not to say that more resourceful countries are much better placed). So, stopping the spread at an early stage is quite critical. But, I suspect the intrinsic characteristics of the contagion is perhaps a bigger determinant than the half-hearted efforts reported here.Edited: 10:54 am, February 15, 2020 "
"Post 84: the NYT article linked in post 81 focuses primarily on the perceptions, biases etc and the roots of these, rather than technical stuff about the virus. It therefore helps to explain the highly negative character of both many of the posts under this topic, and the tone and nature of much of the general public discourse, even allowing that media outlets have a product that they need to sell. With much still to be learned about this virus, cold 'logic' would suggest caution in people's views, especially 'forecasts' and 'extrapolations'.Post 73 is almost a mirror of some of the very negative posts, especially the (express or implied) prognoses."
"#85 - Thank you! I understood the NYT article in post 81, and am even familiar with the research of Amos Tversky, left, and Daniel Kahneman referenced there. In fact, here is an interesting New Yorker link to their story - https://www.newyorker.com/books/page-turner/…Speaking only for myself, I am mostly interested in cold logic, as the people's behavior will run the somewhat predictable gamut.Speaking of that - a New Yorker daily comment on Coronavirus and viral pandemic is quite interesting and illuminating:https://www.newyorker.com/news/daily-comment…"
"Much of the UK press has been very similar to the NYD article, an example here, that has all the key ingredients of such articles: https://www.dailymail.co.uk/news/article-800…"
Another NYT article on cognitive biases and the new conoravirus:https:/…coronavirus-fear.html
"Today Nepal evacuated 175 students from Wuhan and transfered them to a quarantine location in Bhaktapur. They're bound to be criticized for defying WHO recommendations to not place a quarantine facility near high densities of people, but that's pretty par for the course for Nepal, stubborn to a fault.It also appears as if the thermal monitors at TIA are correctly put in place, and hopefully staffed properly.As a harsh critic of Nepal's authorities, I am somewhat impressed with the proactive measures as of late. They are not up to Western standards, but seem to rise above the usual kid-like approach to these things in Nepal."
Nobody have corona Virus In Nepal.just found one guy he came from china but now he also discharge from hospital.
Fear of tourists from the North putting off other tourist?https://kathmandupost.com/national/2020/02/1…
"I am scheduled to travel to Nepal through Doha like you, but I am not scheduled to arrive until May 4th. My plans include motorcycling into Tibet. While I have trip insurance, I'm anxiously watching and hoping for the best. With 75 days till my departure, I'm hoping for the best."
"I'm scheduled to arrive March 21 through Dubai and I'm starting to get nervous as of today. Even if there are no more cases by the time I leave, there could be more cases while I'm there and that could be a nightmare! And I guess we can kiss our deposits good bye if we end up having to cancel out of an abundance of caution?!"
"Hello there we are headed to Nepal in 5 weeks and we am wondering how you are getting on with your trip, have you arrived in yet? And is there any up date on your previous post here. Thank you."
"In yet more bad luck, fly365 have gone under in Australia, along with my flights and $$$$. leaning towards not rebooking now , and going in late Sept for two months. Virus might be under control by then"
"@ Koffee # 93: Yes, the time is quite difficult. My flight is from Europe to Doha 11th March and same day from Doha to KTM by Qatar Airways. I don't know yet what happens when the flight Doha --> KTM will be dancelled ? Than I have to stay in Doha? What do you think?"
"It's sure not looking good for my scheduled departure for KTM through Doha is in 66 days.Given what we (reportedly) know about how the virus is transmitted, it seems like avoiding contact with potentially infected or exposed people is a key personal prevention tactic. Still, one has to ask questions about things like food and lodging. Who was in the beds we will sleep in? Where did they come from? With whom have they come in contact? The same can be asked about who is preparing our food.I am anxiously hopeful, but not optimistic."
"I'm in the same boat as you -- I'm scheduled to leave for Ktm on 19 April, and be in Nepal thru 25 May. I'll be in Dolpo, nice and close to the Chinese border!!I think it would be a risky proposition to be sure, and at this point I've pretty much assumed that my trip will need to be cancelled. It seems to me virtually impossible that Nepal will not become infected with the virus -- and given the health facilities in Nepal, I'd expect it to quickly become epidemic in the country."
"I am scheduled to leave for KTM on 27 March, do Langtang trek. So far I dont think about canceling my trip. I will see, maybe later situation will force me to cancel. Virus started to spread in Europe and in month stay in Europe may be same or more risky that to go to Asia.Edited: 12:07 pm, February 26, 2020 "
"Putting Coronavirus aside, I read the following list of vaccinations online today. Does anyone really get all these and if so, is there a recommended regimen or pace?The CDC and WHO recommend the following vaccinations for Nepal: hepatitis A, hepatitis B, typhoid, cholera, yellow fever, Japanese encephalitis, rabies, meningitis, polio, measles, mumps and rubella (MMR), Tdap (tetanus, diphtheria and pertussis), chickenpox, shingles, pneumonia and influenza."
"#100 you need to consult your own doctor based on what valid and current vaccination record you have. Here is a previous post discussion on that https://www.tripadvisor.com.au/ShowTopic-g29…Personally I would have all of those mentioned with less importance on rabies and shingles and many of those like tetanus, chicken pox , measles and rubella are standard travel and in your country any way."
"Whoa! That's a long list. I hadn't planned on getting any vaccinations but now I'm looking at the CDC recommendations and I may need to visit a travel clinic and see how many of these I really need to worry about. Again, at this point I feel like there's still a good chance I may have to cancel the whole trip depending on Coronavirus. Because 2 weeks from now we could be facing a whole new situation with this virus. So I feel like I'm in limbo."
"As Ali said, most of those we get in the States anyway (unless you're an anti-vaxxer). I live on a farm, so tetinus is always up to date!"
"#102 personally I would still go if in two weeks based on what we currently know of one infection case at present and in that time not likely to go exponential.One worry on the horizon is that countries west in Iran etc have an outbreak and it may enter via the land borders among communities via there regardless of any China visitors. This is likely to take time to spread from that direction possibly months.Edited: 5:57 pm, February 26, 2020 "
"CDC does NOT recommend all of those vaccinations specifically for travel to Nepalhttps:/…vaccines-and-medicinesNo mention of cholera. Yellow Fever only if you are coming FROM/transiting through a country with yellow fever, etc etc.. Many listed fall into the ""routine"" vaccinations... ones you should be up to date on regardless of travel. As Ali notes, there are definitely some anyone traveling to Nepal must add. How did you reach conclusion that they recommended so many for Nepal?Edited: 6:09 pm, February 26, 2020 "
"-:- Message from Tripadvisor staff -:-This post has been removed at the author's request. The author may repost if desired.Posts on the Tripadvisor forums may be edited for a short period of time. Once the edit period has expired, authors may update their posts by removing and reposting them.To read more about editing your posts, please follow this link: http://www.tripadvisor.com/help/how_to_edit_your_postsRemoved on: 3:26 am, March 02, 2020Edited: 3:26 am, March 02, 2020 "
"#104 Yeah I want to be optimistic - it's hard to do because the news makes everything seem dire! I'm hoping that by the time I'm supposed to leave, I'll have a better perspective on the issue."
Nepali Times has an article about Covid-19 and VNY2020:https:/…scoodly
Those were pasted from the CDC website.
Please keep us posted on your decision (or the decision made for you by the government or other authority).
"I fly to Kathmandu tomorrow. We have four groups joining us in March and April with a total of 35 travelers. So far, we're going as planned. We have a team of medical officers overseeing our season, and I've done my best to keep tabs on what's going on in Nepal.I have a meeting with Dr. Regmi , the new head of the Nepal Tourism Board, and later with Yogesh Bhatarrai, the Minister of Tourism. I expect both to tell me nothing but how prepared Nepal is. I am not 100% optimistic our April tours will go. If we get to a point where this thing spreads more, just the travel headache getting to KTM will be a deal breaker."
https:/…Corona is now a hot topic in politics. Visit Nepal year would probably be cancelled soon with restrictions on travel including tourists.
"Hi Everyone,What is the current ruling of Nepal in regards to tourists coming from outside. Did nepal already provide a list of passengers from what country that will not be able to enter the kathmandu? I have a trip to Kathmandu on May 2nd from Philipines - transit in Singapore - Kathmandu. Im currently in Canada and flying to philippines in a month time ( direct CANADA - Philippines)thanks!Edited: 6:33 pm, February 28, 2020 "
"Paolo: nothing yet. But who knows for May! (Did you buy travel insurance? If not, it may not be too late to do so, as Canada has not yet issued any travel advisory for the countries you mention.)Edited: 7:04 pm, February 28, 2020 "
"-:- Message from Tripadvisor staff -:-Tripadvisor staff removed this post because it did not meet Tripadvisor's forum guideline with regards to harassment of another user. We will remove messages that include personal attacks or hostility directed at an individual user or group of users, threatening language or attempts to force a user to discontinue participation on our forums.To review the Tripadvisor Forums Posting Guidelines, please follow this link: http://www.tripadvisor.com/pages/forums_posting_guidelines.htmlWe remove posts that do not follow our posting guidelines, and we reserve the right to remove any post for any reason.Removed on: 2:45 am, February 29, 2020"
"-:- Message from Tripadvisor staff -:-Tripadvisor staff removed this post because it made false or speculative claims about Tripadvisor and its staff, or it quoted or summarized private correspondence from Tripadvisor staff.To review the Tripadvisor Forums Posting Guidelines, please follow this link: http://www.tripadvisor.com/pages/forums_posting_guidelines.htmlWe remove posts that do not follow our posting guidelines, and we reserve the right to remove any post for any reason.Removed on: 2:45 am, February 29, 2020"
"I've been living in or traveling to Nepal for years and always go with Hep A, Typhoid, and an up-to-date tetanus booster. No rabies or any of the others that the CDC has listed under ""Some Travelers"". For meds while trekking, I always have Diamox and azithromycin , complemented by a small array of cough and cold symptom relief."
"I've been living in or traveling to Nepal for years and always go with a laid-back open mindset, and an up-to-date Dal bhat booster. No cocaine or any of the others that the CDC has listed under ""Some Travelers"". For meds while trekking, I always have black coffee and eggs, complemented by a small array of fresh air and much-sleep symptom relief."
Unless one travels to Nepal to only flex mountain walking muscle then there is a chance to come away with a different slant on things.The air quality in parts of China have improved vastly due to factory slowdowns based on the virus spread.Humans are getting sick but the earth heals a little!
"Hi John You wrote: ""Humans are getting sick but the earth heals a little!"" I find that a rather offensive comment given that three thousand people are dead with no end in sight. EricMy Nepal Pages https://wanderingeric.org/category/nepal/Edited: 2:40 am, March 02, 2020 "
"@ John in # 120: You are right, I agree with you.And now I son't know what to do ???My flight is in 8 days from Europe to KTM via Doha?Should I fly or shouldn't I fly?"
"-:- Message from Tripadvisor staff -:-This post has been removed at the author's request. The author may repost if desired.Posts on the Tripadvisor forums may be edited for a short period of time. Once the edit period has expired, authors may update their posts by removing and reposting them.To read more about editing your posts, please follow this link: http://www.tripadvisor.com/help/how_to_edit_your_postsRemoved on: 3:25 am, March 02, 2020"
"I'm also torn @Toni, although I have a couple more weeks than you to decide. It just seems kind of foolish to travel at this point because it's hard to predict what will happen whilst in Nepal. I'm leaning more towards postponing my trip but I'm giving myself until Friday to make a decision either way. I think you have to decide in the next day or two since you're leaving much sooner."
"I’m not scheduled to fly to Ktm until 21 April, and return home at the end of May.Even tho my flight is still 7 weeks out, I’ve pretty much decided to postpone my trek (Dolpo) until next year. The coronavirus situation is still so unknown, and I’m pretty sure that I won’t have the answers I need over the next few weeks. Being a camping trek with full staff, I didn’t want to cancel at the last minute.Unlike most other injuries or heath problems that may occur while trekking, this disease has a very different characteristic... If I’m in Nepal and I bash up my body in a fall, or contract some serious disease, my travel insurance will fly me out to nearby cities (e.g. Bangkok, etc.) for treatment if warranted. So I’m good with that level of risk.But in the case of the coronavirus, evacuation to another country may prove to be entirely impossible due to entry restrictions of the various countries. That could mean that I’m relegated to treatment in Nepal, and trying to obtain respiratory supportive care in the midst of an epidemic in the country. My age doesn’t help either – I’m 62, so at the cusp of old age becoming a big factor. Even if I were to start my trek whilst everything is OK in Nepal (i.e. no confirmed cases), over the 30 days of my trek the situation could completely change. Given Nepal’s poor health infrastructure, an epidemic could occur very quickly.Overall, I really feel that (for me) going to Nepal now seems like a big risk to take. I REALLY hate to say it – I love Nepal, have lived there, and done almost 20 trips -- but just too many unknowns for me to consider taking the trip this spring. I have another trip to Nepal scheduled for the fall, and I’m still optimistic that I will be able to do that one. Certainly over the next few months we’ll learn lots about the virus, and it will be easier to make an informed decision about international travel."
"Hi Mike - You make a lot of good points. There's also the possibility that Nepal just doesn't have the capability yet to test and give accurate numbers about the spread of the virus. The testing capacity even here in the U.S. is very limited from what I understand. So I'm not convinced that we can be reasonably certain that the virus hasn't spread in Nepal esp because they haven't put any restrictions on travelers until this new visa restriction which doesn't even go into effect until next week!It just doesn't seem to be worth the risk. I'd much rather travel without the cloud of corona virus hanging over my head for a whole month. I too hate to postpone but I feel like I don't have a choice. I have to admit I hate the idea of potentially losing my large deposit and paying flight change fees. Ugh!Edited: 12:19 pm, March 02, 2020 "
"Clearly I have no way of knowing -- but it is definitely my assumption that the virus is currently in Nepal, albeit undetected.Lots of reasons that I feel this way: - Several confirmed carriers have been released back into the population: Per a recent article in Nepali Times, several confirmed carriers either walked out of the hospital, or were inadvertently released before their test results came back. I don't know how much karma Nepal has in the bank, but it seems to me pretty unlikely that none of these carriers spread the disease further... - Nepal has continued to allow flights in from affected countries (although there has been a recent announcement to curtail these flights). Per a recent article, 3000 travelers flew to Nepal from China just in the first three weeks of Feb... - Every report and post I've read on the topic has said that screening procedures at TIA were completely ineffective (although to be fair, airport screening only has limited potential effectiveness...) - The virus should be able to spread thru Nepal extremely easily, given the dense population, poor hygiene conditions, poor health facilities, and various cultural norms (e.g. spitting, coughing in the open, etc.) - The disease is virtually impossible to detect and track without appropriate resources ($, staff, test kits), and Nepal is certainly short of all of these. Even here in the US, with presumably lots of resources to apply, it now appears that the virus was spreading in the population for weeks before we detected it...I don't want to be alarmist, and I surely don't mean to offend Nepal, but I want to be realistic..."
"To correct my previous post (I can't figure out how to edit it) -- several ""suspected"" (I think that would be the correct term) carriers have reentered the population (not confirmed cases, as I had written). Here is the relevant passage from the article: ""The two sick Chinese nationals in Pokhara who were asked to stay under surveillance this month went into hiding and could not be traced. A Saudi Arabian tourist who arrived in Nepal via China also ran away from a Kathmandu Hospital where he was being monitored."" (from Nepali times article)SFAIK, there is still only one ""official"" case in Nepal. However, if I remember correctly, that person did reenter the general population before he had recovered (so he was presumably still contagious). I looked for but couldn't find the article about this one, so I'm not positive my recollection is correct."
I too think the virus is already here.I'm currently working in a hospital in Pohkara and I'm not sure what to do.I planned to stay until 27th March.
"Hello EricYou might want to consider the unreported, unaccounted and basically unknown death toll from human activity that pollutes the environment, particularly in China.And that is not taking into account the issue of biodiversity loss that keeps the joint in balance. In Australia we lost over a billion animals to catastrophic bush fires ramped by climate change, as a conservative estimate.Given I have communicated, from Buddhist masters, their advice, you could take that as a heart felt wish from me, that people remain physically and psychologically safe from the issue at hand.So in short, maybe consider the irony in the comment.And Hope that thousands upon thousands of humans are not wiped out in Syria in the next few weeks."
"Tony SI will assume you ment #119 as Eric at # 120 might have a different take on what follows!If this thing is a flu by another name that transfers easily, you could just go and ensure you have a very good medical kit and the ability to hold up in the hills if things get wild. It could prove an amazing journey at a pivotal time.If you are well travelled in particular areas, a certain danger follows like a shadow regardless.If our focus is on our self then we want to protect that and staying home is probably prudent. If we have the good fortune to be free of such a constraint then it is a ‘wide open road’Edited: 5:27 am, March 03, 2020 "
Still nobody have found corona virus and couple of weeks ago one guy habe found virus because he came back from china but now this guy also return back from hospital .otherwhise everything is fake news for corona virus in nepal.offcourse we have to very becarefull about this virus but we are in nepal now and some people from another country and read some fake news and said corona virun in Nepal .we don't know about tomorrow what happen about this corona in nepal but at this moment no more virus .Thank you ..
"Hi guys, is this news real?https://www.dailymail.co.uk/news/article-807…https:/…spain-reports-first-coronavirus-deathIs the news credible? Thanks for your kind response."
"I guess Spain will escalate this case to the WHO which will investigate, with possible terrible consequences for Nepal.Edited: 5:34 am, March 04, 2020 "
"HiJust back from a 15 day visit to Nepal, travelling Kathmandu, Chitwan, Pokhara, near Lumle, Bandipur and Kathmandu.Objectively it seems unlikely that Nepal has no cases of coronavirus, as claimed. We could not gauge how busy the place was as we had never visited before and we were visiting in the off season, but we heard plenty of reports that tourist numbers were down.We used masks largely for the pollution in Kathmandu but not otherwise save at the airport on our way home. We washed our hands and used sanitiser a lot and I gave up worrying how this appeared to others. We stayed in decent hotels and were reasonably careful about where we ate and what we ate and drank (no alcohol to boost our immunity). We had a great time, I think we benefited from Boudanath Stoupa (one of my favourite places) being less busy. I can't advise anyone about whether they should go, we stressed quite a lot before hand because we are at the older end of the spectrum. We visited at a time when I think there was probably a good chance of avoiding infection.Face masks were on display a bit more by the end of our stay but not routinely worn ( although the monks at Boudanath largely wore them). Masks are not a magic bullet in any event. The key we understand is to avoid crowded places, wash hands frequently and avoid touching your face at all.Thank you to all who post on this forum. TA continues to provide good useful advice thanks to the generosity of its posters."
"Thanks for the trip report, Betty.A minor point of clarification to post 131: there has been one recorded case in Nepal according to the WHO. scoodly"
"Walked to Durbar square on a side street with only locals, no tourists tonight (more or less straight down from Kathmandu guest house, then right, then continue straight down untill turning left for Durbar square. Long queues in front of all the pharmacies there. Most people wearing masks, many full n95 respirators. Not sure if they are crowded all the evenings because of being cheap/good or if covid-19 is responsible. Scared me a bit, but fly back tomorrow (well not to Italy as planned, as my connection got cancelled)."
"Post 132: the DM link is interesting (for me, at least). I was in Nepal mid Dec 2019 to mid Jan 2020 - I then returned to the UK. I picked up what I thought was the usual respiratory virus (a bad cold), which gradually eased 2-3 weeks after getting back. This was my 11th visit to Nepal, and I usually get a cold and have sinus issues whilst trekking, and am very prone to getting colds in the UK, especially in the winter. The sinus issues have worsened during my last 2 visits (was going to get them looked at, again, at some point this year).I had assumed that I was in Nepal before the coronavirus spread outside China. Reading the DM link does make me wonder if I should get tested. However, if I was exposed (and I may well not have been), will I still have any trace of the virus?"
"Going early April, so monitoring carefully and grateful for any info. Thoughts with the Nepalese who have recently suffered enough natural catastrophes. This sensible advice issued earlier today.. https:/…"
