"The owner of the small trekking agency I've used for years reports very disappointing customer stats for this spring (do far): 11 group cancellations, 4 postponements, only 4 groups still planning to go, but all 4 currently considering cancellation..."
"People in Belgium or France, amongst others, wonder whether their countries will be added to Italy in the Nepal black list as the number of cases increase ...There is also the question whether the Middle East airlines that bring most European tourists to Nepal may cancel flights.Note that in Belgium someone cannot personally ask to be tested. Only suspected cases."
"Experts are saying that generally older people have been exposed to some previous form of Coronavirus which is a general term and one cause of normal flu however the current specific strain for Coronavirus Covid-19 is more serious.In addition to older people’s health generally being less able to cope due in part to greater likelihood of underlying health issues, their bodies are reacting violently to Covid-19 strain as previous exposure antibodies exist and a small but significant percentage greater than normal flu are unable to cope and dying. The offical figures are showing as high as 1 in 6 older infected people fatality in the older age group.If correct there was a recent media report from a Wuhan Chinese hospital doctor speaking out online saying the fatality in Wuhan is more around 5% vs commonly believed 2-3% across all ages. Higher Wuhan hospital fatality rates may be an indication of possible higher fatalities in countries with weak health care systems like Nepal.Anyway encouraging news from Quitou in another post saying Nepalese Government is currently responding well taking the right steps to reduce the potential spread."
"If you want the most up to date information you can read my post on the main forum page.I have met with various levels of the government including the Minister of Tourism, Mr. Yogesh Bhattarai, and the new CEO of the Nepal Tourism Board, Dr. Regmi.At the root of it, Nepal is actually responding more appropriately than many countries at this point. I find it very safe here at the immediate time. The people are so proactive, schools are closing, factories sending people home for a few weeks, and all gatherings, even in very remote villages, have been cancelled or limited. I'm currently here for the remainder of the spring. Our trips are still going forward, and our travel clients still coming."
"#142 -- I think the key words in your reply are ""at the immediate time"". While Nepal currently has no OFFICIAL open cases (and one presumably recovered case), my personal view is that it's highly, highly improbable that the virus has not entered the country. Nepal's proximity to both China and India, the large number of flights that have arrived from various infected countries, the several cases where potentially infected people were inadvertently released into the population, the very weak airport screening... Just look at what's going on world-wide with the spread, and draw your own conclusions.Once the virus does set foot in Nepal, it will likely spread quickly, and probably very ""quietly"" at first (as it did here in the USA). The dense population, poor sanitary conditions, very weak health system, and lack of funding will all contribute to a rapid spread thru the population. Long-term visitors need to be prepared for the possibility that during your trek the virus could hit and spread quickly. If this happens, it's possible that you may not be permitted to fly back your home country, or possibly even fly to a nearby country for treatment if needed. I think the situation in Nepal can change very quickly, and travelers need to anticipate and be prepared for this."
"@143 - I don't disagree with your observation.A couple interesting points to know about. There is a countrywide effort to brace for the impact of the virus. When I attended multiple meetings at the Nepal Tourism Board and even when I gave a press conference for the Nepalese media, everyone was maintaining a safe distance, not shaking hands, and half of the staff was working from home. The virus dominates every conversation from high government to rural farmer.Small factories have closed, and even rural villages that NEVER see outsiders are cancelling school, events, and believe it or not...using soap.There is a consensus everywhere that the virus cannot be allowed in. And I'm not entirely sure it has. I spoke with the deputy director of the Civil Aviation office and inbound flights were cut in February by nearly 75%. Every hotel manager I interviewed said virtually 100% of the group Chinese tours scheduled for February were cancelled. Just yesterday there were only seven international flights inbound. Down from 34 some days this time of year.As a huge skeptic of Nepal's government, I'm kind of impressed. They've made plenty of horrible mistakes, but none that exposed them to a greater threat. If anything, their actions have compounded cancellations, but protected the population. And they've just been really lucky.To be frank, I'd rather be here through all of March than Seattle."
"Yes, Nepal may be stepping up its response now, but I'd argue it's a bit too late...Per a recent article in Nepal Times, 10,000 Chinese visitors arrived in Nepal in Jan, and another 3,000 during the first 3 weeks in Feb. Add to that flights that have been coming in from other infected countries... Yes, Nepal did recently (or is about to) shut down these flights, but I'd argue again, very likely too late.You would have a very difficult time convincing me that among all these thousands of arrivals from infected countries -- that NONE of them were infected?? That seems to be consistent with the thinking of our inept President here in the USA, too -- he thought he could keep the virus out by implementing procedures that are much more strict than those that Nepal is undertaking. And we can see how successful we've been, I believe it has showed up in 19 states now, and all experts agree that it's much more widespread than we currently see...Look at how very rich and technologically advanced countries (e.g. Korea) have struggled to deal with the outbreak. Nepal has both hands tied behind its back in this struggle...Edited: 8:17 am, March 07, 2020 "
"I should add -- I don't mean to be down on Nepal (per my previous post). It's great that they are now stepping up, as Quitou points out. We can only hope that it's not too late and Nepal is able to avoid a major epidemic.Edited: 8:33 am, March 07, 2020 "
"I think the important variable has everything to do with inbound travel. There are thousands of inbound flights to the US and Europe daily. Inbound flights to Nepal were at a near standstill by Feb 5th.In that 30 day time, a well publicized outbreak of viral flu near Dolpo has come and gone. I contacted seven hospitals, or rather my assistant did. Nothing, and given the leaks of Nepal's big mistakes made, it's unlikely reports of corona are being concealed. Again, I see loads of misteps, but I genuinely think Nepal dodged a bullet in February. How that shapes March has me surprisingly optimistic, but I agree, the other shoe could drop soon.I also had a meeting with the deputy editor of the Himalayan Times, and they have three journalists tasked to corona and I'm impressed with their efficacy and restraint. They're producing reliable news. Unfortunately, my contacts at the NTB are leaking incorrect info daily.Things could change rapidly, but thus far, I'm wildly impressed by the state of affairs."
"This THT news report is worrying: ""Govt not to seek details of Spanish national who succumbed to COVID-19""...the Spanish authorities confirmed that the man had travelled to Nepal, the Spanish government would itself send the details of the man to the Government of Nepal even if the government did not make any request for the same...Nepal’s health ministry had not yet made any such requestshttps:/… Any death linked to Nepal, and both Spanish and Nepalese authorities (both working hard to mitigate COVID19) would want to share details to check for contagion that could have followed his journey in either country. Maybe I'm misreading?"
"Mike’s point is well taken. The real issue for those of us that are not in the high risk population is the possibility of being quarantined in Nepal for who knows how long, if we have symptoms. So we could be stuck there. We can’t predict what will happen once we arrive. It’s possible things could escalate quickly! Then we may have to get a physician’s sign off before we can fly back. That’s why I’m planning to get a visa for 60 days just in case. Hehehehe...."
"Good morning, Koffee, I can understand your position but my visa in my passport [ I don't like VOA ] is only for 30 days, beginning 11th march. When the doktor's of a hospital put me in quarantine - WHAT I can do ???Than I have a very good reason to overlay my visa or not? What do you think ?"
"nepalimmigration.gov.np/post/…France, Germany and Spain added to the list.People from the 8 nations mentioned need to show a health certificate not older than 7 days at immigration.Edited: 8:16 am, March 09, 2020 "
"All 3 new countries confirmed more than 1000 cases. That is probably limit set by Nepal Goverment, for the moment."
What do they mean with a health certificate? Do you have to show a negative corona test or is a paper from an ordinary doctor enough??
"The notice in the link also states that people transiting those countries need a health certificate:""Those applicants and also the nationals transiting from these countries bound to arrive Nepal are required to submit a recently issued health certificate stating that they are not infected by COVID-19...""I hope people are not caught out by this and denied boarding the flight and entry to Nepal.annelies - I don't know what is required by this certificate but getting tested to specifically rule out the virus could be difficult. Testing travellers may not be a priority given the resources required and cost involved. I hope a letter/statement from a doctor stating no symptoms are evident suffices.scoodly"
"And what I make with my ticket for tomorrow afternoon from Europe to KTM ? As fast as I need I will not get a health certificate from a doctor!@ scoodly in # 154: I have read and understand your post - BUT: My flight is tomorrow and till the departure flight I'll not receive any certification from any doctors? What I make now - sitting at home and looking out of the window ?Edited: 9:35 am, March 09, 2020 "
Toni - which airports are flying from and transiting? What's your nationality?scoodly
"My nationality and passport = German.My ticket from Prague, Czech Rep. to Doha and after to KTM. So, bad luck for me, but may be, it's better than later in Nepal in quarantine there . . .The hotel in PKH I will ask to keep my deposit, I will use this when I fly later, may be in half a year . . . ?"
If I were you I'd call here and ask if the doctor would mind checking you and giving you a statement:https:/…doctors-office-first-aid
"It does look like you are caught up in this mess. As well as trying to get the certificate/doctor's statement, perhaps phone the Nepal embassy in Germany for clarity on the restrictions:https://de.nepalembassy.gov.np/contact/Best of luck.scoodly"
"Thank you scoodly, but I leave it now how it is. I cancelled already very quick my flight ticket and the hotels I will write mails.This is not the biggest problem, whwn this CORONA is over and finish I can fly for long time.And you never know what happens when you're in the country and big problems rising up ? For ex: the airline cancel ALL flights in this country - how you want come home and special to come out of the country? Better like this than another big problems.Let's wait - may be the probems become bigger and bigger . . . ?"
"Unfortunately, current notice states that the ""health certificate must prove COVID-19 negative...""...jeeesh!"
"Re #152I don't think ""1000 cases"" is the criterion, as Spain currently is at about 674 cases. https://www.covid-19canada.com/"
"Toni, I'm sorry your trip is affected and hope you can get to Nepal soon. That travel restrictions increase while you were in Nepal is a possibiity. As an aside, Qatar seems to have banned visitors from Nepal which will affect migrant workers. At this stage, passengers transiting from Nepal are allowed. People flying via Doha should seek the latest information of course.scoodly"
"""Qatar seems to have banned visitors from Nepal which will affect migrant workers. At this stage, passengers transiting from Nepal are allowed.""That would be me in May (assuming I get to go). I have flights to/from KTM via Doha. Are you saying (at least currently), passing through DOH from Kathmandu via KTM are allowed?"
"Article on Qatar banning travel from Nepal:https://kathmandupost.com/national/2020/03/0…From another article: ""Passengers from these destinations are still allowed to transit via Doha but will be denied entry if they wish to go landside.""https:/…Edited: 12:10 pm, March 09, 2020 "
"This is the article I got in a news feed, Scott:https:/…Transiting from Nepal seems OK for now but I have not checked further.scoodly"
That's odd. Does Qatar know something we don't about Nepal? Why are they banning Nepalis when there is no public information about the spread of the virus in Nepal? It's a bit worrisome.
"I don't know, Koffee but I doubt Qatar has any evidence to inform this decision, it's probably a knee-jerk reaction.scoodlyEdited: 12:35 pm, March 09, 2020 "
"I’m a member of Qatar’s frequent flier club and they have sent me the following email that may be of us to those with Qatar tickets.Qatar Airways has updated its travel policy so you can travel with confidence, offering you more flexibility and peace of mind. If you have booked or will book flights for travel up to 30 June 2020 you will be offered the flexibility to change your travel plans free of charge by altering the dates of your booking or exchanging your ticket for a travel voucher valid for one year. This includes award flights since we value every Qmile you’ve earned with us as a Burgundy member. So, if your plans change, rest assured that we are ready to support you.I Hope this helps some of you.Best RegardsRob"
"Thanks, Rob. That’s good news for passengers."
#Re 167It's probably this sir.https:/…
Doesn't say where they got it? There are thousands of worker living in Qatar.
"#Re 172Yep, the news is always shady and incomplete. Probably it's a worker but no idea since how long been in UAE or the exact date.there's another Australian guy got infected traveling from Nepal, is there any other news similar like this other than the news from Spain ? https:/…12037114"
"It is always immposible to say where someone got infected, when travel by plane and have another connecting flight. nepal can be as quiltless as guilty"
"How many are diagnosed goes all to the healthcare strength and mass testing of every country Scandinavian country's generally have phone numbers and free testings. My American friends told me that unfortunately the same is not to be said about their health care. That no one would go to a corona test cause they are charging 1k$ for every test. So it will be extremely hard to contain in the U.S as naturally people cant even afford a corona test. I know so many awesome people from the states, but their health care should be ashamed for treating them so unfairly and too unecessary costly."
"@ Frank Norman: I agree to 100 % with you, your words: "" their health care should be ashamed for treating them so unfairly "" are the only truth.-I have been working in Alaska at different cruising ships and I saw and realized what's going on in USA - and because I'm German nationality I can very easy to compare both countries."
"@ scoodly: Hi, scoodly, I want to inform you: Now I sit home and look out of the wet window to the rain.-I asked QATAR AIRWAYS, because I'm also a member of the PRIVILEGE CLUB [ Ha, ha, hi, hi ] and QATAR AIRWAYS wrote to me the following sentence:"" Thank you for contacting Qatar Airways.Our travel partners are in possession of a revised policy issued to accommodate passengers who are affected by the travel restriction imposed by countries, under this policy, you are eligible to change dates without a change fee penalty, fare diffence may apply or to request a refund of the full value ticket in a travel voucher.Please liaison with your travel agency for assistance.You may also contact our colleagues for clarifications.Prague, Czech RepublicWorking hours : Monday to Saturday from 9.00 am - 6.00 pmTel : General reservations: +420296181810. ""So - tomorrow I will go to the Office in Prague and will show this message and ask if I can fly tlater - may be in a half year ??? What do you think, this is a good idea ?And pls let me know what time and when you are in Nepal or near Nepal ?BTW, all guesthouses where I candelled my stay for the month March are very understanding and cooperating and not bad to me - they sad, everything is o.k , you come later and than we see what's happens."
Hi allLooks like travel via India has become problematic as well https:/…74584811.cmsEricMy Nepal Pages https://wanderingeric.org/category/nepal/
"Hi ToniI think it's sad that travel to nepal has been affected and I think it is a good idea to go later in the year. My best guess - and that's all it is - is the difficulties should be over iin 6 months. Good luck!I do not have firmplans to return this year, probably next January.scoodly"
"Post 178: I seriously wonder whether all these restrictions on movement are a waste of time. I can understand restrictions if they slow the spread of the coronavirus, and thus help to spread the resulting additional load on medical resources over a longer time period. Possibly also the hope, and I think it is only a hope, at present, that, in the northern hemisphere, warmer weather will itself stop or slow the virus.However it seems that the virus will spread far and wide. For example the German government has announced that up to 70% of Germans could (that word again) get the virus: https:/…world-us-canada-51835856In London today (in the City, the financial district) there were lots of people out and about, and the trains were very busy - given the lengthy (and it seems variable) incubation period, and the fact that people can be carriers without getting sick and hence realising, and with no cure or vaccine, avoiding restrictions on movement might speed up the whole cycle. Apparently Italy had banned flights from China before the major outbreak (in Italy) - but Italy is currently the worst affected country in Europe. Authoritarian China is apparently claiming to have significantly slowed the virus (or even declared ""victory""), but let's wait and see."
Tough Nepal has border with Tibet yet there is no Corona case in Nepal. Read our complete article about Corona impact in Nepal. https:/…
Some of the information in the link below is not up to date. Here is the latest notice on the official Nepal immigration website:http://www.nepalimmigration.gov.np/Official websites in Nepal are always up to date...aren't they?scoodly
"As Nepal shares its border with China, there will be a higher chance of spreading coronavirus in Nepal from China. there is no confirmed case of Coronavirus in Nepal but four people suspected to have contracted the virus were admitted to the isolation ward of Sukraraj Tropical and Infectious Disease Hospital, Teku, last week."
A minor clarification of post 183:There has been one confirmed case of COVID-19 in Nepal - this is stated on the WHO website.Hardly material to people's decisions whether to travel or not but let's be accurate. If only Nepal had both the will and capacity to test and report cases.scoodly
"The experts say the restrictions help to slow and manage the number of infections so that a country’s health system is less overloaded, spread the eventual infections over time and find solutions like possible vaccine and gather medical resources.In some countries where there is physical border controls like Singapore and others like the epicentre in China severe lockdowns it has slowed the infections dramatically."
"Two travellers denied entry to Nepal at Kharbitta because of ""high fever"":https:/…scoodly"
