"Good afternoon,in about 4 weeks my Nepal trip is suposed to start, this makes me very happy.I want to ask if something is known about CORONA VIRUS, soming from China to . . . ?Nepal has a border with China [Tibet] and this border is still open? This makes me nervous.For all the news, anyeay if bad or good news I am thanksfully.Toni S."
Hi TonyUnfortunately the Corona Virus has already arrived in Nepal and if it is as contagious as reported will spread rapidly through the population as there is only limited healthcare available and no infrastructure to contain it. EricMy Nepal Pages https://wanderingeric.org/category/nepal/
Here is the latest situation report from the World Health Organisation with only one case in Nepal and you are coming from USA which has 5 cases. If you are unconcerned in your home country it should be for Nepal as well apart from Nepal health facilities being less capable if an outbreak does occur https:/…The odds are you will survive as you are unlikely to get it however read the WHO site on precautions here https:/…advice-for-publicThe Nepal border with China has only mostly several road freight transport and does not get large numbers of the Chinese population free flowing so there is not the problem you think. The majority of 134000 annual average Chinese tourists arrive by plane and the overall number is not so large.
"Thank you very much for your responses and your advises. I'm now very much afraid and I don't know what to do ???Yes, I know the traffic from China / Tibet to Nepal is mostly for trucks which bring goods from one country to the otherone, and not so many tourist doming.-In my case I'll fly from Prague / Czech Republic to KTM, with a stopover in Doha for a few hours. In Doha I'm not planing to go outside the airport, I've only 10 hours time till my connection flight to KTM.Oh, my goodness, what can I do now?Edited: 2:31 am, January 28, 2020 "
"Hey Toni,Greetings from a former Alaskan from Haines. :)I spend half the year in Nepal and host dozens of travelers every season. I'm watching this unfold very carefully. Nepal has no way to respond to even a small outbreak. Infectious diseases have been known to rapidly impact tens of thousands of people in short order. Only dumb luck quells outbreaks in Nepal.Currently Nepal has some testing capabilities and just today announced special precautions for Chinese tourists arriving by road and air. Now, that doesn't mean much to me. What Nepal says, and what Nepal actually does is shockingly divergent. I think it's all just positive headline fodder issued by the Tourism Minister, whom I think is a giant idiot. I too am scheduled to arrive in a month, as well as my 30+ clients. For me the next two weeks will be telling. As soon as there are even a few dozen confirmed cases in Nepal, that will spell the beginning of the end. Last season Dengue Fever hit Nepal for the first time and caught 10,000 people on the back foot. The only thing to stop that outbreak....fall weather. And that's my concern. May and June usually see increases in flu and other illnesses. This is really an all or nothing proposition for Nepal. Unlike the US, that can isolate and contain these things, in Nepal, every illness is a runaway train. I would make sure you have good travel insurance. Chances are, we'll all be fine and have a great visit to Nepal, but what happens in the next 2-3 weeks will set the stage."
"I will also add, the problem in Nepal is not just with limited medical resources, which is severe, it has to do with Nepali people. They don't understand infectious disease....AT ALL. I commonly see people who are horribly sick, mingling and coughing all over their kids, family, and anyone around. There is a primitive awareness of illness in Nepal that allows diseases to spread so rapidly. We work with a team of doctors in western Nepal and this is their big challenge."
"Corona virus is a bad cold, deadly to very young, old and weak. IF you are none of those then do not be concernd to a great extent that it changes your trip"
"""deadly to very young, old and weak ""We don't know this yet... don't yet know the real statistics of novel corona virus 2019-nCoV"
"Hi Toni, I leave in a week’s time to go trekking in Nepal and am taking the perspective that the current situation re this virus is not serious enough to warrant any change of plans. Having said that, I have checked my travel insurance again to ensure my cover is appropriate should I be affected and I’ve added a couple of good quality face masks in case I need them. As post #2 says, the risks aren’t inordinately high currently. Risk management isn’t 100% foolproof but it may help you feel a little more confident than your present concerns. Cheers"
Directive issued to to arrange a separate checking facility aircraft flying from China.https:/…
Hi allI notice that British Airways has just suspended all flights to China. Maybe this is a little more serious than the common cold. Eric
This may not be as effective as it should be if other airlines are still flying in from China. All travel should be suspended.
"We just have to keep watching the WHO and other updates, current infections as of todays statement is about 4593 cases, 106 deaths, 50 odd outside of China. Some media sources saying 8500 cases and 130 deaths, so the death rate appears to be about 1.5 to 3%. The elderly and young/ infants often suffer more with such scenarios. The peripheral countries to China with 50 cases is far less and the current risk should be interpreted so.Learning from the last 2003 onwards SARS virus it was 8500 cases with about 9% overall death rate and about 50% among elderly and young/infants, which by comparison to Corona much more deadly. We all lived through that and mostly forget what all the fuss was about. Hopefully it will be similar.Putting it into context to global flu and respiratory diseases there are about 650,000 deaths annually https:/…The 1910 Spanish flu took 50,000,000 globally but 100 years ago different era, today with modern health care and prevention has much better chance.Over on the China travel forum its gridlock panic in places."
"Latest WHO figures 7818 confirmed cases, 170 deaths, 82 outside China, so about 2% death rate, 1% of cases outside China. https:/…novel-coronavirus-2019"
I hope February is still okay - I would be more worried of travelling to Nepal Mid March or later. I'm pretty sure it will spread worldwide - it's too contagious to be contained in Africa or countries like Nepal. But it took like 1 months in Wuhan from first cases (8. December) until the health system started collapsing (10. January according to quite a few sources hospitals started getting problems). Problem is more to get a flight back once the situation explodes....I am pretty sure that 90% of infections in Wuhan are not registered / people did not go to hospitals after Mid January and for a cold you don't go anyhow. I would guess if it arrives in Nepal - from first spread to say 10 people - it will take 2-4 weeks until situation gets out of control. I don't see country by country getting closed out from air traffic. Either worldwide air traffic gets suspended (except for evacuation back home) or air traffic excet to China will just be kept up.
Im supposed to volunteer in Nepal starting March 2nd as well and stay for about 3 weeks in total. Im worried as well and at a loss of what to do.
For those who say it's only a cold and dangerous to the old.https:/…
"If the infected aged death rate information in this is correct https:/…With China average percentage of people over 60 years being about 12%31500 cases globally, 99% in China638 deaths, only 2 outside China, 500 over age 60 years (80%), 138 under 60 years age (20%)14% death rate among those over 60 years age, much more significant than 2% rate generally quoted for all ages. 0.5% death rate among those below 60 years age, significantly different at 4 times less than previously thought compared to 2% rate generally quoted for all ages. If correct this provides some greater risk assurance for this age group, about 1 in 200 death rate compared to 1 in 50 death rate if you get infected. This will likely be skewed by how good or bad treatment and recovery in a Nepalese hospital would be."
"The picture appears to be more complex than this. The virus has the most devastating effect on those with co-morbidities, compromised lung function (eg asthma) and diabetes are the two conditions I have seen mentioned. These conditions will be more prevalent in older people.One suspects that in a country with both high pollution levels and a high number of cigarette smokers the virus is likely to have a more devastating effect."
"To all: Thank's a lot for all your responses.- Now it's still 32 days to my flight from Europe to KTM. I really don't know what to do - when I cancel my flight I will loose all the money for the ticket I payed already. - I think I'll wait little bit longer for some more new's?Thank's a lot . . .Edited: 11:04 am, February 07, 2020 "
"Fake News from TAAN, would be funny under other circontances ...( https:/… )"
"I'm still planning to go unless calamity hits. It's not there atm, and it hasn't taken hold anywhere else yet, maybe a little to much doom and gloom on this forum in regards to it. It's cold in Wuhan now, hopefully it's a cold virus , and as the weather warms it drops away. It should of spread like wildfire in other parts of the world by now, but it's mostly people coming from Wuhan. I'm cautiously optimistic, less so when I read this forum. We'll wait and see"
"I am not (in any sense) a medic. I well understand the comment in post 21 about there possibly being too much gloom and doom. As an aside, if people only read certain posters, it would be a wonder that anyone ever went to Nepal (scams, pollution, road accidents, altitude sickness, unsafe water/food, bad weather etc etc etc). One observation/question: if the virus spreads outside China in a significant way (so far the number of such cases seems to be very limited, though this may be changing...), would Nepal and the main trekking areas, be significantly more dangerous than staying in one's hometown? I ask because every week I am in London, usually 2-3 times, for work. London is incredibly international, and we deal with people from overseas. For example yesterday I 'met', at a distance (followed up by phone), a Chinese property developer who had just returned from southern China - no checks at all on his arrival in the UK... Unless somewhere like London is shut down, with the number of people and how busy public transport is, presumably huge numbers would be quickly exposed to the virus. Obviously developed countries have much more in the way of health resources than somewhere like Nepal, but my impression is that if there is a major outbreak, the health system just about anywhere will be overwhelmed."
"@22 The real challenge with Nepal and viruses has everything to do with a lack of resources, and an appalling lack of resolve. That's not to say they don't know how to leverage positive headlines. I spend my fare share of time in remote Nepali hospitals and working with small health posts. Even the major hospitals lack the tools needed to test, treat, and quarantine. The most complex issue is simply a matter of culture and communicable disease. In London, or most of the US, households only have 2-4 people. In the US and Australia, there's simply a lot of space between people. In Kathmandu, people are stacked on top of each other...literally in some cases in buses and tuktuks. There is also a complete lack of hygiene. We're not sure who has the bar of soap in Nepal this week. It's also common to spit, cough, snort, and basically dispatch disease like a germ canon.For the government's part, saving face means everything to Nepali culture. Rather than endure the shame of saying they are concerned, they would rather say...we're 100% safe, which they have done. One tour operator told me yesterday, ""Nepali people don't get sick like Chinese people."" To your last point, it would take thousands of cases to truly overwhelm the response capabilities in the US or most of Europe. In Nepal it could just be a dozen that does in tens of thousands.Edited: 6:06 am, February 08, 2020 "
"I don't disagree with most of the points in post 23, but if the virus is, or becomes, easily transmittable, then the crowded public transport systems in modern cities by themselves will do a fantastic job of spreading the virus. I understand the UK (and I assume most similar countries) can handle small numbers of affected people in special units, but thousands, let alone tens or hundreds of thousands, will completely overwhelm any system. Having stayed in the non-tourist villages on the two guides I trek with, and another (unrelated) Nepali (14 stays, for 55 nights in total 2011-20), hygiene practices, especially for food preparation, are very much a work in progress. However, I have never had stomach problems in their villages."
"@24 Some of this falls into my field of work. When viral outbreaks hit Nepal, the spread is always accelerated. Even the recent Dengue outbreak a few months ago was accelerated by virtue of ""domestic density"" or simply put, the close proximity of people in one room to get bit by one mozzy.Right now in Karnali, an outbreak of viral infection has killed to, and our team members in the area suspect it has effected over 1,000 people. In March of last year, we responded to a viral outbreak that overflowed patients at every hospital and healthpost near Jajarkot. Same again earlier than year in Banke, and again in Banke six months earlier. It's important to also consider, 50% of all Nepali kids are malnourished and imuno-compromised. I've visited more than 300 remote schools and we have seen...four...with hand washing stations. It's a recipe for rapid and lethal spread of communicable pathogens.This is why corona must NEVER get it. There's nothing to stop it. Call that fear mongering if you want, it's also a reality worthy of attention.Edited: 7:53 am, February 08, 2020 "
Hey i am from NEPAL. Till now there is no any such suspect has been found suffer from corona.its safe to visit Nepal.
"#26Well Sunil, there has indeed been a case reported in Nepal... https:/…73590302.cmsProbably others not reported/confirmed.Edited: 10:01 am, February 08, 2020 "
"It’s understandable that lay persons not involved in or versed in public hygiene, health and sanitation issues both in their home countries and abroad and who dodged illness in their trips may view these discussions as too much doom and gloom. While those who work in the field might appear too alarmed. Often many people need to have a significant negative life experience and often enough until it sinks in to form a lasting change in outlook, even though the visual cues from what their eyes, noses and logic should be telling them should be very logical or is it a case of eyes wide shut.Nepal and in fact most of the entire developing world and particularly the Indian subcontinent experience all manner of public health and sanitation problems that were mostly resolved 100 years ago in parts of the world with enough resources and proper government. We in developed places forget and take for granted the gains in public health achieved in certain parts of the world over hundreds of years by the modern industrial societies and seem to think that is shared everywhere, when it is certainly not by two thirds of the world population.My line of work in Australia is in environmental health and even in as affluent and developed a place, behind the scenes from public view we deal regularly with infectious disease control, food and sanitation, fetid conditions of overcrowding in low social economic housing and apply the full measure of health laws against recalcitrant members of the public that cause these problems. There are also very vulnerable communities within Australia such as the Aboriginals who live in remote areas with very low quality housing and nutrition conditions similar to the worst of the developing world and it is a great source of shame.At work we deal with lots of people in the public who are totally unaware of such issues but upon explanation they very quickly understand while some do not. Likewise most tourists I have met trekking and travelling with extensively, even though they are not medics or well versed do in fact understand and accept there are issues and try to do something to protect themselves, while a very few don’t get it and are still pondering if it is reality at all. As the saying goes one can only lead a horse to water but not make it drink. Perhaps some view such discussions as doom and gloom probably because it will affect their total decision to travel or trek as they have difficulty balancing the negatives and positives.Edited: 12:48 pm, February 08, 2020 "
Hi allIf anyone even briefly thought that Nepal would step up to the plate during a health emergency check out this story. https://kathmandupost.com/health/2020/02/09/…EricMy Nepal Pages https://wanderingeric.org/category/nepal/
"#29 I can’t see any airport arrival quarantine accepting or needing that if a person is coming from Nepal unless they were resident in China less than 14 days virus incubation time. If it is in fact needed then the test and certificate date should only be as close as possible to departure date, highly unlikely.If the news report is correct it appears to be the lab taking advantage of the situation corruptly from Nepalese travelling abroad.Edited: 5:20 am, February 09, 2020 "
"I think this is about comparative safety - if the virus is or becomes very contagious, is it safer to stay at home, or will the risks be much the same if people travel (in this case to Nepal). If people live in comparatively isolated (ie less visited) rural areas in developed countries, presumably it is safer to stay put.However if they live in or near major urban centres, the risks of travelling are presumably not that different to the risks of staying put. As above, in any major, modern, urban centre, the sheer number of people and the range of places (internationally) they are going to and coming from, the densities of use of public transport and public spaces, means that the virus would, presumably, spread very fast. I have little (no) faith in the honesty or ability of the Nepali authorities, (one of the benefits of knowing some Nepalis very well is that one becomes much more aware of the realities of how things work out there, in a political sense). However the Chinese authorities don't exactly seem to have handled the early stages of the outbreak well, and as one of my posts above, a person flew direct from China (PRC) to the UK this week, without any checks at all, which raises question about the UK authorities abilities and motives (not to upset the PRC government?)."
"Taking the comparative risks as outlined in 32 at face value, I know where I would want to be if I did contract it and it's not Nepal.scoodly"
"If there is currently no cure for the virus, and 'treatment' consists principally of helping people's immune systems fight off the virus (or not), and with western health systems likely to be overwhelmed if there is a big outbreak (annual flu stretches the UK health system), how much real difference will the location make, if someone gets the virus. The local health systems in China appear to be more than stretched. This is probably something best addressed by those with real understanding of these things, so it would be interesting to hear from a such person/s."
"-:- Message from Tripadvisor staff -:-Tripadvisor staff removed this post at the original author's request.To review the Tripadvisor Forums Posting Guidelines, please follow this link: http://www.tripadvisor.com/pages/forums_posting_guidelines.htmlWe remove posts that do not follow our posting guidelines, and we reserve the right to remove any post for any reason.Removed on: 7:32 pm, June 18, 2020Edited: 7:32 pm, June 18, 2020 "
"It would make a great deal difference where one is 'treated'.Taking the analysis of risk of infection as similar in the UK and Nepal at face value: then there is a comparison of health systems. If the somewhere like the UK helath care syatems would be overwhelmed then Nepal's would be to a much greater extent - and it would take nothing like the numbers in China to get to that point.As for the quality and access to care there is a world of differtence even if there is no cure. Travellers, assuming insurance does cover this outbreak - check policies carefully, would get better care than locals who (mostly) could not afford treatment in the better hospitals but i would still rather be in the UK than at, as examples, CIWEC and TUTH (both of which I have experience of).But here's a simple question for others: where would you rather be if you contracted this virus, in hosptal at home or in Nepal?I am not a doom and gloom monger about travelling to Nepal at this time (though I would consider it carefully) nor do I ignore the diffences between the UK and Nepal and it does not take, for example, medical professionals to inform me of this (though not to be ignored).scoodlyEdited: 7:21 am, February 09, 2020 "
"@33 I think you miss the larger issue. Western countries not only have a better support system to detect, treat, and isolate cases of the virus, the basic culture of daily life has proven to slow the rate of spread. Again, population density isn't the only factor. Facilities in Nepal are 40 years behind the West, and that's being generous.I'm with Scoodly. The cause for concern is if this virus ever gets in the door in Nepal. Whereas the West can beat it back quite well, there's nothing to stop it in Nepal. Think of it like a match to a hay stack. In the West, we can get appropriate care in minutes. In Nepal? Forget it. I would take Japan as an example. With the cruise ships folded in, they have more than 40 cases, but the threat to the nation is assessed as minimal. That many cases in Nepal, with nothing to abate the spread, would become thousands by week's end.Again, how do we know? Because outbreaks are common in Nepal. Like those going on now in Karnali."
"#31 there might be some forewarning in terms of comparative safety in terms of any new diseases coming from outside Nepal presumably spreading from unscreened quarantine airport arrivals, spreading in cities and then to countryside. Though less likely the nCorvirus might also enter from China to Nepal overland on the several truck freight and trade routes. In which case trek routes like Langtang and Namche via Tibetan traders might cause the spread in the reverse direction starting from trekking areas and places in eastern Nepal borders. The movement of people across the borders are very leaky and that is also a source of potential virus entry.A Trekker still needs to run the gauntlet in the infected cities upon airport arrival and departure so one is potentially still at risk.Given that trekking area lodge food and water sanitation are not good and general high rates of colds and coughs are common the conditions are ripe for spread of the virus. In such a case the health authorities would be focused in the wrong direction and the problem would be upon them without notice.In terms of food preparation a typical trekking lodge kitchen doesn’t even have a proper separate hand washing sink to attempt to reduce infections to customers so any instructions entrusted to the guide to guarantee proper customer safety couldn’t even be carried out as one of the health authority precautions is to wash hands.Edited: 11:29 pm, February 09, 2020 "
"Why are people so afraid from the corona virus ?When I read about it, sounds like a normal flu for regular heathy individuals, unless you have weak immune system or heart problems I am not sure what the issues is.The symptoms of most coronaviruses are similar to any other upper respiratory infection, including runny nose, coughing, sore throat, and sometimes a fever. In most cases, you won't know whether you have a coronavirus or a different cold-causing virus, such as rhinovirus.https://www.webmd.com/lung/coronavirus#2"
"Post 38: good to get some wider perspective, but we do live in the age of fear (or in the west we do). I write this from the UK, where we have had several years of Brexit fear mongering (off topic) and now the corona virus, which may mutate, but currently seems to be equivalent to flu (which itself varies). My 2 questions about corona and travelling were:Are the risks (probabilities) greater than staying home, especially for those who live or work in big cities in the developed countries. One person coughing on a crowded tube train will do lots of spreading.Is there a cure for the virus - I understand that there is not. 'Treatment' seems to consist of supporting people's immune systems, which either fights off the virus (in most cases), or not... The main response seems to be isolation, which is to (hopefully) protect others. If Nepali customs are so favourable to viruses etc, why haven't tourists got sick in large numbers in previous viral outbreaks? As for ""Whereas the West can beat it back quite well, there's nothing to stop it in Nepal"", the Chinese authorities' only effective response seems to be isolation, some of it enforced in a very heavy handed way. If there is a major spread in the west, and with no cure, is it likely that the west will preform a lot better than China?"
