"@38 We have an epidemiologist on the advisory board of the nonprofit organization I founded in Nepal. His assessment, as it relates to Nepal, has to do with the unusually high infection rate of corona. It's a numbers issue. While most flu strains kill tens of thousands of people, it infects hundreds of millions and the mortality rate is rather low. Coronavirus has doubled the mortality rate in just 16 days. While the mortality rate is low, it's multiples higher than the average flu and it has potential to get much, much worse. With regard to Nepal, keep in mind, 50% of all children are under nourished. Health resources are beyond primitive. Have you ever seen a remote health post in Nepal? They're like big walk-in first aid kit at best. As our adviser said, the 3% mortality rate in China, could easily become a 20% mortality rate in an undeveloped country like Nepal. Our adviser also said, with 900 deaths reported, it's unlikely all of those patients were old, young, weak, or compromised. Statistically."
"Thanks Quitou for responding as someone with a real understanding of these issues.One of the differences I see between Nepal and the UK in terms of the spread is Nepalis do not have access to free health care so might not be able to afford so not seek care and be in the community. With free health care (at the point of delivery this is much less likely to be the case in the UK.Another issue is the chance of spread in hospital. As an example, on a ward in TUTH there was no water in the toilets. I asked to used the medics toilet and was allowed (foreigner privilege no doubt) there was water but no soap or towels - appalling. As a teaching hospital TUTH is probably one of the best funded government hospital in Nepal. I shudder to think what others are like. As for treatment and care, a one sentence description does not cover it. Even as a lay person, a quick read of the WHO guidance gives concern about Nepal's capabilities and convinces me (if needed) that in the event of an infection I would prefer to be in a UK hospital.I had an email exchange with an insurance company I have used in the past and a spoke with the one I used for my trip in January. The former was equivocal: underwriters may approve a claim now but may declare it a pandemic which is not covered. The latter stated coronavirus claims were not covered. Check carefully. Again, no intention to scaremonger.scoodlyEdited: 6:29 am, February 10, 2020 "
"@39 I realise that Nepal will have a higher mortality rate due to being a poorer country as a whole, I was talking mainly for tourists like me who come from UK or any other developed country. Why would people cancel their plans or holiday for a flu like virus that's dangerous to the 2-3% of the population, it just seems a bit too much overreacting to me personally.I might of course be wrong and It might be a lot more dangerous but just from what I have read doesn't seem like a major problem."
"I do agree that the media in many cases is making nCoronavirus more alarming than it needs to be.Here’s what we currently know of nCoronavirus and one doesn’t need to be an epidemiologist, it’s just simple level maths. I’ve done done several epidemiology units in my studies but I don’t need to apply fancy bio stats for this and this is why all the health authorities with their armies of epidemiologists around the world are worried. Currently 40,200 official nCoronavirus cases, 901 deaths = 1 in 44 chance of death across all ages or 2.2% death rate. Current season flu in the US has 20 million cases with 10,000 deaths = 1 in 2000 chance of death. Comparing the two, nCoronavirus is 45 times more deadly than flu across all ages. However, the odds are that a person will survive nCoronavirus if you are a healthy person.99% of nCoronavirus cases are currently in China and 80% of deaths are for those over 60 years age who generally have more underlying health issues. China’s percentage of people in this age bracket is about 12% so of the 40,200 cases there are likely to be 4824 people in this age bracket. 923 total deaths so far means about 738 people in that age bracket = about 1 in 6 chance of death or 15% death rate very high.This is based on Chinese people, who roughly have similar health and life expectancy to that of those in the USA. In less developed countries with lower health and life expectancy the death rate would surely be higher.If the above figures are correct, conversely for those below 60 years age the death rate is much less than the currently reported nCoronavirus 2.2%. It comes out at around 0.5% or 1 in 200 death rate, which is still well above flu of 1 in 2000 or 10 times more lethal.In summary the across all ages the death rate comparison is nCoronavirus 2.2% vs flu 0.05% or 44 times. If nCorona virus spreads like some flu have in the past to 20% of the world or let’s say just to China’s population there could be 280 million cases and 6 million deaths.Also, note since nCoronavirus official cases came to be officially reported on 20 January there was about 300 cases in only 20 days it is now 40,200 cases, in another month it could be around 3-5 million cases currently growing between 10-20% daily. If left unchecked in the month at 2.2% death rate that could be around 60-100,000 deaths and that in itself is only 2 months on and we still have about until June for this to play out."
"It is premature to postulate the case fatality ratios or characterize whether the media is being alarmist or not. There is a lot that is not known as yet. Here is a piece by Dr. Leung, an infectious disease epidemiologist and dean of medicine at the University of Hong Kong.https:/…coronavirus-china-research.html"
"Thank you for this intelligent discussion / thread. Even though I have no upcoming plans in Nepal, I appreciate solid information that is relevant for many other developing locales. Plus it is so relieving to read compared to the many other somewhat exhausting ""safe or not safe"" forum threads out there about the virus.Edited: 5:12 pm, February 10, 2020 "
"This is very similar to trying to convince someone who doesn’t believe in wearing car seat belts and they say I havnt seen anyone or many die in front of me and I doubt it. Yet those who work or study in the field, the traffic Police and ambulance responders and doctors know it well. With stats incident rates like 1 in 44 or others the chances are one won’t see the problem occur the majority of times so it can’t be demonstrated in practice.Edited: 6:38 pm, February 10, 2020 "
"Looking closely at the timeline and infected people day by day at the moment, and you can see a gradual decline in the infections, so maybe the measures the Chinese government has taken are working after all.2020-01-27 = 4,515 (+64%)2020-01-28 = 5,974 (+32%)2020-01-29 = 7,711 (+29%)2020-01-30 = 9,692 (+26%)2020-01-31 = 11,791 (+22%)2020-02-01 = 14,380 (+22%)2020-02-02 = 17,205 (+20%)2020-02-03 = 20,438 (+19%)2020-02-04 = 24,324 (+19%)2020-02-05 = 28,018 (+15%)2020-02-06 = 31,161 (+11%)2020-02-07 = 34,546 (+11%)2020-02-08 = 37,198 (+7.7%)2020-02-09 = 40,171 (+8.0%)2020-02-10 = 42,638 (+6.1%)That's not to say it can't go all to hell tomorrow, and turn for the worse, but at the moment I am staying positiveEdited: 2:59 am, February 11, 2020 "
"Here is some more detail on those comments from Zhong Nanshan, the Chinese government’s senior medical adviser.In an interview with Reuters, the 83-year-old epidemiologist who won fame for combating the SARS epidemic in 2003, said the coronavirus outbreak was hitting a peak in China and may be over by April.He said a forecast based on mathematical modelling, recent events and government action suggested the peak should come in middle or late February, followed by a plateau and decrease.“I hope this outbreak or this event may be over in something like April,” he said in a hospital run by Guangzhou Medical University, where 11 coronavirus patients were being treated.“We don’t know why it’s so contagious, so that’s a big problem,” added Zhong, whose previous forecast of an earlier peak turned out to be premature. He said there was a gradual reduction in new cases in the southern province of Guangdong where he was, and also in Zhejiang and elsewhere."
"#48 that’s good if the decline of infections going to be as predicted.As to why it is more infectious there is some recent information from China believing it’s not only spread in large water droplets from sneezes and coughs at 1-2m range where it settles out but it is possibly aerosolised meaning the virus is transmitted in smaller airborne droplets of water suspended in the air for longer and travelling further and increasing infection opportunities.This combined with people shedding the virus before they appear or feel ill gives it unique abilities to spread. With the aerosolisation factor it’s likely to mean that due to being carried in smaller droplets there is possibly less concentration of virus particles needed to infect someone, which is a third factor. This is how influenza virus behave as well and manage to spread rapidly.These virus adaptations are not great for overcrowded, unventilated housing and public transport conditions combined with lack of hygiene practices"
"The latest twist - Nepal's human rights council, itself a joke, pressured the gov to evacuate 180 people from Wuhan. Rather than heed the mandate of the W.H.O. to quarantine them far from large populations of people, Nepal, in their infinite wisdom, has chosen to place all 180 people in four facilities within the most densely populated valley in the entire country. And, the facilities are clearly not to W.H.O. standards. And, the regional hospitals have all said they lack the resources to treat more than a few critically ill patients. Maybe as few as 11, all without the ability to contain the virus in the hosptial.I have a meeting with the Minister of Tourism in two weeks. Maybe. Much could change in two weeks."
"Corruption and incompetence, plus denial (in its various forms) are not, in any way, unique to Nepal. As above, the response of the Chinese authorities seems to have left a lot to be desired (British understatement), and the UK government (last week) was letting in people coming directly from China (PRC) without any checks. I do have some direct experience of Nepali health facilities: I have been several times in the 'health' facility in my guides' village (Rasuwa district) - it is in a large, impressive looking building that has almost nothing in it, including no doctor. Interestingly, the (much poorer) village of the other Nepali I know well (which is in eastern Kavre) has smaller, but excellent, and amazingly hygienic facilities - a huge contrast. I went several times (early 2018) to a Ktm hospital - the younger guide had a very bad chest type infection (intravenous antibiotics) - hygiene was dreadful, effectively non-existent (we brought in stuff for him, and ran the test results past a UK doctor who has extensive experience in Nepal, since the 1980s). BTW what is the source of your claim that 50% of Nepali kids are malnourished. Experts (proper ones) were saying on the BBC this morning (radio) that it now appears that the corona virus can be spread by breathing, not just by sneezing etc - obvious implications for transmission in modern cities. NB mentioning 'treatment' is a bit misleading - it is mainly isolation and supporting the immune system - as I understand it, currently there is no direct treatment of the virus."
"""NB mentioning 'treatment' is a bit misleading - it is mainly isolation and supporting the immune system - as I understand it, currently there is no direct treatment of the virus.""Treatment is not misleading at all - read the WHO information about early supportive therapy (synonymous with treatment). ""Supporting the immune system"" includes using antibiotics where appropriate which WHO advises, among other things. This is treatment but not a direct attempt to treat the virus or cure it (no such claim made by me).scoodly"
"@recomments, the statistics on child nutrition and development are consistent when reported by UNICEF, USAID, etc. The ""national"" score for malnourished kids is really closer to 45%. But in 10% of the areas my organization visits, the degree of malnutrition is qualified as ""critical"" to ""severe"" meaning it will likely produce lifelong damage or developmental disabilities.And most hospitals in rural areas are either vacant or do not have doctors. That was just in the Himalayan Times today regarding the hospital in Jajarkot, a hospital I know well and visit often. Back to kids, illness, and treatment. It's rather common for me to meet kids in the spring, return after monsoons, and find they did not survive the season. This due to simple things like basic and even mild gastritus. Unleash something like corona in Nepal and it will make the devastation of 2015 seem manageable. By the way, there are currently two large scale viral outbreaks in Nepal right now. Untreated."
"“Aerosolization” of Corona virus in a previous comment meant it is airborne or more effectively carried in the air and for longer time period to be breathed in. While sneezing and coughing sprays out larger droplets of moisture but about 1-2m range.If you are sneezed or coughed on or within that range the droplets can still be breathed in and the spray droplets land on you and surfaces to be transferred to entry points into your body via mouth, nose and eyes. So washing hands helps to limit that transfer and masks reduce being breathed in.It has always been known by experts and well taught among all the medics and various allied health professionals that the common cold and flu can be transferred to people in all of the above ways but more often in the sneeze and cough range. What the experts are saying for Corona virus or the new name COVID-19 is that it has special ability among some other forms of similar virus to become particularly airborne and breathed in."
A UN article on malnutrition in the developing world with 1 in 3 children globally being under nourished https://news.un.org/en/story/2019/10/1049261What can seem quite misleading to the lay person including highly experienced trekkers and visitors is that the outward appearance of what is a healthy person or child does not translate to preconceptions of obviously healthy or unhealthy individuals standing right there before you. A malnourished child can be carrying body fat appearing healthy but is not.
"Yesterday Evening i heard rumours about an hotel infected and people running away when they wanted to quarantine it. Not looking good. Besides like 1/3 people in Kathmandu are coughing anyhow all the time. that plus no hygiene, I'm afraid I cannot make my flight back in 3 weeks."
"""‘Preparation to quarantine evacuees complete’Or maybe not:https:/…scoodly"
"#56 ""Yesterday Evening i heard rumours about an hotel infected and people running away when they wanted to quarantine it. Not looking good.""Excellent reporting. Yesterday evening in Khumbu I heard rumors that the Yeti had caught the virus in Tibet after a shopping trip over Nangpa La. He sneezed on a yak that later got in a shuffle with a donkey train that a Belgian trekker petted before boarding the KTM flight out of Lukla. Not looking good."
so kind of you KarlEdvard to post the most reliable up to date informationI wonder if the traumatised donkey train could be evacuated on a scam helicopter and charge it to the Yeti insurance companyI have just contacted my discount budget third party booking agency and asked if I can cancel my trip to Belgium as the flu is sure to spread quickly around a small country that you could sneeze from one end to the other
Well I personally met people who saw that scene. The only thing rumour about it is that it was because of Corona Virus.
"Post 61: ""Associated with over coming fear"" - it seems like some people will have a lot of chanting to do."
Pity the Dalai Lama doesn't have faith in the efficacy of the mantra in the real world (he's cancelled all his engagements).It's good and fine to have faith but it would be nice if all these leaders were as if not more vigorously promoting advice on hand washing.
"Namaste Betty,unlike Religion as such, Buddhism is more a scientific investigation of the mind with yoga and some ritual thrown in. If most of the punters in the crowd do not practice the yoga of reciting the mantra then not much any other individual can do. As mentioned in my post...it s up to you’... being the individual must practice rather than expect another to save them. In regards to Tara, a female deity, the term Namaste translates as ‘ I recognise the divine within you’. Thus the recitation of the mantra connects the individual with that aspect of their own divinity as means of healing and protection.Buddhism has very little to do with faith but a lot to do with practice and reason.As to the real world, what are you suggesting regarding the Dalai Lama and his positive influence around ‘the world’ .I dare say Indian officials etc would have had something to do with the cancellations as well. Hysteria in the crowd is rife....just read all the post here!Stories from Australia include a man of Chinese descent dying in the street of a heart attack as no one would go near him for fear of the virus.....thinking he had the virus simply because he seemed to look of Chinese Heritage.As to hand washing....I always travel with hand sanitizer....stands to reason....but the this virus is airborne is it not!"
HiI probably shouldn't have responded earlier but it worries me when we lose sight of the science.Handwashing/sanitising is critical in reducing transmission of the virus. This is one of most important messages that we need to take on board (clearly alongside all the other related advice e.g. sneezing?coughing into something rather than the air)Nil to add
"Seems like your suggesting I or Buddhist meditation masters have ....’lost sight of the science’. Living in Australia the science and experience of climate change have a direct impact on me daily at the moment.I teach STEAM being science, technology, engineering, art and maths, from the prospective of kitchen gardening.A major in comparative religious studies and history of religion at uni underlined the nature of Buddhism as a practical and in-depth science of the mind, meditation and experience being the microscope.Despite the above, numerous trips into the Himalaya has exposed me to a number of events I cannot easily explain to another unless they witnessed it too. Even then, individual interpretations of the same event never quite match."
"A new update from Ktm Post with some info on what's going on in Nepal WRT the Coronavirus and the one confirmed case... No indications of spreading (yet), but worth mentioning what the confirmed case said: “Ever since I was discharged, I have been meeting family members, friends and neighbours,”Nepal may need lots of Karma to get thru this one!https://kathmandupost.com/health/2020/01/31/…"
"@67 That post is a little old. In the last two days, two Nepali nationals, and one Chinese visitor, were admitted into the main diagnostic hospital for testing. The test results have not been announced, and seem overdue. The real bummer is a Saudi man who went to the hospital complaining of Cov-19 symptoms. He was tested, but left despite the hospital having legal authority, and moral responsibility, to detain him. He's on the loose.The borders remain open to Chinese visitors, with virtually no screening. At the Indian border in Nepalgunj there is a ""Health Desk"" tasked with screening for COV-19, but they not only don't have the tools to do so, they don't have any idea what to look for, or what to do if they found it.Lastly, we're still not sure if the government will approve the flight to Wuhan to evacuate 180 Nepali nationals. We do know, the quarantine facilities in place DO NOT meet W.H.O standards, and directly defy recommendations to place these facilities as far from major population centers as possible. Basically, Nepal has fubared this entire thing thus far, and been incredibly lucky. Only luck will save Nepal at this point."
"Quittou, how this can be: "" The borders remain open to Chinese visitors, with virtually no screening."" ???I have read that all the borders to China, including Tibet, are closed? What is the truth now?"
"My understanding is the borders with Tibet are closed (causing food shortage in the far west of Nepal). Quitou refers to the Indian border being open to Chinese visitors with no screening. I have not heard about any of the Indian borders being closed to Chinese visitors and would be very surprised if there was any screening given that the stated screening at TIA is not happening, at least fully.scoodly"
https:/…For what it's worth this is a report in the Himalayan Times today that the three tested negative
Mike T suggests Nepal needs Karma to get through this.Karma is action which has a cause.Quilto suggests Nepal needs luck to get through this.Luck is open to interpretation...not saying that karma is not....but then does luck have a cause? Or is it random?
"Despite the concerns about other border entry points, it would not appear there a lot of China visitors using those points, though it may only take several infected to spread but the risk appears low."
"Today at Boudha StupaChokyi Nyima Rinpoche and the monks of Ka Nying Gompa will be conducting a number of rituals and prayers for those who died from the virus and to decrease the fear and general emotional upset connected to it.From the Buddhist perspective, simply rejoicing that these practices are being conducted adds to their positive intent and bring benefits!"
John C - Can you open your own thread to spread the gospel of Boudha? By polluting this thread - you are giving Boudha and Boudhists a bad name. Could not care less about the Buddhist or any other religious mumbo jumbo on this particular matter..
"Although kavm, you do realise that Kathmandu is arguably the most temple rich and ritualised city in the world and mention of its cultural practice in dealing with this issue is hardly evangelical.That is not suggest an increased awareness of how the illness spreads and control through hygiene is any less useful to the people of Nepal.Edited: 12:41 am, February 15, 2020 "
looks like the tabernacle doesn't like the templemore hand washing please everyone
"It seems that the position with regards to the risks of getting the virus, whether in Nepal or elsewhere, is no clearer, and hence the question of comparative risk (ie being in Nepal versus being elsewhere, except say Wuhan) is no clearer.It is not even that clear as to what the survival rate is for those who become infected. It appears that most of those infected will get a relatively mild illness. There is currently no cure, or vaccine. Most of the stuff in the general media about the likely spread and consequences of the virus includes the key word ""could"" (which is logical, as so much is still not known). However the use of could enables large sections of the media to slant their headlines in a much more dramatic way - bad news and fear always sells. There is a similar situation with a number of the posts under this topic. No one can, at this stage, disprove any of the 'could' based suggestions and extrapolations, other than to point out the lack of balance. Though a totally different situation, exactly the same thing happened with Brexit in the UK (I am in the UK). There were thousands (probably tens of thousands) of dramatic, bad/worst case headlines and 'pronouncements'. Most were presented in such a way as to suggest that the doom foretold would happen (the could aspect being carefully underplayed). This mis-use of could provided a form of cover, though it was usually done in such a way as to not detract from the doom mongering headlines. Here also one could express doubt about what was being said, but it was impossible to go further, let alone disprove most of it, even some of the more extreme nonsense that was put about."
"As yesterday’s New York Times notes, we are hardwired to miscalculate risk:https:/…coronavirus-risk-interpreter.html"
"Post 81: many thanks for the link to the article, which I think is excellent, and which I would encourage people to read."
"@73 This is what we mean when Nepal is not capable of managing this type of scenario, or media messaging. I'm actively working with the NTB on this very thing. To say ""Nepal is in no danger"" creates even more panic and worry. Every country is at risk of exposure. The primary difference is the ability to respond. Even the head of the WHO said their greatest fear is this epidemic spreading to a country with a weak healthcare system. That, means Nepal.I interviewed the Deputy Director of the Himalayan Times, and they agreed their best course of action is not to continue to print ""Nepal is safe"" pieces, but to accurately report on the ACTIONS ongoing, and not the PROMISES and false claims of officials and random people with no experience or authority. Like the NTB and Mr. Bhatarrai, who said ""Nepal is safe"" with nothing to back it up.In 14 days I arrive with two video crews and four journalists. We'll see how prepared Nepal is."
