"Mr Fontana, the Governor of Lombardy, asked the Central Government to adopt stronger measures to arginate the virus outbreakhttps:/…Google translatedMILAN (ITALPRESS) - ""All 12 Lombard mayors who therefore know the area and the situation of the hospitals better have asked me to turn to the government to tighten the maneuvers, to create the social distance to stop the infection. A strong question that comes from all the mayors of Lombardy. We have not made any requests yet, we will have a meeting this afternoon with the government, but we have talked about the closure of commercial activities, to evaluate the opportunity to suspend local public transport, to check and understand if there are companies whose activity can be suspended. We must try to understand and apply strict health measures within business activities that can continue. These are all proposals that we will make to the Government, solutions that we will submit to the evaluation of the Executive"". To say the president of the Lombardy Region, Attilio Fontana, to the microphones of Sky Tg24. The drop in infections in the Lodi area ""is the demonstration that not being together and not participating in gatherings is the only means by which we can block the development of this virus"", added Fontana"
"News from VaticanSt.Peter Cathedral and Square will be closed to visitors and tourists…vatican.va/content/…00328.htmlGoogle translatedIn coordination with the measures launched by the Italian authorities, some further measures have been taken today to avoid the spread of the coronavirus.From today, the Piazza and the Basilica of San Pietro remain closed to guided visits and tourists.Annona's pharmacy and supermarket remain open, but with quota entrances.Also from today, as a precaution, the mobile unit of the Vatican Post in St. Peter's Square, the two stores of the Vatican Publishing House, the Photo Service of L'Osservatore Romano, which will remain accessible online, and the warehouse of clothing.The cafeteria for employees will be closed to the public from tomorrow, 11 March, when a meal delivery service will be activated at the request of the various entities and entities of the Holy See and the Vatican City State.These measures will remain in force, unless otherwise indicated, until April 3, 2020."
Here is an English translation of the Italian Government's 16 point decree limiting movement of persons:https:/…
"For the first time Codogno has zero new positiveshttps://www.tgcom24.mediaset.it/cronaca/coro…Google TranslatedThe mayor of the city and president of the Province of Lodi, Francesco Passerini warns that ""the battle is not over"" but underlines how this is the result ""of a quarantine done seriously""For the first time since the coronavirus emergency, no new infection has been recorded in Codogno. ""We are particularly happy with what seems to us to be a great result - said Francesco Passerini, mayor of the city as well as president of the Province of Lodi - but we, who have been the red zone of the Lodi area, have taken the quarantine seriously, and this is certainly why we are now witnessing the drop we were hoping for "".""The battle is not over - concludes the mayor - but if we keep all the intelligent behaviors dictated by the government then we will have only a few weeks of sacrifice and then we will be out of it""."
"Raffaele,That is a very nice bit of good news. I so hope this can be the start of the downward trend!Wishing the best for the Italian people and all affected in other areas."
"The latest briefing on COVID-19 restrictions by OpsGroup, an airline pilot support site, is herehttps://ops.group/blog/china-coronavirus/"
Officially declared a pandemic by WHOhttps:/…
"Any activity other than food and pharmacies are now closed. The measure includes any non essential industrial activity.Here is the message to the Nationhttps://www.youtube.com/watch…Edited: 5:06 pm, March 11, 2020 "
"In observing the Italian prime minister some background may be useful.At the last national elections in 2018, the ruling leftish coalition lost out as did the Berlusconi party and a government was formed by the Five Star Movement and La Lega [the League]. https:/…2018_Italian_general_electionI wrote this, as an outsider, in 2018…blogspot.com/2018/10/a-perspective-on-curre…The parliamentary leaders of those parties did not want to be prime minister but Guiseppe Conte, a professor of private law with no parliamentary experience, accepted the challengehttps://en.wikipedia.org/wiki/Giuseppe_ConteIn 2019 the differences between La Lega and Cinque Stelle led to a collapse of their coalition, a new governing coalition formed between Cinque Stelle and the leftish Democratic Party, with Conte still prime minister. La Lega now in opposition and in collaboration with the Berlusconioni and Fratelli d'Italia [Brothers of Italy]. the latter direct heir to the Fascist Party.In regional elections La Lega has maintained government of much of the north but not Emilia Romagna. This meant lots of sniping between those regions and the national government. That pattern seems to have declined very recently with the urgency of issues and necessity of collaboration... and a rise in support for Conte himself.Just to note that where we of the Anglo world tend to scoff at the instability of governments in Italy, a major factor is in the Italian constitution. in the ferocity of demands for democracy post WW2, the constitution for the new republic went further than other democratic constitutions in allowing a government to be brought down not just by vote of confidence in the lower house (as in UK, Canada, Australia) but by vote of either house. These countries, unlike the US, have parliamentary systems where governments are formed, prime ministers appointed, on the basis of control of the parliament."
"Patient One, the 38YO man from Codogno is finally out of intensive carehttps://www.tgcom24.mediaset.it/cronaca/sono…Google translated""Am I in Lodi?"" Patient 1 speaks, just after leaving the ICUThe manager's words, the first to test positive for coronavirus in Italy. His wife, 8 months pregnant, returned home after hospitalization in the Sack and is waiting to give birth to a baby girl""Excude me, where am I, am I in Lodi?"". These are the first question asked by patient 1, the 38-year-old athlete and runner, immediately after waking up in the intensive care unit. The man first appeared at the Codogno hospital on the afternoon of February 18, without however having the symptoms that could have led to identifying him as a 'suspicious' case. So much so that after the necessary investigations and treatments, despite the proposed hospitalization, he had decided to go home.The hospitalization - A few hours later, however, the situation had precipitated, to the point of requiring, on the morning of February 20, the intervention of the resuscitator and an intensive care unit. It was his wife who had informed the doctors that her husband had been having dinner with some friends at the end of January, including one who had just returned from China. The swab and the discovery of the first case in Lombardy had been arranged before the explosion of the 'epidemic."
"Fanpage has published on Youtube a visit to and interview with senior staff of the resuscitation unit of a leading Milan hospital. The movie is here.https://www.youtube.com/watch?v=zjYLuKT7keEI have made a rough translation of what they say, which contains some repetition. Transcript begins:Resuscitation ward of the St Paul Hospital in Milan.Here all the patients have the corona virus, there are no other diseases being treated here.The mortality of patients brought to me is 20-30%The particular thing about this disease is that it lasts a long time.Anyone can be at risk of infection.No one can enter here.It’s extremely dramatic for a person dying, because they truly die alone.We only have corona virus patients who have breathing problems, brought into this protected environment, arriving sedated. They arrive sleeping and are intubated to have mechanical assistance with their breathing.We have been tossed into this tumultuous situation, everyone is closed out, we concentrate on the problem of infection from SARS-Cov2 [the name of the virus that causes the disease COVID-19, aka corona virus] This is something dramatic and violent. We dominate all existing health facilities. Lombardy definitely has an optimal health system but this epidemic does not stop, everything is inadequate.We have been working without a break since 22 February and we are wrung out.We get sick, we lack beds, we lack people. Above all we lack nursing staff.In the first phase the patient is in general anaesthesia, no feeling, no sight, not speaking, totally dependent on this ventilation machine that has become famous. We support basic life functions to allow time for the battle against this infection. An infection not just locally in the lungs but extending into other organs. Gaining time for the organism to recover itself, because no treatment exists. The system is clogged because the the number of resuscitation posts is limited.20-30% mortality, they were people in good health, predominantly male with high blood pressure.Data we have received and our own local experience indicate that any individual can be at risk of infection. The level of psychological suffering correlates to the impossibility of seeing anyone from family. Because no one can come in and this is a dramatic thing fo the person dying. They die alone. We are collapsing a bit because it’s now three weeks; every now and then someone collapses.end transcriptA few hours ago Fanpage published an interview with a manufacturer of resuscitation units based in Bologna. In this fast talking interview he said that hitherto most of his resuscitation machines were exported. He has now been directed to double production and export none.Edited: 4:22 pm, March 12, 2020 "
"""Because no one can come in and this is a dramatic thing fo the person dying. They die alone.""Thank you DennisThe video you shared provides a real estimate of the severity of the problem.Very touching"
That video and transcript made me really sad. I wish more people could understand how their desire to travel without respect for other's welfare can end so sadly for those who become infected and especially those who die alone.
"-:- Message from Tripadvisor staff -:-Tripadvisor staff has removed this post because it did not meet Tripadvisor's forum guidelines with regards to off-topic chat. Please limit conversations to subject matter directly related to the host forum. For example: when in the London forum, please stick to topics that relate to travel within the London Metropolitan Area.Off-Topic Chatter is a forum for discussions gone afield from the topic of travel. Please note that the Off-Topic Chatter forum is un-moderated -- the Forum Posting Guidelines are not enforced, with the exception of pornographic images or text, hate speech, unauthorized re-prints of copyrighted text, and messages that promote or encourage illegal activities. Each user is expected to take responsibility for his or her own conduct.To review the Tripadvisor Forums Posting Guidelines, please follow this link: http://www.tripadvisor.com/pages/forums_posting_guidelines.htmlWe remove posts that do not follow our posting guidelines, and we reserve the right to remove any post for any reason.Removed on: 2:04 am, March 14, 2020"
This is distressinghttps://www.youtube.com/watch?v=qgylp3Td1Bw
"Is Lufthansa Airlines cancelling flights from O'Hare in Chicago to Catania Sicily, stopping in Munich for flights in mid April?"
@274 are you surprised? There was extensive media coverage of LH cancelling a large number of flights ...Germany has the virus too.
"The Laos/China border crossing at Boten is reported to be closed. My wife and I intended returning to China that way after our flights were cancelled.Instead I flew from Vientiane to Kunming yesterday as an expedient.Checking with Lao Immigration at Vientiane revealed that you can in fact leave Laos at Boten, though not the other way around.Expect thorough compliance procedures entering China at Mohan. Baidu Ditu suggests this might be closed.While Laos is reported to be free from Coronavirus, I did not see, neither was I subjected to any form of medical screening at Vientiane airport."
"From the Swiss Federal Office of Public Health on travel from Italy to Switzerland (see last paragraph):https:/…massnahmen-des-bundes.html""Maintaining the capacity of the healthcare system, and entry restrictions for people from high-risk countries and areasThe Federal Council is taking measures to restrict the entry into Switzerland of people from high-risk countries and regions. These measures are intended to assure the provision of adequate care and therapeutic products to members of the public.Definition of high-risk countries and areasIn consultation with the Federal Department of Foreign Affairs FDFA, the Federal Department of Home Affairs FDHA defines countries or regions designated high-risk countries or regions. Various conditions must be met for this to happen. The country or region must have:• a border with Switzerland,• imposed extraordinary measures to prevent and combat the novel coronavirus.At present Italy is designated a high-risk country.People from Italy will be refused entry to SwitzerlandPeople from Italy will be refused entry to Switzerland. Exceptions are possible, for example for people who live or work in Switzerland. Anyone wishing to enter Switzerland despite the entry ban must prove that one of the exceptional conditions is met."""
"An array of sensitive social and economic family initiatives by government, tax adjustments and postponement of local elections.Use Chrome browser to be offered a translationhttps:/…a one page summary of a 120 page decree."
"@CicimoThank you for your post. Very informative.Anyway, Italians are not allowed to leave their homes without a good reason. I believe Swiss will not see many people at the border ;-)"
A fragile hope is given by the introduction of a new teraphy with Remdesivir. In the Chieti Hospital is beginning a new protocol to test it's effectiveness chietitoday.it/cronaca/antivirale-sperimenta…
"Any information on the Adriatic countries? I'm supposed to travel to Croatia, Montenegro, Bosnia-Herzegovina & Slovenia, leaving March 31."
BNSimsSorry no news from there but if you post to their geographical forum you might have better luck
#277 #279 I read that as not only Italians but any traveler from Italy.
"BobbyI am sorry but I am afraid I don't have any verified info to share on travelers other than Italians. I don't even know for sure if trains are still running or not. With people locked at home if they run looks like a nonsense. I know for sure busses are still running but not all of themEdited: 10:10 am, March 14, 2020 "
"It has been officially adopted the Protocol regulating measures to contrastate and contain the outbreak of Covid-19 virus in workplaces.All non essentials activities are closed, but for the others still working, here is the document regulating measure to adopt in workplaces for the safety of the workershttps://www.ansa.it/sito/notizie/economia/fo…Google translatedCoronavirus: protocol points, shifts, devices and canteensThirteen chapters, also re-modulation of production levelsThere are thirteen points in the ""Protocol for the regulation of measures to combat and contain the spread of the Covid-19 virus in the workplace"". The document, according to what is learned from union sources, indicates the precautionary measures: from entering the company to managing canteens and common spaces, from safety devices to managing a possible case of coronavirus. The Protocol ""was signed at the invitation of the President of the Council of Ministers, the ministers of Economy, Labor, Economic Development and Health, who promoted the meeting between the social partners, in implementation of the measure (article 1, first paragraph, number 9) of the Prime Ministerial Decree of 11 March 2020, which, in relation to professional and production activities, recommends agreements between employers' and trade union organizations. The Government favors, as far as it is responsible, the full implementation of the Protocol "".Here are the measures:---Sorry, too long to translate it all"
"Thank you, Raffaele R for Reply 285. It is very informative. For your information, below is the remaining text that you did not translate into English. In case you are having difficulty translating long texts in your links, I am able to do so by first opening the link, then copying the entire document into Google Translate, Italian to English, which provides a complete translation, at least on my computer (MacBook Air with latest OS running Safari).https://www.ansa.it/sito/notizie/economia/fo…Here are the measures:• OBLIGATION AT HOME IF WITH FEVER OVER 37.5. Obligation to stay at home in the presence of fever (over 37.5 °) or other flu symptoms and to call your family doctor and health authority.• ENTRANCE CHECKS. Before entering the workplace, staff may be subjected to body temperature checks.• CLEANING AND SANITIZATION. The company ensures daily cleaning and periodic sanitization of the premises, environments, workstations and common and leisure areas.• TO WASH HANDS. It is mandatory that the people present in the company take all the hygienic precautions, in particular for the hands and the company provides suitable detergent means.• MASKS AND GLOVES. If the work requires an interpersonal distance of less than one meter and other organizational solutions are not possible, the use of compliant masks and other protective devices (gloves, goggles, overalls, headphones, gowns) is required.• CANTEENS WITH CONTINGENT ACCESS. Access to common areas, including company canteens, smoking areas and changing rooms is contingent, with the provision of continuous ventilation of the premises, a reduced parking time and with the maintenance of the safety distance of 1 meter between people.• CHANGING ROOMS AND DISTRIBUTORS. Provide for the sanitation of the changing rooms and guarantee the periodic sanitisation and daily cleaning, with special detergents, of the canteen, of the keyboards of the vending machines for drinks and snacks.• POSSIBLE STOP NOT NECESSARY DEPARTMENTS AND SMART WORKING. Limited to the period of the coronavirus emergency, the companies may, having as reference the provisions of the CCNL and favoring the agreements with the company union representatives, order the closure of all departments other than production or, in any case, those whose operation through the use of smart work, or in any case remotely.• REMODULATE PRODUCTION LEVELS AND SHIFTS. Production levels can be remodeled. A shift plan for employees dedicated to production must be ensured with the aim of minimizing contacts and creating autonomous, distinct and recognizable groups.• SOCIAL SHOCKS AND HOLIDAYS. Use social safety nets as a priority. Otherwise, the periods of vacation arrears and not yet used.• STOP TRAVEL. All national and international business trips and business trips, as well as internal and training events, are suspended and canceled. Face-to-face meetings are not allowed.• SCHEDULED ENTRANCE-EXIT TIMES. Staggered entry / exit times are encouraged in order to avoid contacts in the common areas as much as possible (entrances, changing rooms, canteen).• MANAGEMENT OF A CORONAVIRUS CASE. In the event that a person present in the company develops fever and symptoms of respiratory infection such as cough, he must immediately declare it to the personnel office, he must proceed with his isolation and that of the others present from the premises. The company immediately notifies the competent health authorities and the emergency numbers for Covid-19 and collaborates in defining any ""close contacts"".APPLICATION COMMITTEE. A committee for the application and verification of the rules of the regulatory protocol has been set up in the company with the participation of the company union representatives and the Rls.RESERVED REPRODUCTION © Copyright ANSA"
"Cicimo, I see you are contributing in many places but stay with us if you can... :-). We need voices and translation support. Although my Seattle daughter keeps me uptodate with excellent King County public health advisories this Italian planning and regulation is way ahead and exemplary for most of the world. There are a number of us contributing around the clock. We need more. It’s 7am Sunday here now, I woke to read rising distress in the situation discussion, things will get worse. I use a MacBook Air with complication of Italian keyboard but set to Australian key settings. Much more fun for an old geezer than sudoku. I recommend to people that they open links in Chrome where offered translation to whatever language is primary language in one’s use of google. Though for key documents in PDF etc and daily email news eg from Corriere della Sera the path you describe via google translate is essential. Please stay with us... :-)"
Thanks!
"To: Dennis A, the Chrome translator on my computer seems to be working now. It wasn't before. Thanks for reminding me to check it again.And, thanks for the continued updates from folks like you and Raffaele R who provide the ears to the ground information on Italy."
"And the great GAC, Italian to the core but living in that gigantic super-state just a bit south of you!Necessary sometimes to refresh/ reload pages in Chrome to get language options offered again and grab quickly whichever you want.Edited: 5:44 pm, March 14, 2020 "
"Prime Minister Conte in an interview with Corriere della Sera, as quoted in morning email from Corriere della Sera.This is google translation, original text follows""Scientists tell us that we have not yet reached the peak, these are the most risky weeks and we need the maximum precaution. We cannot let our guard down. It is the most important challenge of the last decades, to win it we need the responsible contribution of 60 million of Italians ""«We must avoid in any way the movements not absolutely necessary. It's time for sacrifices, for responsible choices. From the beginning I worked with a spirit of unity, putting health at the center, which I believe explains that 62% consensus. We are facing an emergency never known since the post-war period until today. The vast majority of Italians are aware that the rules serve to protect our loved ones. I am proud to lead this great community, which in the moment of maximum difficulty stops to sing the national anthem and to send a moving applause to the doctors and nurses who work exhausted in the ward ».""Gli scienziati ci dicono che non abbiamo ancora raggiunto il picco, queste sono le settimane più rischiose e ci vuole la massima precauzione. Non possiamo abbassare la guardia. È la sfida più importante degli ultimi decenni, per vincerla serve il contributo responsabile di 60 milioni di italiani""«Bisogna evitare in tutti i modi gli spostamenti non assolutamente necessari. È il momento dei sacrifici, delle scelte responsabili. Fin dall'inizio ho lavorato con spirito di unità, mettendo la salute al centro, il che credo spieghi quel 62% di consenso. Stiamo affrontando un'emergenza mai conosciuta dal Dopoguerra a oggi. La stragrande maggioranza degli italiani è consapevole che le regole servono a proteggere i nostri cari. Sono orgoglioso di guidare questa grandiosa comunità, che nel momento di massima difficoltà si ferma a cantare l'inno nazionale e a rivolgere un commosso applauso ai medici e agli infermieri che lavorano stremati in corsia»."
"A new red zone has been issued this morning. It,s in Region Emilia Romagna , close to Bolognahttps://www.ilrestodelcarlino.it/imola/crona…Google translatedCoronavirus, red zone, the territories of chief town Medicine and of the hamlet of GanzanigoNobody will be able to enter or exit: here are all the new rules. The complete ordinanceMedicina, 16 March 2020 - The territory of the capital of Medicine and the Medicinal fraction of Ganzanigo are now a red zone. Or rather: closed, delimited, totally isolated to avoid the spread of Coronavirus towards the metropolitan city and Bologna. The mayor Matteo Montanari announced it with a painful video on Facebook."
Solidarity from Israel. The photos of the building of the Municipality of Tel Avivhttps://www.tgcom24.mediaset.it/mondo/foto/c…
Good eveningWe are not better by the virus. The only to take advantage is our planet. We stopped moving and rushing around. As a result we reduced pollution.Here is the situation in China by the beginning of marchhttps://www.youtube.com/watch?v=w5SR3Q5Ecmwand here is the situation in Italy nowhttps://www.youtube.com/watch?v=L806aVBjlxI
"According to IL Giorno (Milano newspaper), in the Lombardy region the infected have leveled off today. the curve is flatter. Still increasing but not exponentially so."
"New decree 17 March on economic and social measures, from prime minister’s officeFor translation open this report in Chrome browserhttps:/…"
"The following is the first good news since days as Latrevisana anticipatedhttps://www.tgcom24.mediaset.it/cronaca/lomb…Google translatedCoronavirus, Gallera: constant non-exponential trend in Lombardy""The daily data leaves a little time, but the data is constant and this is the most important element"". This was explained by the Lombardy Welfare Councilor, Giulio Gallera, on the growth trend of coronavirus infections in Lombardy. ""All the mathematical schemes gave it an exponential rise - said Gallera - instead the data so far is constant. We wait in the next few days, by Sunday, to check if there is a slowdown"".Edited: 7:23 am, March 17, 2020 "
