"Could we please start this thread for offical corona virus information: only for actual governmental announcements, or links to news coverage of announcements. Please no personal opinions or advice, or questions about your upcoming trip. In English or Italian. Thank you.Edited: 9:59 am, March 05, 2020 "
Italian Health Ministry website news and media page:www.salute.gov.it/portale/news/p3_2.htmlFor offer of adequate translation open that link with Chrome browser.Region of Lombardy government web sitehttps:/…map of Lombardyhttps://goo.gl/maps/KcWb4HFrM1r9AjFF6Veneto Region government web sitehttps://www.regione.veneto.it/map of Venetohttps://goo.gl/maps/GCgNMeMrbS8h83YK9Piedmont region government websitehttps://www.regione.piemonte.it/web/map https://goo.gl/maps/VSk4k5Ddj5jnb2qh9Emilia-Romagna government websitehttps://www.regione.emilia-romagna.it/map https://goo.gl/maps/eV72zPXMHM9UeAAh8
"and Friuli Venezia Giuliahttp://www.regione.fvg.it/rafvg/cms/RAFVG/regione.fvg.it/rafvg/…map of the regionhttps://goo.gl/maps/v6yn8LZ67HUnuYWHAEdited: 1:24 am, February 24, 2020 "
"And Liguriahttps:/…coronavirus.htmlmaphttps://goo.gl/maps/nNFyuwtReSVQigsE9These three messages provide links to regional governments from the French border to the border with Slovenia, to La Spezia (including Cinque Terre), Bologna and Rimini. With links to maps which can be browsed.There are different levels of restraint on social and commercial activity in different regions. The easiest way to get translations of Italian language web pages is to open them with the Chrome browser."
Thanks Dennis.
"Discussion of issues with infectious diseases professor in Milan, Massimo Gallihttps://www.corriere.it/salute/malattie_infe…"
Well done!
live coverage from isolated towns by fanpagehttps://youtu.be/_TPT-k9NCtI
"Dennis,thank you!"
"Yes, many thanks again, Dennis, for really useful information.MMM"
Is La Repubblica a decent source? https:/…
"Yes, Repubblica is a conservative newspaper of long standing. But it is not a major newspaper and as before I recommend that people refer to Corriere della Sera, the most substantial paper, based in Milan. See this page for latest news OPEN IN CHROME BROWSER TO BE OFFERED A TRANSLATION, on computer top right of page, on tablet at bottom of page. https://www.corriere.it/cronache/20_febbraio…See also this set of cards prepared by a virologist. https://www.corriere.it/salute/malattie_infe…Important to note that in the event a person has symptoms the advice is NOT to go to doctor’s office or emergency department but call an emergency number. .... Transmission of the virus in Lombardy has occurred as in cluster infection places people have gone to Emergency and staff and patients have acquired the virus there."
"My strong impression is that La Repubblica tends to be more alarmist and sensational than Corriere della Sera. Nevertheless, they are both mainstream, respected news sources. I read both regularly."
Thank you again Dennis A. Are you aware if there are any restrictions on air travel within Italy at the moment? We arrive I Milan and fly to Catania two days later. The link to the newspaper is excellent. Thank you!
"Brisby, thank you, see thishttps:/…and keep looking at it. I would use a mask anywhere around there and on a plane and as far as possible keep space from people. (A mask on a long journey from Australia helps keep moisture in, avoids drying out and respiratory irritation.)You don't say when you are traveling. Check with GP to see if they have any fluvax or pneumovax. Vaccination against the flu is not vaccination against COVID-19, but avoiding being sick is first step to avoiding a weakened immune system. In any case the winter flu season, though winding down, is not over in Italy.Edited: 4:47 pm, February 24, 2020 "
"CDC has issued a level two alert for Italy. They were stating ""At this time, CDC does not recommend canceling or postponing travel to Italy"" but have changed it to """"Because older adults and those with chronic medical conditions may be at higher risk for severe disease, people in these groups should discuss travel with a healthcare provider and consider postponing nonessential travel.""https:/…coronavirus-italy"
"Regarding the value of wearing masks, their is little evidence the kind of masks you can easily buy are effective in preventing airborn viral diseases. To work they have to be a certain kind and they have to fit perfectly, ie, no airleaks, and fit very tightly.That excludes any man with a beard and many people who have prominant cheekbones. That ""fit"" on the face is quite uncomfortable and too claustrophic for many people.The kind of mask that you see most people wearing: a typical surgical mask loosly tied onto the face, are useless. There have been many articles recently about the effectiveness of wearing a face mask: you can google it and read for yourself. The take home I got from reading one of those articles a week ago was that wearing gloves and frequent hand washing if you are not wearing gloves are much more effective than a mask."
This Singapore news source always has good informationhttps:/…
No mask is perfect. Much depends on how properly people fit them.I think (no link) Tony refers to this standardhttps:/…face-mask.aspxThere is a global shortage of maskshttps:/…Simple mask are better than none. And an article in the Journal of the American Medical Association last year suggested that the simple masks are just as good. https:/…190903134732.htmOn face touching... masks help remind and discouragehttps://www.ncbi.nlm.nih.gov/pubmed/25637115
"It is hard to see what the links are that are being posted - in some cases I just see https:/ .... So without clicking on every link, I don't know if this was already posted. If it was, I apologize. This is an article from the NY Times today with reporting from Italy re the situation on the ground in Milan. https:/…"
"#19, mom, that's the style of TripAdvisor, just click on their abbreviations. I have not seen any to be dangerous, for years.#20 brisby. Please wait at least till next week, follow at https:/…105711970"
Basic statistics herehttps:/…I don't know who is maintaining that.
"Best current advice on TripAdvisor, from GAChttps:/…105715593"
Thanks Dennis A (and GAC).I'm following this thread for my trip to Europe in June. I feel fortunate I have plenty of time to plan for changes....
GAC- looking at Dennis’s link above the number went up 100 from yesterday.
"Dennis, yes thanks, I know that's the style of TA - I was just saying that because the links don't show the whole title of what is being linked I didn't know if what I was about to link had already been shared."
DELTA AIRLINES HAS A NEWS RELEASE ON ITALY FLIGHTS:https:/…coronavirus-situation-in-italy
"The Australian national broadcaster ABC has published a page in which a virologist advises on preparing for a pandemic. https:/…11998540Here in this forum the focus is on to travel or not and under what conditions and with what care, but there is time and brain and cupboard space to be prepared and add quality to daily life, hygiene. etc. At home as well as in travel.It is useful in research to note that:- the virus is technically called SARS-COV2- the disease it causes in humans is COVID-19In each case the COV means corona virus. The word corona enters into the story because under the microscope the virus has a crown-like array of spikes around it.A company researching for vaccine has announced that it plans clinical trials in humans in April. From clinical trial to approval and availability can take time.https:/…d41586-020-00555-xIt is valid perspective to compare with the incidence of flu, for which people are habitually unprepared with vaccination. It is important to be aware however that the structure of the virus, as above, is quite different from regular flu and there is incomplete understanding of this virus and its behaviour."
"Do follow the main discussion, especially contributions by GAChttps:/…105724776"
"""Regarding the value of wearing masks, their is little evidence the kind of masks you can easily buy are effective in preventing airborn viral diseases.""A doctor here in the UK described those masks as being about as useful as a piece of toilet paper stapled to each ear!"
"To know more about the virus and vaccine question, see this page new today at Linkiestahttps:/…This is Linkiesta, an independent and relatively young and vigorous investigating news outlet in Italy.https://en.wikipedia.org/wiki/LinkiestaAS NOTED BEFORE, OPEN ITALIAN PAGES WITH CHROME BROWSER TO BE OFFERED A TRANSLATION."
#30 Andmar see #18.
Lazio informationhttp://www.regione.lazio.it/rl_main/map https://goo.gl/maps/v5Ms1cgrLe9z1DSWATuscanyhttps://www.regione.toscana.it/-/coronavirusmap https://goo.gl/maps/LASTHBxMXmJ8fHuSALe Marchehttps://www.regione.marche.it/ [rules to 4 March]https://goo.gl/maps/9uCRxwqEVimcG1nB8Umbriahttp://www.regione.umbria.it/coronavirushttps://goo.gl/maps/SS8E94yRoND2knhh9
Thank you mr Dennis !
"The U.S. CDC travel notice on coronavirus and travel in Italy is now reposted by the U.S. Embassy Rome on the website https:/…It is currently at Alert - Level 2, Practice Enhanced Precautions, in the scale 1 to 3."
thank you cicimo
"-:- Message from Tripadvisor staff -:-This post has been removed at the author's request. The author may repost if desired.Posts on the Tripadvisor forums may be edited for a short period of time. Once the edit period has expired, authors may update their posts by removing and reposting them.To read more about editing your posts, please follow this link: http://www.tripadvisor.com/help/how_to_edit_your_postsRemoved on: 6:39 am, February 26, 2020"
"Natasha, all your postings are very important, on all subjects, because they carry meaning and character of Rome. I am going to add more information and links on regions, please check on my work. Thank you. :-)"
More sensible advicehttps://gizmodo.com/should-you-cancel-your-t…
"THIS IS ABOUT TRAVEL INASMUCH AS THIS DISEASE THREATENS TRAVEL AND UNDERSTANDING THE DISEASE IS HELPFUL.Definitions:This thread and much public discussion is labelled 'corona virus'. Corona viruses are a family of viruses that under a microscope look like a crown. See the image on this pagehttps://appleinsider.com/articles/20/01/31/a…The virus of concern at the present time is officially called SARS-Cov2 [severe acute respiratory syndrome - corona virus 2]https://www.medscape.com/viewarticle/925710That's the organism. A particular virus. Bacteria are unicellular organisms, most of which are beneficial or neutral in effect. Human cells in people are only 10% of the total cell count in our bodies.https://www.nih.gov/news-events/news-release…Viruses are entirely different. Smaller than single cells, they invade, alter and manipulate normal cells and their functions.https:/…intro-to-virusesViruses are not treated with antibacterial, antibiotic drugs. Use of antibiotics in useless circumstances renders them less useful in serious bacterial disease.So the final official name is for the DISEASE caused by SARS-Cov2....COVID-19This is the Wikipedia entry for COVID-19https:/…Coronavirus_disease_2019Understand that wikipedia is an encyclopedia edited by anyone; editing is constantly monitored. Understand also that original research and ideas are not accepted on wikipedia, information should be linked to sources elsewhere. So what you read today may not be the same tomorrow. Citations should be to xxx (accessed [date])"
"RegionsThis discussion is a bit like a dish of ravioli in presenting links to regional governments in Italy and their advice and regulations regarding COVID-19This wikipedia entry on regions of Italy includes maps. Maps of regions, also maps of provinces, smaller geopolitical entities within regions. https:/…27ItaliaI suggest that to find mention in this thread you use the find function on computer for mention of word on a page, or perhaps to make it simpler, google regione [name of region, in Italian, e.g Toscana, not Tuscany] perhaps adding the word corona for a different bunch of returns. e.g. regione emilia romagna coronaThere will be lots of pages offered in Italian. Use the Chrome browser to be offered translation, to whatever language you most use on your computer/device."
"#41 Re:Gizmo link , they said “ Many public health experts have already criticized the travel restrictions implemented by countries like the U.S. For one, the fear and economic damage these restrictions create can unintentionally worsen the situation, making countries more reluctant to report cases within their own borders. They can also make people prejudiced toward the residents of affected countries or of their neighbors who hail from there.”. I read things like that and it infuriates me. I don’t care about that junk, I care about my families health, the health of people around me, and doing the best I can to make sure I don’t go somewhere and get quarantined. If travel restrictions help prevent the spread then DO IT.Edited: 11:04 am, February 26, 2020 "
"Campagna, including Napoli [Naples]map https://goo.gl/maps/jAudXUhK8Agm2heK8…campania.it/regione/it/news/regione-informaAn ordinance at great length, not translated in Chrome, this is just a scratchy google translation of the relevant part, including usual practical stuffRECOMMENDSto the Mayors of the region who have adopted measures, pursuant to art.SO or 54TUEL to communicate it promptly to the Presidency of the Campania Region for the purpose ofmonitoring and coordination of activities;to the mayors of the region to avoid organizing and carrying out eachevent involving meetings or gatherings of citizens;school managers to avoid organizing and carrying out trips and trips toeducation, in Italy and abroad as well as any event not strictly necessarycurricular activities that involve student meetings or gatherings;School managers to ensure the dissemination of information and communications in orderto the good practices recommended by the Ministry (wash your hands often with solutionshydroalcoholic; avoid close contact with people suffering from infectionsRegional Council of CampaniaPresidentbreathing; do not touch your eyes, nose and mouth with your hands; cover your nose and mouth if you dosneezes or coughs; do not take antivirals or antibiotics unless prescribed; clean thesurfaces with chlorine or alcohol based disinfectants; use the mask only if you suspectbeing sick or caring for sick people; contact the single emergency number 112 ifyou have a fever, cough or difficulty breathing and you have returned from China, or from other areas offull-blown infection);regional transport companies to ensure appropriate prevention measures andcontainment of the risk of contagion, to protect employees and users, includingthe increase in the disinfection of wagons, carriages, train and bus cockpitsregional."
Please tell me we are bringing all US citizens trapped in Italy back home before they become infected and we should officially close off travel to and from the country until they aren't a hot zone.
"I like this resource. You can scroll down to the map, expand it and see exactly where the cases are located in each country. Then click on the location and get info about the case. Click on the arrow (<--) to close the case. Above and below the map is good info, complete with links to the ""source."" This site is kept very up-to-date.https:/…"
OpsGroup is a civil aviation pilots group established recently to get clearer advice to flight crew than is provided by the ICAO's standard NOTAMs [Notices to Airmen].Today they have published this page of information on global flight restrictions due to COVID-19.https://ops.group/blog/china-coronavirus/
"#47. Yes, Renee, also good that each entry has a link to click to see the source."
"Regional government Sicily…sicilia.it/portal/page/portal/PIR_PORTALEPuglia regional governmenthttp://www.regione.puglia.it/Abruzzohttp://www.regione.puglia.it/Sardegnahttps://www.regione.sardegna.it/Molise…molise.it/flex/…1Trentino Alto-Adige [no news at the moment]http://www.regione.taa.it/Basilicatahttps:/…home.jspCalabria [look down the page, right side, at this moment]https://portale.regione.calabria.it/website/"
"Updated numbers 528 cases, 14 deaths.https:/…"
"This afternoon, the Governor of the Lombardy Region (capital city Milan) announced that decisions will be made TOMORROW or SATURDAY concerning the restrictions currently in force within the Region to combat the spread of Coronavirus.It is quite possible that certain restrictions will be either modified or dropped. One restriction already dropped was the requirement to close all pubs, bars, cafes and night clubs at 6 p.m. These establishments may now remain open provided that the number of patrons be limited to the number of chairs at the location, and that all patrons be served at table and not while standing at the bar counter (which tends to get crowded). Pubs were closed in Lombardy Region for only TWO NIGHTS before the restriction was lifted.There is SPECULATION that MUSEUMS may reopen next week, perhaps with some restrictions on the influx of visitors to avoid congestion. I should point out that only the major museums have capacity/crowding issues. Many, many lesser known museums in Italy do not present problems of overcrowding, and it seems silly to keep them closed.Another statistic: of the 528 reported cases of contagion, only 37 require intensive care hospitalization (7%). While that number Is relatively low, it does represent a huge threat in the aggregate in a worst case scenario, because there are simply not enough hospital beds in the country to accommodate the huge numbers of patients which would materialize should the virus spread widely out of control. But this scenario may never occur, as we all hope."
"Up to 650 cases. That is a big jump from yesterday.https:/…countriesmaphttps:/…Edited: 12:47 pm, February 27, 2020 "
"Just so you know, the source of this virus is not yet clearhttps:/…d41586-020-00548-w"
"We are flying from TX to Rome on April 5th for 2 nights in Rome, then a 3 day stop in Florence, then on to Positano for 7 days. At this point, we are nervous/anxious as to whether our trip will hold together. And if it does, we are concerned about the possibilities of being put in quarantine once we arrive, or risk the museums and other attractions being closed (Rome & Florence). Delta said unless Rome is added to the list of restricted destinations, there are no refunds. Trip insurance doesn't cover pandemics, so that's out of the question as well. We are in a holding pattern, hoping for the best. Anyone else experiencing this angst about their upcoming trip to Italy?"
"Sherobin, I'm in your position as well. I am flying from TX to Rome on April 12th and also nervous about the financial loss of this trip. I've heard good things about Delta, not so much Lufthansa which is who we booked tickets with. I have airbnb reservations that I can still cancel at full refund, so at least it will just be tickets (although it is for 7 people). Good luck to you!"
"#55If you open this article in GOOGLE translation, you will discover that there is a brand new virus on the loose in Italy (and elsewhere), namely theVIRUS OF FEAR.Reading the article may not assuage your anxieties, but provide some context and perspective:https:/…"
"There is uneven provision in regions of advice on who to call if you have relevant symptoms. Can someone In Italy please confirm if this applies everywhere:----- DO NOT GO TO DOCTOR OR EMERGENCY DEPARTMENT, CALL 118Different regional governments also have different free call 800 numbers.The Veneto page is clearer than some others. https://www.regione.veneto.it/article-detail…use Google Chrome browser to be offered translation to main language you use in Chrome."
Yes we are always more organized...
"IATA, the international air transport association, has this list of restrictions by governments on entry by people coming from affected regions. https:/…1580226297.htm"
what does that mean?
"I’ve been following all of this for days now, here and other places. I have concluded that 75% of the concern has been and continues to be caused by the media. This virus is somewhat more than the common cold and less than the common flu. Would I go to China, heck no- but to fair I wouldn’t go there anyway. Now I will state what I am worried about and that is the continued drum beating by the media may result in getting quarantined either at my destination or trying to come home. That concern is what might keep us from our planned trip, but catching a bad cold isn’t going to be the reason."
"The intention of this particular discussion thread is to provide information as set out in the title of the thread. There are other discussion threads for individual concerns. (Click on Italy forum to find them)There is a glut of information in media which will increase. Perhaps most important now to focus here on rules, restrictions, etc in Italy and affecting travellers to and from Italy. Important to provide links to information, always show others where news comes from, to avoid rumour propagation. #62 please consider. If replying to another message, please be aware that at TripAdvisor replies are just added at the end. That means for example, Natasha #61 that unfortunately we don’t know what you are asking about.Edited: 2:20 pm, February 28, 2020 "
"Sorry, I’m an idiot and made a mistake."
"#64. No, I think just human. :-). Lots to mull and muddle. One current perplexer for me in reading Italian newspapers and regional government sites , part in Italian, part in the translation (as many may be doing) offered by google when you use Chrome, is the translation of the Italian word tampone. Yes the computer offers tampon but there are two relevant and quite different meanings. First is the barriers around certain towns, second the swab, the pharyngeal swab for virus tests."
"Number to call if you are concerned about your symptoms or contact with virus [if you are in Italy]Throughout Italy people are being asked not to go to family doctor or hospital emergency department... but to make a phone call.The Veneto Region has a very clear page of advice on this. It gives a number to call which is specific for the Veneto region, other regions other numbers (I think). For other regions see region map linked from #43 above and elsewhere in this muddle links to specific regions.=====This is the Veneto regional government's advice.[google translation, using Chrome browser][there is a reference to 118, which is the national number for emergency]800462340. This is the toll-free number activated by the Veneto Region to assist and inform citizens on the behaviours to be taken by people who fear having come into contact with viruses.The decision was made in light of the fact that many people are calling 118 to inquire about the infection, to avoid overloading the operations centers, which can have consequences for rescuing people who actually need immediate intervention.It is also recommended to call 118 in case of breathing difficulties, to request the immediate sending of an ambulance.The technicians of the Region specify that people who fear having come into contact with infected subjects, but who have no symptoms or who have mild symptoms such as fever and / or cough without breathing difficulties, must not call 118 and must not go to Hospital; instead, they must contact the toll-free number which, based on the news reported, will provide all the information and any instructions on the behavior to be adopted. In addition, users can also request information and instructions from their general practitioner.The general practitioners of the Veneto region can be contacted by telephone by their clients who perceive symptoms, and who therefore do not have to go to the clinic. The doctor will perform a telephone triage and decide whether it is necessary to make a home visit or activate the intervention of the public hygiene service or the emergency-urgency system."
The US CDC just updated Italy to Level 3 - Avoid nonessential travel to Italyhttps:/…coronavirus-italy
"This is REALLY BAD new. Unless the threat level is reduced pretty soon, the tourist season for Italy is finished for much of 2020. There will be thousands of workers out of a job in Italy.I have to question the sagacity of this action. Does the CDC have information not being divulged in the Italian press???"
"I am afraid that you might be right... even though me and more travellers still plan to visit Italy this summer, many people vill cancel. I plan to be there in the beginning or around midth june, hopefully this will all be over by then.... But then our bookings are all free to cancel, not because of the Coronavirus though, but personal, so we will not lose anything if we cancel it on the last moment. I must admit though that I was a bit surprised to read a post here from someone who was thinking about cancelling even though he wasn´t travelling until in september!Edited: 6:36 pm, February 28, 2020 "
"-:- Message from Tripadvisor staff -:-This post has been removed at the author's request. The author may repost if desired.Posts on the Tripadvisor forums may be edited for a short period of time. Once the edit period has expired, authors may update their posts by removing and reposting them.To read more about editing your posts, please follow this link: http://www.tripadvisor.com/help/how_to_edit_your_postsRemoved on: 12:03 pm, March 03, 2020"
@67 is exactly the kind of news that I come to TA to get...thanks...agree with @68...not so sure this is not premature...I do question what more they know.
