"I agree Fam-Mayer, and I am thankful for Germany's assistance with our sick, and I also agree about the grandstanding PR of other nations, but that doesn't include those on the ground from those nations, but the governments. Really there is no escape, and there is heart wrenching grief Dennis.After weeks of isolation, the number of positive cases and deaths continue to increase.Many nations have begun lockdowns, but only Spain and Italy know this feeling at this level.It can't even be described.Vagabonda"
"30 doctors arriving from Albania. We don't leave a friend alone in difficultyhttps://www.tgcom24.mediaset.it/cronaca/emer…Google translatedCoronavirus emergency, Albania sends 30 doctors to Italy: ""Let's not abandon a friend in need""The Albanian Prime Minister: ""Today we are all Italians and Italy will win this war for us too, for Europe and the whole world"".""We are not without memory: we cannot fail to demonstrate to Italy that Albania and the Albanians never abandon a friend in difficulty. Today we are all Italians, and Italy must win and will win this war for us too, for Europe and the whole world "". This is what Albanian Prime Minister Edi Rama said, greeting a team of 30 Albanian doctors and nurses sent to Italy to help colleagues engaged in the fight against coronavirus in Lombardy at Tirana airport."
"The ISS, the high institute of health, advisory body of the Italian government has some invaluable pages now.Use the Chrome browser to be offered a translation to language you normally use with google.https:/…aggiornamentiThat link above is a constantly updated list of publications on COVID-19You will find there papers of 28 March on stress management for health professionals and at home and in family, including thishttps://www.epicentro.iss.it/coronavirus/sar…"
"Nice to see the news about support from Albania and the warm language. In Rome in 1969, there was a large conference, a congress, of the Italian Communist Party which regularly won 30% of the national vote and regularly won government in Florence and Bologna etc. A journalist friend rang the Albanian Embassy to ask if Albania was sending a delegation to the PCI congress. At the time, Albania's only friend was China, at the height of the cultural revolution, China with two border wars with the USSR in the spring and autumn of that year. The embassy's reply to the journalist was ""we are not aware of any communist party in Italy'. How times change... and we need to expect even more historic change in the world from this pandemic."
"Mr Brusaferro from ISS, the high institute of health, told the Italians that restrictions will be surely held until Easter. After March 12th we will see if and when a gradual reopening will be possiblehttps:/…Google translated""The virus slows down, but only after the Easter data can the bans be reviewed."" To say it, in an interview with Repubblica, is Silvio Brusaferro, President of the Istituto Superiore di Sanità. He warns: ""Even when coronavirus cases drop to zero, life will not return as before for quite some time. At least until a vaccine or an effective drug against the disease is found."" Brusaferro explains that ""the slowdown is there. We are witnessing a flattening of the curve, there are still no signs of descending but it is better. The important measures that have been taken are showing their effects"". And he reiterates the importance of ""arriving at Easter and then we look at the data to determine how to proceed, given the evolution of the epidemic"".""Unfortunately, there are no examples to follow in the world - he says - we will be the first to do such an operation and we are studying various models. The problem is understanding which opening shapes guarantee that the curve will not start growing again"".Then, Brusaferro talks about the possibility of evaluating the measure of keeping certain categories of people at home, perhaps based on age. ""We are talking about fragile and elderly people - he explains - We must protect them, create support networks and evaluate how certain measures would affect them""."
"The following article can explain the Albanian Premier Mr Edi Rama's words pronounced while greeting the doctors and nurses boarding to go to Italy, to give their support in the Italian hospitals.""Very rich Countries turned their shoulders to others. We are not rich but we cannot forget the help we received from others""A merciless analysis on relationship between Italy and other European States mostly aimed at financial situation. Covid19 gave an hard push to a financial system under pressure. As a result EU stability is at risk.Please note: the analysis is critical to European Financial Institutions and Banks, not to any of the people from any singolar Nation.korazym.org/40230/…"
"The Fiera di Milano building has been transformed into an hospital in 10 days. It will soon to be the biggest intensive care structure in Italy, First patient will arrive by the end of the weekHere is a videohttps://www.youtube.com/watch?v=4ryJ6Sh1WmYhttps://www.tgcom24.mediaset.it/cronaca/lomb…Google translatedCoronavirus, inaugurated the new hospital at the Fiera di Milano: ""In 10 days what you do in years""Over 1,200 donors contributed to the realization of the largest intensive care unit in Italy: a total of 21 million euros were collected""We did in 10 days what we do in an ordinary way in a few years"". This was stated by the president of the Fondazione Fiera, Enrico Pazzali, during the inauguration of the new hospital and intensive care center at the Fiera di Milano, built for the coronavirus emergency. Over 1,200 donors contributed to the realization: a total of 21 million euros were collected.Edited: 4:38 pm, March 31, 2020 "
"Update to #361500 people worked 10 day and 10 nights continuously to complete all tasks.Here is a tribute to their workhttps://www.youtube.com/watch?v=g3Ra6sStF-cThe song they are singing is the most classical song from Milano, the city hymn"
"The Italian Fashion Industry of the Made in Italy is on the first line against the Covid19.Names like Gucci, Valentino, Zegna, Prada and other 180 brands are all working to give the Nation what is needed as masks and clothes for doctors and nurses or any other type of working clothes where necessaryHere are a few press articles. Too many to include allhttps://www.ladige.it/popular/salute/2020/03…https:/…https://www.lastampa.it/moda/2020/03/29/news…https:/…https:/…https://www.ilsole24ore.com/art/dalla-famigl…Edited: 5:31 pm, March 31, 2020 "
Reported. This Marlo person is spamming the forums trying to sell her own products/services. What a worm.
"The following is a very good news from EUhttps://www.tgcom24.mediaset.it/mondo/corona…Coronavirus, von der Leyen apologizes to Italy: ""Now the EU is with you""The President of the EU Commission calls for a common response against the crisis: ""Too many have only thought about their own interests, but now Europe has changed its pace""Europe is mobilizing alongside Italy, but it must be recognized that in the early days of the crisis, faced with the need for a common response, ""too many have thought only of their own home problems"". The president of the EU commission, Ursula von der Leyen, writes in a letter in which he takes stock of the latest speeches. ""That past - he observes - was a harmful behavior that could have been avoided, but now Europe has changed its pace""."
Not promising.https:/…ar-BB122vvc
"Intensive care beds are beginning to be ready all over ItalyHere are 39 new beds in Cattinara, close to Trieste upgrading total available in the Region Friuli Venezia Giulia up to 102https://www.youtube.com/watch?v=cCFRx8C9sx8"
"Probably some predictions are beginning to be possible on getting back our life.Mr Borrelli, Head of Protezione Civile is evaluating possible ipothesys to get out of lockdown but it all depends on future data trends. He first admitted that until May 1st the actual situation will not change then he stated that the only fixed data is by april 13th.Exit from lockdown will be divided in stages. We are at stage one, every activity not strategic closed.We need to fix a date for the beginning of phase two. By then we will gradually reopen selected activities with all the due attentions. The beginning of phase two will be communicated by the Government after indications of the technical-scientific committee.Mr Borrelli, answering to specific question said that may 16th might be a possible day for the beginning of phase two but he highlighted to be only a hypothesishttps://www.ansa.it/canale_saluteebenessere/…"
"Good morningThe following is the first attendible hypothesis to get out of lockdown. It all depends by factor R0. It is the disease transmission coefficient.https://www.tgcom24.mediaset.it/cronaca/coro…Google translatedCoronavirus, this is what life will be like when the quarantine ends: distances, masks and reopening calendarPhase two will most likely start in May. Fundamental will be the factor R0, that is the speed with which infections spreadR0 is the number that almost all Italians are now learning about and is the coefficient with which epidemiologists keep the evolution of the disease under control. In the acute phase of coronavirus it was over 2, that is, each infected caused at least two other people to get sick. Now it is approaching 1 but only when it falls below this threshold will the new life of the Italians begin. And by new we mean a radical change in habits."
Other doctors and nurses are in Italy to helpUcraina sent a delegation of medical personnel that will begin to work in Marche Region soonHere is their arrival videohttps://www.youtube.com/watch?v=xj8e17h_jng
Ten days to build this hospital within the Fiera di Bergamo area.142 beds of which 72 of intensive care and sub intensive care.Workers spontaneusly sang when they saw the camera. They are proud having delivered the work in such a little timehttps://www.youtube.com/watch?v=SbiR8Q5HRpk
"The Government admitted: we don't know when all of this will end. Minister of Health: I cannot give a date when all of this will be over. It would be irresponsiblehttps://www.tgcom24.mediaset.it/politica/cor…Google translatedCoronavirus, Minister Speranza's plan: from Covid hospitals to appsFive key points to get out of the epidemic ""with great gradualness and caution"": ranging from the strengthening of local health networks to tests and swabs to map ItaliansThe battle against coronavirus ""is far from over"" and ""our goal is to find a way to live"" with this threat ""until there is a cure or vaccine."" This is what the Minister of Health, Roberto Speranza, says, who announces a strategic plan to exit the epidemic ""with great gradualness and caution"".There are five fundamental points: social distancing and means of protection for all, Covid hospitals throughout the national territory, strengthening of local health networks, sample study to understand how many are infected in Italy and an app, Korea model, to verify the contacts of positive people.“We have to tell the truth: the situation remains dramatic. The emergency continues and we will have other difficult months "", underlines Speranza."" I don't want to deceive anyone, it is useless to think that there is a saving solution. Unfortunately there is not. And I can't give a date when it all ends. It would be irresponsible. """
"The new hospital built within the Milano Fiere structure is operative since today.The first two patients arrived todayhttps://www.tgcom24.mediaset.it/cronaca/coro…Google translatedCoronavirus, first two patients at the Fiera hospital in MilanThe temperature was taken at the entrance to doctors, nurses and operatorsWith the arrival of the first ambulance, operations began in the new health facility created in the pavilions of the Fiera di Milano to deal with the coronavirus emergency. At the entrance to doctors, nurses and operators, the temperature was taken. The hospital, created with private funds, is managed by the Polyclinic of MilanThe first two patients are a 72-year-old man and a 63-year-old woman, both from two Milanese facilities."
"The first ""believable hypothesis"" is out. It'll still depend on future data but the following can be a suitable option.Government is planning to fix the beginning of Phase Two on May 4thhttps://www.ilsole24ore.com/art/fase-due-ver…Google TranslatePhase two, Conte-Scientific Technical Committee summit. Hypothesis crucial date 4 MayIn view of the April 13 deadline, the first half-month reopenings are under consideration. Some manufacturing sectors are affected, while the deadline of early May is looming for a gradual easing also for peopleThe deadline of April 13 foreseen by the last decree of the Prime Minister is approaching and the Government is thinking in these hours on what to do from Tuesday 14. A decision could come out of the summit by videoconference between Prime Minister Conte and the Technical Scientific Committee, expected in the afternoon: at the center of the meeting - which should also be attended by some ministers (Speranza, Patuanelli, Boccia and Catalfo) - the containment measures in view of the so-called ""phase 2"", that is, which could be characterized by a partial and gradual opening , after the close taken after the coronavirus emergency.Gradual opening for some manufacturing sectorsThe parameter to be taken into consideration is, as explained on more than one occasion, the contagion curve: if it continues to fall, a first opening could start already from mid-April. Those production chains where spacing between workers with a mask obligation can be guaranteed could be involved. Certain manufacturing sectors such as mechanics, construction and trade (where possible) could fall. At the same time, two criteria could be considered. The first: those of the geographical areas, giving priority to the opening of those areas where the coronavirus has done less contagions. The second: age, with the elderly and more fragile people who will remain under protection."
"so does my Priminsister give updates in Canada on a the issue on daily TV broadcast it is a week to week thing I think on updates 2 days ago Trudeau's saying Canadians are looking into well into May for Canadians things well be easying up on lockdowns in Canada we don't even have as many cases or deaths and are medical system is still at 100% good at this time so did Trumpet say the US will be all good to go in April for in Easter, today its a different story for the US on the issue, yesterday Trumpet blamed the world health organization that they made a bad call on the virus"
Thanks PirateStay safe and stay strong in CanadaAnd. here are a few pictures of people worning in a Covid19 test laboratory in Bolognahttps://www.tgcom24.mediaset.it/cronaca/emil…
"President Mattarella: message to the nation for Easter greetingshttps://www.tgcom24.mediaset.it/politica/mat…Google TranslatedMattarella: ""We need rigor, but we are about to win the fight against the virus""Message from the Head of State on the occasion of Easter: ""We cultivate hope and trust, sacrifices are giving results""It remains ""indispensable to maintain rigorous compliance with the behavioral measures: we are about to win the fight against the virus or, at the very least, to reduce its danger as much as possible. Waiting for specific drugs and a vaccine that will completely defeat it"" . This was said by President Sergio Mattarella, in a video message to the Italians on the occasion of Easter.""In many letters I have received - the Head of State underlined - the stories of forced loneliness that many are experiencing even in these days of shared celebration are narrated. I understand well the sense of privation that this produces. I know that many Italians will spend Easter day in solitude. It will be like this for me too. In these days, however, we also see the real possibility of overcoming this emergency. The sacrifices that we have been making for over a month are producing the desired results and we cannot stop right now "" .""We cultivate hope and trust"" to be able to defeat the coronavirus and ""in the sharing that we all feel, in this period, for our common destiny, I wish to express to you all my greatest closeness,"" said Mattarella. ""We avoid the contagion of the virus and rather accept the contagion of solidarity between us. As soon as possible, on the basis of scientific evaluations and according to the indications that will be established, a gradual, progressive recovery can be started, with the final objective of a normalcy found ""."
"Lockdown is a nightmare for a lot of activities but for those relying on tourism is even worse.Category Association attempt to valutate losseshttps://www.tgcom24.mediaset.it/televisione/…Google translatedCoronavirus, tourism on its knees: ""90 million hotel stays lost until May""At ""Stasera Italia"" the alarm cry of restaurateurs, merchants and beach managersHotels, restaurants, travel agencies, event organizers are all on their knees because of the coronavirus emergency. At ""Stasera Italia"", the representatives of the tourism sector try to reckon with the losses they had and that lie ahead in the future, even if it is impossible to do so precisely.The president of Confturismo-Confcommercio Dario Patanè talks about 90 million hotel attendances lost until May: ""Many hotel or tour operator activities are in the limelight,"" he explains. And even the beach managers are worried, with the summer season seeming compromised: ""On all Italian beaches, preparations for planting umbrellas were in full swing, now everything is stopped"", says Antonio Capacchione, president of the Italian seaside union."
"Good morningIn Italy the lockdown exit has partially begun although it won't be the same for every Region.https://www.ansa.it/sito/notizie/cronaca/202…Google translated (excerpt)Coronavirus, here are the activities that start again todayThe Regions in no particular order: Veneto opens to jogging but from Lombardy to Campania the bookstores are still closedIt is not yet Phase 2, but it is at least the first shy step of a new beginning. Therefore, between gels and masks, bookstores, stationery shops and clothing stores for children, they reopen their doors, with all the necessary precautions. But this is not the case throughout Italy. Not a few regions - with a babel of ordinances - have decided to maintain the strong restrictions of the lockdown, while others have instead begun to loosen the meshes of the prohibitions in the wake of the now stable, if not slightly decreasing, data of the contagions from coronavirus.And it is not excluded that next week other sectors of industry, such as fashion, auto or metallurgy, may also restart, even if the head of the Civil Protection, Angelo Borrelli, calls for calm. ""At the moment - he said yesterday - these are premature hypotheses"". In a country still armored also on the mobility front - with the limitations confirmed on Sunday by the Ministry of Transport on air, car, rail and maritime traffic - from today, therefore, a slow recovery will be attempted."
"Follow up #381The following artiche better explains the rules for arrivals in Italy and domestic movementshttps://www.tgcom24.mediaset.it/cronaca/coro…Google translated (excerpt)Coronavirus: bookstores, stationery and children's clothing reopenOpenings also for some textile factories and for the fashion sectorPROHIBITED MOVEMENTS AND SPORTS, STAY MOTOR ACTIVITY For another three weeks you will have to stay at home, except for ""proven working needs"", needs or health reasons. No events, closed bars, restaurants, cinemas, theaters, museums, pubs and discos. Places of worship are open but no masses or funerals. Transfers from where you are are prohibited, transfers to the second holiday homes are strictly prohibited. Parks and playgrounds remain closed, as is confirmed by the stop for all sports activities, even the training of professionals. Motor activity near home is allowed, alone and keeping distance.STRICT ON THE ENTRANCES, STOP TO THOSE WHO HAVE FEVER Confirmed the rules on entry into the country and on short transits from abroad: those who return will have the obligation of fiduciary isolation even in the absence of symptoms. It is possible to move for work for a maximum of 5 days (72 hours extendable by 48). More stringent rules, in both cases, on departure from abroad: a declaration must be given to the carriers (with the reason for the trip, the address of where you will be in isolation and with which private vehicle you get there), which will have to measure the temperature and block the journey of those with fever. Stop confirmed for cruise ships with passengers and Italian flag. For those still traveling, at the time of disembarkation, Italian passengers who live in Italy are subject to 14 days of quarantine in their home, which they will reach only by proven means. Foreigners (of origin and residing outside Italy) are immediately transferred abroad, by plane or car, at the owner's expense."
"Here are a few ipothesys on how we will have to go on the beach this summer. Plenty plexiglass everywhere.I believe air conditioning will have to be a must without sea breeze circulation under the umbrellas. Generally I don't comment news on paper but this is incrediblehttps://www.ilmessaggero.it/italia/coronavir…Google translatedCoronavirus, how we will go to the sea this summer: umbrellas three meters away and plexiglass wallsThree meters away between an umbrella and the other and then plexiglass barriers. Not only that: staggered access and technological sanitation of common areas. Here's what our beach holidays could be like this summer. At least judging by the first projects that beach clubs are working on. Already designed by some companies that have made themselves available to the categories of tourism by offering the same barriers that are installed in supermarkets to protect the checkouts. Not only umbrellas and deck chairs isolated from the plexiglass. For tour operators it is easy to foresee a flood of hygiene requirements: from staggered access to the beach, to the installation of dispensing sanitizers in bathrooms, bars, ex-common areas, showers. Without forgetting the need for masks to stay in the open air, the possibility of staggering access based on the age group and the compulsory booking before access to the bathing establishments."
"Message from Ursula von der Leyen, President of the European Commissionhttps://www.youtube.com/watch?v=QE4BhKZWdQQ"
"Is this private beaches, public beaches or both? I can only imagine the mass amount of plexiglass it would take to cover our local beaches here in Alabama. Not to mention the drunken idiots that end of destroying them. I am in prayer that there is a solution to this virus that doesn't compromise the safety of all, some, or even the few. I pray that as you all begin going back out, that it will be both safe and without an increase in virus cases. With Summer just around the corner, we all need this to be gone for the purpose of our sanity, but more importantly the financial stability of all of our countries."
"SabrinaPost #383 is only an hypotesys they are thinking about. A guy I know manages a beach establishment in Francavilla al Mare, where I go on summer. He told me yesterday he prefers to remain closed rather than build such a mess. We both agree there won't be anyone (tourist or local) willing to spend their holidays in a transparent oven exposed to the summer burning sun.On july and August under umbrellas or palms is as cool as the sea breeze can flow among them. If the plexiglass stops the air flow then the temperature is going to be more dangerous than the virus.I believe they will change their mind in the next few days, but it's only to my humble opinion."
"Raffaele, I agree that would be insane...No breeze....sun coming through the glass just right will bake anyone even on a cool day. Plus it would take away from the whole point of going to the beach which is to feel the breeze and enjoy the open area."
"Thank you Raffaele for all the updates. We have a family trip to Italy that we booked in Dec '19 (that I planned for over a year) to celebrate me and my wifes 15 year anniversary but we fear we'll have to cancel and rebook for next year, after a vaccine can be produced. In your humble opinion, do you think it would be worth going in July if travel restrictions are eased? Will restaurants be open? Will beaches be allowing tourists? I greatly appreciate you keeping us updated and I check your posts daily."
"Hi DavidThank you for your post. I am afraid none can say what will be in July. I have no data to say. I am here to report what I see from within Italy but they don't ask my opinion on future steps.I was watching news on TV only a few minutes before I read your message. The speaker was telling there is a strong political and imprenditorial pressure to reopen activities but the experts are denying. The speaker said that even if some activities will reopen, we will have to cohabit with the virus. It means to wear gloves and masks plus social distancing for who knows how long for.I don't really know what the situation will be in Italy in the next weeks or months to allow again to go to the restaurant or in other non essential places.In my humble opinion, until all this mess will not be resolved worldwide I believe will be difficult to plan an holiday outside of own Country.I can only suggest to stay tuned. When things will begin to get better, if not me someone will tell here"
