"Some news from Emilia-Romagna:- for this week schools and university are closed until 8th of March. Educational tours have been suspended for the whole Spring.- public places (like markets, malls, pubs, bars, restaurants...) can decide to stay opened, but trying to avoid crowd. The best should be that everybody respect the distance of 1 meter each other, but is not strictly respected. Of course is possible that a restaurant stays closed for lack of clients...- museums and monuments could stay opened, respecting the rules to avoid crowd. For this reason is possible that sometimes you have to wait a little bit more than usual to enter. The most of public museums are opened. Some car museums decide to stay closed for the whole week (Ferrari, Enzo Ferrari and Lamborghini). Ducati museum decide to stay closed the whole month until the 3st of March.- Public events have been suspended (concert or similar). Cinemas and theaters could stay opened respecting the limit of the distance between people, so the most decide to close the whole week until 8th of March.- Trade fairs and exhibitions have been suspended: the most have been postponed on next months.At the end the citizens in Emilia are doing their life as usual. There is much less traffic and crowd, but the life is going on. There are not so many people really concerned of the virus: we are much more worried for the economical consequence!"
@133 Thank you...very detailed pdf...I note more than I thought in Naples. will be interesting to follow this daily.
"Apologies if I am posting information someone has already posted, but this is worthwhile: It's the translations of the basic Italian vocabulary about the coronavirus. Really worth having.https:/…"
"gene: I know you seem to like to muck around a lot about this sort of disaster stuff (here and in other forums where unfortunate events occur) - but your post saying someone is minimizing number of people confirmed to have the virus here in NYC is seemingly to try to make people suspicious of other posters - Here - for your very own eyes - is the NYC health department statement re: the ONE person here confirmed to have it - (it does not mean others may have it, just that we have one confirmed person with it) - as of yesterday March 2.https:/…coronavirus.page"
my only reply to @137 is I sincerely hope that NYC stays at one case....and thanks for taking the time to notice my postings.
"Dennis: No, I won't post such links as I use google translate to read the articles and it is not as accurate a translation as could be (I can read some Italian pretty well but the translations are still necessary for me) and it is a hassle to do the translation, cutting, pasting - If I can manage to do the research needed to decide if I want to make a Spring trip, others can do the same if they believe it is important enough to do, I'm sure. And what I find ""useful"" does not mean it is so for others. (Please don't suggest that I use Chrome; I won't use that product)Edited: 10:47 am, March 03, 2020 "
#139 the information on government decree for this week was posted Monday. But hard to find as this thread is now cluttered.
"The New Scientist, reputable science reporting weekly for more than half a century, has published this article on symptoms and tests in COVID-19https:/…"
"For news from the epicentre Corriere della Sera remains the key Milan based news resource https://www.corriere.it/https:/…Also of long-standing as a national newspaper is La Stamps published in Turin. https://www.lastampa.it/https://en.wikipedia.org/wiki/La_StampaNewer national newspaper of the last forty years is La Repubblica. Born from the stable of L’Espresso, well established investigative weekly. https://www.repubblica.it/https://en.wikipedia.org/wiki/La_Repubblica…https://espresso.repubblica.it/The papers now covering the question of whether a much larger Red Zone needs to be established, not just the eleven towns. And until someone offers a better route, opening these links in Chrome browser remains the way to get immediate translation into the language you use in google. It’s a process that often shifts words to e.g. English but retains the Italian sentence structure. . L’Espresso likely the most difficult for the computer to translate because more reflective on issues and with more complex expression."
"In Rome you have Il Messaggero. Reporting now that the virus affected pope has tested negative to COVID-19https://www.ilmessaggero.it/In Florence La Nazionehttps://www.lanazione.it/firenzeleads with concern at half empty hotels. In Bologna and in editions in Emilia Romagna and Le Marche, the historic and important Il Resto del Carlinohttps://www.ilrestodelcarlino.it/concerned about new cases in Emilia Romagna. https:/… is an entertaining read, informative also about the vigorous Italian mind. And as a much better than sudoku war against dementia typing Italian names on an iPad at 5.40 in the morning is I suppose interesting but it’s a bit annoying when every time you type la it changes the la to L.A. ... etc... Time for coffee and MacBook."
"#143 Dennis you can add an Italian keyboard to your ipad or iphone here is how:https:/…how-to-change-keyboard-on-ipadThen it will also start to auto correct you in Italian.Much less frustratingEdited: 1:57 pm, March 03, 2020 "
"In the right corner the Vatican newspaper, which my iPad won’t open properly http://www.osservatoreromano.va/itAnd in the red corner, L’Unita, stuttered to death in the last decade.https://en.wikipedia.org/wiki/L'Unit%C3%A0?wprov=sfti1"
"Alzano Lombardo, close to Bergamo is probably going to be the next red zone in Italyhttps:/…Google translatedGallera: Bergamo surge of infections""Red zone? We wait for the ISS """"The sharp increase in coronavirus cases"" in the Bergamo area of Alzano Lombardo is an objective fact. Lombardy Welfare Councilor Giulio Gallera said this by answering a question about the possibility of new red areas. ""We asked the Istituto Superiore di Sanità to make assessments and suggest the best strategies to us and the government,"" he added, underlining that in the area there is now ""the highest number of infected people"" in Lombardy, also higher than in the Lodi area. ."
"Mille grazie KS # 144! ..mostly I write in English . On the MacBook Air I have an Italian keyboard, but set to Australian key placements which forces touch typing... I will set up the Italian now. Saluti"
#147Prego!
"DennisAs an added value, here is the list of the newspapers in Italywww.fieg.it/chisiamo.asp?sector=testate"
Raffaele linked us to L’Eco di Bergamo. Other regional papers in the critical northern area are L’Arena in Veronahttps://www.larena.it/and Corriere del Venetohttps://corrieredelveneto.corriere.it/...a regional print of Corriere della Sera.
"Raffaele #149 ...that list is daunting. Would you and others like to add key sources, especially from the south, of which I know less."
"Il Mattino in Naples leads right now with the core issues, no football, no kissinghttps://www.ilmattino.it/"
"Il Giornale di Calabria has many articles about local economic concerns before mention of COVID-19, and that article is focused on the economic impacthttp://www.giornaledicalabria.it/Giornale di Sicilia leads with three teachers tested positive at the University of Cataniahttps://gds.it/The Giornale di Puglia has an interestingly international perspective in its coverage of the virushttps://www.giornaledipuglia.com/Edited: 3:01 pm, March 03, 2020 "
"Illustrating the value of following local news, this is about some closures at Pompeiihttps://www.ilmattino.it/primopiano/cronaca/…"
"L'Osservatore Romano http://www.osservatoreromano.va/itopens on laptop, although ipad made a mess of it.An extremely valuable insight into the Vatican's perspective on many important issuesSee the links to key words bottom right column."
Statista is a web outfit that picks up useful statistics. This link to OECD forecasting on the impact of COVID-19 on economic growth. https:/…
Is there any official rule for a US resident returning from Italy (Mar 24)? I've looked everywhere. There is no quarantine at this time is there?
"""Is there any official rule for a US resident returning from Italy (Mar 24)?""Depending on the situation in Italy in 3 weeks, which no one can predict, there may or may not be a mandatory quarantine."
"JB, where did you look? Google returned various hits, here's one: https:/…index.htmlAt the moment, you can expect to be screened multiple times (temperature check and observations for symptoms), likely before boarding and on arrival.******************************************************Dennis, you know you can ask TA to reinstate your deleted posts, right? Contact Staff through the Help Center."
"are you flying to the US non-stop from Italy?The US gov't indicated yesterday that ""screening"" of all air passengers (regardless of nationality) departing from Italy for US destinations would begin within 12 hours. The US gov't had previously stated it would screen all the passengers twice: Once before boarding the plane in Italy and once again upon arrival at the US sirport. But I have not seen news stories that this screening has begun. I am guessing that when it begins, if a passenger of any nationality shows symptoms of coronavirus infection, that passenger will be put into quarantine in Italy. If a passenger arriving in the US is showing symptoms of the virus, i would think that everyone on the plane would to into quarantine, or maybe they can travel onward if they contnue to do their own temperature checks,It has never been clear from anything I have read what happens to people who fly to the US from a non-Italian airport but who were in Italy during their trio. The American Embassy in Rome might know the answers to these questions.Edited: 6:11 pm, March 03, 2020 "
"""If a passenger arriving in the US is showing symptoms of the virus, i would think that everyone on the plane would to into quarantine.""This scenario is kind of scary."
"To be honest I don't think they have any plan in place so doubt anyone is going to be quarantined...at most they are suggesting ""self quarantine""."
"From Prevention.com:What happens during a coronavirus health screening?The screening is broken into two parts, according to the CDC: First, people will fill out a short questionnaire about their travel, any symptoms they might have, and their contact information. Then, CDC staff will take the temperature of each traveler with a hand-held thermometer that doesn’t touch the skin and observe the traveler for any signs of illness, like a cough or difficulty breathing.If someone is found to be sick, CDC officials will evaluate the individual further to see if they should be taken to a hospital for medical evaluation and to get care as needed. Currently, people who test positive for COVID-19 are being quarantined.If someone doesn’t have symptoms, CDC staff will give them health information cards. The cards tell travelers what symptoms to look out for, and what to do if they develop symptoms within 14 days.“One of the key things the screening does is it gives the CDC and public health authorities time to educate the passenger about what to do if they get sick after they leave the airport, and alert them to the fact that they might be sick,” says infectious disease expert Amesh A. Adalja, M.D., senior scholar at the Johns Hopkins Center for Health Securityhttps:/… The CDC link in the above article shows the protocol for China. The Italy Protocol is not yet specifically posted anywhere. But this article states that according to “CDC sources” the protocol it is as copied above which matches the protocol for Other parts of China outside of Hubei province. It does not say that whole plane is quarantined, just those found to be sick; others are asked to self monitor for 14 days. There appears to be no specific Italy protocol posted anywhere yet. But if they are not quarantining whole plane from China...It is still day one of new Italy screening so we may see more official guidance soon."
I think it would be good if someone could start a separate thread on this question of getting back into the United States so information on Italy is not lost from sight.
Does anyone know if you are treated differently if you only transit thru Rome? Are you still tested?
Some already did start a thread on the issue of going back to the U.S. from Italy https://www.tripadvisor.com/ShowTopic-g18779…
Thanks #166 MC. For roundup of Italian news 10 hours ago go back a couple of pages to. https://www.tripadvisor.com.au/ShowTopic-g18…
"Thanks, KSoze2020.Edited: 6:23 am, March 04, 2020 "
"scubadoc,If you are transiting through Rome in order to get to the US, then you will certainly be tested when you reach the US, and possibly in Rome as well."
"If I was on a plane where a passenger was screened upon arrival and then taken into medical care, I would want to know that, because then I might self-quarantine (this is a very contagious virus, and I have elderly relatives, family, co-workers with respiratory ailments)But then again I might want to do that if I'd been in Italy, period. I hope everyone who flies will inform themselves ahead of time about how to protect oneself while using airport restrooms, airplane restrooms, while in one's seat, etc. Even if one doesn't particularly worry about being ill from the virus, it can be deadly to others if you spread it around.Edited: 6:31 am, March 04, 2020 "
Just announced by Italian government - all schools and universities in all of Italy to close immediately until the middle of March - football authorities order Serie A football matches across Italy to be played behind closed doors and no spectactors
"correction: BBC now says Italy is considering closing, earlier it say Italian government was going to..."
"JeremyYou are correct. Italy is going to close all schools and universities immediately. The decision has not been taken by the Minister yet because there is only the positive technical opinion.Is better to be safe than sorry. Drastical measures are necessary. I believe it's only a matter of time.Less movements, less contacts between people, the best.https://www.tgcom24.mediaset.it/cronaca/coro…Edited: 9:15 am, March 04, 2020 "
"It is official. Virus in Italy was around weeks before first caseansa.it/canale_scienza_tecnica/notizie/biote…Google translatedCoronavirus in Italy for weeks before 21/2The proof in 3 genetic mapsThere is the first evidence that coronavirus circulated in Italy 'several weeks' before there was the diagnosis of patient Codogno's one. It is contained in the 3 genetic sequences of the virus circulating in Lombardy, obtained by the group of Milan State University and Sacco Hospital, coordinated by Gianguglielmo Zehender, Claudia Balotta and Massimo Galli. The analysis of further genomes, in progress, will be able to provide more precise estimates of the virus's entry into Italy and possible ways of spreading.The genetic sequence shows the relationship with the viruses circulating in other European countries and confirms the origin from China.In fact, the first analysis showed that the coronavirus isolated from three people in Lombardy has strong analogies with the genetic sequences of the coronavirus of the first case found in Italy, that of the Chinese tourist hospitalized in the Spallanzani hospital in Rome with his wife, and of the patient one of Codogno, both obtained from the Istituto Superiore di Sanità (ISS) and the Celio Military Polyclinic of Rome.The analogies with viruses isolated in Europe are also strong, especially in Germany and Finland, and in Central and South America. The analysis, notes the Sacco hospital, confirms the Chinese origin of the infection"
"A decree very soon.From Quotidiano""Following the recommendations of the Scientific Committee, the Prime Minister's decree is on the way. Plan to enhance intensive care. Emilia, positive councilors Donini and Lori. Fourth victim in the Marche, first in Piedmont, third in Liguria. Strong volatility on the stock exchange. Government, Minister Patuanelli in self-isolation. Napoli-Inter Cup of Italy postponed....""https:/…coronavirus-italia-morti-1.5056117Rome, March 4, 2020 - Coronavirus numbers in Italy are growing ( over 2,500 infections and 79 deaths ) and the government is implementing new measures against the spread. And among these there is also the closure of schools across the country: the stop - which also involves universities - will last until mid-March. The official decision should come in the afternoon, reports Minister Lucia Azzolina. Among the hypotheses there is also the enlargement of the red zone . Meanwhile, the Scientific Committee expresses ""strong concern"" and draws up a vademecum with 'new' rules: no handshakes, no hugs, just meetings and conferences, stops at events, including sports ones . Football matches, if anything, only behind closed doors, as suggested by the Minister of Sport, Vincenzo Spadafora (""We are going in this direction""). Meanwhile, Napoli-Inter of the Italian Cup has been postponed today . In practice, the invitation is to radically change lifestyle in the next 30 days. During the day the concrete measures will be known, in the form of a decree of the Prime Minister. On the table also the stop to cinemas, museums, theaters, gyms throughout Italy, avoiding any gathering. No decision yet, but it's one of the hypotheses on the table."""
"La Stampa https://www.lastampa.it/reports the concern of WHO that COVID-19 is much more lethal than influenzaThis article on what we don't know about it: ability to spread, incubation period, what temperature it dies...https://www.lastampa.it/cronaca/2020/03/03/n…Edited: 12:01 pm, March 04, 2020 "
"For new readers: if you open Italian language pages in Chrome browser you will be offered a [rough, computer] translation."
"#175There is an error (or at least one error)in machine translation.Italian text says basta meeting e congressiincorrectly translated asjust meetings and conferenceswhen it means the opposite: absolutely no meetings or conferences... basta in sense as when saying to someone ""enough of that!"""
"At this moment prime ministerial and education minister press conferencehttps://www.laprovinciacr.it/news/cremona/24… perhaps someone can find transcript soonEdited: 12:24 pm, March 04, 2020 "
#179 press conference dealt with medical and scientific advice behind decision to shut schools and universities throughout the country to 15 March. More to be announced later
This is the COVID-19 information page of the peak health advisory bodyhttps://www.epicentro.iss.it/coronavirus/
"Please remember we need to keep this thread for information. Chat opportunities in many other places, see the Italy forumhttps:/…ShowForum-g187768-i20-Italy.html"
"Italian government has confirmed the closure from this evening of all schools and universities in Italy for at least two weeks, following 28 more deaths in the last 24 hours."
"#183. And lots more. See previous page. A point emphasised in Prime Minister Conti’s press conference is that restrictions on activity of many kinds and advice for older people to stay at home etc reflect the fact that the public health system is at risk of overload.Edited: 1:44 pm, March 04, 2020 "
This is the meeting from which further decisions will be published governo.it/it/…14238
"Al Jazeera is running a valuable independent global blog on COVID-19https://www.aljazeera.com/news/2020/03/italy…Nature carries a report on work on vaccines, particularly testing of existing vaccines against this new target. https://www.nature.com/articles/d41587-020-00003-1?utm_source=Nature+Briefing&utm_campaign=0ebb957e06-briefing-dy-20200304&utm_medium=email&utm_term=0_c9dfd39373-0ebb957e06-44313961See also the China Daily on thathttps:/…AP5e5f0433a3103a24b1109777.htmlMuch hope for the success of measures to limit movement and activity arises from the success in China of such measures. The Asia Times lead story on how that’s been achieved https:/…Edited: 2:11 pm, March 04, 2020 "
"#186. Getting the link to Nature right, I hopehttps:/…d41587-020-00003-1"
"Government announcement regarding expansion of health serviceshttps:/…Additional personnel, restrictions on visiting/accompanying, barrack accommodation being established by military at various places."
"Looks like the CDC updated their info and makes and USA traveler to Italy is required to self quarantine for 14 days, not just people that visited the high risk areas.https:/…coronavirus-italy"
"#189Yes""CDC recommends that travelers avoid all nonessential travel. [I think it says that five times]Older adults and people with chronic medical conditions may be at increased risk for severe disease.Travelers should avoid contact with sick people and clean their hands often by washing with soap and water for at least 20 seconds or using an alcohol-based hand sanitizer with 60%–95% alcohol.Travelers should stay home and monitor their health during travel and for 14 days after returning to the United States.Travelers who feel sick with fever or cough or difficulty breathing should seek medical advice. Call ahead before you go to a doctor’s office or emergency room.""That last sentence is important but not quite accurate. People with relevant symptoms https:/…COVID19-symptoms.pdfare not to go to a medical practice or emergency department but to call an 800 number. Different number in different regions. Assesssment away from medical practices and emergency departments.Before you get sick consider getting the relevant 800 number. Go back to #43 on page 5 of this thread to work out what regions you are visiting. Back there also links to regional government web sites with advice and the 800 number.Edited: 7:27 pm, March 04, 2020 "
When we last left this thread 2 days ago the CDC had just updated their guidance to include this lovely bullet point:Travelers should stay home and monitor their health during travel and for 14 days after returning to the United States.A game changer for many of us.
"Thank you for reopening this, yes, our March 21 departure for Venice-Positano-Rome will likely be canceled now with this additional restriction"
"Nothing to be optimistic about, but the ISS (Superior Institute of Health) states the virus in Italy is less lethal than in ChinaHere is the linkhttps:/…Google translatedCS N ° 16/2020 Lethality in Italy less than that of China for all age groupsIss, March 6, 2020 For all age groups, the lethality rate from Covid-19 in Italy is lower than that currently in China. A comparison was made between the Chinese and Italian data produced by the Istituto Superiore di Sanità, according to which even the current general lethality in our country is lower than that in China in the first phase of the epidemic.In Italy on 4 March lethality (calculated as the number of deaths on confirmed cases) among the over 80s was 10.9%, while in China on 24 February (latest available data, extracted from the report of the joint China-WHO commission) was by 14.8%. Between 70 and 79 years the comparison sees Italy with a lethality of 5.3%, while China has 8%, and between 0 and 69 it is 0.5% in our country against 1.3% in China . As regards lethality in general, on March 4 in Italy it was 3.5%, while in China on February 24 it was 2.3%."
"Italy's COVID-19 death toll has seen another sharp increase, with Rome reporting 49 new fatalities on Friday evening.It means 90 people have died in just 48 hours, according to the latest figures from Italy's civil protection agency.It comes as France announced it was closing creches and secondary schools in two of its most coronavirus-hit regions from Monday.Earlier, the number of confirmed COVID-19 cases globally rose above 100,000, according to researchers.https://www.euronews.com/2020/03/05/two-more…"
Joining this post to keep updated. Thanks
"Received an email this morning from Italiarail in U.S. if you have booked and paid for rail tickets in Italy, check your emails or Italiarail website. Apparently they will refund or rebook your tickets. I am hoping Trenitalia will do the same. Italiarail state NOT to apply now but wait until the new email is sent. If you ask for refund before that they will use the old policy and you won’t get any money back. If you don’t get an email, check the site or email them asking for clarification."
"This resource from Johns Hopkins University in the U.S. tracks total worldwide confirmed infections on a country-by-country basis, plus deaths and recoveries. It is mentioned in a post in another thread entitled Coronavirus Situation, but I don't see a link in that post.https:/…It is compiled from official sources such as WHO, CDC, ECDC, NHC and DXY. Acronyms can be expanded in the link. If you click the map, it expands as the following URL:https:/…bda7594740fd40299423467b48e9ecf6"
Thank you #197 Very helpful. Have you also looked at worldometers.info . Also very helpful and real time stats
#193 Thank you
"The BBC reports Italian authorities announcing 49 more deaths from the virus in the last 24 hours, the biggest Rise in Italy so fat."
New governement decree issued overnight gives powers to requisition hotels for the purpose of quarantine:https://www.ilsole24ore.com/art/coronavirus-…Open in Chrome for translation
"Crediting elibel_2017, who posted this informative and currently updated map of the number of active cases, serious, deaths, etc.:https:/…Edited: 3:29 am, March 07, 2020 "
"""New governement decree issued overnight gives powers to requisition hotels for the purpose of quarantine"" If you were on the fence about traveling to Italy, this should help finalize your decision."
