"Thanks for the article Tarik, I like your google working :-) Just saw the news, 7000 cars have entered Croatia through Bregana, 4000 of them are foreigners. Minister of tourism anounced to introduce an app by next week- meant for foreigners to speed up the entrance and avoid crowds.He said it will be ""similar to e-pass"". Obviously we'll have to go with the flow and see what they will come up with!Edited: 11:24 am, May 21, 2020 "
"-:- Message from Tripadvisor staff -:-This post has been removed at the author's request. The author may repost if desired.Posts on the Tripadvisor forums may be edited for a short period of time. Once the edit period has expired, authors may update their posts by removing and reposting them.To read more about editing your posts, please follow this link: http://www.tripadvisor.com/help/how_to_edit_your_postsRemoved on: 5:15 pm, May 21, 2020"
I will respond when I have a little more time.
"Thank you RiEugen, much appreciated! It is great that information is available :-)"
"“Now, when everything is clear I just hope that those who have engaged themselves into a defamation campaign and unnecessary quarrel and will recognize all the useless efforts. It is so sad and shameful what they have been doing for several last days.”Well, you did pretty well engaging in shameful behaviour. To be honest, the only reason I bothered to contribute is your behaviour, especially towards £€$. He had an experience that directly affected him. You dismissed it, intimidated him and accused him of spreading misinformation. You even threatened to report him to TA. Obviously you have no idea how TA works. Besides, at the time, his position was the official policy. You could have put your case/opinion forward, even though it wasn’t official policy at the time, without being nasty towards the poster. Read your post 69.How would you like to drive from north of one of European countries only to be turned away at the border? Even if it happened to one person, as it did to £€$’s customer, it is one person too many to be put through unnecessary hassle.RiEugen, I suggest you be a little more civil and understanding towards those you might not agree with, instead of bullying them. It is the least, a worthy DE would do."
"Don't be so hypersensitive. RiEugen was polite and discreet. His prognoses was sane and adequate. Those Hungarian guests have choose improper time of arrival. Maybe to quick. Victims of system in time of change. I enjoy attitude of Croatia's government to their citizens tourist business. Hope that others will follow their example fast.Our government is much more indifferent to our needs.Edited: 6:59 am, May 22, 2020 "
Hi Gary. We are also booked for the first week in August. Jet2 flights resume from 1st July.Have you cancelled or do you think you will get to go away?
HiI definitely won’t be cancelling as I would lose all my money. I’m prepared to go if possible and do quarantine when we get home.I would probably better if jet2 cancelled though and then we would get a full refund
"I’ve now rebooked with Jet2 for next Sept, there’s increased risk for us to consider and didn’t want to find that test were running it but we felt not safe enough to go. Croatia / Dubrovnik seems pretty pricey so can’t afford that kind of £ loss or to go and not have a good time because of restrictions that as they say can be imposed at any time. And doubt my workplace would be impressed with people possibly quarantined for two weeks! All in all for us it’s best to wait."
"Thank you to the DE's and others that have taken the time to research and fill us tourists in on what is happening currently in Croatia regarding tourism! As a DE for another area, I understand the work it can take to provide current, up to date information! Add COVID19 to the mix and the changes are being made daily! Hard to keep up!Does anyone have any info in regards to tourists coming in from the United States? Like I said in an earlier post, we are scheduled to arrive in Dubrovnik Aug. 6, stay there a coupe days. board a Sail Croatia cruise for a week, disembark in Split and stay there a couple days before heading to Zadar for a couple days then flying home! We are so hoping to still be able to go, but we do not want to quarantine upon arrival in Croatia! Any insight specific to to travelers from the USA would be much appreciated!"
"In this post we provide information and travel advice that should be helpful if you have already booked a holiday in Croatia or are considering a holiday for later this year or next year. Croatia's borders are now open to tourists who have pre-booked accommodation. The borders are open to all foreign tourists not just EU citizens. Croatia has a low incidence of COVID-19. Only 100 deaths at 26 May. Last Updated - 26 May 2020 11.00Croatia currently has a low incidence of COVID-19. As at 26 May 2020, 2244 confirmed cases and 100 deaths. Croatia closed its borders to foreign travellers and restricted internal movement at an early stage but from 28 April started a stepped reduction in lockdown restrictions. Over the weekend of 16/17 May Croatia opened its borders to foreign tourists who have pre-booked accommodation before entering the country, There has remained some conflicting information on Government websites but these sites are gradually being corrected. There has remained some confusion as to whether the borders were open to all foreign nationals or just EU citizens. The main Croatian government website providing information for travellers specifically stated that the borders were open to EU citizens but did not provide such a clear cut statement in respect of non-EU citizens. Croatian Villa Holidays has however obtained a written confirmation from the Border Police Directorate that the borders are open to all foreign nationals and at our request have specifically stated that they were open to UK, US and Norwegian nationals. All tourists entering Croatia will need to present a formal confirmation that accommodation has been booked showing the address of where they are staying. Tourists entering the country will be given instructions on the procedures and rules they must follow for social distancing and reporting any symptoms of COVID-19. Hotels have been permitted to open if they observe social distancing rules."
"-:- Message from Tripadvisor staff -:-This post has been removed at the author's request. The author may repost if desired.Posts on the Tripadvisor forums may be edited for a short period of time. Once the edit period has expired, authors may update their posts by removing and reposting them.To read more about editing your posts, please follow this link: http://www.tripadvisor.com/help/how_to_edit_your_postsRemoved on: 3:56 pm, July 13, 2020"
Thanks for the update @GaryBelfast - any idea if tourists visiting the likes of churches and museums in Croatia will have to where masks like they will have to in Italy? We are booked to visit Tuscany in September but that mask restriction may sway us to rebook to Croatia instead if no facial coverings are required there. My wife works in the NHS and has to wear full PPE on a daily basis so doesn't want to do that on holiday too. If both countries require face masks we might just postpone our European jaunt until May next year and have a 'staycation' in Scotland in September instead.
"Article in todays Daily Mail (uk) that says Croatia will open to tourists from 15 June although British tourists will be restricted.It does say this could later be lifted.***********just posting for reference, im not saying this article is factually correcthttps:/…Edited: 10:42 am, May 28, 2020 "
I checked with our UK travel insurance provider on Friday and their view was we will be unlikely to be travelling to Croatia in August. I am going to continue watching for updates from UK Gov on travel policy and make a decision to cancel (as we are covered) mid July. Croatia may be fully open but decide to exclude the UK which is a possibility.
"Gary, thanks for helping us out finding accurate information.I would stick to official information published on the official sites of Croatian government. Seek email confirmation from the authorities if in doubt.Please do not rely on newspapers as it has been proven that even the ""serious"" British papers are not always publishing accurate information (actually no medias are 100% trustworthy in my modest opinion).Edited: 7:02 pm, June 07, 2020 "
"I emailed the ministry of Interior for the Republic of Croatia at this email address: policija@mup.hr and received this response. Just to be careful and sure, I will email them again after June 15. In my email I gave them all of my flight information and where we will be staying. We are flying in from the USA so I do not think the driving across the border info pertains to me. Maybe I should fill out the forms they suggest just in case. Dear Madame, Nationals of Czech Republic, Hungary, Austria, Estonia, Lithuania, Latvia, Poland, Slovenia, Germany and Slovakia do not need special reason to enter Croatia and also nationals of other countries who have residence permit in this ten countries. All other foreign nationals who provide a proof of reservation for turistic accommodation will be allowed to enter Croatia. This rules are valid until 15th of June. We don`t have information what rules will valid be after that. In order to reduce traffic jams at border crossing points and waiting times to cross the border which will increase compared to border checks in the past few years due to the fact that additional data need to be collected from passengers, we recommend foreign nationals who intend to stay in the Republic of Croatia to provide their data in advance by filling in the form on the website entercroatia.mup.hr. Passengers who provide their data in this manner will not have to waste additional time to provide the necessary data at the border crossing point since border police officers will have access to their data in the system. Furthermore, passengers who provide their data in this manner will receive confirmation on their e-mail address that their announcement of visit has been received, as well as all other necessary information concerning the instructions and recommendations issued by the Croatian Institute of Public Health. Passengers who fail to provide their data through the said application in advance will be able to do so at the border crossing point when entering the Republic of Croatia but this will require more waiting time in a separate lane. Kind regards 1578584955066_mup-hr-en-logotype.jpgKabinet ministra, Služba za odnose s javnošću | Minister’s office, Department for Public Relations t: +385 1 61 22 353 | f: +385 1 61 22 771e: policija@mup.hrUl. grada Vukovara 33 | 10 000 Zagrebmup.gov.hr1578584973571_eu2020hr-logotype.pngeu2020.hr"
"CroatiaCroatia will reopen its borders to all EU citizens, including from the UK, on June 15, with no obligation to quarantine.Croatia opened its borders in mid-May without restriction to nationals from the Czech Republic, Hungary, Austria, Estonia, Latvia, Lithuania, Poland, Slovenia, Germany and Slovakia.Other visitors from the EU/EEA, and the UK, could also visit from May 11, though restrictions were in place, including quarantine and proof of accommodation.https://www.euronews.com/2020/06/12/which-eu…"
"Hi there meant to be going to Dubrovnik in august , can you use cash in restaurants and bars or is it card only thanks , I love Varna"
"Tarik, If possible and you have the time, could you post any updates over the next month regarding travelling from Dubrovnik to Bosnia and backYou have been most helpful on this forum and you are the one who seems to know exactly what is happeningI have car hire and hotel booked in Mostar and some time in the next month i will have to decide whether to cancel or not so i do not get charged the full fee"
Looking likely the UK will lift quarantine for the main European holiday destinations including Croatia. https://www.theguardian.com/business/2020/ju…
yes but will Croatia want us brits there?fingers crossed.
unless your gov changes their strategy i cant see that being a thing
Gary are you still planning to travel to Dubrovnik? Thinking of changing our Majorca flights to Croatia. Wondering if you’re still going?Many thanksCathy
GaryBelfast just wondering - did you go to Dubrovnik as planned on 1st Aug? I’m hoping to go 23rd Aug from Dublin and keen to hear your experience please?
