"Insurance policies will cover Covid 19 claims on holidays booked prior to March 17th, and that includes medical expenses if the virus is contracted whilst on holidayCurrently, looking at all the policies I have checked including my own, ( Nat west) any holiday booked after this date will not be covered and this also means you will not be covered for medical expenses. If you move an existing holiday and it’s for the same duration etc and the original was booked before 17th March then in most cases the cover will continue.Early days yet and things may change.However if we lose the EHIC card in January when leaving the EU and the insurance companies stick to this current policy into next year, then in would be a brave or foolhardy person who travels to Lanzarote without insurance, if you were unfortunate to contract Covid 19 then the treatment could well cost you your houseAs I said earlier let’s wait and see, many of us would love to return, Lanzarote May open and invite us, but that does not mean it may be possible"
Hum...I have made enquiries to my fav complex about March.
I have Sept (50/50) and Feb bookedHappy HolidaysDanny
We are booked for Christmas and hope it will be okay as we have cancelled Gran Canaria for beginning of October.We need our PDC fix!
A light at the end of the tunnel - or an oncoming train?https://tinyurl.com/ybzu2p28
I paid my deposit for Christmas today!
"I booked flights with Aer Lingus for 19 December at lunchtime.This is good news for the Irish market, here in Ireland we are progressing well com ing out of lockdown in the first phase.Edited: 11:23 am, May 08, 2020 "
We will be back. I truly hope everyone is ok. I'd be so sad if I heard people who had businesses have had to come back to the UK. Lanzarote your in my thoughts
Lost the April and June visits Hoping the July break will happen. Probably tooooooooo optimistic.Lets see what the latest lockdown news reveals in 20 mins.  Also any return obviously depends on Spanish government as well as ours.  Well at least it looks like we will get the gardens centres open. More bl**dy queuing l o l .
ArthurJYou have been missing about 10 days so I was getting worried.Good to see you back
"Just a note: Yesterday I was privileged to join a charity event online for Emerlan, Lanzarote rescue service. 38 of the island's acts performed live via vid link. They raised to date 0ver €43k. It is not too late to donate. Merely join Lanzarote musicians unite facebook page. you can still see the amazing vids on the page.There is hope...stay safe"
"We will be back as soon as it is safe to travel. Have been going at least 3-4 times a year for the last 5 years, it’s second home to us even though we do not own a home out there. I need that place for my sanity. Peurto del Carmen - Tisalaya apartments holds a piece of my heart. Cannot wait to return to see Felipe and the rest of the staff there."
"I am hoping to get back next January ,Lanzarote has been my winter sun break for quite a number of years now but this year I was in Prague in January though did have a trip to Tennerife in November last year. Sorry to say I will not be going back there ,just to much of a concrete jungle for me and I much prefer the more open areas of Lanzarote and the lack of the numerous high rise.There is a group of us older folk hoping to make the trip in January if things are open up by then but will make no bookings till we are a bit more sure."
Was due to revisit 1st June for a week. Was originally taking my Mum and Auntie as they needed a break from looking after my Nan. Unfortunately Nan passed away a couple of weeks ago due to this virus so this week in June would have been a much needed break but hey ho it isn't to be.Our Villa owner has been amazing and has allowed me to move it to June next year but i've booked two weeks instead of just the original one week. Just been onto Ryanair and they have moved the flights at no cost so I'm pleased with that.Only 388 sleeps to go :)
"Hi Phil . So sorry to hear about your nan . What a lovely gesture to take Mum and Auntie for a break . Irrelevant in the circumstances i know but pleased you had no problems rescheduling . Hoping your visit will come around quickly for you and your family , you certainly deserve it . Best wishes and take care ."
"We lost our Easter trip to Rhodes and we have rebooked June in Lanzarote for June 2021.We had a holiday to Costa Teguise booked for August. I know it is unlikely to have taken place but we took the decision to cancel rather than pay the balance this week. Lost the deposit of £400 with Tui but feel it was the right decision because in the event we could have gone, we didn’t want to, sadly.We also have a booking for Playa Blanca in October. We will have to consider the prevailing conditions in July when we have to pay the rest of that holiday.All very depressing as I love my holidays and having something to look forward to and to plan for keeps me going. Still, there’s much worse things than losing a holiday at the present time."
Thanks dodgydjWoking. As I said i'm counting myself lucky that I have no issues rebooking the villa or flights when I know so many are desperate for a refund or still uncertain about their booking.I'm hoping that the local pubs and restaurants on the island get up and running again with the 'New Normal' what ever that may be and survive these tough times. So many great independently run places that I can't wait to get back to when we do arrive back in June 2021
"MrsKris, I would be quietly optimistic about your Playa Blanca trip in October."
"easyJet to resume flights on ""a small number of routes"" from 15th Junehttps://www.bbc.co.uk/news/business-52751791Edited: 3:24 am, May 21, 2020 "
We had a Jet2 package to PDC in September booked through Hays Travel with the balance due to be paid next month. My wife is a bit worried about going this year so we contacted Hays to see if we could postpone it. They have played a blinder and got it rebooked for next April with an extra day for the same money and no amendment fee.
"Excellent news Blueboy . Nice to hear a positive story and good for you for giving the company a mention here , rock on next year eh ? ✈️"
Hays and Jet2 are playing a blinder. Luckily we always try and book via Jet2 and they have moved our June holiday. Unless something changes they have got our loyalty now
"apparently Heathrow Airport have run out of money , hope it doesn't affect anyone , im sure there will be a bailout , think its the busiest airport in the UK"
#114 Mrs Kris Did you contact Tui to see if you could rescedule for next year? Bit late now but you could ask about your next holiday rather than loosing your deposit.
"Lanzarote moves to ""Phase Two"" on Mondayhttps://tinyurl.com/y92fwqnl"
"sparkybill, we probably jumped the gun a bit as yesterday Tui announced that any holiday up to the end of August could be amended without charge. Galling to say the least as we could have rescheduled and saved the deposit but c’est la vie!"
"Good on TUi, we contacted Jet 2 asking for similar,they informed us any costs would be incurred by us.We have travelled with Jet2 for many years and have always rated them.I can appreciate they are a business at the same time shocked at their reply."
"Had a text from Jet2 yesterday to confirm what we already really knew - our holiday on 25th of June has been cancelled, and we will be getting an email shortly with our options. Think we are just going to move it to next year(depending on cost) sad as we were looking forward to our stay at Lava Beach. Just have to get our Lanzarote fix via the webcams until then.Hopefully the island will recover and everyone's favourite bars & resturants will be there waiting for when usBrits are allowed to travel :)Stay safe everyone"
Spanish Prime Minister Pedro Sanchez announces that international tourism will re-start in July 2020.Lanzarote expects to complete the de-escalation from lockdown by 22nd June.https://tinyurl.com/ydgwsxdq
"Encouraging news. Spain has reported a zero death toll from CV19 for the first time since the outbreak began and, stupid air traveller aside, Lanzarote has recorded no new cases in more than a month. Also, no one else travelling on the aircraft has tested positive (but the incubation period may not yet be passed) which should reassure people that you do not sit in a ""biological soup"" of recycled air when flying."
Good point Malc.
"True, if nobody catches it during a two and a half hour flight by the side of an active Covid sufferer, that should help to put people's minds at rest a bit."
Think it’s an excellent point to make as many people appear to worry more about the traveling than their holiday destination with regards to virus . Sure i read somewhere that modern aircraft today have a complete cabin air turnaround in approx 3 mins dispelling the urban myths
"Until I retired last year, I had worked for a company that specialised in aircraft interiors maintenance and although we didn’t do very much of the mechanical side, you do pick things up. If you are interested, the interior airflow of a modern aircraft would be one of the cleanest outside of a laboratory.In flight, air is bled off from the compressors in the engines – not air that has passed through the turbines. Basic physics will tell you this air is very hot, so it then gets chilled and sent into the cabin above your heads. The air is extracted at floor level, so you sit in a curtain of air flowing from head to toe. Under the floor, half the air is jettisoned from the aircraft and the remainder is passed through medical grade HEPA filters, mixed with air from the chillers and sent off round again – the whole process takes two to three minutes. You will hear passengers complaining of sore throats and dry eyes, but that is down to a lack of humidity in the cabin air; the air sourced at 40,000ft is dry and the continuous dumping and filtering drops the moisture content even more. The only way to increase humidity is to add water but water is very heavy, which means it is expensive to carry - lack of moisture in the air is also why aeroplanes don’t tend to go rusty, so there is a benefit.....Nothing is foolproof but as with everyday life, you are far more likely to pick up CV by touching a contaminated surface such as an overhead locker or the meal tray. Aircraft will be cleaned between flights and surfaces sterilised, but I will be taking hand sanitiser if I get to fly anywhere this year."
Malc Bthanks for a very informative post.Hopefully I can check this out agin on July 12th (always the optimist lol).
Yes superb info Malc.
"I have to say I’m really concerned about Lanzarote. Following the collapse of Thomas Cook and the Ryanair withdrawal of flights and closure of its Island base (from January 2020) visitor numbers were significantly down for the first 2 months of this year before Covid 19. This reduction in supply is driving up the price of available flights further compounding the problem. German tourism is also on the decline. An island that relies on tourism 365 days of the year is going to lose a significant amount of small businesses which will damage the holiday experience. Lanzarote needs speedy, radical financial assistance to increase the supply of tourists at a competitive price or face years of stagnation."
Already booked for next year.
"@ Honestger -- I don't know the basis for your gloom and doom report, but it doesn't seem to be borne out by the figures from the tourist office: https://turismodeislascanarias.com/sites/def…Okay, all the islands peaked in 2017 with a fantastic year, but it doesn't seem to me as though 2019 was a disaster. Obviously Covid-19 has been rather more than a hiccup, but of course the regional and national authorities are both well aware of the need for support. In fact, Lanzarote and Fuerteventura have been singled out as cases of special need. All sorts of schemes are in the pipeline at both levels of government.As for the private sector, I believe Ryanair's cutbacks pre-pandemic were only ever meant to be temporary and both TUI and Jet2 were stepping in to increase their supply. There are already a couple of new airlines arriving from European countries (or were, again pre-pandemic).I just got back from a 5-day holiday on Lanzarote and I found the atmosphere among business owners to be mainly very upbeat and optimistic. Of course, some will close. And they can't expect a lot from July and August -- in fact just 8% of the normal tourist numbers are expected then :( . But the government is keeping its furlough-type support in place until end September at least. I think we'll find that most of the totally legal businesses whose owners want to continue will manage to remain open.One thing that will help massively is a measure that they really do seem serious about bringing in now: linking the obligatory monthly social contributions payable by the self-employed (i.e. most business owners, entertainers, freelancers, tradesmen, craftsmen...) to what they actually earn. At the moment, every established autónomo pays at least €300 monthly, even if they earn less than that. That in part explains why so many people work illegally at the moment.I wouldn't say I'm particularly optimistic as there are clearly hard times ahead, but I am hopeful and I do still have confidence in the authorities here (más o menos, anyway)."
"@SheilaW34. Thank you for your post and the information you provided. I’m sorry my post came across as ‘doom and gloom’. As a regular visitor (was due there 29/6/20), it was meant to point out my genuine concern. There is little doubt that the collapse of Thomas Cook and Ryanair reductions were set to have a significant effect on the supply of tourists in 2020. Jet 2 and Tui are expensive in comparison and competition will be fierce (from all over the World) for the smaller numbers travelling this year and next. It will be fascinating to see what happens. Spain and the EU are not famed for speedy interventions and the island needs capital now. In reality, State Aid is required to subsidise flights but other countries will understandably object. It also contravenes EU rules."
"Hi Sheila , hope you enjoyed your mini holiday ! Agree bar and restaurant owners are generally quite optimistic about the future . Wasn’t aware the “ furlough “ scheme was in place until September which might mean places opening up slower than i had imagined . Also VERY interesting about autonomo payments , about time too ! Ridiculously expensive to employ someone here without being a little creative , if you get my drift ! Would like to sell handmade crafts / paintings just to bring in a little income but the social payments make this impossible to do legally , which i want to be . I live here so should contribute but not more than i earn !"
