"-:- Message from Tripadvisor staff -:-This post has been removed at the author's request. The author may repost if desired.Posts on the Tripadvisor forums may be edited for a short period of time. Once the edit period has expired, authors may update their posts by removing and reposting them.To read more about editing your posts, please follow this link: http://www.tripadvisor.com/help/how_to_edit_your_postsRemoved on: 3:19 pm, February 21, 2020"
"-:- Message from Tripadvisor staff -:-Tripadvisor staff removed this post because it did not meet Tripadvisor's forum guideline limiting each user to a single forums screen name.To review the Tripadvisor Forums Posting Guidelines, please follow this link: http://www.tripadvisor.com/pages/forums_posting_guidelines.htmlWe remove posts that do not follow our posting guidelines, and we reserve the right to remove any post for any reason.Removed on: 10:16 pm, February 20, 2020"
"Well, there’s lots of influenza around. I guess some people have rearranged trips if they came down with the flu. Seems odd so many of them would be on one flight. But seat maps are not a very accurate way of determining how full a flight is anyway."
"""the virus"" i like that better than coronavirus or covid-19"
What virus? Influenza? Common cold? Norovirus? We could go on here.
"Once, a long time ago, one of my computers *caught* a virus.CDC did nothing!Best of luck,Hunt"
What virus? Everyone knows he's talking about the clap!
"-:- Message from Tripadvisor staff -:-This post has been removed at the author's request. The author may repost if desired.Posts on the Tripadvisor forums may be edited for a short period of time. Once the edit period has expired, authors may update their posts by removing and reposting them.To read more about editing your posts, please follow this link: http://www.tripadvisor.com/help/how_to_edit_your_postsRemoved on: 3:19 pm, February 21, 2020Edited: 3:19 pm, February 21, 2020 "
"I don’t blame you for being concerned about the outbreak. 11 dead in Nevada. 2,900 nationwide. And that’s just through early January.https://www.usnews.com/news/best-states/neva…"
Lol! 'The outbreak' is just as non-specific as 'the virus'!.
