"#183- Same here. Set to leave in about 9 days with a week on London and Eurostar over to Paris for a week with our return flights leaving from CDG There are 6 of us including the kids. Much of our trip was pre paid (train tix to Paris, Thayls tickets to Belgium and Great Western tix to Bath),American Airlines is not negotiable at all on allowing us to postpone with an $1750 change fee for the 6 tickets so we’re set to continue at this point. Please post an update on your experience. Stocked on hand sanitizer and been taking additional vitamin c per my docs suggestion. Would love to know more about any restrictions happening though if any are at this point. We’re actually still pretty excited, but nervous of course as we don’t want to end up quarantined in any way. Thanks!"
"I'm also set to leave for London March 20th with my three children, ages 15, 12, and 9, and on to Paris via Eurostar for Spring Break. Everything pre-booked and impossible to get out of as of yet, so I really hate to cancel. Mostly concerned about quarantine and them missing school. As of now, we have not canceled anything. We are practicing good hygiene and have plenty of sanitizer, vitamins and supplies, both for here and our trip. The kids have also heard so many rumors at school that they are worried about this trip, too. So hard!"
there is an excellent URL provided plagiarisedhttps:/…regmaiche
"Hope all have a wonderful trip and you are correct that common sense preparation and precautions will keep you as safe traveling as at home. Please report back with your experiences. We have lots of time before heading to London and ScotlandIn September. You might want to check to see if you could take advantage of any recent hotel price reductions. Enjoy your trip.Edited: 10:23 am, March 07, 2020 "
I’ve been checking car rental prices and they haven’t dropped much (in France at least). This suggests to me that tourism isn’t dropping off a cliff yet.
195 The VIA Condotti was deserted yester/to/day regmaiche
"What Via Condotti, which is obviously in Rome, has to do with travel to London? And how Via Condotti is related to car rental prices?"
1] a little diligent knowledge personal experience is helpful2] Paris Quai de bercy >> to Rome Tiburtina <
1] for my sins as a tutor I had to teach equations to the modestly talented time equals distance divided by speed adjust fit what one wants < 24 hours journey between Q DE B & Tibertina see previous contributor re France  no time at all now got it adios regmaiche
"Don't worry Noraatc, most of us have no idea either."
"Two friends of mine arrived in London yesterday morning, staying at the Sheraton Grand Park Lane (where my one friend has been staying on business for the last 25 years...) They say the hotel is at ~50% capacity. I was able to re-book my hotel for later this month at a lower rate (saved almost 150 GBP over 7 nights). Now I just have to hope we can get there (and back.) Right now, I am a bit worried that my customers will pull the plug on anyone visiting their offices that have flown in from elsewhere. I have heard several instances of this, including the friend I reference above. Fingers crossed I still make it over! I've got dinner plans with local friends, theatre tickets for the weekend, etc. all planned out."
"Bring your own toilet paper.Otherwise, London is open as usual."
"Has there been any comment by government or others about closing popular tourist attractions - when the incidence rate rises to a given level?We are coming from Aus so we will be a long way from home.It is inevitable that the virus will continue to spread.The risks as I see it are:-Becoming sick and possibly hospitalised (we are over 65yrs) and partner having to pay for accomm while waiting-Changes/cancellations to flights and ferries, trains etc-Tourist attractions closing - so we miss out after long trip to get there-Getting stuck in transit if Singapore imposes further bansWould appreciate thoughts on this, thanks"
"@Noraatc - I’m from Sudbury as well. I heard Concord has its first case, along with Wellesley. This is bolstering my thinking that as long as there aren’t dire warnings in London and France and Amsterdam before I leave in early April, we’re going. I’m not feeling like my risk is a lot lower here at home if it’s out in the community already here at home."
"You as well, Noraatc! From what I read, the patient called ahead to Emerson so the staff was prepared; and it was a mild case and the person was sent home under quarantine. Reassuring that Emerson has it figured out. My mother lives next door in the senior care center, though, which is worrying. I can’t stop thinking about the senior home in Kirkland, WA.I do worry how easy it would to find care overseas (with no understanding of their system) but have to believe in the kindness of strangers helping you should that happen. I have confirmed my health plan covers me while abroad so I’m set there at least."
"#205 GreatTravelling.......that is how I see it........your costs could be extensive but not only if you get ill.......you might have to self quarantine if you are exposed to someone who has the virus. Where would a traveler stay in that case? Would your hotel have to provide accommodation for these additional days? How do you get food? If you then get ill and must be hospitalized who pays that bill? Most standard travel/medical insurance policies may not? Who pays for your new return flight home? Complicated questions and potentially very costly answers! I think the question is far more extensive than your chance of contracting the virus at home vs on “vacation.” Sorry, just being rational........the kindness of others may or may not be your salvation.Edited: 11:30 pm, March 07, 2020 "
"Has there been any comment by government or others about closing popular tourist attractions--Not in the UK. Major events like the Six Nations and football matches are under review; one of the Women's 6N matches this weekend has been postponed, but the others went ahead as planned. Some matches may happen, but without spectators. Of course, things may change; look at Lombardy. But the UK isn't there yet."
"Oh I agree, lots of unknowns . I would think the kindness of strangers would help direct me to a hospital if I needed one, for instance, or to help sort out where to go if quarantined. In mass quarantine events there must be some help (Red Cross?) for travelers? I’d love to see an article about what happens if you’re quarantined abroad - it feels like a real possibility but also a bit mysterious at the same time. Time will tell - We are not making any decisions until the start of April, at which time the UK and France May look like Milan and it will be an easy choice to stay home."
"if your tickets are booked with Delta, I just read that Delta has added an option to cancel flight booked prior to March 1. Just in case things get worse and cancellation is unavoidable or preferable.“You may choose to cancel your trip, and use the value towards a future flight. —You may cancel your flight and apply any unused value of the ticket toward the purchase of a new ticket for a period of one year from the original issue date.—Applicable change fee and fare difference will apply for new travel dates and will be collected at the time of booking the new ticket.”Edited: 7:59 am, March 08, 2020 "
Thanks Angela.....we did book our flights on Delta prior to March 1
"Booked for 8 nights in London, arriving on March 19 with our two teenagers. Living day-to-day with a back up plan to go to Buenos Aires if there is a travel warning/ban to the UK. We have until March 14 to get out of our Airbnb with just a loss of the service fee."
"MChiddy, sooner is better I think. Our trip is not until March 28. Have fun and come back safely as planned. Let us know how it’s going while you are in London as much as you possibly can please."
>>antibacterial hand wipes<< Check if those contain at least 60% alcohol.
"Yep, am aware of the effective ingredients, no worries."
"Safe travels, MChiddy! I will be anxiously waiting for your trip report. Thank you in advance for writing it for all of us who are planning to come to London soon.Enjoy London!Nora"
"Thanks! This is probably my 18th or 19th(?) trip (husband is from Woodford Green, Essex). It will be interesting to see if much has changed but I suspect it's pretty much business as usual, only with smaller crowds of tourists. Our only worry is visiting his elderly parents, which was the purpose of the trip when we booked it. We will play it by ear upon arrival but so far, they still want us to visit.Edited: 3:51 pm, March 08, 2020 "
Arrived in London yesterday. On day 2 of our trip had a awesome time walking around. Everything is normal here not any diff than US - hope it stays that way. Weather has been decent.
"Awesome news, Ayesha!!! Keep us posted please! Stay safe and healthy!Nora"
"Hi! We're planning an 8-day stay in London departing 13/MAR. Concerned about closures there, museums, sights, etc. Any info on that?"
Nobody knows.
"I can only assume that Ana W has not read the 200-odd previous posts that can be summarised thus: With some very minor exceptions, life in London and the rest of the UK continues as normal."
"MChiddy one idea might be to meet them at a tea garden or beach where you are all outside. See what they say. They will know the situation better than you.I live in a retirement area and we are continuing with all activities. Keeping fit, socialising (with sensible precautions) is important. Meeting you will do them more good providing you remember to take care."
"Hi Toopaz - Unfortunately, my in-laws are 88/89 yrs old and unwilling to get out and about due to knee and hip issues, and general disinterest. We will see how they feel about seeing us after we arrive, although their main concern wasn't about their health, but ours. Perhaps if the weather is nice, we can have a chat in their garden rather than in their enclosed lounge, as it typical when we visit.Edited: 10:57 am, March 09, 2020 "
"*as IS typical*We have plans with friends and tickets for various things, so all won't be lost if we don't make it to Woodford to visit them. My husband is just keenly aware of their age and with us being so far away, we have been trying to make the trip over a little more often. We were in London in October as well."
"Well, we've just received word that my in-laws don't want us to visit them, they aren't comfortable with the situation. So, we're deciding what we want to do now. I've prepaid our hotel for 9 nights and they have already told me that unless my flights are cancelled, they won't even think about issuing a credit towards a future stay. Hoping to still make the trip, as we were also planning on meeting up with various friends too.Ugh, what a mess!Edited: 12:03 pm, March 09, 2020 "
"If you are in good health, I would probably wait and decide, McChiddy. You have nothing to lose if you wait a bit longer. If I go, I will not be showing up at my parents’ house (87 and 90 years old) for two weeks upon my return. Best of luck with your decision!Nora"
"Hi, I live in outer London and had to go into town today. I was also on the King's Road on Saturday (for an appointment), and was surprised to see, on both occasions, that it was busy, as were London Victoria and London Bridge stations and the overground trains I took into central London. I think visitors in London right now, would see little difference from the norm. There is an undercurrent of anxiety- expect furious glares if you cough or sneeze! However, everything is open as usual.Unfortunately, as has happened in Italy, South Korea and elsewhere, the situation can alter rapidly as government advice changes/infection rates increase. It makes it impossible to know for certain whether to travel or not. I cancelled my own overseas plans for April as I didn't fancy being stranded far from home, but everyone's risk tolerance is different!Btw: You won't see many locals wearing masks, mainly because they are not widely available in UK shops at the best of times, (and not at all now). Some have been buying them at horrendously inflated prices online in small quantities for emergency use and DIY shops have sold out of dust masks, respirators, etc. However, there is no culture in the UK of mask wearing outdoors ordinarily, so things will have to get worse before those who do have them, bring them out in public!If visiting, please bring your own hand sanitizer and wipes. These haven't been available in shops for a couple of weeks, despite government claims that there is no problem with supply. This is partly due to hoarding but also to people buying in bulk and reselling at inflated prices. Supermarkets are only now, belatedly, trying to respond to this by introducing rationing for such items.As elsewhere in the world, toilet paper is becoming hard to find, but if staying in a hotel, this won't be an issue!I have another appointment in central London on Wednesday, so if I notice any changes, I will report back.:)"
"Oh, thank you so much for your post!! I so appreciate the information you've provided! And yes please, let us know how it is on Wednesday!"
"I had not, as I am normally not on this site. But thank you for your response."
"Poundland at Dalston Junction had supplies of household cleaners and wipes for those who must have single use products in a display very near the shop entrance this morning. They also had soaps, shower gels and hand washes on the shelves.Sainsbury's and Waitrose branches have cleaning products as do the M&S Food Halls I've been in. My Sainsbury's in Whitechapel was a bit picked over last Wednesday but was stocked up again by the weekend. The branches of Boots I've been in over the last few days have had soaps, shower gels and some cleaning products as well.Some people are making an effort to practice good cough or sneeze hygiene and some are not. What is notable is that people are talking about hand hygiene as if it was a new invention rather than a first line sensible measure.School parties are visiting museums, shoppers are out in full force, the markets are busy and life goes on. If asked, my take on things is that many people will do what they can to reduce the risk and hope they don't meed Covid 19, but aren't hiding from life in the short term."
"Delta extends its offer for change of flight or cancellation implying things are not looking good, Italy locks down the whole country, fear of being quarantined/ locked down while in London, and fear of being alienated when we get back from London (if we can come back as planned), fear of my daughter cannot go back to school when we get back (self quarantine), stock market is crashing....March 28 (my travel date) is still 19 days away and much can happen between now and then....I am so sad this is happening. What a mess!!!"
"I’ve been watching this thread and the news for awhile, trying to find info that would help quash the growing feeling inside me that we need to cancel our trip (18-days thru France-Netherlands-Germany-UK). We have decided to cancel - we can always go back next year. We were to leave a month from today, and if these countries are as impacted in a Months time as Italy is now, it would not be good to be there. Plus, my best friend has a bad case of asthma and we will have 2 teenagers with us. I wouldn’t want them quarantined in the states either upon their return. Really hard decision but we’ll regroup and plan a trip for 2021 (we will buy cancel for any reason insurance this time... you live and you learn). Several attractions seem to offer the ability to reschedule your tickets - I hope that will work out."
"I have followed this post and all of those who post that everything appears normal in the U.K......business as usual. It is not “normal” for those of us trying to decide whether to go ahead with our long planned trips. Each day the news makes you stand up and take notice......Italy locking down millions; Ireland canceling St. Patty’s Day Parade; cruise ships denied ports; concerts and sporting events cancelled; schools and universities closed; suggestion people over 60 refrain from flying. These are not normal times and traveling anywhere these days is risky. It is risky not only because museums might be closed.....it is risky because the spread of this virus changes by the day and no one can predict what tomorrow brings. Each of us must make our own decisions about upcoming travel but I would be very concerned about traveling until things settle down worldwide.Edited: 10:49 pm, March 09, 2020 "
"Hi all, I’m supposed to be heading to London on Friday to see Book of Mormon in the prince of Wales theatre. Just wondering has west end theatre been affected at all as I can’t seem to find news of it online? Thank you!Edited: 6:18 am, March 10, 2020 "
"""I can’t seem to find news of it online?""Because there is no news to report."
No panic and no change in major tourist sites at the moment. London is open as usual!
"Just back from 2 days in London. All is as usual, tube trains, shops and galleries were just as crowded as always and I saw only 4 people wearing face masks and 3 of them were Asians who often wear them anyhow. In the lavatories people seemed to be a bit more thorough than usual with hand washing, otherwise no impact at all."
London is almost entirely normal at the moment.
"Hi, here is a link to an interesting news article on how people here are reacting:https://www.bbc.co.uk/news/uk-51815486:)"
"Yes, but the trouble with these articles is that the journalists hunt down the one person wearing a mask, or the one empty shelf in a shop, and use that to illustrate the article.I was just in London this weekend. Perhaps the traffic was a little lighter than usual, particularly out near the airport. But I didn’t see a single mask. People were out and about enjoying life more or less as normal. I am sure a lot of them are thinking about the virus, washing their hands more often and the rest. But so far, that’s it. Of course, looking at Italy, that might be about to change here, who can say?"
"I'm self-employed and rarely venture into London but did so today to spend a day in an office - afterwards friends and I went for dinner in Chinatown. Piccadilly seemed about normal for a rainy Tuesday evening when we arrived at 7pm, but it was a little quieter than usual at 9pm when we left - although far from deserted. I had to stand for one stop on the Piccadilly Line and then got a seat despite some delays on the line. But nothing stood out as being abnormal and I think people are going about their everyday lives for the moment.I realised it's perfectly possible to avoid touching anything on the Tube if you're able to stand without holding on and avoid holding the handrail on stairs and escalators."
"Hi, the article I mentioned doesn't say that many people are wearing masks, (I haven't seen anyone wearing them myself except for a couple of tourists, who presumably brought them with them). I merely thought it was an interesting piece, with some good BBC links on related topics that may be of interest to overseas visitors. Having said that, I did see people wearing their scarves over their mouths on the tube and train yesterday, (and it wasn't cold!) My son noticed the same thing in London on Saturday. I agree that London seems as busy as ever. Those tourists who are here are going about as usual, enjoying their visit, as everything is open. Some city companies are encouraging more from home working, however, where this is possible. All the cinemas and theatres are open. My son goes to the cinema regularly and says it's been as busy as usual. The restaurants near me seem to have been quieter in the last week, but Costa and Starbucks were as busy as ever! For now, life is continuing much as normal, but people are following the news with more than usual interest here."
"Latest figures from Heathrow Airport this morning say travelers are down 4.8%;Put in reverse then, 95.2% are traveling as normal . . .Not saying it's right or wrong, just an observation ."
"The British health minister has just tested positive to the virus. Although many on this forum continue to claim that it is business as usual the risks are very much alive. I think every traveler must consider those risks and the consequences should they get the virus while on vacation, especially an international trip."
"The business as usual posts refer to the day-to-day normal things at that moment such as are attraction open, are people out and about etc."
"Actually it is a junior minister in the Department of Health, Nadine Dorries, that has been infected, rather than the Health Secretary, Matt Hancock, himself.https://www.bbc.co.uk/news/uk-51827356Ms Dorries has since tweeted that the experience was ""...pretty rubbish, but I hope I'm over the worst of it now..."" Which suggests that the majority of people who do catch the virus will recover, as has been borne out by statistics. Yes, there are risks in travelling, but the point is that there are also risks in remaining in your home country. Latest figures show that the UK has 5.6 cases of the virus per 1,000,000 of population, whilst the figure for the US is 3.1.So in deciding what to do I would consider your own state of health, whether your insurance covers you if you do become ill, and the official advice from your own government.I am travelling to the United States between April 25th and May 18th, and am not gonig to cancel unless:-(i) The UK government advises against all but essential travel to the US(ii) The US government decides to prohibit entry to the US for UK citizens(iii) My airline (Aer Lingus) cancels the flight.If any of these event occur, my insurance will kick in, and I will be able to rearrange the trip for later in the year."
"If London enacts more draconian measures to combat coronavirus, such as banning gatherings of crowds, closing attractions, etc., does the rest of England have to follow suit? If social distancing works, and flights don't get cancelled by the airlines, would tourism be ""normal"" in the Bath, Cotswolds, Glastonbury, Wells, Stonehenge, Avebury circuit?"
Many scientists and doctors strongly suggest the way to “control” this virus is to be aggressive now and anticipate what WILL happen in the days and weeks ahead. To say that this virus will merely disappear and things will continue as normal is very unrealistic. Good luck with your travel plans.
"I’m a traveler. I canceled my 18-day trip yesterday (April 8 - Paris, April 26-London). I’ve been on these forums and read the news, but haven’t been able to find out what happens if you are quarantined away from home - do you get put in a hotel? By yourself of with your traveling companions? Are you charged a reasonable hotel rate or are you at hotel’s mercy? How do you get food and necessities if you’re sick and in quarantine? These are the kinds of questions that aren’t answered. If anyone has seen an article with specifics pls post on this forum. Everything I’ve read is so general that it leaves you with all the same concerns. After what happened in Italy I decided it wasn’t worth the risk if the rest of Europe was about a month behind Italy, since I was to travel in a month. I am sure I have as much chance of catching the virus here in the US but it feels like it would be easier to deal with at home. Also, I don’t think I’d be ‘present’ if we took the vacation - I’d be too worried about whether X was open or if we could take the train to Y. This decision is personal to us, and was hard, but now that it’s been made I feel a rush of relief.Edited: 7:14 am, March 11, 2020 "
>>To say that this virus will merely disappear and things will continue as normal is very unrealistic.<<Who said that...?
I came to the same conclusion as SMa1983.....too many unanswered questions especially for international travelers. Should the virus spread rapidly in an area a traveler would be more vulnerable not only to the virus but to circumstances in general. And how much fun is a vacation with that hanging over you?The President of the United States feels it will magically disappear. The scientists feel we are just at the beginning of this crisis. We dropped the ball on testing so accurate numbers are unknown......I do not know the extent of testing in the U.K.
"I am so torn at this point. I want to go but the fear of the unforeseen events is getting stronger. I have asthma and it is complicated to think of the unexpected expenses if I get the virus and have to be hospitalized during my trip in London even though I have travel insurance. I haven’t cancelled anything yet because I am still hopeful. Delta’s condition of rebooking has to be done within one year of the original issues date (I purchased on Jan 13) meaning we can’t go during spring break next year (April 2021). I am still in a “wait and see” mode until a week before my travel date (March 28). I have decided to cancel my upcoming trip to California (2 days after my London trip) to attend a conference. That decision is much easier than our London trip.Edited: 7:46 am, March 11, 2020 "
