"This forum has kept my hope up about going to London regardless of the Coronavirus situation. But I am curious as to how much has London tourism been affected by Coronavirus. I am hoping the situation will get better over the next few weeks and that we can visit most, if not all, of the attractions we plan to visit. I hope none will be closed down while we are in London."
"I suggest reading or listening the bbc news onlinehttps://www.bbc.com/news/ukhttps://www.bbc.com/news/health-51048366there is the general uk news site and several news related listen again radio show or podcastshttps://www.bbc.co.uk/programmes/b006qtl3https://www.bbc.co.uk/programmes/p084r5cqEdited: 10:45 pm, February 27, 2020 "
"I have not seen any recent updates on London tourism numbers, but others likely have their fingers on the pulse of such.Are you a travel writer, looking for info, or a traveler?If the latter, what, exactly, is it, that you wish to know?Best of luck,Hunt"
"I just want to know the trend (decline in tourists). I am guessing there will be less tourists from Asia, especially China and South Korea but I am not sure what percentage of tourists in London are from Asia. I just hope London stay safe and open business as usual in the next few weeks or months. I am just a traveler from the US, first time to Europe so I am super excited but also afraid of the possibility of having to cancel my trip should things get worse."
Check this for quick up to date analysis... http://worldometers.info/coronavirus/
"We were just in London. The only thing we heard from a local is that the very high end shops are suffering a bit due to the lack of tourists from Asia.On our travels we met others from the US and numerous other European countries. There were lines at most attractions, though never over 20 minutes."
I’ve just had a US visitor so we went out a lot in Central London and it seemed as busy as ever there and on the tube. But of course anything could change now anywhere in the world. Don’t book anything where you can’t get your money back if you are legally prevented from going.
"I haven't noticed fewer people in London, it's just as busy as always. A few people walking around with masks on now and all shops seem to have run out of hand sanitiser, but that's about it."
"We were doing touristy things in London last week and London seemed as busy as ever.Saying that, the Chinese restaurant we went to (not Chinatown) was almost empty.Down in Bath, I am still seeing Asian tourists (but they could easily be UK residents on a day-trip and/or some of the thousands of students who come over to study at our University). I know some language schools have had blocks of students cancel, which has implications for some host families and local businesses, but most people are unaffected.It is early days, but I think most fit and well families are carrying on as normal."
"I'll be in London in 3 weeks (18th to 22nd March) and not worried at all.I just hope this virus doesn't spread too much here (Austria) or in the UK and it would affect my plans (flights cancelled etc). I already bought tickets for musicals/theatre, Potter Studios and an exhibition and would be pissed if I wouldn't be able to go.I'll stay at an Airbnb, so unlikely to be quarantined, no other guest who could show symptoms or getting tested positive.I'm in Vienna (Austria: 5 confirmed cases at the moment)."
"Just got back from 3 days in London and it's business as usual. Hardly saw anybody wearing face masksThink this is a total overreaction. Up to 30,000 flu deaths each year globally and nobody bats an eyelid. 2,000 COVID deaths and the world goes bonkers. Financial markets crashing, flights cancelled, people having to isolate themselves (after they have become infectious, so pointless exercise). Makes me wonder if that Extinction Rebellion lot are behind the whole thing"
"I haven't noticed anything different. Certainly everyone seems to be at work as usual. The ballet last night was sold out and the theatre looked full to me, although there was a man wearing a face mask in the row behind me. And the tube home was pretty crowded too. I guess things might change over the next few months but there's certainly no sign of hysteria here."
"I don’t know when your trip is but for any trip we always get travel insurance. There are many types and not everything is covered so you have to research what is best for you and your family.........medical, medical evacuation, trip interruption, lost baggage, trip delay, etc. Most policies have restrictions unless you purchase the more costly “cancel for any reason” policy. We also try not to lay out much in advance and never book non flexible, pay now hotel rates, etc.The question of travel safety is really up to your tolerance. My wife has a lower tolerance than I have. You can get sick at home just as easily as you can on any trip........however you are more likely to be in crowded situation on a trip......airports, planes, public transportation, shows, sites, etc. Really depends on what you are comfortable with. Our trip to London is in September so it is a wait and see on how this “pandemic” develops.Edited: 5:40 am, February 28, 2020 "
"I feel some people are not grasping the implications of the coronavirus outbreak.The chances that you will catch coronavirus in the UK are very, very low - at least at the moment.The chances that your trip will be disrupted due to measures put in place to stop the spread of coronavirus are much, much higher.The Swiss have just temporarily banned all public events with expected attendance over 1,000. This is a drastic measure, and while I cannot see the UK copying it exactly, it is quite possible that some large events may not go ahead. If you can't cancel or delay your trip, as mentioned in #12 - get travel insurance."
"As far as I can see, not at all."
There yesterday and just as busy as ever.
"Yes we have travel insurance. We can cancel our hotel one day before arrival without any fee. We have only booked WB HP studio, Parliament tour, and Heathrow Express so the loss is for these three is only about £150. The travel insurance that we bought while booking our flights using Skymile doesn’t cover much but we will get money back if we have to cancel and re-deposit the miles back if the reason of cancellation is covered. I am more worried about not able to go outside my control and being locked down at the hotel if someone in the hotel tested positive. Plus the “epidemic” is excluded on the travel insurance so I think we will not be covered if we have to stay longer or have any medical expenses caused by Coronavirus."
"If I had travel plans for let’s say the next 4-6 weeks with so much uncertainty, I would have a difficult time convincing my wife to go. You have to go with your gut feelings and level of tolerance. Being away from home and the support you have is anxious enough without any unforeseen effects of the current health situation. We had a cruise scheduled for December and just cancelled it.......our September London/Edinburgh is a wait and see right now."
"66 Million people in the UK.19 Cases.To put that in perspective, that’s 1 in every 3,450,000.All have visited one of the infected Countries like Iran, Italy and China.Oh and so far, no Deaths!"
"Re post #18. I don't think people are necessarily concerned about catching the illness or even dying, but more to do with what the situation is regarding day to day life in the city. At the moment everything is normal, but if there was to be an outbreak here I suspect it would cause considerable disruption as in the effected areas in China and Italy. As it is schools are already start to shut in the UK as a result."
"On our TV news, there were photos of St Marks Square in Venice, looking deserted. London is nothing like that.All the reported cases are in (or have been in) specialist isolation hospitals or quarantine. There has been no mass contamination event in the UK as there seems to have been in South Korea, Italy and Iran. There has been little or no person-to-person infection in the UK.However, shares in travel companies like airlines have plummeted in the expectation that people will cancel travel plans. And posts like this will encourage people not to travel and so it will become a self-fulfilling prophecy.Yes, don't travel to risky areas, but where there is minuscule risk, why not continue with your plans?"
"#19, you are so right! Yes I want to go on with my plan. I could appreciate less crowded attractions as long as they don’t look deserted. I want to enjoy London at its fullest of energy and excitement. I don’t want to be interrupted with quarantine should someone in the airplane or in the hotel tested positive. I want to be out and about during my 7-8 days in London (I will be there in 4 weeks). I am not worried about getting Coronavirus because if I get then I won’t be able to go out and about anyway. Being locked down while you are well and could have been out doing things is painful emotionally.Edited: 8:58 am, February 28, 2020 "
"The American Center for Disease Control and Prevention (CDC) has put some countries on their 3 stages of alert, and the UK isn't on any of them now. But that means here nor there when it comes to travel next week, or next month. https://wwwnc.cdc.gov/travel/notices/And for some, it's not nervousness about getting sick. It's about wasting time and money to go play tourist and not being able to do touristy things.And travel insurance (unless you pay for cancel any reason) only covers you if you actually contract the virus, not because you're worried about it.It's really a rock and a hard place for near-time visitors, as so much had to be paid upfront.Edited: 9:05 am, February 28, 2020 "
"Judging by the ludicrously long queue (in the pouring rain!) for the security check at the British Museum today, I'd say the impact on the number of tourists visiting London is nil.A few people wearing face masks, and being looked at with ridicule by fellow visitors, and yet leaving the toilet without washing their hands because they seem to assume sanitiser will do.Edited: 10:14 am, February 28, 2020 "
"#23, good to know! Thank you! I appreciate the responses from all of you.If any of you reading this post are currently in London , can you please provide update? Thank you so much"
">>A few people wearing face masks, and being looked at with ridicule by fellow visitors, and yet leaving the toilet without washing their hands because they seem to assume sanitiser will do.<<That's disgusting. It's always disgusting but now it's also ridiculously stupid if they're wearing the masks...!"
"The same group were all carrying selfie sticks, so I think 'stupid' is a fair assessment of them generally, but yes, who leaves a public toilet without washing their hands. Gross!Edited: 10:43 am, February 28, 2020 "
">>If any of you reading this post are currently in London , can you please provide update?<<I walked from my place in Islington to Russell Square for work this morning. It's completely business as usual right now Angela. Busy as ever. I'll be heading out to the pub for a few drinks later.Edited: 10:52 am, February 28, 2020 "
"It’s good to see that London (much like NYC) has been business as usual lately. I’m planning to go to London the first week in June and have been watching these forums like a hawk all week. I know the situation is so fluid but I hope I can still go with no issues! I’m also hoping that there is *some* merit to the idea that the warmer weather might lessen the risk a bit, but I realize nobody knows."
I agree that wait and see is the only logical approach at this time. One of my concerns is the lack of worldwide testing and treatment so who really knows how many people going about their normal business in London or NYC are infected.
"It's not just London and NYC, martyap. That's the question around the world because it's flu season. How many people are or were infected who are/were treated for the flu?One of the (now) confirmed austrian Coronavirus cases is an elderly man who already was a critically ill 'flu' patient at one of our hospitals for 10 days before he even got tested for COVID-19. Now he is quarantined, all his visitors and hospital staff, doctors, nurses have been tested (negative).He wasn't tested because he didn't travel and no one he has been in contact with travelled during the weeks prior to his contagion. His 'patient 0' is unknown."
"Well, it's ""relatively"" warmer in the Southern hemisphere but the outbreak has just started there. Let's see if there is a statistically significant difference in the rate of spread of infection in the southern hemisphere compared to the northern hemisphere"
I spent time in tourist London (Kings Cross and Oxford Street) yesterday and the day before and it struck me that it was business as usual. In two days I only saw one youngish man on the tube wearing a mask.Politicians are scared to be seen doing nothing so I wonder is something may result from a Cobra meeting called for Monday but I don't see the point of cancelling anything or closing stadiums and other places where people will gather unless cases of local to local infection are reported.
"jtwiz – I think that’s very understandable. A lot of people are feeling the same way. An Italian student of mine has booked to go home to Rome for the Easter break. She's now thinking of cancelling even though she won't get a refund on the flight and will be stuck in her student house on her own outside of term time rather than being back home with her family. The alternative of course is potentially much worse, which is that she's unable to get back into the UK without potentially going in quarantine and missing important exams."
"We are set to travel to London next Friday and I'm nervous. Not so much about going there but if something were to happen while we are there (quarantines, things cancelling, schools shutting down). That would be a major bummer. My tickets are non-refundable and unless there is a state of emergency in UK, virgin probably won't refund my tickets. i also paid for my airbnb already. SIGH."
"Ayesha, I think the chances of anything major happening in the next week or so are highly unlikely. If you were coming in a month though, well, who knows.Over the last 2 weeks there's been an extra case here and there, but no mass outbreaks. It really would be overkill to be shutting tourist attractions and having mass quarantines with only 20 people in the UK affected."
"Tourism is already affected. Airlines like British Air, Lufthansa, United have cut flights, instituted hiring freezes, offered employees unpaid leaves and if you don’t “see” it does not mean it isn’t happening. I do not think you can make light of this and going forward it may not be business as usual."
I’m traveling in about 6 weeks and am also worried about the trip being disrupted due to containment measures. What does a quarantine look like if you’re stopped at the airport for instance? Where do you go? Who pays?
I think even with travel insurance you run the risk of a financial burden. One issue for us......if it becomes as widespread and transmissible as some think is it worth the risk to be away from home?
I haven't noticed any change at all but to be honest London is a very busy place I think there would have to be 1000+ less visitors to actually notice
"'so who really knows how many people going about their normal business in London or NYC are infected.' No one knows how many people around the world have contracted COVID-19, had a mild illness, and are now going about their business. As well no one knows whether any of those people will have passed on the virus.With a longish incubation period and mild respiratory symptoms in a number of people it really will be difficult to say that the disease in City A is the result of a traveller from City B. Incubation with influenza is about one to four days during which time a person might feel off colour and pass on the virus before the illness kicks in.I'd say the biggest concerns are that there aren't any effective antivirals, no vaccine as yet, and that this is an unknown pathogen which may turn right after indicating left.Those at risk - and it's not just the very young or very old - will have to decide their risk tolerance. I intend to travel next week but plan to ensure more than my usual hygiene standards for my own health and to avoid acting as a vector."
"“It really would be overkill to be shutting tourist attractions and having mass quarantines with only 20 people in the UK affected.”===============It’s only 12. 8 of the first 9 patients have recovered and been discharged. Indeed with 4 of those 12 active cases being from the Diamond Princess and under quarantine the moment they left Japan, you can argue there are only 8 “homegrown” active cases in the UK. Of course that could change and I suspect it will to some extent. How serious that “some extent” turns out to be is anyone’s guess."
"We are scheduled to arrive March 19th. A bit worried (not so much about Coronavirus as I beleive it can be transmitted anywhere) but more so about getting over there and being stuck or our Eurostar being canceled into France where our return flights depart. I am also wondering if we need to purchase a private medical insurance policy in order to be seen by a doctor if needed. We still plan to visit as the insurance policies are not allowing any coverage for a ""known or foreseen"" event. We have about 15 tours between London, France and Finland that are already paid. Just not sure what's going on at this point. Even if our flights reimbursed us, we are not likely to get the Eurostar, Thayls, Great Western Railway, etc trains and so forth reimbursed."
"I would pose these questions directly to your travel insurance company......they are all different in the coverage they offer; what they would cover; etc. The most worrisome thing is that it appears this is so fluid that situations can change in any country in a matter of days.... before you travel or during your stay. Also worrisome is that China, South Korea, Iran and now the US government have not been totally transparent or prepared."
"-:- Message from Tripadvisor staff -:-This post has been removed at the author's request. The author may repost if desired.Posts on the Tripadvisor forums may be edited for a short period of time. Once the edit period has expired, authors may update their posts by removing and reposting them.To read more about editing your posts, please follow this link: http://www.tripadvisor.com/help/how_to_edit_your_postsRemoved on: 5:39 am, February 29, 2020"
"How does that link tell us anything about London ? The only significant , and ltypical, item is about Trump ignorantly saying coronavirus is a hoax. !!!!"
Sorry....the link I tried to post was a recent article about travel insurance and what may and may not be covered......tried to edit it but was too late....link does not lead to the article........NO COMMENTS ABOUT TRUMP AND HIS LEADERSHIP ABILITIES
". I am also wondering if we need to purchase a private medical insurance policy in order to be seen by a doctor if needed. ———————————-You should always have this when travelling, virus or no virus."
"Martyap, if you want to delete that, just choose 'Report inappropriate content' under the post, and then select 'Delete my post'.Edited: 5:24 am, February 29, 2020 "
"I'm not sure why some people, probably not from your home country, deciding not to come to England because of an unfounded fear of a virus which has hardly affected the UK should affect your health while here.Now if you were going to North Italy ...."
"<< Even if our flights reimbursed us, we are not likely to get the Eurostar, Thayls, Great Western Railway, etc trains and so forth reimbursed. >>Isn't that what travel insurance is for ?"
"#48 Sorry, but your link did take one to about 20 items, one of which quoted Trump as saying Coronavirus was a hoax. Shouting won't alter the facts !"
"Every policy is different.....some will pay directly and some are only secondary insurers. All policies have limits of liability so you could find yourself responsible for costs incurred beyond the coverage. I am not an expert on travel insurance but I believe if you are concerned about upcoming travel it is in your best interest to check out exactly what you are covered for........you might find it is less than you think.I was able to remove the link.....thanksEdited: 5:52 am, February 29, 2020 "
"Post 49 - yes, medical insurance is highly advisable.Only basic emergency medical care is free to visitors to the U.K. anything else is subject to charge - as is repatriation, which can get very expensive indeed."
"Going forward this may become a very unique situation as to what travel insurance will cover or even be able to cover. We have travel insurance for our September trip which includes medical insurance and repatriation. If the situation worsens how good will that coverage be? We do not have the more costly cancel for any reason policy so if we decide not to travel we would lose any items we already pre paid (air, theater tickets.) Our hotels are all booked with flexible, refundable rates.I would be very careful what you pay in advance........if you have already pre paid items and your trip is soon I would contact your travel insurer and find out what your coverage is and what your options are. Don’t assume just because you have a policy you are good to go.....be proactive."
"Adding to #55, consider what would happen if you need an extended stay eg because you or travel companion aren’t declared fit to fly or are in isolation for two or more weeks."
The Louvre closed until further notice. Is it only a matter of time before one of London's museums follow suit? https:/…29cc5b26f3620a2bbd6c8444f4f12e42
"Closing the Louvre to visitors sounds like an exercise in reducing the potential for transmission to staff than anything else.However, if staff leave their houses, use the Metro or walk through the streets of Paris the chances of meeting the virus are probably only slightly lower than when at the not really closed environment of the museum, although the number of people moving through it is substantial.Trying to maintain a cordon sanitaire when the population inside it has a mix of those who may have been in contact with the organism is rather an exercise in futility. Risk reduction attempts such as this can ramp up anxiety in the well population too."
"That’s what I was wondering too about attractions closingEdited: 3:42 pm, March 01, 2020 "
"I wonder that the reason of low number of positive cases in some countries, like UK, where the neighboring country has high numbers like Italy, is due to lack of testing. In US, only those symptomatic patients with explicit contact history with known locales or known positive cases have been tested, less than 500 tests have been done. New cases will certainly rise when more testings are carried out in the following weeks. Not trying to be alarmist, but I think there is a possibility of false negative due to lack of testing. I don't see how UK is substantially different from Italy, especially when the population are free to move about."
"Italy is not a neighbouring Country to the UK!Remember we are an Island, and even though we have left the EU, and were never part of the Schengen Zone anyway, there is no freedom of movement in the sense you are meaning!Of the 36 cases in the UK to date, virtually all of them have been linked with people contracting it whilst visiting another infected Country!"
"-:- Message from Tripadvisor staff -:-This post has been removed at the author's request. The author may repost if desired.Posts on the Tripadvisor forums may be edited for a short period of time. Once the edit period has expired, authors may update their posts by removing and reposting them.To read more about editing your posts, please follow this link: http://www.tripadvisor.com/help/how_to_edit_your_postsRemoved on: 9:18 pm, March 01, 2020"
"#63, ""all of the cases have visited infected countries"" - is this because only those cases have been tested? In US, this was the reason until couple days ago (and we didn't know about it until a couple days ago), is UK testing standard different from US?Edited: 9:35 pm, March 01, 2020 "
"If you are concerned then stay away. The virus, which seems to be little different to a normal flu virus, is in the US as well so choose your risk level & location. Consider other risks too - you are far less likely to be shot in London!! You say your aren't trying to be alarmist but that is exactly what you are being. Feeding the hysteria is not a good idea."
"On the other hand, choosing to ignore the fact is also not a good idea.Edited: 9:47 pm, March 01, 2020 "
I don’t know? What is the Standard? What is your Standard?We will find out tomorrow morning when the Prime Minister chairs a COBRA Meeting on the Subject!
"There is a difference between ignoring things and hysteria. I was in S E Asia in late Jan/Feb with thousnds of reported cases and none of the hysteria that has now attached itself to e.g. Italy, often borne of a complete lack of understanding of the location of outbreaks and the steps taken, nor of the actual rsk of catching COVID19. Many thousands more have died in the US from ordinary flu. People need to get some perspective."
