"The pandemic is in the media. I was in Costco yesterday and people were buying (whatever was left)....toilet paper, water, tissues, paper towels and cleaningsupplies as if we were being invaded. I agree about using common sense and going about your business. My concern is that I’d rather deal with the hysteria at home than across the pond on “vacation.”"
">>The pandemic is in the media.<<That's the ""infodemic""..."
I think I would rather be quarantined on my chosen Greek island for an extra two weeks as opposed to being stuck at home in my flat!. I will still be going on my holiday in June as long as the flight will take me. !!
"The “infodemic” is on the TA Rome forum as well, Ariel. Self-appointed moderators are having sleepless nights updating TA readers with the information easily available online and making their own judgements, projections and recommendations. Kudos to the London forum contributors for being so reasonable and respectful!Edited: 11:37 am, March 04, 2020 "
"Our trip is in middle of May to UK. I appreciate the thoughtful posts from those of you who live there. We plan on using public transport and staying in VRBO - Bath, London, York and Edinburgh. So far we plan to continue as planned."
"Circulation in the papers and media watching is way down in the USA. There are many who appear to be using this virus for personal gain. We see it over and over here with weather events, mass shootings and with the narrative used being only the part that furthers their personal agendas. Hope TA doesn’t think I have over stepped the line on posting this. I rely on TA for all my travel planning and value the input from individual contributors."
"Armrest Dominance, I stopped making advanced booking too. At this point I only booked WB HP studio, Parliament tour, and Heathrow Express. I decided to just wait and see till it is closer to my travel dates. Good thing London has a lot of free museums so if no tickets are available to other attractions while we are in London then we just gonna go to the free museums. If we can still go (end of March.)Edited: 12:50 pm, March 04, 2020 "
I wondered if there would be panic on here when a big gathering cancelled the show.The reason they cancelled/postponed it was because a number of the participants couldn't fly here because of flight restrictions by their countries. It was multicultural and couldn't continue with only half the contributors. So far the only one.The major sights will be open as long as we don't get massive loss of staff due to illness as they are residents or the thing doesn't rage into something massive. And that's an unknown. We are all in the same boat there.
"So far the growth in the number of cases has been almost entirely people who brought it back from trips abroad. As long as the increase doesnt include lots of people who picked up the virus in this country your chance of acquiring the virus here is low. There is still some scaremongering on this thread.We dont yet know exactly how long the virus survives outside the body. To quote a bit of science instead of hysteria "" depending on the material and the conditions, human coronaviruses can remain infectious from 2 hours to 9 days.At temperatures of around 4°C or 39.2oF, certain versions of the coronavirus could remain viable for up to 28 days. At temperatures of 30–40°C (86–104°F), coronaviruses tended to persist for a shorter time. ""Important to note that the shorter survival times are on metal surfaces - like the rails on the tube. So to be infected you have to grab that rail after an infected person has done so and before someone else has touched it. You then have to touch your mouth, nose or eyes before you wash or sanitise your hands.When there is evidence - in the form of large increases in cases who contracted the virus in this country - or the virus being widespread in the environment I'll be more concerned. We are not there yet.We are beginning to see large events with a lot of international participants being cancelled."
"I just checked Delta website and it looks like Delta is now offering fee waiver for international flights booked on or before March 1 Impacted Travel Dates are March 1-March 31. New tickets must be re-issued on or before May 31, 2020Rebooked Travel must begin no later than May 31.Not a lot of flexibility but better than nothing for those who want to reschedule their trip.I hope I read this right, cancellation is not in the offer, only rescheduling is allowed for fee waiver.Edited: 4:13 pm, March 04, 2020 "
"Thanks Angela. I'm scheduled to leave 03/27, and as of now still plan to go. Delta's new policy assumes things will be hunky-dory by 05/31, and they know most families can't just adjust their vacation when school is still in session."
"On the radio yesterday, LBC someone rang in from a bus company that do tours around London. He has just lost his job with a few others as the number of tourists has decreased already. I know it’s not peak season yet. One thought is though once it’s becomes wide spread, it won’t matter travel as you then could catch it anywhere, as long as the place you go has a good health care system."
for those of you with booked flights soon - my take on this is that you are a lot safer coming soon than in May. We are still in the containment phase but it's increasingly unlikely this can be contained and if it cant May could be peak epidemic. However by then there will probably be epidemics in most of the world.
“”but it's increasingly unlikely this can be contained””This is an assumption and not the fact at this point.
This is an assumption and not the fact at this point.———————————————It’s pretty much the message that the Chief Medical Officer has been giving in various interviews today.
"It certainly does not look good, but we still do not know what will happen in the following months. I found this information right now (thank you, brittraveller, for providing the source. https://www.gov.uk/government/news/statement…"
"For those who are not canceling yet: you might be able to rebook your hotel at a lower rate. I just canceled my hotel reservation for 7 nights and rebooked at the lower rate (same dates: April 27th to May 4th). The new reservation can be canceled one night before arrival and saved me $250, in case I will go ahead with my trip...Edited: 12:45 am, March 05, 2020 "
"I agree that if you are choosing going now vs. going in May, now maybe a better choice. Most of the travelers' concerns are not catching the virus, but for logistics, like attraction closing, public events cancelled, or flight canceled, etc. Since the cases are low in UK currently (even if it may not truly represent low virus spread), the above measure are unlike to happen. It will take some times for the case to ramp up, so right now maybe the window of time to go.Edited: 2:17 am, March 05, 2020 "
"-:- Message from Tripadvisor staff -:-This post has been removed at the author's request. The author may repost if desired.Posts on the Tripadvisor forums may be edited for a short period of time. Once the edit period has expired, authors may update their posts by removing and reposting them.To read more about editing your posts, please follow this link: http://www.tripadvisor.com/help/how_to_edit_your_postsRemoved on: 8:30 am, March 31, 2020"
"A form of collective insanity if you ask me.————————————————-I’d only ask you if I knew that you were an epedemiologist.“Since the outbreak of Coronavirus, far more people have died from Influenza, yet nothing is ever said about that.”———————-Not true, although that seems to have become a mantra in the last few weeks. In addition everyone in the UK who might be at risk is offered free annual immunisation. Those of us who don’t qualify can have it done at a pharmacy for a modest amount of money. So plenty is said about it."
"The difference is that the mortality rate for flu is about 0.1%, yesterday it was announce that for CV it is now about 3-4%. It is also different from flu in that it seems to stay alive on surfaces for much longer."
I think it is significant that yesterday we had the biggest daily increase in infections and the government decided to stop giving daily reports on infection rates!
"#155 of 155 “I think it is significant that yesterday we had the biggest daily increase in infections and the government decided to stop giving daily reports on infection rates!“The fact is that this virus is spreading rapidly and drastic measures will be taken in many countries. The OP and others on this forum are trying to determine if travel to the UK is safe. It is probably as “safe” as where you live. Look at the thousands of passengers on the Grand Princess now in limbo off the coast of California......how many are now infected? How many were infected during their several weeks of traveling on back to back cruises to Mexico and then Hawaii?How many disembarked the ship after the first cruise, boarded planes and innocently went about their business spreading the virus even more?No matter how you spin this, traveling away from home is risky. You are leaving your comfort zone, your support system and access to your medical coverage. Will sites close during your vacation? Will venues like theater shows cancel performances? Will you be quarantined at your expense? No one knows but as this virus spreads these are certainly possibilities and as the OP asked........there is no way to determine how much tourism will be affected but it will be affected.Sorry for being so gloomy but I really feel that this is not to be taken likely. Chances are travelers will continue with their plans and have a great time but there are risks involved that should be considered. Decisions are made daily based on the spread.Edited: 5:38 am, March 05, 2020 "
"All life is a risk and sometimes travel away from home is safer than staying at home. I've visited South Africa a few times and I consider it safer for white South Africans in London than in Johannesburg. I dont have to avoid roads with slow traffic here for fear of being highjacked, I dont need a private security firm on speed dial.There is scaremongering still on this thread. As I've pointed out before the virus doesnt live for long on metal surfaces. It can be made harmless by soap and hot water, by 70% alcohol, by various disinfectants, by UV light. Infections in the uk are still almost all acquired abroad. The average person with the virus will give it to few others, because it is not transmitted as easily as the mass hysteria might suggest. Other infections, like flu and norovirus, may actually be LESS prevalent this year precisely because people are taking seriously advice about hand washing.We are still in containment mode, so only a few cancellations of events involving a lot of international participants. However the mass hysteria may mean that attractions are a bit less crowded and prices are a bit better. Now is a good time to visit."
This is not scaremongering. The lack of transparency and not taking this virus seriously is a mistake and washing your hands and going about your business sounds better than it is. Each traveler must determine his or her tolerance level.
UK is no longer in containment stage. From BBC: Coronavirus: UK moving towards 'delay' phase of virus plan as cases hit 115 (https://www.bbc.com/news/uk-51749352). There are cases of community spread.
Someone has died in UK from coronavirusgoogle.com/amp/s/www.manchestereveningnews.c…
"Noraact, thank you! Yes I have been watching the price of the hotels as well. Today is the first time I saw significant drop so I cancelled my reservation and rebooked too (I haven’t given up!!!!) I think it will probably drop some more by the end of March. It’s demand and supply market so now is a good time to go actually, less tourists (at least there must be a lot less tourists from Asia), cheap hotels, etc....as long as attractions stay open and do business as usual and the fear of being quarantined is less than the excitement ones have hoped for. Though, I recently have another fear of “alienated” upon my return from London should anything happens like Italy; however, we are still going at this point because Delta offer to reschedule the international flight is limit to traveling by May 31 which is not doable for us.Edited: 1:32 pm, March 05, 2020 "
"Same here, Angela! I am still going on April 26th, unless something very significant and unfortunate happens (for me, Level 3 Alert from CDC is significant). My airline ticket is on points, so... oh, well, the worst case is that I will lose them, but I am sure Chase Manhattan will offer me something (I am a life long customer and have Chase Sapphire). So let’s hope for the best!"
"Hi all! I'm scheduled to go on May 31st and I'm also taking a wait-and-see approach. I really don't want to cancel, but I figure by then hopefully either things will be improved (I know it's a long shot but I'm hoping that this is like the flu and diminishes in warm weather), or it will be a semi-equal chance of catching the virus here at home. I figure I'll wait until early May to see what the situation is - both in London itself and whether traveling by plane is safe, and then make my decision. I appreciate everyone's insights. I haven't been to London in 3 years and I miss it!"
"I am not an alarmist but it appears that this virus may be here for many months. Each day more community based cases are confirmed all over the USA. Our trip to London and Edinburgh is not until late September and the only thing we prepaid was air. I would be very cautious what you prepay that is not refundable; see what your travel insurance covers. All we can do is wait and see how this virus spreads. We all have different criteria, circumstances and risk tolerance so whether to travel will be very personal decisions. Whatever you decide.....travel safe"
"Excellent, Ariel! I am not planning to cancel (and I am way older than you) and will be anxiously waiting for your trip report. Fingers crossed!"
"martyap - I was about to pay for airfare for a late sept trip, but held off. If H1N1 is any guidance, it subsided around july/aug 2009, then the 2nd wave started around spet/oct, then vaccine became available in nov. So maybe sept will be a narrow window."
"The way things look it might not be necessary to purchase air now to get a better price. Everyone has different circumstances and risk tolerance. Everyone has different obligations at home. Everyone has varying health conditions. If things get worse we would have difficulty going on a vacation and having a good time. That’s us. It has nothing to do with what might or might not be....just pure facts. If we lose a few $$, so be it.Note: I believe Airbnb just came out with some new cancellation policies re:this virus"
"Meanwhile those of us who live near London are still buying ballet, opera, theatre and Wimbledon tickets for the upcoming months."
"Latest advice from our chief medical officer “One of the things that is clear if you model the epidemic,” says the chief medical officer, Professor Chris Whitty, “is that we will get 50 per cent of all the cases over a three-week period – and 95 per cent of the cases over a nine-week period, if it follows the trajectory we think it is likely to.”The problem, of course is - which 3 week period? We are now moving out of the containment period with 25 new cases in London yesterday and into the delay phase - trying to reduce the peak of the infection and spread it over a longer time period. We need a heatwave.This is likely to spread faster in America where those with an infection may be less able to afford to stay home."
"#170 ""Meanwhile those of us who live near London are still buying ballet, opera, theatre and Wimbledon tickets for the upcoming months.""Buying theater tickets and spending thousands of pounds for a trip are quite different. All I am saying is that this is very fluid and governments both in the UK and USA can change policy at any moment. As the World Health Organization calls it, ""This is not a drill."" I hope this disappears tomorrow but travelers should realize that trips in the next few weeks and months might be disrupted.....no one knows how much and you certainly cannot pinpoint how you might me affected during your travels. I am only suggesting you know all your options both medically and financially BEFORE you travel.Edited: 7:44 am, March 06, 2020 "
"I agree that everyone should do a little research. I've seen some posts (on different forums) where someone has decided to cancel just assuming they get refunded for everything and then be shocked to find out they don't. If the destination isn't a high risk area then the costs are likely to come out of your own pocket.I would cancel if things changed and my government (and the WHO) regarded the UK as an ""epidemic area"" - don't know if that's the correct term, that's what they say here about continental China, Iran, South Korea and Italy - and if I lose my money so be it. But as of now I'm continuing my planning and staying optimistic."
"If you decide to cancel your trip, CONTACT all places that you made prepaid advanced reservations regardless of what the written policy about change or cancellation said. Some places have allowed cancellation with full refund or change of date without a fee during this uncertainty. If they don’t allow today or this week doesn’t mean they won’t allow it next week or month, don’t give up. If you decide to go, enjoy your trip, wash hands often, bring hand sanitizer, don’t touch your face, and come back with your trip report to give us hope."
"I have just read that Italy overall has seen a 90% drop in visitors and airlines are cancelling flights due to lack of demand. Sicily alone has seen an 80% drop in bookings and that is about as far from the centre of the outbreak as possible. So when the number of infections in the UK get into four figures we are bound to see the same thing here. At the moment London has the largest number of cases in the UK. Still only double figures, but I wouldn't go near London at the moment."
Just read that two British airways baggage handlers have tested positive! I wonder how many bags they have handled since they became infected?
"The figures for London are tiny compared to people here with TB and the regular flu. I travel by tube every day because I have to. I went to a concert at the massive 02 venue last night . I cant live my life hibernating in fear in my house else I would die of anxiety, stress and depression instead!! Spreading fear and paranoia helps nobody. Just be careful and keep washing your hands. We have to live life!!!Edited: 10:12 am, March 06, 2020 "
"“”Just read that two British airways baggage handlers have tested positive! I wonder how many bags they have handled since they became infected?””So what??? In no shape or form it means that every bag owner will become deadly ill. It depends a great deal on the age, immune system and overall health of a person. Some people really enjoy living in fear rather than thinking logically about the whole situation. Desinyy, thank you for your post! Way to go, in my opinion.Edited: 10:21 am, March 06, 2020 "
"David, I think the virus has impacted on tourism all over the world. I saw online that San Francisco Chinatown is a ghost town. Chinese people around the world have a big hit on their business (restaurants, etc). People are being very cautious and soon some won’t go out to eat regardless of what restaurant it is because who knows if the chefs are infected and touch the food, sneeze or cough into the food. But like Destinyy said, we have life to live so each one of us must know how much risk we can handle and act accordingly."
"Yesterday we had a meal from our local Chinese takeaway. It's not something we do often but we thought we ought to support their business. Instead of the constant scaremongering from yorkshire lets have some more facts - from the World Health Organisation, about contact tracing of the infected in China "" Between 1% and5% of contacts were subsequently laboratory confirmed cases of COVID-19,"" These are family contacts of people confirmed to have Covid-19 and the vast majority STILL dont contract the infection. But if you want to panic over a bag just wash your hands after you handle it, then stick it next to a radiator for a time. We dont know yet how much effect heat has but it wont survive long on a bag anyway. To quote the DC this time "" COVID-19 has a generally poor survivability on surfaces and poses a low risk of spread from one person to another through contact of a shared surface"""
"We are basically doing what you suggest on Long Island, New York......going about our business. We ate lunch out today, went to the mall, Costco and my wife is currently having a manicure at a salon owned by a Chinese couple. It is easy at home and if you should get ill you go to your own doctor, your own hospital, using your own medical insurance and if you are quarantined you do so in your own home.Traveling, especially internationally “ might” involve a different set of issues......venues might close; trains or planes might suspend service.....and if you become ill your medical travel insurance might be worthless. And suppose you do contract this virus and told to self quarantine......where????? at whose expense? what about your traveling companions? who pays for the changed international flight home?We are trying our best to support local businesses at home as much as possible and agree that the hype and hysteria is not useful. We also agree that the risk is low and common sense precautions will most likely keep you safe and healthy to enjoy your trip. Knowing your options, liabilities, insurance, etc is very important at this time."
"Hello everyone We were set to leave this Sunday with our two grandkids. I have been so worried about taking them and either scaring them to death with all the hand sanitizer, etc., or them being quarantined and missing school for two to four weeks. If it was just my husband and I, there would be no question. Today we finally decided to cancel. We were able to rebook a trip to Fiji on the exact same dates. So, thank you everyone for your kind remarks and thoughts. I hope all of you who get to go enjoy your trip!"
"This is a very informative thread. Leaving for London and Paris next week. Flight, Euro star and hotels booked since December. Travel insurance purchased but seems pointless. We are getting mixed reviews as well on whether to travel. As a provider I am only concerned about being quarantined or stuck for any reason. I also feel it is inevitable that I will contract this virus from my hospital or office but at least I will be home. This is very hard...Edited: 10:33 pm, March 06, 2020 "
"Very personal decision.......watching the 20/20 special right now. This seems like it will change and not for the better every day. My point, if I were going to get this virus I would be better off at home than somewhere across the Atlantic. Planes and ships and the underground are Petri dishes under the best circumstances.....good luck with your decision and stay safe.Edited: 10:57 pm, March 06, 2020 "
"I have been so worried about taking them and either scaring them to death with all the hand sanitizer, etc., or them being quarantined and missing school for two to four weeks. If it was just my husband and I, there would be no question. Today we finally decided to cancel. We were able to rebook a trip to Fiji on the exact same dates.————————-Lacy20, we must all make the decisions that feel best for ourselves and our family BUT you do realise that the hand hygiene guidance doesn’t just apply to London or Europe? You must teach your grandchildren this whether you are staying at home in Arizona, travelling to London or visiting Fiji. It’s guidance for everyone, everywhere."
"What brittraveller said. People must keep up good hand hygiene EVERYWHERE. Lacy, this concerns you and your family at home too and you are not excluded from it by not travelling to Europe."
"Very much agree with the previous couple of posters. It doesn't matter if you stay home, go o Europe or somewhere else, you still need to practice good hand hygiene and help to protect yourselves.Personally, I think that it's good for children to learn about viruses and how to minimise risk."
"It. Er tai ly seems to still be busy. 2 weeks ago I was trying to book a restaurant for my upcoming birthday weekend I. 2 weeks time and I was on my 6th or 7th choice before I could get a reservation at lunch or dinner on the Friday or Saturday. I appreciate that’s more likely due to locals booking but folk are clearly still going out and about, getting on with their lives.Was out for lunch with my sister in Edinburgh yesterday, The restaurant was absolutely packed and if we hadn’t had a reservation, we would not have got in. Went to a gin place afterwards and also bursting at the seams. We were able to get a table that was being held for people coming for dinner at 7.30 as long as we moved on before then. On.y difference I noticed was in the bathrooms where folk were taking more time washing their hands."
In London now for a short trip. Took Thames River cruise and they cancelled several sailings for lack of demand and our boat was 1/4 full. It never gets full in winter but still. Very few Far Eastern visitors.
