"Im in wait and see too, but not feeling good about it as I did a week ago. Read an article recently that said most likely this virus will hit everywhere and so no place is safe including your home (it wasnt a ""scare"" tactic article), so you should decide if you do get it are you more comfortable in your own country for care and/ or is the country you are visiting up to the standard of care you would need. Live in Colorado and in the last few days we have seen more cases reported. Event cancellations and school closings. We are schedule for April 22 to London and April 28 to Portugal so hoping for some better news in a few weeks. Just hoping BA credits our ticket for further travel."
"Hi, Re: TestingI don't think they are testing people here in the UK unless they are either already in hospital and showing symptoms or have returned from Italy, etc. or have knowingly been in contact with someone who has. This is despite evidence of community transmission having begun in the UK. My son woke up this morning very poorly, with symptoms of the coronavirus. (Of course it could be flu or a bad cold.) However, he travels into London by train and packed tube every day, so we are concerned.He was told by NHS111 that he couldn't be tested as he didn't meet the aforementioned criteria. The gp won't see him either as his symptoms are those of the coronavirus. He wasn't told to isolate himself by the NHS advisor, which I find even more worrying. I really sympathise with those due to travel. I cancelled my own forthcoming visit to Japan and South Korea. Not an easy decision, but the right one for us."
"This is a link to an article about the effect - if any - on tourism so far. The Guardian is not, imo, known for being alarmist. https://www.theguardian.com/world/2020/mar/0…"
"Here's another one from the Metro. This publication doesn't have the gravitas of the broadsheet, but it is an interesting article, with pictures:https:/…"
"Just returned from a two week trip. If no one had told me that there was the Covid 19 virus going on, I wouldn't have known. I saw may be 3 people in masks (one at the York train station, two in the London tube). Among other things, I went to Mamma Mia and Les Miserables, and it was full house. I didn't notice any empty shelves at the supermarkets (Sainsbury, Co-Op) that I went for groceries. Things can certainly change very quickly but if I were in the process of planning a trip, I would just continue to monitor. And unless I am older, have a history of respiratory system problems or in questionable health, I would wait-and-see."
PLtraveler ......glad you had a great trip....did not realize Le Mis still sold outWhat is today or last week is not what will be next week or next month. It is risky to travel internationally at this time ...... how risky is difficult to say
"Of course the past cannot predict what's going to happen in the future when it comes to Covid-19. But if you read everything in the news, you would think supermarkets are being raided, people are wearing face masks to the hilt on the buses and in the tube. But that's not quite the case, and that is something to keep in mind when trying to filter the information coming in."
"I had to cancel my trip to London for next week due to a travel ban/restriction by my employer.As I understand theatre/musical tickets are non-refundable, also my prebooked ticket for the Tutankhamun Exhibition. I have tickets with my friend for the Warner Bros. Studio Tour, we still don't know what to do with those.My employer will pay for all non-refundable expenses, which is a lot at the moment."
"I don't think there's anything to do. You could contact the theatres and WB Studios. I don't think they'll refund anything, but at least the WB Studios are usually sold out so they might be able to let someone else use the space. Then get the money back from your employer."
I contacted WB HP studio last week and they said they will allow change of date without a fee or full refund if trip is cancelled. You just need to call them to make a request for refund.
"I am at the wait and see model, as my family will be traveling on April 7th. I think we should be fine but if it develops and spread then I would cancel. I already contacted my AirBnb host just in case as for my airfare I dont think Norwegian will allow any credits or anything it would be wash, I havent contacted them."
"If London enacts more draconian measures to combat coronavirus, such as banning gatherings of crowds, closing attractions, etc., does the rest of England have to follow suit?--The Mayor doesn't have that power – public health is a matter for local councils and the NHS. I think only HM Government could order such restrictions, but it would be done on a locality-by-locality basis in the first instance"
"It's my friends birthday, March 21 so she'll ask her friend. If her friend can't go to the WB Studios with her, yes we'll ask WB Studios for a refund. Both, 'Harry Potter and the Cursed Child' and Delfont Mackintosh Theatres don't refund tickets, they would exchange them to an alternative date. Which isn't possible for me. I'll most likely come to London later this year for one of the NFL UK games, but they aren't announced yet, so I can't plan anything at the moment."
"I very much doubt if any tourist attraction would wish to be seen as profiting from coronavirus.I would expect refunds to be forthcoming from many operators who don't usually issue refunds, and alternative arrangements such as change of date being offered by others."
"Supposed to fly tomorrow night from the East Coast for a 3 day London mini-break, just got a Washington Post push that the White House is considering a Level 3 Travel Advisory on all of Europe now, all but guaranteeing we cancel as traveling w/ our two kids as well. Only a matter of time before they get sent home from school for 2 weeks anyway, don't want to risk having THAT mess start just for them as soon as we get back, plus risk of stranding. Prez addressing nation @ 8, chances high he will want to show off yet more Wall-building by bragging about banning nonessential EU travel too. Off to make calls and figure out how to break the news :("
Can you recommend some restaurants near Russel Square? Our hotel is very close.
Antalya Restaurant (Turkish) in Southampton Row is quite good.https://antalyarestaurant.co.uk/
Le Bistro Savoir Faire is a TA London favourite.http://savoir.co.uk/savoir/
And Trattoria Verdi Restaurant is a nice Italian sometimes with a pianist as a bonus.https://www.trattoriaverdi.co.uk/
For such a serious topic you might think restaurant questions AND recommendations should be in a separate post. Everyone has their own priorities I guess.
"martyap, very few people are affected by Coronavirus for the rest of us life must go on as usual."
"Auld Jimmy, those are almost exactly the same words said by our Italian friends in Emilia Romagna two weeks ago."
"Carry-on-as-normal 'Blitz spirit' in this situation shows ignorance and selfishness, not strength of character. Everyone can and should do everything within their ability to minimise the spread of the disease, for other people's sake. A lot of us have to attend and travel to work, but we don't need to engage in unnecessary additional activities. The more people demonstrate stupidity in the face of the crisis, the more likely it is that we will have restrictions forced upon us by the government."
"“martyap,very few people are affected by Coronavirus for the rest of us life must go on as usual.“That’s what Tom Hanks and his wife thought. I hope you are right and this forum can return to posts about restaurants and theater tickets. The question is whether the “leaders” of the USA and U.K. are doing everything to mitigate the spread of this virus or are they merely saying it will magically disappear. That method did not fair well for Italy."
"We are due to fly from NZ to London at the end of March for most of April, spending a couple of nights in Bali on the way. I’ve been following this thread to keep my optimism going but today had really knocked my confidence that the trip can take place. London and the south east are my home. My elderly dad is there. I haven’t been home in a few years and I’m desperate to see him. But Don’t want to risk bringing the virus to him. The whole situation sucks.Will keep reading here though. If people are adamant that London goes on as usual 10 days from now, 12 days from now, who knows.Edited: 6:40 am, March 12, 2020 "
"The government is set to announce new restrictions today. Seems likely to be school closures and ban on public gatherings. So I expect places like museums, cinemas, theatres etc will be affected.By the way, I don't think Bali is safe! A British tourist died there this week."
Your last sentence is omniscient . I never try to paint refined gold I can add nothing more to it. So sorryRegmaiche
"@Ariel-Scarlett - and my Finnish based company just banned all international travel! So no London for me, just cancelled my flight and hotel. I have theatre tickets for next Saturday night which I offered (free, of course) to my friends that live in town. But now wondering if West End shows will be cancelled as well..."
"In Scotland the First Minister is recommending that all gatherings of over 500 people be cancelled, from Monday. The UK government may decide on similar measures."
The handwriting has been on the wall for a while. Unfortunately I feel we are in for a prolonged ordeal. Hope everyone stays safe and healthy.
"Ok I decided to cancel my trip to London (March 28-April 5) even though U.K. is excluded from the travel ban. Much can happen on UK side (travel ban, attractions closures, etc) between now and then. I have spent too much time to think, read, educate myself for the last 4-5 weeks and it is time to get over with it for now. I will reschedule my trip to London once the virus is under controlled and things are back to normal.Edited: 9:17 am, March 12, 2020 "
"@Angela, I think that is a very wise decision. I am not an alarmist (nor a germaphobe - I just flew on a 6 hour flight yesterday!) But it is so very stressful to figure out ""what's next"" in the list of bans, restrictions, etc. I will say I am very happy that my upcoming April holiday is in Key West - even if my flight gets cancelled, I can do a REALLY long road trip from NJ."
"@jtwiz, thank you! I also cancelled my trip to CA in April. I travel to Tampa FL once a month by plane but I have been thinking about driving instead of I still have to go (work related) during this chaos. I have asthma so I am in a high risk group.Edited: 10:48 am, March 12, 2020 "
">>In Scotland the First Minister is recommending that all gatherings of over 500 people be cancelled.<<Same here, those are cancelled until the end of May. I'm very glad I got to see Bryan Adams last weekend before the next gigs were cancelled...Interesting to see if the Eurovision Song Contest will be axed."
"I am in the same boat as well, Ariel. With all the restrictions, I have very little hope that my trip will happen. I will cancel my hotel soon (luckily, it is a Marriott hotel with free cancellation) and will call Virgin Atlantic to ask for rescheduling. @jtwiz, I guess, the road trip to FL from NJ does not sound too bad: my family members do it every year to my surprise. We are considering only road trips for this year; luckily, New England and Nova Scotia offer amazing opportunities."
My hotel reservation is non-refundable unfortunately. I'm not touching my flight yet - if there's any chance that Finnair will cancel it then I'm just going to wait. If I cancel the flight myself I'll only get half of it refunded.
"Hi Ariel, it makes sense to call the hotel and ask what they can do for you. The whole world is in the uncharted territory now and in the pretty gloomy one, so I hope they will cooperate with you and maybe at least allow to reschedule, as other businesses do. So sorry about it! I know how you wanted this trip to happen. Nora"
"Best of luck, Ariel! I am waiting for Virgin Atlantic at this point: maybe they will allow cancellation vs.rescheduling. If not, I will reschedule for September 2020. Not the right time to travel for sure..."
"We are - were - flying Emirates who are offering to park our fares if we re-book by August, without penalty. Hotels and car hire being similarly accommodating, although I’m yet to find out about a couple of pre-paid Premier Inn stays. We have tours booked at the Tower of London, Harry Potter Studios etc also, has anyone found places like that to be flexible?"
"I'm booked to leave Chicago for London this Sunday the 15th. I'll stick to the plan even though I'm having 2nd thoughts. What is going to be so different is that I would expect the international terminal at O'hare (Chicago) to be close to empty on Sunday. Unless I misunderstand, nothing would be going out other than to the UK."
So I have been asked by my coworkers over the last few weeks if we are still going. I finally told them yes we have cancelled our trip today and that is when one of my coworker opened up. He said if we went then I will have to be quarantined for 14 days before going back to work. It is not his to say but I can see that some other employees would refuse to come to the office if I show up after coming back from London. Same with my daughter’s school. Some moms have told me they were concerned about our trip as well and they are uncomfortable about my daughter returning to school after our trip. So there are much more to think about at this point. The travel ban has made me call it enough until things are normal again.
"Thank you, MChiddy! Not the same atmosphere in NYC... Broadway shows are getting canceled, Metropolitan Museum is closed, etc., etc."
"Hi Angela - It sounds like you made a wise choice for your family and community. I am lucky in that we don't have kids at home anymore and we also work at home. So self quarantine for a few weeks wouldn't be a total hardship, if necessary. London and the rest of Europe will survive and you'll get there eventually ❤"
"MChiddy, thanks! We have until Dec 30, 2020 to reschedule and travel so hopefully we can go by then."
"Just remember, everything is closed on Christmas Day, virus or otherwise ;-)"
"Re 304 - RetiredTripper -you might be interested in this.https://www.gov.uk/government/news/covid-19-government-announces-moving-out-of-contain-phase-and-into-delayUK is moving out of ""Contain"" phase to ""Delay"". The action plans for Delay stage include banning large scale gatherings. I would expect this is the time that closings will begin to be announced.Also - if you are flying out of ORD on UA or AA, you leave from a domestic terminal. But if BA, Terminal 5. And, I would agree, 5 is likely to be fairly empty"
"Angela, interesting discussion from your co-workers and fellow moms. I honestly didn't consider that. Because our travel isn't for 2 more weeks, I'm holding out that the flight is cancelled by Delta. I want a refund, not a crappy credit (particularly since I only spent $2669 for 4 tickets w/ seat assignments), and you know the airlines will do everything they can to recoup their losses from this. I imagine travel later this year will be twice the cost, leaving you to pay significantly out of pocket.Edited: 8:16 am, March 13, 2020 "
"@europelover2014Yes. I read BBC news online twice a day and keep up with all things UK. My assumption right now, and of course could change, is that the museums will stay open a while longer. I have no interest in other venues such as theater or concerts. A large part of my trip (which could increase) is walking through various neighborhoods and along the canals, and I would be ok with a trip that becomes almost entirely outdoors. And yes, I always fly BA so it should be pretty darn quiet.Edited: 9:21 am, March 13, 2020 "
"^^^ I hope you have a good trip. I have mentally written off my May visit. I am also canceling a domestic flight next week. Our local library, schools, park district have shut down (north 'burbs). I'm not going to risk being exposed somewhere and bring that back to a community that is trying to fight back. It will happen - but I couldn't live with being my area's ""patient zero"".Edited: 10:21 am, March 13, 2020 "
We are booked to leave from NYC Monday. Having many second thoughts.
"#312 I'm due to go to NZ/Australia in 2 weeks, and if I rebook for later in the year flight costs go up 30%. Definitely also hoping for a flight cancellation / ban on incoming flights."
"Dayton, I used Skymiles to book our flights. I called Delta yesterday and the automated answering service said they will call me back “more than 6 hours”. It has been about 30 hours and I have not heard back from them. The online Coronavirus update said unless you are traveling within 72 hours don’t call them. I am also hoping to see the my flight get cancelled so I can get the miles deposited back to my account without restrictions if when I have to use them. I hope you can get all your money back!"
Thanks for your detailed response! We’re suppose to travel next Friday. We are still on the fence at this moment. Going to wait and see what next week brings.
"We’ve decided to not proceed with our planned March 18 Family trip. It’s become clear that the trip wouldn’t be “as planned” even under the best of circumstances. Too much anxiety, too many questions, things like our Paris day trip already off the list. Non-refundable expenses hurt, but- truthfully- the money would have all been spent 2 weeks from now either way. I will cancel the Delta tickets this weekend, and have some credit for future. (Warning to others who haven’t looked: everyone seems to be pushing trips to end of summer, and prices seem to be skyrocketing)"
Harry Potter has closed and I received an email that they will call and give a full refund in upcoming weeks.
"Hi, I’m in London now and everything is business as usual. Not sure how long that will last, but for now they’re just saying “wash your hands a lot and you’ll be ok.” Everything is open. Good servers and hotel staff can be seen wearing gloves and sometimes masks as a precaution. No one is panicking (yet)."
>>Everything is open.<<No it's not. As you can read in the post immediately preceding yours.
"Tina, I don’t know where you are from and if you have visited before but you give the impression that everything is normal. No it’s not. London is quieter than normal, there fewer tourists, workers are working from home. So please be accurate. Royal Opera House has stopped back stage tours and I’m sure that other attractions may also implement changes.I would prefer that tourists did not come to the UK even though there are no bans. We don’t want tourists to bring the virus with you, we don’t want tourists to have to use our over stretched NHS. As a tourist you should Not want to take the virus back to your country. This virus needs to run its course and that will take time. It won’t disappear in one season we could be faced with it next winter."
"Much of Central London, it's many attractions, streets, squares etc now resemble The Whispering Gallery at St Paul's Cathedral... so, so quiet.Keep well allAnthony K"
"#316, all visitors, and returning Kiwi must self isolate for 14 days on arriving in NZ."
"-:- Message from Tripadvisor staff -:-Tripadvisor staff removed this post at the original author's request.To review the Tripadvisor Forums Posting Guidelines, please follow this link: http://www.tripadvisor.com/pages/forums_posting_guidelines.htmlWe remove posts that do not follow our posting guidelines, and we reserve the right to remove any post for any reason.Removed on: 11:58 pm, July 02, 2020"
That's an inapropriate comment IMNSHO.Not funny.
"#325Yes, I saw that this morning! I don't think I'll have any trouble getting a full refund, I'm sure Australia will do the same soon."
"I was so happy to see that the Warner Bros. Studio Tour is closing. We cancelled our trip to London. We had tickets for Harry Potter on the 18th. Looks like they are closing just in time for us to get a refund. We should get refunds for everything we booked in Paris as well.Edited: 10:20 am, March 14, 2020 "
Well that's great for you
They haven't closed anything officially but everywhere pretty empty and think official closure will come in next few weeks anyway.I wouldn't waste your money visiting London atm not a happy place
"I agree with you, Essex Wanderer. Comment #326 was not funny. It was totally useless and I am glad it has been removed."
"I have no idea what percentage of London visitors are from the USA (seems like a fair % from just reading this forum), but USA just announced a “travel ban” from USA to UK/Ireland, to be implemented on Monday, Mar 16.No real details yet, but assume those are being worked out now.So, tourist numbers will go down, but no idea by how much??Hunt"
"Yes, just saw that our wonderful leader had his temperature taken, got tested for the virus and announced the extension of his travel ban to include the UK/Ireland starting Monday. I don’t think the US and Europe will move towards controlling this virus until drastic measures are enacted similar to China and North Korea..........i have been following this thread for a while and feel for those who had their travel plans ruined, lost money, etc........but control of this virus is what is paramount. We are schedule to travel to London/Edinburgh in September and even that might be dubious. Stay safe, stay healthy"
Here is the story - https:/…world-us-canada-51891662Nobody going anywhere other than home...
"I guess the decision was made for me since the US is banning travel to the UK (and may possibly restrict travel from Seattle soon).Hardest to get money back will be from the airlines, especially the internal British Airways flight from London to Edinburgh.Anyway, everyone stay healthy. It's a bummer we're not going there this time, but we will be there in the future. London is our favorite city.Edited: 4:26 pm, March 14, 2020 "
I have a trip scheduled in April - bu still want to go. Just wondering how long the Great Briain travel ban will go
Your guess on the length of travel restrictions is as good as anyone's. The virus is not going away anytime soon.
Scientists calling for more restrictions in the UKhttps:/…science-environment-51892402
Looks like we got out at a good time. Sad we had to cut the trip short but happy for the time we did get!
"I'm still leaving from US on an overnight to arrive in London on Monday, the 16th. There is no barrier to coming back from the UK as long as you're a US citizen. I will have to self quarantine on my return.  Not to be at all flippant, but if I get ill in the UK, at least I can get tested and get better hospital care in London than I would at home (at least for now)."
Extend your stay and save us your sophism. You are willingly and selfishly flying into a hotspot that everyone agrees contributes to spreading the virus and threatens others on your return.
"Not sophistry, truth. I can't get a test here at this time. I've checked. U.S is not prepared, UK is."
"“ at least I can get tested and get better hospital care in London than I would at home (at least for now).”So you will use our stretched. NHS, so selfish. Stay at home, you don’t know if you are bringing the virus with you. Why should the NHS use valuable resources on you."
Re #341 You have got to be kidding....
"So many have lost the concept of ‘sacrifice for the greater good’ these days. It’s sad, and scary in this situation. No amount of lost deposit on your trip, or disappointment, is worth the risks - which are real and varied. London will still be there when this mess is over. Be patient."
"I just canceled my April trip. Really, London does not me now and my family certainly does. And it looks like poster #341 wants to get into the 14 days quarantine upon his return and does not realize that UK has to take care of her own citizens now and not of him. So selfish and irresponsible!"
"Some abuse this forum to advance a political agenda and bash someone they disagree with. Happens all the time. Gratuitous swipe. Disguised as travel question or advice. Plus, in this case, the selfishness."
"-:- Message from Tripadvisor staff -:-This post has been removed at the author's request. The author may repost if desired.Posts on the Tripadvisor forums may be edited for a short period of time. Once the edit period has expired, authors may update their posts by removing and reposting them.To read more about editing your posts, please follow this link: http://www.tripadvisor.com/help/how_to_edit_your_postsRemoved on: 11:09 am, March 15, 2020"
"RE Post 347 ...Cancelling an April trip. What have your trip providers said about refunds or vouchers?Is anyone cancelling May trips, yet?CheersAnthony"
"If 341 is under 50 and in good health normally the likelihood that they will use NHS resources is smaller than normal. If they get the virus - and that is not guaranteed as some family members of those infected do not - they are unlikely to need a hospital bed. Increased hand washing here means less transmission of other infections. If they self-isolate on return there is less risk they will transmit the virus than if they stay in America. The virus is already widespread in America and is going to spread even further thanks to a health care system that is costly and inefficient and a president who hammered the public health budget and doesnt listen to experts. That is not a political comment it's a statement of fact by someone with no axe to grind.For those at low risk life will, and should, go on - those at higher risk need to look to protecting themself."
341 has been married for 40 years so I'm guessing they may be just a little bit over 50...
