"For the convenience of visitors, with the Corona virus reducing tourism and for other reasons, some hotels have new reservation date limitations (and may offer full, partial or no service in the meantime).  If you know of others, please add to this initial list, which is subject to change. Any corrected errors, revisions, additions or updated information (expected) is requested and appreciated. Current date for opening of new reservations (subject to possible change)Baccarat (April 20) Gramercy Park (May 1)Gansevoort Meatpacking (May 1)Warwick (May 11) Hilton Midtown (May 19)Selina Chelsea (May 25)Flatiron (September 1)Standard High Line (to be determined)Closed: Blakely (renovation/use)Edited: 9:48 am, March 22, 2020 "
This is a great resource for those who are planning a 2020 trip to NYC. Thank you!
"Teacher91. Thank you for your gracious note...and its encouragement to others to add their experience and opinions.If you wish, you can follow for a time the reviews of properties following new reservation dates to help assure your satisfaction.Edited: 12:29 pm, March 22, 2020 "
"Personally, I think those dates are optimistic and will likely change. Also, if I were in a rush to book I would be EXTREMELY careful where I booked, as some places are going to fold, no matter how eager they may seem to take your booking."
Do you think businesses will start reopening again that soon? I was thinking more July onwards
"I think the dates referred to are the dates they will start taking bookings again, not the dates the hotels will re-open. Estimates I have seen indicate the virus may not peak until June and then could come back in the fall. Personally I would not even consider making a booking for 2020 unless I was sure everything was already up and running and experts advised the virus was gone and not expected to return."
"Ok, I see. Our booking is looking likely to be cancelled, and we will be rescheduling for next year I think. As much as it’s disappointing we will look forward to next year when we are past this difficult time."
@4 No way is the city going to be back to normal by those dates. Cuomo was talking about several months of this. I wouldn't plan any trips to NYC at all until being given the all clear. At this point the best we can hope for is a treatment being developed to help minimize the damage.
Yes of course! Hence my previous post saying we will be rescheduling for next year.
"I have a September booking, at this point I would be surprised if that is a go."
"Yes, Cuomo quoted some health experts that the epidemic would go on for 4-9 months. The summer may be lost.Edited: 5:53 pm, March 22, 2020 "
"Good hotel thread again, Little.Things may change though, so expect that."
"Everyone's very helpful input and cautionary notes are well-taken. The dates as noted were taken from the hotel sites when a booking window shows it has opened--and may ultimately bear no relationship to actual dates of booking, occupancy or any aspect of hotel service. For those hotels and others, you have raised a fair question--how whatever situation(s) caused a pause--would significantly change by then, especially with developments in NYC within the last 48 hours and continuing. At the same time, it may have been a prudent decision for a hotel to pause and take stock of a number of factors in light of what may be its own, and these unique and exceptional external circumstances.We don't know. We may soon. ."
Aynat62: Thanks. I appreciate your note.
agree looking like a stay at home summer.
"We have two new hotels, a Hotel Indigo and the four star (!) Flushing Renaissance (Marriott) /Tangram due to open in May and June. I strongly suspect this will be put off. Flushing relies a good deal on Asian visitors which are not coming."
The Best Western President is closed.
"-:- Message from Tripadvisor staff -:-This post has been removed at the author's request. The author may repost if desired.Posts on the Tripadvisor forums may be edited for a short period of time. Once the edit period has expired, authors may update their posts by removing and reposting them.To read more about editing your posts, please follow this link: http://www.tripadvisor.com/help/how_to_edit_your_postsRemoved on: 8:20 am, April 09, 2020"
"If the infection rate curve is symmetrical, the start to the peak is about the same time period as the peak to the end. We have not reached the peak yet after about a month. Time will tell."
@17 i really hope you can use that reservation however I don't think it will be possible...as we all are doing...just guessing based on daily info we get via various sources.
The Maritime is closed to reservations through June 29.
"Sister City, on the LES, has temporarily suspended their hotel and restaurant operations. No mention is made of when services will resume.https://sistercitynyc.com/"
"Although no mention is made on the website, the Ludlow Hotel does not allow any check-in or check-out via their online reservations until July 1st 2020. https://ludlowhotel.com/"
I have just been reading the NewYorkPost where hotels are hoping to be back in business by July - https:/… Overly optimistic in my opinion. I fully expect to have to cancel the two options I have for July.
"If these current and future lockdowns work, and everyone abides by them, I have hope that things will be OK by September. July would be even better! Tough lockdowns are needed for a few months for the benefit of everybody. It's painful but I hope everyone can have patience and tough it out for a few months."
"I was supposed to be in NYC from Mar 28-31 and staying at Artezen Hotel. I hadn't canceled the hotel reservation yet, because it was nonrefundable, so I was waiting to see if the hotel would make a move first, before I tried to get a refund or credit. I got an email today stating that they will be closed through at least April 13 and will offer a credit to those with non-refundable reservations, good for one year."
Anything on the broadway plaza hotel? I thought I saw yesterday on thier site they were closed but today I'm not seeing that. We have reservations for june.
"The residence Inn Central Park will be suspending operations from Friday March 27th. See their web page for more details.Lisa, contact the hotel directly."
Great news today from DJT....things up and running for Easter!! Get those buffet reservations made. Churches will be full!!
Meanwhile cases in NewYorkCity are rising at an alarming rate.
Yes of course....saw a photo today of the lines at ER in Queens...I am sure it is the same at every hospital...on the hotel topic I am sure each and every hotel will be required to do a major deep clean etc. to get back up and running...July seems optimistic I am thinking more Sept. and it will take some time...business travelers will be back much sooner than tourists. Going to take some time for people to feel confident again.
"After the Corona virus first presented, about 210 (about 50%) of 415 TA-rated Manhattan hotels paused their regular booking and occupancy calendars to consider the situation. [The 415 hotels are from the Top Question on Facilities Fees (yes and no) at https://www.tripadvisor.com.au/ShowTopic-g60763-i5-k12580854-189_Manhattan_Hotels_Charging_Resort_Fees_214_That_Do_Not-New_York_City_New_York.html]A. In 2020 thus far, 6 Manhattan hotels have “closed” (not paused) their operations for various reasons:: i. Blakelyii. Best Western Presidentiii. Lord & MorisIv. MAvev. AKA Smith Tribecavi. AKA Wall StreetB. For other hotels, 23 paused and tentatively scheduled to accept reservations beginning in April 2020. These “April” hotels can offer a quick initial look not only at the individual hotels but how a portion of the Manhattan lodging industry is responding. [Other hotels can be considered at a later date.] 1. St. James April 92. U Hotel April 123. 414 Hotel April 134. James NY NoMad April 135. Mimosa April 146. Loew’s Regency April 157. Fitzpatrick Manhattan April 168. Four Seasons Uptown April 16 9. MADE April 1610. Room Mate Grace April 1611. RIU Plaza April 1712. Baccarat April 2013. Belleclaire April 2014. Edison April 2015. Evelyn April 2016. Frederick April 2017. Iroquois April 2018. Library April 2019. Pierre April 2020. Walker Greenwich Vill April 20 21. Washington Jefferson April 2022. Surrey April 2423. Courtyard Fifth Ave April 27Your comments, additions and corrections are requested and greatly appreciated."
"This seemed the best (open) thread to add this to...""These aren’t temporary bumps in the road. Peter Ward, president of the New York Hotel and Motel Trades Council, told me that 95% of his 40,000 members would be laid off within a week. That’s tens of thousands of cooks, waiters, housekeepers, busboys, front desk clerks, security guards and casino employees out of work.The Hilton is 2,000 rooms. It’s a billion dollars worth of real estate in midtown Manhattan and it’s closing its doors because they have zero convention business, zero business travelers and zero tourists,” Ward said. “They’re literally operating at below 10% occupied.”For perspective, says Ward: “9/11 was insignificant compared to this. Hotels never dipped below 60% occupied for 9/11, and that was only for a 20-day period of time.”nydailynews.com/opinion/ny-oped-why-trump-is…"
The Four Seasons Hotel is offering rooms to medical workers. I thought this was a nice gesture under the circumstances.
#34 - Yes it will be good for those who have a (currently) impractical commute and those who are hesitant to go home to their families because they are worried about becoming infected themselves. (Have read things about medical workers self-isolating at home in basements and garages) Since few locals have that kind of space it's good they can have options that give some small measure of peace of mind about their loved ones as they continue to take risks to care for patients.
Wider impact on the hotel industry chicagotribune.com/coronavirus/ct-chicago-ho…
"Call me crazy but I'm an eternal optimist. I have not yet cancelled either my NY hotel or flight reservations for Memorial Day Weekend. I truly believe that the city will be up and working by then but I will only come if some resemblance of normal has returned and the safety level is okay. My heart goes out to all those affected by this chaos. I have an essential infrastructure job (ATT) and our driving culture ""shelter in place"" is quite different I'm sure than what NY is experiencing. Hoping for the best."
"As soon as next week, Columbia University is planning to turn some of its dorms over to doctors and other health care workers so they can avoid long commutes and the risk of infecting others, according to a university spokesman.https:/…NK2r8r5e5t"
"Continuing from Post 32    To provide a 1-month window, here are hotel reservation openings tentatively scheduled for May 1-4.The totals: April: 23; May 1: 65; May 2: 4; May 4: 1 TOTAL: April – May 4: 23+65++4+1= 93MAY 1 1. ACE2. Allen3. Aloft Downtown—Financial District4. Ameritania5. Amsterdam Court6. Archer7. Artezen8. Astor on the Park9. Belvedere10. Bentley11. Benjamin12. Bowery13. Broadway Plaza14. Bryant park15. Carvi16. Chatwal17. Crosby Street18. Dream Downtown19. Dream Midtown20. Edition Downtown21. 11 Howard22. Elysee23. Empire24. Eurostars Wall Street25. Executive Le Soleil26. Fairfield Inn Chelsea27. Four Seasons Downtown28. French Quarters (currently Scherman)29. Gansevoort Meatpacking 30. Gramercy Park31. Greenwich32. Iberstar 70 Park Avenue33. Kimberly34. Leon35. (The) Lex36. Lombardy37. Lucerne38. Marcel39. Mandarin Oriental40. Marriott Vacation Club Pulse41. Moderne42. Moxy Downtown43. Moxy East Village44. Moxy Times Square45. Night46. Park Hyatt47. Plaza Athenee48. POD 3949. Public50. Renaissance Chelsea51. Roger Smith52. Roxy53. Seton54. Sherry Netherland55. Shocard56. Soho 5457. Soho Grand58. St. Regis59. Standard East Village60. Standard High Line61. West 57th St. by Hilton Club62. Westin Grand Central63. Whitby64. Wingate by Wyndham65. Wyndham Midtown 45May 266. Four Points Chelsea67. Four Points Downtown68. Nolitan Soho69. Pod 51May 470. CarlyleYour corrections, updates, revisions and comments are requested and appreciated."
"It’s an interesting article In Post #36 KayeWhat’s being published a lot about hotels, is the question of staying open, closing or being used as quarantine accommodation. What hasn’t been covered much by journalists, is some of the other factors that go into the decision - namely the peripheral costs of of trying to keep hotels open, such as commercial grade deep clean of areas to ensure safety to all patrons - something that simply cannot be guaranteed or filled for a number of reasons.I had a first hand look at a hotel being prepared for use for quarantine (not for medical staff), and it was complicated. Having doctors come in, set up assessment stations in isolated areas, condoning off certain public areas, ensuring questionnaires checked by legal bodies, the language that has to be used when registering guests, mentioning of legal consequences of non-adherence - hotel staff are ill equipped and ill prepared with such short noticeI’m sure that city/ government authorities are doing what they can to assist, but at present, the reliance on the hotel to uphold and vigilantly maintain quarantine standards is low to non existent, especially when these hotels are barely above skeleton staffing I fear it won’t be long before hotels become small outbreak hotspotsEdited: 12:36 am, March 27, 2020 "
"KVE - I know it doesn't really answer you question but this clip of an interview with a man from our Army Corps of Engineers might be worth a watch https:/…The way I understand it, here they are planning to separate facilities into Covid and other uses and the field hospitals (and hospital ship) would be more suitable for non-covid patients (accidents ,heart attacks, etc.) How they might segregate self isolating patients and test results pending asymptomatic people I don't know. I would think hotels would be hesitant to agree to covid cases for reputation / PR reasons but more agreeable about other types of cases if needed. Places like the Javitz which are all concrete floors and hard surfaces might easier to confidently sanitize afterwards than hotel roomOK gotta get some sleep now."
"That’s some excellent information Kaye and good reading for anyone who has interest in the wider impact on the industry.Thank you for taking time to write that, and hope you are safe. Rest well"
"KVE - You're welcome - some of what I wrote was simply common sense guesses but I think they are reasonable.One thing I didn't notice last night was your mention (#40 above) of being involved in a hotel assessment (presumably in your home location). While I understand you may not be willing / able to disclose more details, can you comment any further on preparedness (government and otherwise) where you are and how the public is dealing with the situation there?"
"The very first voluntarily agreed hotel for quarantine in Sydney took place only two nights ago, and thus far it has proven to be a disaster. The hotel is a downtown 5 star, and rather than publicly declare their intention, they did so with absolute secrecy, with 290+ pax arriving in the middle of the night, and has caused a public spectacle. I can’t disclose too much but here is a crumb (QF6034). Two days later, the hotel concerned has yet to make any public statements, so the perception is that of a clandestine operation money grab, rather than a community service. The staff and management were ill prepared (staff given a ten minute brief on PPE equipment), with only minimal police and private security offered. And now they’re experiencing the difficulties for which they weren’t prepared. There are reports of guest rebelling to go outside to smoke, guests getting intoxicated in their room with alcohol they’ve brought in, wandering around the corridors and heading down to the lobby - and this is only their second day of the 14 day quarantine. There simply isn’t enough staff or police presence to maintain protocols. To compound matters, the hotel is not sole use - it has tentants that use common elevators, and there are also non quarantine guests still in-house.I’m sure that other hotels around the world in major cities will handle it much better, and also have better support of the local government. But this particular example is an unmitigated disaster,Edited: 9:24 am, March 27, 2020 "
One of many articles published about the plethora of issues;https://www.google.com.au/amp/s/amp.smh.com.…
Oy veh
"Continuing The Question and Posts 32 and 39, here are hotels with revised reservation dates through May 29 (total 98):May 11 WarwickMy 15MayfairMay 17 Quin Central ParkMay 21Luxe LifeMay 29 Pestana Park AvenueEdited: 5:39 pm, March 30, 2020 "
These hotels have reservation-opening dates of June 1 (totals to date: 98 through May 31 + 24 through June 1 = 122)1. Assemblage John Street2. Beekman3. Chelsea Pines4. Conrad NY Downtown5. Conrad NY Midtown6. Courtyard Chelsea7. Courtyard Herald Square8. Eventi9. Franklin10. Grand Hyatt11. Gregory12. Hilton Club NY. 13. Hilton Garden Inn W. 35th St.14. Hilton NY Fashion District15. Hyatt Centric Fifth Avenue16. James NY Soho17. Ludlow18. Martinique19. Michelangelo20. Mondrian Park Avenue21. Novotel22. Omni Berkshire23. Renwick24. Skyline
Hi I appreciate there is more serious concerns for you in NYC and us in UK but if anyone has any info as regards RIU Plaza in Times Square as regards bookings or recent cancellations or general info during this unsettling time it would be very much appreciated as hotel website is not stating anything as due to stay mid June.Thank you and stay safe/healthy.
"Geordie: You are planning a visit to the colonies, and you want access to accurate and timely information. There is nothing more important than that. (We have had 240 years to get the act together.)I called for you, but the response was blunt; the office is “closed”, and was said to reopen on another date. But the hotel is an international chain, with another hotel under development in the Theater District and tentatively scheduled to open in 15 months. And these days requests for current information are, in a word, foreseeable.To summarize: the hotel website and customer service are a disappointment—worse, in many ways, than much or most of the 120+ Manhattan properties already identified with revised reservation dates. (If the website were an enigma, it would be a promotion.)A number of things could be said, but to struggle against obscurity, accompanied by the Sound of Silence, is futile. The complexities of virus impact and planning in the aftermath are one thing—but the level of communication about them by the hotel, when we are well into April, offers the stickiest of wickets.The best that can be said, which is insufficient, is your dates apparently have not (yet) been cancelled. (What it says about service, when and if you show up, is another story.)Consider making a refundable reservation elsewhere. Other hotels will be glad to hear from you. In the meantime e-mail daily, friendly but not familiar. And follow the website, even if it offers you mysteries without any clues.ANY response by the Riu Plaza management team might have been better—even if merely to say: “Hello. Just go away.” At least that would be connecting.Edited: 4:18 pm, April 04, 2020 "
"Following Posts 32B, 39, 47 and 48, this is the last initial portion of a survey of 140 Manhattan hotels which had postponed their reservations open dates, operations or both. All dates are subject to further change.JUNE 1 1. Sofitel 2. Standard High Line JUNE 2 3. Chambers 4. Ritz-Carlton Central ParkJUNE 15 5. Innside NY NoMadJULY 1 6. Chelsea Savoy 7. Jane 8. Ludlow 9. Manhattan Times Square 10. Maritime 11. Peninsula 12. POD Times Square 13. Springhill Suites Fifth Avenue14 Wellington 15. Yotel SEPTEMBER 1 16. Flatiron TO BE DETERMINED 17. Hotel 91 18. NoMad NY"
Cheers LittleBiffOne
"To take stock: Following the onset of COVID-19, an initial question was: how has the onset impacted hotel operations and reservations availability? 1. A search of all Manhattan hotels, reduced by those sorted as “ONLY AVAILABLE HOTELS”, yielded a partial answer: approximately 140 (approximately one-third) of 412 Manhattan TA-rated had paused to consider, and initially revised dates of operations, acceptance of reservations, or both. (The assumption was most if not all of those hotels were unavailable due to the onset, and not being sold out, as market conditions with lower demand had created lower occupancy city-wide.) The conclusion: as one might imagine, the impact was significant. However, apart from the hotels’ own assessments of operations/reservations dates, the limited data did not provide a basis for projection of future occupancy trends.) 2. As a next step, the thread did a survey and reported initial results of PROJECTED revised dates as follows.Post 32B: Open or opening by May 1Post 39: Opening May 1-May 10Post 48 Opening May 11-31Post 51 Opening June 1—futureSince then, further revisions have been made by the hotels, and other changes may be made in the future.Note, however: These posts only indicate hotels which changed schedules. To find other hotels which have remained open and have accepted reservations throughout and for the future, one way is to use an aggregator site, choose your dates, and limit your search to “ONLY AVAILABLE HOTELS”.] 3. As an update, this post will withdraw Post 32B, and substitute the hotels listed below. (The initial lists for other dates, beginning May 1, have not been reviewed since first listed.)After revised schedule: open, to be opened, or reservations accepted by May 1: : 1. Belleclaire 2. Courtyard Fifth Ave 3. Edison 4. Evelyn 5. Fitzpatrick Manhattan 6. 414 Hotel 7. Four Seasons Uptown (subject to health personnel lodging) 8. Frederick 9. Hilton Midtown10. Iroquois 11. Library 12. MADE 13. Mimosa 14. RIU Plaza 15. St. James 16. U Hotel 17. Walker Greenwich Village 18. Washington Jefferson 19. SurreyEdited: 9:05 pm, April 14, 2020 "
"--Edited: 11:02 pm, April 18, 2020 "
"The hotels which have advised interim dates are taking a very big gamble by publishing/announcing even ‘anticipated dates’ so quickly. Should they get this wrong, it will be the trigger for more grief for themselves and their guests. Providing dates which could change, isn’t necessarily good service.It’s not as simple as just announcing a date and updating it as they go along. Doing so has a very negative impact. Doing so repeatedly can have a long term perception impact.Edited: 12:55 am, April 19, 2020 "
"The Hilton Midtown? Is that the one on Sixth Av? That has a lot of rooms and I think it would be optimistic of them to think they could come anywhere near filling it, unless they have some huge convention coming to town that wants to go ahead as scheduled.I'm not certain but I think the hotel formerly known as the UN Plaza, now I believe a Millenium Hilton, may be open. I have seen someone behind the front desk when walking by - but nothing else -- no doorman or taxis, though the sniffer dog and his handler are still out front (I believe there are also offices in that complex).And for the past week or so there's been a bunch of trucks and vans from World Central Kitchen, I think the Jose Andres charity, parked out front. So I assume people from that group are staying either at that hotel or somewhere nearby.Edited: 3:50 am, April 19, 2020 "
">>> That has a lot of rooms and I think it would be optimistic of them to think they could come anywhere near filling it<<<And this is precisely the problem hotels are faced with. As a general rule of thumb, a hotel needs to average roughly 30% occupancy to profit pre-tax. Anything below and it will cause a loss. This only takes into account operating costs such as staffing, utilities, perishables/wastage/leakage. Then you have administrative costs.Worse still, even when a hotel is operationally closed, it still needs to be ‘run’. Staff to take calls and enquires (even if taken offsite) engineering/maintenance (standalone property may only need someone to come check during the day, but those located in mixed business usage building, may need to have someone onsite 24/7) to oversee systems which cannot be shut down, security, and so forth.This is where publishing/announcing anticipated dates adds to the above. What does the hotel do? Announce it and keep dates open from that date? Then reservations come flooding in. Announce it and not show availability? It increases call enquires and emails. If they do accept reservations and the hotel cannot open by that date, then what? Hundreds of hours trying to contact guests to move, cancel, amend, refund, all of which can draw a very mixed reaction. Some are extremely understanding, others will see it as a premature call by the hotel or see it as incompetence that they announced it without better foresight."
"Re: Post 56The Hilton Midtown plans to accept new reservations beginning June 1. Your thoughtful observations are worth watching.You are correct. The Millenium Hilton NY One UN Plaza is open and is accepting reservations..Edited: 10:47 am, April 21, 2020 "
