"UPDATE AND SUMMARYIn the aftermath of COVID-19, 123 Manhattan hotels (about 30% of 412 Manhattan TA-rated hotels) revised their operations or reservations schedules, or both: 1. For April, 2020--Post 32B (21 hotels) 2. For May 1-July 1 (a few in August and September)—this Post (102 hotels). [This Post revises and replaces Posts 39, 47, 48, 51 and 53.] By May 1, a majority of those 123 changed-status hotels--along with the other (about 70% of all) Manhattan hotels which did not change--will be at (or will have returned to) a regular operation and same/revised reservations schedule.During the aftermath of COVID-19 through September 1, 2020, none (or very few) of all 412 Manhattan hotels have permanently closed or are now publicly-scheduled to close. Hotel status and schedules are subject to change. Additions, revisions or corrections are welcome and requested.MAY 11. Allen2. Aloft Downtown—Financial District3. Ameritania4. Amsterdam Court5. Archer6. Artezen7. Astor on the Park8. Belvedere9. Bentley10. Benjamin11. Bowery12. Broadway Plaza13. Bryant park14. Chatwal15. Crosby Street16. Dream Downtown17. Dream Midtown18. Elysee19. Empire20. Executive Le Soleil21. Fairfield Inn Chelsea22. Four Points Chelsea23. French Quarters (currently Scherman)24. Gansevoort Meatpacking25. Greenwich26. Iberostar 70 Park Avenue27. Kimberly28. Leon29. (The) Lex30. Lombardy31. Lucerne32. Marcel33. Mandarin Oriental34. Moderne35. Moxy Downtown36. Moxy East Village37. OYO Times Square (formerly Night Times Square)38. Roger Smith39. Roxy40. Seton41. Shocard42. Soho 5443. Soho Grand44. St. Regis45. Standard East Village46. Time47. West 57th St. by Hilton Club48. Westin Grand Central49. Wingate by Wyndham50. Wyndham Midtown 45May 11 51. WarwickMay 1552. Four Points Downtown53. Marriott Vacation Club54. Mayfair55. Renaissance ChelseaMay 1656. Whitby May 1757. Quin Central ParkMay 1858. Baccarat (from April 20)May 2159. Luxe LifeMay 2660. Hilton Midtown61. Selina ChelseaMay 2962. Pestana Park AvenueMay 3163. Eurostars Wall Street JUNE 164. ACE65. Assemblage John Street66. Beekman67. Carlyle68. Courtyard Fifth Avenue (from April 27)69. Edition Downtown70. 11 Howard71. Four Seasons Downtown72. Franklin73. Gramercy Park74. Grand Hyatt75. Gregory76. James NY Soho77. Michelangeo78. Mondrian Park Avenue79. Moxy Times Square80. Nolitan Soho81. Novotel82. Omni Berkshire83. Park Hyatt84. Skyline85. Sofitel86. Standard High LineJune 387. CarviJune 1588. Innside NY Nomad June 1689. Sherry NetherlandJULY 190. Chambers91. Manhattan at Times Square92. Moxy Downtown93. Plaza Athenee 94. POD 39 95. POD 5196. POD Times Square 97. Watson 98. Wellington 99. YotelAugust 1100. Merrion Row101. NOMad NYSeptember 1102. FlatironEdited: 5:15 pm, April 23, 2020 "
"All hotels in Post 32B are currently scheduled to continue or resume standard operations and reservations schedule. However, since that post was compiled about one month ago, most have extended their full resume date to June 1, with these exceptions: 1. Fitzgerald Manhattan and the Baccarat have resumed, and 414 Hotel will resume May 1. 2. The Four Seasons Uptown is serving medical staff through hospital reservations, and will resume general reservations June 16.Thus, subject to further change, the numbers for paused hotels (in addition to those now with regular operations and scheduling) are (approximate and subject to change):Begin May 1: 50May 2-31: 13June 1-30: 44July 1: 10August 1: 2September 1: 1Edited: 4:46 pm, April 24, 2020 "
"Re: Post 61.Historical data was used leading to Post 61. A further review of the compilations shows a major change: management has often taken longer to consider issues during the pause, with the result that many (not all) hotels moved the end of their pause from April and May to June 1. Those totals now (and subject to change in the future) are: May 1: 14May 2-31: 14June 1: 75June 2-30: 4July 1: 11August 1: 2September 1: 1Edited: 9:03 pm, April 24, 2020 "
https:/…
"Re #61 In No. 1, do you mean the Fitzpatrick Manhattan, by Grand Central, or some other hotel? I'm not certain the Fitzpatrick Manhattan ever closed. In any event, I know it's open now as I walked by the other day and saw both people in the lobby and someone loading or unloading luggage in the street."
"Re: Post 64QQ2: Your question is a good one:The Fitzpatrick Manhattan is at 687 Lexington Avenue (56th-57th St). It is available May 1.The Fitzpatrick Grand Central is at 141 East 44th St., and is open now as you noted.Edited: 9:36 pm, April 24, 2020 "
"Right, it is the Grand Central one I walked by and that is open."
"Do your lists include the hotel formerly, and possibly currently, known as the Beekman Tower, at 49th and 1st? It must be open as every time I walk by I see people in the lobby -- several the other day. One advantage of a place like that at a time like this is (in addition to being recently renovated) it has kitchenette facilities, which would come in handy when so many restaurants are closed and most hotels' room service is either limited or not functioning at all."
"Re: Post 67You are right--the Beekman Tower on MItchell Place near the UN is open.You have hit a big point: at a time of limited restaurants, a kitchen or kitchenette can be an attractive feature. There is a top question that has a list of this alone--and a separate list of hotels with 2 queen beds and a kitchenette/kitchen which may be particularly appealing for a family. It has not been updated recently, but it has more than 60 hotels and it is athttps://www.tripadvisor.com.au/ShowTopic-g60…If you thought it might be appealing, and if you wanted to post your point as a separate thread with a citation to the link, I think it might draw appreciative attention."
"The Beekman Tower is also right across 1st Av from a good sized deli, something else I think is worth noting these days.Edited: 1:23 am, April 25, 2020 "
"Great work, very useful thread. I couldn’t find Hotel Beacon on list. I actually made a reservation back in Feb 2020 for Feb 2021 so all before COVID-19. I suspect the hotel will be open but not sure QANTAS will be flying to USA even then :("
"Flashman: Thank you, from all of the contributors. You are correct about the Beacon. When the list was originally prepared, the hotel was open and accepting reservations. Now, it will complete phasing in and accept new reservations beginning May 20.Edited: 3:46 am, April 25, 2020 "
^ Thanks LBO. Hope the great city of NYC recovers quickly
"Flashman: Your good wishes are deeply appreciated.Taking a step back, this is an introductory baseline, for three upcoming developments:1. How many of a little more than 100 hotels in May and June hold to current phase-in operations and reservations schedules.2. In the second half of 2020, what are :A. the trends in rates and occupancy; andB. What current hotels--IF any--alter operations or uses. .3. About one dozen new hotels are tentatively scheduled to open through the end of 2020, and about two dozen more during 2021. A vaccine may (or may not) be readily available in the US and worldwide by the end of 2021. Whatever happens: 18 months from now (and sooner) would be a good time to take stock of the impact of the developing COVID-19 situation on business/tourist travel, current lodging choices and the impact of new competition. New hotels--IF completed and opened as tentatively scheduled--could increase the current stock of Manhattan hotels, by the end of 2021, by a little more than 8%.Edited: 5:24 pm, April 25, 2020 "
The fact that not all hotels in NYC are on the list suggests a lot of hotels aren't closed at all? We ourselves have a cancelable reservation at the NobleDen in August but there is no mentioning of Covid measures on their website.  It probably won't make a difference as right now we feel like postponing the trip (if the airline is willing...) but I found it remarkable. @60 I really feel sympathy for smaller hotels that just started. But your remark makes me wonder: how profitable is the hotel business in NYC? Prices for rooms are sky high but this is all about high costs?
"Den: You are correct--many hotels are not on the list because those other hotels are open and are accepting reservations now. Just as one example, during the first week of May, on one site there are more than 160 hotels are available just in Manhattan. (Even for some on the list, they are open, serving all reservations thus far, but have paused accepting new reservations for the time being.)You hotel has availability from June 1 forward including all of August. (The hotel may not mention COVID-19, but it has paused accepting new reservations through the end of May.) .On profitability, NYC hotels recently averaged less than 20% occupancy, at or near a historic low. Very limited air travel and the issue of the virus may remain the same for the immediate present. While profitability will vary by property, it is not strong right now for most Manhattan hotels--and as about 100 more hotels open up reservations over the next 60 days, there will soon be further pressure on occupancy and rates. With a view toward the future, many hotel managers and investors may be considering the same question you raised.Edited: 8:27 pm, April 25, 2020 "
"Post #74It is a terrible circumstance for hotels in NYC, as they are caught in what’s often described as a perfect storm.Key Performance Indicators for January 2020 indicated an increase in every single aspect of revenue - top to bottom - but this is where the numbers are deceiving. In terms of bottom line results, hotels in NYC recorded losses in every category. Averages for gross operating profit and profit margin were in the negative by substantial margins (Year On Year), and costs for rooms, staffing and undistributed has all increasedAnd this doesn’t take into account the full effects of oversupply and the full impact of the virus, including the recovery"
Guessing January is not a good month for hotels anyway in NYC due to weather etc. Would be a concern if in general NYC hotels operated at a loss year in year out given that short term rentals are largely removed from the “ competition”?
"It’ll take about ten years to explain properly, so I’ll try and put it in a nutshellNYC is an extreme market to figure out, and typically takes 5-6 years to understand the nuances that affect the dynamics, which can greatly fluctuate year by year. Aside from the more obvious permutations and the ever increasing oversupply, NYC has had (for about 5 years now) an identity crisis and a saturation of sorts in upper end of the midrange market (4 to 4.5 star)Hotels who are on the lower fringe of five star cannot compete upwards because their product and target market is not the same, but also due to a fairly solidly established leisure market in the 3 to 3.5 star market, they find it difficult to compete downwards without long term financial impact. All of this, combined with increasing property taxes, labour costs, is having a crippling effect across the city. And it will take its toll.Edited: 2:23 am, April 26, 2020 "
Thanks for the answers. And compliments for the important information in this topic by the way!
"I have always been amazed by the hotel activity in Flushing. For years, we had only a few, but more recently, three have opened, two more are supposed to open and a sixth is nearing completion. The land has been cleared for a seventh, but no construction begun. I think there are two factors here. One is the proximity to LGA. The hotels nearest LGA tend to be somewhat isolated while Flushing has the subway, retail, and restaurants.. The other is catering to Asian visitors."
"-:- Message from Tripadvisor staff -:-Tripadvisor staff removed this post at the original author's request.To review the Tripadvisor Forums Posting Guidelines, please follow this link: http://www.tripadvisor.com/pages/forums_posting_guidelines.htmlWe remove posts that do not follow our posting guidelines, and we reserve the right to remove any post for any reason.Removed on: 3:24 am, August 08, 2020Edited: 3:24 am, August 08, 2020 "
"There are continuing concerns about a ""second wave"" of covid 19 in the Fall. I think everything is wait and see at this point."
"Fox has raised a key point:In addition to the 30 hotels with new reservations schedules tentatively beginning July 1: a new wave of Coronavirus could bring pressure on many other hotels as well, with resulting impact on occupancy, rates and other considerations.Edited: 6:25 pm, May 05, 2020 "
"In light of COVID-19, more than 120 Manhattan hotels initially revised their operations or scheduling dates for new reservations. While approximately 4 dozen have reopened and/or are operating under current new reservations schedules (adding to existing hotels which did not change their operations or schedules), a number have extended their plan for reopening their reservations. The current projected dates and totals for reopening reservations are (approximately): On July 1: 71 moreOn August 1: 8 moreSeptember 1: 7 moreOctober 1-January 1: 2 moreOf 8 others: 2 are permanently closed (the Maxwell and the Times Square Edition) 6 others have no currently-offered new date to accept new reservations (Amsterdam Court, Bentley, Franklin, Marcel, Mayfair, Park West (formerly Astor on the Park).With these changes, previous lists in this thread are outdated. The current totals are subject to change.:Edited: 1:27 am, May 23, 2020 "
