"This is becoming a common local problem. Do your budget and if you cant afford food, fuel, accommodation then perhaps consider a country like vietnam https://www.stuff.co.nz/national/crime/11305…"
"-:- Message from Tripadvisor staff -:-Tripadvisor staff removed this post because it did not meet Tripadvisor's forum guideline with regards to harassment of another user. We will remove messages that include personal attacks or hostility directed at an individual user or group of users, threatening language or attempts to force a user to discontinue participation on our forums.To review the Tripadvisor Forums Posting Guidelines, please follow this link: http://www.tripadvisor.com/pages/forums_posting_guidelines.htmlWe remove posts that do not follow our posting guidelines, and we reserve the right to remove any post for any reason.Removed on: 9:37 am, May 28, 2019"
"""Great example these 2 women are for the LGTB community.""I find this comment offensive, What about the many thefts carried out by the straight community? It is completely irrelevant.."
If it was brought up in court and the media also noted it - then it must have relevance.
"-:- Message from Tripadvisor staff -:-This post has been removed at the author's request. The author may repost if desired.Posts on the Tripadvisor forums may be edited for a short period of time. Once the edit period has expired, authors may update their posts by removing and reposting them.To read more about editing your posts, please follow this link: http://www.tripadvisor.com/help/how_to_edit_your_postsRemoved on: 7:45 am, October 16, 2019"
"#1 - no, it just said they were in a relationship. It didnt mention what the relationship was and it could be a business relationship. you assumed."
"**Their lawyer said they did so out of ""desperation"" because food is so expensive in New Zealand. **yep, blame the victim. I had to steal as you made my luxury goods too expensive. I have been poor in France - we ate simply and skipped alcohol and all luxuries. We had fun being creative. The judge made the right call."
This is wrong in any country in the world not just New Zealand but it does send a message which is what the judge wanted to do.If you can't afford to go on holidays in a country don't go of if you steal and get caught (and you should) it is nobodies fault but your own.As per post #6 ==The judge made the right call.===
"Shoplifters are shoplifters, I very much doubt it is a state of mind that you can switch on and off, hence the repeat offending. If they were at home they would be shoplifting there instead of on holiday.Being habitual shoplifters has nothing to do with ""doing your budget and allowing spending money for expenses""."
Just 2 women ( aged 21 & 25 ) who were in a relationship ( according to the court report) who repeatedly stole - not because they were starving but because they thought they could rort the system. As I stated before - most Asian countries would have deported them as criminals.
"This was a good 20 years back, but I remember visiting what is now Countdown Springlands in Blenheim. By the checkouts was the following sign: ""Free ride in a police car for every item stolen"".And let's not forget if you're convicted and the judge is having a bad day, you get free accommodation with all meals included at the ""Milton Hilton""."
"-:- Message from Tripadvisor staff -:-This topic has been closed to new posts due to inactivity. We hope you'll join the conversation by posting to an open topic or starting a new one.To review the Tripadvisor Forums Posting Guidelines, please follow this link: http://www.tripadvisor.com/pages/forums_posting_guidelines.htmlWe remove posts that do not follow our posting guidelines, and we reserve the right to remove any post for any reason.Removed on: 1:40 am, May 29, 2020"
