"For the moment no disruption. But it seems the situation changes by the day or by the hour. Slovakia announced very severe lockdown measures (cut ALL international transport links), and the Czech premier mentioned that ""radical"" measures will be taken to curb the epidemic.Meanwhile the number of cases is increasing fast in Spain too. So it might be that flights between Budapest and Barcelona/Prague will be cut not because of Hungary but the measures of the destination country."
"From tomorrow on (07:00 local) , the Czech Republic and Slovakia canceled most or all of their international trains.Therefore all trains from Budapest to these two countries, and those to Germany and Poland which go through them, have been canceled as well.Have no info about flights yet."
"Czechia has banned all travellers from China, S Korea, Iran, Italy, Spain, Austria, Germany, Switzerland, Sweden, Norway, Netherlands, Belgium, UK, Denmark, and France.So pretty much in shut down mode, bugger tourist industry and tens of thousands of people who rely on it to live. Wonder if it will have a better outcome than the UK, which for now is taking a relaxed approach, saving hard hitting measures until virus really starts ramping up. Danger with total containment is that when you stop measures background virus is still around, and will start infecting people all over again, until population immunity or vaccine halts it."
@Laura-Eva- well trump thinks because UK is not in Schengen and has closed boarders that Uk is safer. But then you have flights from all over coming into Heathrow and potentially carrying the virus. Trump also thinks his “wall” will keep the virus in mexico. So much for anything he says or his crdibility.
"US has already enough contagion to spread an epidemic.Viruses love air travel, rather than a slow boat. We can't kill them, just build up our resistance, a battle the human race has won over recorded history, with casualties we cannot accept in modern times."
"-:- Message from Tripadvisor staff -:-This post has been removed at the author's request. The author may repost if desired.Posts on the Tripadvisor forums may be edited for a short period of time. Once the edit period has expired, authors may update their posts by removing and reposting them.To read more about editing your posts, please follow this link: http://www.tripadvisor.com/help/how_to_edit_your_postsRemoved on: 7:24 am, March 13, 2020"
From 16 March the Czech Republic enacted a total entry ban for foreign citizens. That definitely answers the question about flights from Budapest to Prague.
"We are supposed to be heading to Budapest from Vienna in a couple of days. I would be crazy disappointed if I cant visit (absolutely understand though) but is there going to be anything open. Here in Austria restaurants, shops, museums and even hotels are said to be closing Monday next week."
"7 of us are meant to arrive Friday the 20th of March for a stag weekend.Are things like the shooting range, go karting tracks, bars or clubs still open or is it going to be a waste of a journey coming? Thnak you"
"Hi There, can you tell me if there are any attractions open e.g museums, tours still going etc and what closures there currently are in Budapest please? Are there any rumours about upcoming closures etc? Many Thanks in advance."
"@ greyhound85034,I was rolling on the floor laughing, when I heard of the 3 exemptions of that air traffic ban:UK, Ireland and?????? The Ukraine:)))))))))The country that for the time being doesn't even have quick tests, and the quarantine rooms look like some shabby barns from western movies of the 70-s!!! My mother in law had to go to a hospital in Kiev. My brother in low, after witnessing the general conditions over there, is praying of her not catching that virus from the Hospital proper..."
"Airbnb has started giving full refund for cancellations.The flight tickets are a bummer, with airline only allowing reschedule but not refunds.Any thoughts which can be next best month to visit given the current scenario."
"The City Council of Budapest ordered the closure of thermal spa's and the Zoo from Monday, 16 March.Public transport in Slovenia is going to shut down completely on the some day (it means entering Hungary by train/bus will not be possible)Not sure about all museums in Budapest, but those operated by the City of Budapest are closed already.Do not want to sound too alarmist but I think more restrictions might be in the pipeline as right now Hungary has the fewest restrictions among CEE countries (no total entry ban for example, like SK, CZ, and PL) and the number of cases just started to increase.Edited: 7:16 am, March 15, 2020 "
Any news on cruises - bike/barge on the Danube? Thanks.
"Hi,There was some misunderstanding recently, but let's pretend you are talking about those 2-14 day river cruises to or from Budapest.I don't like to repeat yesterday's or even earlier posts or infos, like quite a few posters around here doing constantly (they probably have an urge to show up or simply don'r read other people's post) but now have to repeat that: ALL those river cruises have been cancelled till April 28!"
Thank you. I apologize for asking the same question as others.
Jet2 have cancelled all flights to Budapest as of now and will be flying customers home upto and including the 20th March.
"Devastated but probably for the best, I'll still be visiting as soon as we're able to. More time to practise my Hungarian I suppose"
That's it. Total entry ban for foreigners just announced (dont know about the details)So I assume you should cancel if your planned trip was in the next 2-4 weeks (nobody knows how long this can last)
"We are due to fly from UK to Budapest tomorrow morning with Ryanair who have not yet cancelled our flights, can you tell me where I can get the latest information on announcements coming from the government in Hungary? Thanks in advance"
"Link with details regarding complete ban of foreign entry.https://www.usnews.com/news/world/articles/2…Edited: 7:46 am, March 16, 2020 "
When does foreigner travel ban start? I have Ryanair flights tlv - bud and bud - Dub on 18th
"According to a Hungarian friend, it is being reported that the airport will close this evening. I will post as soon as I can find more information."
"Hi Rommel, from today, only Hungarian residents can pass the borders of Hungary in order to stop the spread of the virus. Approximately 30-40% of the restaurants and other tourism-related places are already closed, and as they have to close their doors at 3 pm, there will be far more that remain closed all day. Schools, pre-schools are closed, everybody who is capable has to work from home and isolate themselves from other people. We hope, it will be better in May when you will arrive, or even sooner. Please check the cancellation policy of the hotel you have booked, as they might be changed. Take care. Marta"
"Roman Citizen, Magyar Hírlap, today 20:15hrs reported Kovács Zoltán, minister for international communications saying that it is the borders which are closed but ""we are not closing the airport"".If you look on Flight Radar you can see that there was a pretty full list of departures tonight with normal punctuality. Tomorrow seems pretty normal too, with both El-Al and WizzAir running flights from Tel Aviv, and BA departures to London Heathrow. I'm guessing people using Budapest as a transfer hub will not be affected as long as they remain air-side. Its the airlines which will eventually close flights, so all the more urgency to make your journey ASAP."
"Pat Q, as of today your Ryanair flights are still on schedule to run TLV - BUD - DUB."
"-:- Message from Tripadvisor staff -:-Tripadvisor staff removed this post because it did not meet Tripadvisor's forum posting guidelines with prohibiting self-promotional advertising or solicitation.We ask all of our members to keep their forum messages free of self-promoting advertisements or solicitation of any kind - members affiliated with any tourism-related business should not include commercial contact information or URLs in their forum messages.To review the Tripadvisor Forums Posting Guidelines, please follow this link: http://www.tripadvisor.com/pages/forums_posting_guidelines.htmlWe remove posts that do not follow our posting guidelines, and we reserve the right to remove any post for any reason.Removed on: 7:19 pm, March 22, 2020"
"-:- Message from Tripadvisor staff -:-Tripadvisor staff removed this post because it did not meet Tripadvisor's forum posting guidelines with prohibiting self-promotional advertising or solicitation.We ask all of our members to keep their forum messages free of self-promoting advertisements or solicitation of any kind - members affiliated with any tourism-related business should not include commercial contact information or URLs in their forum messages.To review the Tripadvisor Forums Posting Guidelines, please follow this link: http://www.tripadvisor.com/pages/forums_posting_guidelines.htmlWe remove posts that do not follow our posting guidelines, and we reserve the right to remove any post for any reason.Removed on: 11:33 pm, May 20, 2020"
Errrrr can we ask what the relevance of a post about India in March has to the current situation in Hungary ?
"-:- Message from Tripadvisor staff -:-Tripadvisor staff removed this post because it did not meet Tripadvisor's forum posting guidelines with regards to family-friendly language and/or subject matter. We will remove messages or topics that contain objectionable language and images (avatars or links to pornography), including but not limited to profanity, obscenity, vulgarity, pornographic literature, racial slurs, hate speech, personal insults, hostile comments and threatening language.To review the Tripadvisor Forums Posting Guidelines, please follow this link: http://www.tripadvisor.com/pages/forums_posting_guidelines.htmlWe remove posts that do not follow our posting guidelines, and we reserve the right to remove any post for any reason.Removed on: 1:49 pm, May 22, 2020"
"Hi, I wondered, is there a 14 day quarantine for arrivals from the UK (with a UK passport) at present? I was hoping to have a couple of days in Budapest en route to Sicily on 19th-22nd June but will go straight to Italy from the UK if so. ThanksEdited: 5:42 am, June 04, 2020 "
"https:/…entry-requirementsPersonally I think that it is unlikely that travel from and to the UK will get any easier before the end of August. Like her neighbours, Hungary has been very successful in limiting the impact of Covid-19 upon the nation's health - unlike the UK. They are not going to throw that away, they will wait until countries like the UK (and Sweden etc) show that they have the disease firmly under control before allowing people arriving from those countries to enter."
"Ok thanks, yes makes sense, I was probably being overly optimistic since I haven't been to Budapest before and was hopeful of ticking it off my list. Nevermind, I'll wait until later in the year.Edited: 8:26 am, June 04, 2020 "
