"“ I can’t figure out why California did so poorly. Newsom seemed to be doing the right things ahead of the nation, yet we messed up too. Why? Whose fault is it?” I agree we were doing great and it’s really disheartening to see where we are. Newsom was getting it from people that wanted to open up in April and now he’s getting from the same people that just want to order their rosé next to the beach. He can’t win. Imo what Madeline said true. We opened around Memorial Day, SIP fatigue and the national leadership such as it is got bored with it all at the same time. People started traveling to California from other states and within the state. People just stopped paying attention. A large portion of us are pretty dense and only can see about a foot beyond themselves. My county had very low numbers until after Memorial Day and we had a memorial service for a sheriff killed by a right wing boogaloo lunatic. Unfortunately the 100s, maybe 1,000s, of police officers from around the state didn’t wear masks. The memorial service was less than a mile from my house and people were really upset that they weren’t wearing masks, at all. Protesters were smart enough to wear masks but not police officers that traveled here from the around the state. Our numbers our still low but since that memorial our numbers have tripled and all those attended went back to their communities."
"I went to a friends for a socially distanced dinner party (in the garage with the door open). Let’s of people having meals outdoors on Chestnut St, many of which are NOT socially distant (don’t know who is enforcing that). Heard a lot of fireworks as we ate and chatted in Pac Heights but I saw basically no cars and few people on my drive home about 9PM. A few fireworks heard in my neighborhood but not much worse than a normal 4th. I did appreciate that there wasn’t the massive crowd that usually crams into the Marina for the entire day getting drunk, rowdy, leaving trash on the sidewalk and being noisy throughout the day and into the evening."
"All these people, activities, diversities and irregularities make San Francisco what it is, that’s what a little big city is like, just like the hills and fog; without which we are just another Sacramento or midwestern city with perfectly lined streets with happy perfect citizens. All parts of our beautiful life in an unusual city by the bay."
"I see nothing 'beautiful' about endless booming fireworks and firecrackers even when it's not 4th of July! For weeks now, we've been witness to the nightly spectacles. But last night was the ultimate. I thought these private fireworks displays were considered to be illegal. Now it sounds as though local officials and the police are okay with them because many residents are too cooped up due to COVID-19? Some of those loud booms sounded like bombs went off. And those poor cooped up souls needed to emit these bombs past midnight until 3-4 am! Gosh, I feel so sorry for them (not). We tried to navigate our street except some louts were blocking traffic and boldly let off their pent up frustrations with multiple fireworks, barring us and other cars from passing. To me, this lack of regard for fellow residents does not add any positive aspects to SF at all. Even the dogs, including mine, are petrified each time there are these useless private firework displays. Some suffer so badly that they need to be tranquilized.Edited: 6:29 pm, July 05, 2020 "
110 fires had to be dealt with by SFFD. Majority caused by fireworks. Obey the law. Respect your fellow citizens.
"“All these people, activities, diversities and irregularities make San Francisco what it is, that’s what a little big city is like, just like the hills and fog; without which we are just another Sacramento or midwestern city with perfectly lined streets with happy perfect citizens. All parts of our beautiful life in an unusual city by the bay.”Surely you are not equating an ethnic fair or music concert with a night of endless explosions set off by amateurs who risk their safety and the safety of the rest of us? Or suggesting that illegal fireworks use is just another element of cultural diversity? People usually don’t mind having festivals or parades in their neighborhoods and generally welcome them, even if they do bring some inconvenience. Those activities have what we once called “redeeming social value.” And as long as folks behave, they don’t have an inherent risk of fire, disabling injuries, or trauma to animals, children, or people with some health issues who might not even be near the actual incident.The Fresno FD was so swamped by fires that it stopped responding to medical cases other than cardiac arrest. Let’s hope no one died as a result. In Los Angeles, fireworks abuse may have contributed to poor or unhealthy air quality, and even worse, caused a fire that spread to a building and burned out eight residents. https:/… https:/… And here is a story about a city’s official fireworks show that went sideways (maybe literally) and started a fire that burned several acres. This was not in California, so who knows what kind of regulations they have. But it just goes to show that even an organized show can go wrong.https://www.bing.com/search…"
"#54, the most idiotic defense for use of illegal fireworks I've ever read. Actually, I think it's the only one because who would even try?"
"7/4 private fireworks happened every year, as well as news about fire departments, did you all complained about it every year in the past? Or just this year? or just angry old people constantly complaining about neighbors and young people? If you just moved to San Francisco, welcome. It will happen again next year."
"Yes. There are always private fireworks happening yearly, but this year's was the worst ever! Seems like you're oblivious that this year the fire brigades were going from one fire to another 110 in total. All of that resulted in displaced residents and lost livelihoods as businesses were destroyed.FYI, residents have been complaining about these illegal fireworks since Memorial Day. Nightly booming going off even up to last night!"
"I have known angry old people all my life, they are always angry about something or somebody, now that I am an older person, I do my best not to be an angry complaining old guy. I remind myself that I was young and reckless once, I was different, I didn’t always follow rules, I didn’t drive 65. Most things we don’t like or don’t agree with or find annoying can be tolerated. Just take a deep breath and move on. Different opinions? Naturally, we are all supposed to different. After all, this is San Francisco, this is not Modesto."
"Eh, not only 'angry old people' have been complaining. And I refuse to believe that peoples' differences need to result in endangering others' lives regardless of residence."
"We are awaiting news of our flights from UK but are sure they are going to be cancelled, whatever, we won't be visiting this year. Busy cancelling hotels and car hire, sorry to be missing it but hope to visit another year.Stay safe and well people."
Thank you Penny for your kind words. Stay safe and healthy.We were in London twice right after terrorist acts. It hard to believe that it has almost been 19 years.To me this feels scarier as it continues to unfold. And for essential reasons holed up in DTLA with the looting and civil unrest. The business core is boarded up with grafitti and filth. You won't be missing a thing. To think LA was on top with James Beard awards and a Renaissance to this. I saw part of a briefing with Mayor London Breed. I like her. She seems competent and doesn't look like she's part of the mafia. Being near a nuclear plant and having false alarms I know we're hosed if we have to rely on our Mayor and council.
"I agree fireworks were much worse this year. Yes, it happens around New Years and Chinese New Years and the 4th of July every year, but it was at least 3 times more this year. We could see at least 10 full, long fireworks displays from our house going on in one valley between us and the Daly City hills. Yes, they were pretty, but a lot of the fireworks were very, very low in elevation in city built of wood--and they weren't just roman candles or bottle rockets but full on fireworks displays. Someone spent a lot of money for some of the displays, I'm guessing into the thousands or multiple thousands of dollars based on how showy and how long some displays were.They mostly didn't bother me personally since not many made it into really close range to our house and weren't excessively loud, but they are tougher on animals and people at closer range and are a huge fire risk. There was a fire in McClaren Park and also a 6 year old boy was shot and killed in the Bayview as he was watching fireworks.I get that people are tired and fed up with restrictions and want an outlet, but we've got to think of this as a marathon and not a sprint. It's not going to just go away next week. We need to do sensible things for our own sanity, find a balance with the restrictions and our society and not let up just because we're tired of it. I've noticed people slacking off more about being careful (stuff like not really distancing) and notice it's harder to keep things up myself, but it is important to do what we can reasonably do. I think most people here are trying to be conscientious, but some people not so much. I do know someone who had covid-19 (someone I work with) and he was under 40 or so and in good health and was very sick for three weeks or longer. We were not exposed since he had already been working from home for 3 or 4 weeks when he began showing symptoms. My husband has a colleague whose father died from it. It is definitely out there and I expect most people will know people who have gotten very sick and maybe some people who will have died before this is over.Hang in there and do what you can to stop or slow this thing down."
"“I saw part of a briefing with Mayor London Breed. I like her. She seems competent and doesn't look like she's part of the mafia.”I don’t think the Mob (at least not THAT one) is very influential in San Francisco these days. There was some action in the past, around the 1930s to the 60s or so. There were always rumors that 1970s Mayor Joe Alioto (of the Sicilian immigrant family that started the fishery and seafood restaurant businesses) had Mafia connections. I don't know that it was ever proven for sure, but he did get into legal trouble.We’ve had our share of scandals and corruption in high places in recent years, but now we have our own home-grown graft (google Ed Jew, Leland Yee, Mohammed Nuru – a former long-term BF of the mayor, Tom Hui, and Linda Crayton). I’m sure there are others that I can’t remember right now. We’re happy to let New York and Las Vegas have the Mafia, because we’re quite capable of producing our own crooks."
"The San Francisco Zoo will be permitted to re-open as early as July 13. The Zoo will likely have mask wearing, social distancing, visitor limits.....the latter regulated by requiring timed entry reservations. We are members of the SF Zoo, too, and it is quite nice with lots of open space, albeit with a few “houses”....Kind of out of the way, which makes it more a resident rather than visitor attraction. L streetcar limitations might impact access imho."
#66Frisco that was a fun read I enjoy reading Teri Sforza at OC Watchdog. I thought Leland sounded familiar. She covered that story. I love when corruption is exposed but more so prosecuted.
"-:- Message from Tripadvisor staff -:-This post has been removed at the author's request. The author may repost if desired.Posts on the Tripadvisor forums may be edited for a short period of time. Once the edit period has expired, authors may update their posts by removing and reposting them.To read more about editing your posts, please follow this link: http://www.tripadvisor.com/help/how_to_edit_your_postsRemoved on: 7:34 pm, July 12, 2020"
"We have been out dining about 8-9 times in neighboring San Mateo county since the reopening, going out again tonight with a small group of friends, party of 6.I usually call multiple restaurants before I leave office, find one that opens between my San Francisco office and San Mateo county home, only about 1 in 10 is actually open for dine in. Restaurants with open signs are mostly for take out only, best to call first before parking.For lunch, nearest open restaurants are in Daly City, nothing is open near office in San Francisco. I miss sushi, but found none yet, a famous Japanese ramen place is open, only open Japanese place I found."
"At most of the restaurants we went to, my wife and I were the only table of customers, at couple places, there were maximum 2 tables, far apart. Most customers are not going out to eat yet, that is good news, this could be the safest time for indoor dining. It was a little stuffy in restaurant last evening, our friend requested air conditioning, but restaurant said they keep doors open without air con for fresh air, which is safer. I was at Lowe’s Tanforan on Friday, it was busy, at Office Depot on Thursday, not busy. Everybody wore masks. I wear 2 layers of masks, different materials, I heard on news, different materials masks are more effective. I keep 6-8 masks in my car. People in the Bay Area are well educated good citizens, we all wear masks. I don’t wear mask where out walking in the open air, by all reports, open air outdoor with social distance is the safest place."
"Many counties have had to back off the indoor dining. Sonoma and Marin are two. Santa Clara too I think. SF has not yet allowed it.Anyone who read the article about a sick woman in China dining in a restaurant who infected 9 people, none at her table but all in the path of the ventilation system, would know better than to dine inside. I certainly wouldn’t.Edited: 2:03 pm, July 13, 2020 "
Aerosolized virus + confined space = enhanced risk of infection.
"Governor Newsom shuts down all restaurants in California today. Governor Gavin Newsom Orders Indoor Service At All Restaurants, Bars, Movie Theaters In State To Close Again; No End Date Given."
"How could we’ve messed it up so badly? We are the cleanest, most advanced, most sophisticated, smartest and richest state in the world; the tech center, entertainment center, agriculture center, the best and brightest are all here. How could we’ve mess this thing up so badly? Again and again. I really don’t understand it."
"San Francisco has now made it onto Governor Newsom’s watch list: https://www.sfgate.com/news/editorspicks/art…Edited: 9:51 pm, July 17, 2020 "
""" Again and again. I really don’t understand it."" #76 We are all aware now (most of us) that this thing is not going to vanish overnight.Other countries that are slowly getting on top of it have competent national leaders."
"The world is sick and tired of hearing Post 76.That was about 30 years ago.And if I was a POTUS or Governor I wouldn't be wagging that finger to the Middle East, Russia,China.Korea had missiles at our shorelines in the 90s. But let's just chant our way while other societies advance.SARS2 is a test of how dirty people here really are.I'll wear my shield mask and gloves and hope for the best."
I agree Mac. I believe our society is going the way of Rome. Nothing lasts forever. Such as us.
"Maybe TA could start a new forum ""Apocalypse and Lamentations."" This isn't the end of the world, but apparently it's the end of civility and common sense."
Speaking of civility...
"Seems quite civil in my world. There is your own reality and there is a TV/web news reality. Don’t confuse both, unless you live in a neighborhood where people refuse to wear mask and you know many people are sick with Covid19. I work and out shopping at Lowe’s and Popeye, everybody wear a mask, everywhere; in my office, in store, 6’ apart in check out line, in bank and with protective shield. I see nobody congregate in groups. Do not confuse people in my world with people elsewhere in the news who refuse to wear mask or crazy party crowd, our local hospitals are not packed with COVID patients. My Bay Area is very civil and responsible, but you may live in a different communities with nasty neighbors. Or is it a reflection of internal demons? You see what you want to see."
"But you live in San Mateo county, right? Big back yard etc etc."
Yes Mac We live in a bubble too. However we are in DTLA on essential business. What we see is an entirely different world.SF isn't civil when they lose a sporting event.It's way more populated here too.You can't get away from people.You are correct my perception is different than most. We're outnumbered here for sure. We're not familiar with this way of life. And it has changed so much.I never knew there was some competition that NoCal was better than SOCal until I started hanging on travel boards. I guess you are now.
"Covid-19 new cases jumped to over 73000 on a single day yesterday. Why are we doing so bad in this country, the US of A? Thanks to many who are ignorant and who are non-believers. Those who still brushes it off as ""just another day"" or ""this is no different than another flu"" need to wake up. These numbers will accelerate for a while before things get better.I have been patiently sitting at home since March 19 when the order in Sacramento came. Not making any trip except doing grocery. Not even downtown Sacramento. I was hoping to see it end in a few months. My fate was determined by others. It looks like this will continue for months on end.What would you consider as ""end of the world""? Half of the world's population wiped out? Oh wait... that can't be the end. The end means population = 0."
"-:- Message from Tripadvisor staff -:-Tripadvisor staff has removed this post because it did not meet Tripadvisor's forum guidelines with regards to off-topic chat. Please limit conversations to subject matter directly related to the host forum. For example: when in the London forum, please stick to topics that relate to travel within the London Metropolitan Area.Off-Topic Chatter is a forum for discussions gone afield from the topic of travel. Please note that the Off-Topic Chatter forum is un-moderated -- the Forum Posting Guidelines are not enforced, with the exception of pornographic images or text, hate speech, unauthorized re-prints of copyrighted text, and messages that promote or encourage illegal activities. Each user is expected to take responsibility for his or her own conduct.To review the Tripadvisor Forums Posting Guidelines, please follow this link: http://www.tripadvisor.com/pages/forums_posting_guidelines.htmlWe remove posts that do not follow our posting guidelines, and we reserve the right to remove any post for any reason.Removed on: 1:24 pm, July 19, 2020"
"I wear 2 masks, 4 layers of different materials filter more effectively. My custom mask cocktails are pretty comfortable, I can do this for years to come. In early days, mask was uncomfortable for me, but I figured out solutions. Improvise, adapt and overcome. Visited 5 stores today, everybody wore a mask. Nobody debate about mask. I used hand sanitizer in my car before and after shopping, this takes seconds, visited 5 stores today, did that everywhere. I washed my hands first thing after I came home. Things we all can do easily and cheaply.Everybody at my office wear mask, no one order them to wear mask, they wear masks for themselves and as a civic duty.Common sense."
"-:- Message from Tripadvisor staff -:-This post has been removed at the author's request. The author may repost if desired.Posts on the Tripadvisor forums may be edited for a short period of time. Once the edit period has expired, authors may update their posts by removing and reposting them.To read more about editing your posts, please follow this link: http://www.tripadvisor.com/help/how_to_edit_your_postsRemoved on: 5:50 am, July 19, 2020Edited: 5:50 am, July 19, 2020 "
"-:- Message from Tripadvisor staff -:-Tripadvisor staff has removed this post because it did not meet Tripadvisor's forum guidelines with regards to off-topic chat. Please limit conversations to subject matter directly related to the host forum. For example: when in the London forum, please stick to topics that relate to travel within the London Metropolitan Area.Off-Topic Chatter is a forum for discussions gone afield from the topic of travel. Please note that the Off-Topic Chatter forum is un-moderated -- the Forum Posting Guidelines are not enforced, with the exception of pornographic images or text, hate speech, unauthorized re-prints of copyrighted text, and messages that promote or encourage illegal activities. Each user is expected to take responsibility for his or her own conduct.To review the Tripadvisor Forums Posting Guidelines, please follow this link: http://www.tripadvisor.com/pages/forums_posting_guidelines.htmlWe remove posts that do not follow our posting guidelines, and we reserve the right to remove any post for any reason.Removed on: 1:23 pm, July 19, 2020"
"-:- Message from Tripadvisor staff -:-Tripadvisor staff has removed this post because it did not meet Tripadvisor's forum guidelines with regards to off-topic chat. Please limit conversations to subject matter directly related to the host forum. For example: when in the London forum, please stick to topics that relate to travel within the London Metropolitan Area.Off-Topic Chatter is a forum for discussions gone afield from the topic of travel. Please note that the Off-Topic Chatter forum is un-moderated -- the Forum Posting Guidelines are not enforced, with the exception of pornographic images or text, hate speech, unauthorized re-prints of copyrighted text, and messages that promote or encourage illegal activities. Each user is expected to take responsibility for his or her own conduct.To review the Tripadvisor Forums Posting Guidelines, please follow this link: http://www.tripadvisor.com/pages/forums_posting_guidelines.htmlWe remove posts that do not follow our posting guidelines, and we reserve the right to remove any post for any reason.Removed on: 1:25 pm, July 19, 2020"
"I also have face shields, at office and as backup in my car, I wear face shield at office. Our San Francisco office is not open to the public, all staff wear masks full time without any demands or requirements from top. I take off the mask when inside my private office, put them on when I go outside my office.Problem with face shield is I forget I am wearing it, until when I drink, but that means it is effortless and comfortable. It gives me relief from mask, while the protection is less, but it does block me from unknowing spitting whatever when I talk to others at work, something is better than nothing.Varies reports say eyes are main entry points for virus, I have 20/20 vision, no glasses, face shield protects my eyes.I don’t wear face shield out about, because nobody wear it openly, I don’t want to attract attention or look out of place, we all need to fit in."
"If Americans would adhere to six foot distancing and face masks/shields, this country would be in a lot better place. The U.S. could sure learn some lessons from other countries: https://www.sfgate.com/science/article/Taiwa…"
