"I just want to say thank you for all of your help. I'm saddened to say that we have had to cancel our trip (flights were cancelled by the airline), but knowing that Spain and Portugal are doing a better job of handling this crisis than the U.S. is, I'm trying to tell myself it's the right thing to do, anyway. Our group is from Michigan and New York, the only two states currently doing ""well"", but I know that even that is relative to the rest of the U.S., and that we are still not doing as well as you guys are at controlling this thing. I know that not having tourists from the U.S. will be an economic hardship for some, but I also know that this illness is not to be taken lightly, and I do think this ban is maybe for the best. If anything, Europe should be banning us because of our inability to deal with Covid19, but the result will hopefully be the same in terms of lives saved. I look forward to a time when we'll be able to visit. Everyone we have dealt with (with the exception of Ryanair-- I have NOTHING good to say about them!) has been nothing but understanding, polite, and kind, and it makes me even more determined to visit when it's safe to do so.Wishing you all the best. Take care, stay safe, and I hope you are all able to weather this. Again, thank you!"
Can anyone comment yet on how hotel swimming pools are operating in practise? Thinking of booking a trip to one of the Islands but its not a holiday for my children if they can't comfortably use the pools. I've emailed a couple of major (5*) hotels and they can't seem to answer the question!
"So after a token three weeks' quarantining returning holidaymakers or others arriving from Spain, the UK Government announces that it intends to make an announcement tomorrow to open or borders to them;https://www.bbc.co.uk/news/business-53199089"
GOV.UK Foreign travel advicehttps:/…spain
"New draft list of 15 countries that will be allowed to enter EU when borders open. There are two lists, one for those that will be accepted, and one for those who will not. The list has already aroused controversy after sources revealed that the United States - the worst-affected country worldwide by COVID-19 with more than 2.4 million cases, is on the latter list. The latest draft list of the countries for which Europe's borders will be open, and can confirm what we reported on Wednesday that Brazil, the US and Russia are indeed not on the approved list."
"HiI'm thinking of booking a short trip end of July to Malaga. May I ask if the flights have been going ahead or being cancelled regularly? Airlines are publishinh fliggt dates and allowing to buy tickets but ive heard are then cancelling flights to and back closer to the travel dates,most not offering refunds? I would like to know for sure before I book and mist importantly because I don't want to get stranded. I won't have a car with me so I will not be able to drive to otger locations for flights back if they get cancelled."
"Hi, Could anyone please tell me what hotels with buffet style restaurants are doing stop the spread of Covid19? Thanks in advance."
"Hi LJDavies, there is no simple answer to your question as hotels and chains could be doing things differently. Some will be providing buffet style meals and others wont. Have a read at this hotels procedures for an idea of how things may work https://www.goldenhotels.com/en/covid19/ for better clarification you may be better asking in particular resort forums."
Thank you.
"HiI have booked to drive to L'Escala in August. I have found a form to complete for entry into France on the DFDS and Eurotunnel websites https://assets.ctfassets.net/mivicpf5zews/4f…https://www.eurotunnel.com/Eurotunnel/files/…I've also got the link for when I return to the UK. For transit into Spain I cannot find a form. My wife and daughter are flying and there is an app for them to make declarations.Please can anyone advise as I'd hate to arrive at Le Perthus and be refused entry to Spain - it's a long way from Yorkshire! Thanks in advance, much appreciated xEdited: 4:31 am, July 09, 2020 "
"Hi Wilkies, the form for Spain can be found here https://www.spth.gob.es this can only be completed a few days before travel/entry into Spain so depending on the length of your drive, you may need internet access enroute."
Hi we are looking at driving to our destination in Nerja via Euro-tunnel to avoid flying. Can anyone clarify if we are able to travel in the same car? We are 2 couples from different households We will be driving through France and also need to know if we would be able to stop over in France on way to Spain without the need to quarantine. Many thanks for advice.
"Hello,I plan to drive from France to Andorra, but I will cross Spain. Is the form (https://www.spth.gob.es/) required also for me, even though I will not come to Spain by plane?Thank you.Edited: 8:18 am, July 12, 2020 "
"My daughter aged 12 will be travelling with a friends family to Spain on Friday. Can I fill out a stand alone Spanish health form for her as if she was an adult or will the friends family have to include her under the travelling with minors ,dependents section of the application. Irrespective I think as the parent I will have to sign the QR coded form for her to travel. Any help would be appreciated,I’m a little confused !Edited: 10:54 am, July 19, 2020 "
Has there been any closing down of borders due to a rise in Covid19 cases in the Catalonia region?Anthony K
"Not as of yet but France is ""watching the situation closely"". Worth keeping an eye on continuously as things here in Spain tend to change quickly and with little to no warning especially if the government is involved."
"hi, I am Canadian and plan to visit spain in September . do I need to be isolated for 14 days or any health form I have to fill out before the trip? where can I check those info? thank you."
"Hi James, the health form that has to be completed can be found here - https://www.spth.gob.es I can't help with the other part re quarantine."
"Hello Forum,I have a trip to Spain planned for the end of August. I am a citizen of the USA and my spouse has dual citizenship from USA and Italy.According to the information on the IATA map for Spain, the way I read it, they seem to allow EU Nationals and family members who are traveling together.We will be traveling together from JFK. Does anyone know if that includes family members with a USA passport? Thank you,Steven"
Report. July 24https://english.elpais.com/society/2020-07-2…
"-:- Message from Tripadvisor staff -:-This post has been removed at the author's request. The author may repost if desired.Posts on the Tripadvisor forums may be edited for a short period of time. Once the edit period has expired, authors may update their posts by removing and reposting them.To read more about editing your posts, please follow this link: http://www.tripadvisor.com/help/how_to_edit_your_postsRemoved on: 4:02 am, August 10, 2020"
Can anyone help me to complete the spth form for myself and my granddaughter who is a different surname. I have tried with her details and her mums but either says form cannot be created or form cannot be retrieved . Any help would be appreciated
Can anyone point me in the right direction about the health form which needs completing before visiting Spain. I am taking my granddaughter who is ten and has a different surname to mine. I have tried putting her details or her Mums details but it either says cannot retrieve form or create a form
"Is anyone there now or travelling soon and can give some insight to what it’s like. Got seville and then Malaga city booked from sep 2nd wonder will it even be worth going. Will a lot of places be closed? Masks everywhere etc? Does anybody know.Edited: 5:49 am, August 06, 2020 "
We have a Santander crossing booked 21 August. After a few nights in the Rioja region supposed to be heading to Nautic Almata campsite near Rosas. Anyone there at the moment? Debating whether to divert to France and lose deposits on camp sites. Any information appreciated.
"Spanish health minister announces closure of nightclubs, bars in bid to slow coronavirus spreadhttps://english.elpais.com/society/2020-08-1…"
"-:- Message from Tripadvisor staff -:-This post has been removed at the author's request. The author may repost if desired.Posts on the Tripadvisor forums may be edited for a short period of time. Once the edit period has expired, authors may update their posts by removing and reposting them.To read more about editing your posts, please follow this link: http://www.tripadvisor.com/help/how_to_edit_your_postsRemoved on: 4:38 pm, August 15, 2020Edited: 4:38 pm, August 15, 2020 "
"-:- Message from Tripadvisor staff -:-This post has been removed at the author's request. The author may repost if desired.Posts on the Tripadvisor forums may be edited for a short period of time. Once the edit period has expired, authors may update their posts by removing and reposting them.To read more about editing your posts, please follow this link: http://www.tripadvisor.com/help/how_to_edit_your_postsRemoved on: 4:38 pm, August 15, 2020"
"i suppose if your self employed like me you need to work but at the end of the day , its self choice ."
"-:- Message from Tripadvisor staff -:-Tripadvisor staff removed this post because it did not meet Tripadvisor's forum posting guidelines with prohibiting self-promotional advertising or solicitation.We ask all of our members to keep their forum messages free of self-promoting advertisements or solicitation of any kind - members affiliated with any tourism-related business should not include commercial contact information or URLs in their forum messages.To review the Tripadvisor Forums Posting Guidelines, please follow this link: http://www.tripadvisor.com/pages/forums_posting_guidelines.htmlWe remove posts that do not follow our posting guidelines, and we reserve the right to remove any post for any reason.Removed on: 7:16 pm, August 17, 2020"
Spain’s regions begin to implement ministry order to close bars and nightclubs and impose smoking restrictionshttps://english.elpais.com/society/2020-08-1…
"New coronavirus cases in Spain begin to stabilize, but hospitalizations are risinghttps://english.elpais.com/society/2020-08-1…"
Comments made by Spanish professionals make interesting but disturbing readinghttps://english.elpais.com/society/2020-08-2…
#113 spam......reported
