"After seeing the curfew thread, I checked to see if anything else had changed and it has - TCI is now a Level 3 Travel Advisory destination. https:/…turks-and-caicos-travel-advisory.htmlI was on the fence about cancelling our rescheduled trip for December, but now I have made my decision.I feel blessed to have had 4 perfect vacations in TCI. If life ever returns to normal, we'll return. Be safe, Islanders!"
"When I read your message I looked at the US travel advisories site. It looks like it was updated on August 6th, 2020 and many destinations had an increase in the risk of travel rating. Anguilla is now level 3, Nevis/St. Kitts is level 3, Caymen Islands is level 3, Aruba is level 3."
"-:- Message from Tripadvisor staff -:-Tripadvisor staff has removed this post because it did not meet Tripadvisor's forum guidelines with regards to off-topic chat. Please limit conversations to subject matter directly related to the host forum. For example: when in the London forum, please stick to topics that relate to travel within the London Metropolitan Area.Off-Topic Chatter is a forum for discussions gone afield from the topic of travel. Please note that the Off-Topic Chatter forum is un-moderated -- the Forum Posting Guidelines are not enforced, with the exception of pornographic images or text, hate speech, unauthorized re-prints of copyrighted text, and messages that promote or encourage illegal activities. Each user is expected to take responsibility for his or her own conduct.To review the Tripadvisor Forums Posting Guidelines, please follow this link: http://www.tripadvisor.com/pages/forums_posting_guidelines.htmlWe remove posts that do not follow our posting guidelines, and we reserve the right to remove any post for any reason.Removed on: 7:05 pm, August 08, 2020"
https:/…map-and-travel-notices.html
"-:- Message from Tripadvisor staff -:-This post has been removed at the author's request. The author may repost if desired.Posts on the Tripadvisor forums may be edited for a short period of time. Once the edit period has expired, authors may update their posts by removing and reposting them.To read more about editing your posts, please follow this link: http://www.tripadvisor.com/help/how_to_edit_your_postsRemoved on: 5:08 pm, August 08, 2020"
"#1Okay. This is a TCI travel forum. I posted current information about TCI. Level 3 means ""Reconsider travel"". I've reconsidered."
When the OP references a curfew and the increase in the travel advisory rating it infers a crime or safety risk. Other threads indicate that the OP believes there is a crime issue in T&C. I wanted to clarify that the increase from a 2 to a 3 travel rating was not due to a crime spree. Which is why I listed many popular tourist destinations that also had a rating increase. Virtually all the destinations rated by the US moved to a 3 travel advisory. There are only 11 destinations in the world that are a 2 or less right now. As travelers attempt to sift through SO much info regarding travel it’s important to be specific when possible.
"RE: OP, #1, #5 , #7 Do some research... in my opinion, this increase to Level 3 was tied to a recent death that happened as a result of being accosted and killed changing a tire on the side of the road. Any of us, Tourist or Local, could be accosted changing a tire on the side of the road. Information is not positive or negative, it's informative. Just ignore the Property and Business Owners who will try to silence you as they are understandably growing frustrated that their Cash Cow seems to be under the weather and not producing as much Golden Milk as usual. RE: #2: See #1 above. Information is not positive or negative, it's informative. There is some negativity and vitriol being ""spewed"" on this forum, but when I look in the mirror, I just see beauty, brains and rainbows... ;-)Stay Home and Stay Safe.Edited: 12:36 pm, August 09, 2020 "
"Thank you Dagney. I was just searching recent crime and came across the murder of the man on Leeward Highway by ""masked men in a dark car"". https:/…I loved our stays in Provo. This would have been our 5th year in a row. I'm really sad to make the decision to cancel."
If you read the US travel advisories site it clearly addresses the increase. To imply this is crime related is false. If you look at the site you will see MANY popular destinations were bumped up. And it doesn’t take much effort to find the information regarding the specific reason ALL these destinations were impacted. The change in travel rating is not due to crime.
"Lisa, I agree. Be safe."
#10Not false. Me thinks thou dost protest too much.
"Thank you, Irish-fan."
"This is the strangest of posts. I don’t protest....I’m stating facts. On Aug. 6th, 2020 the travel ratings of MANY places were increased due to COVID. Here’s the link to the info:https://wwwnc.cdc.gov/travelI seldom post b/c I leave the lunacy to people who have the time for it. But this post was misleading which was then backed up with.....misinformation. When there are facts available use them."
"RE: #10, #12 I know that the murder happened around 11:00PM on August 5th. You are stating that the State Department advisory threat level raised to Level 3 on August 6th. I am telling you why I think the level rise was tied to the murder, why do you think it was not? Just because other destinations were increased to, or are resting at, a Level 3?The rise in COVID + cases was completely foreseeable and avoidable. The people that think it's OK to travel internationally during a pandemic, are the same people that think the virus is overblown and if they feel OK they are virus free and don't need to take the precautions that the ignorant sheep (their words, not mine) are taking. 13+, 12+, 29+ ... anyone still arguing that this is local spread, and not caused by the influx of tourists, is kidding themselves.Stay Home & Stay Safe!"
"Lisa M - Hopefully we’ll see you next year. The site you are relying on for your decision offers no information about travel to the USA.Okay, this is a Travel Forum, I live in the Turks & Caicos Islands. I want to travel. I need to go to New York. Where would I find similar information about the Level of Fear and reasons which I should consider or reconsider going to New York?I don’t have time to dig thru forums. Due to where I live, I also know, for a fact, just how twisted forums can become with erroneous mis-information posted by person(s) who do not live there nor even visited for years.Dagbey - The incident you refer to happened at 11pm on the 5th. Do you really believe that had any effect on our Level 3 upgrade the very next day? But okay, please ignore me, I just moved in 32 years ago.Edited: 6:06 pm, August 08, 2020 "
"#15. We know, for a fact, this latest increase is locally spread through contact tracing."
Dagney...click on the link I provided. It literally spells out what the NEW rating is in reference to and lists TONS of destinations impacted. And it’s irrational to believe an event on 8/5 influenced the change in travel rating. I have zero issue with calling out the increase from a 2 to a 3. But it should have been communicated factually. It takes a few minutes of due diligence before posting to be sure you’re accurately reporting on something as specific as a travel rating.
"#17 Huh? What ""latest increase"" is known to be locally spread through contact tracing? 3 days ago, if I remember correctly, something like 60-75% of those cases had no epidemiological links. Even if, somehow, the cases yesterday, about which I have not inquired, do have epidemiological links to other cases, it's impossible to know that all of the cases over the past 3 days are/were caused by pre-July 22nd on-island virus, and statistically, it's much more likely that new positive cases were flown in after July 22nd (statistics can be manipulated, but numbers don't lie). The incidents on North Caicos are extremely informative.Stay Home and Stay Safe!"
"#10, #14 We all have it all wrong. ""Curfew"" is a trigger word for some here and no matter what the OP hears will insist she's right. Just like any fire should be considered as arson for insurance fraud. I agree there is zero basis in fact to claim the curfew being reimposed is a response to crime or anticipated crime. I would bet the crime rate is actually down since Covid shut the TCI down. But consider Mr. Heinlein's "" Never attempt to teach a pig to sing; it wastes your time and annoys the pig."" Which is a metaphor to explain the difficulty and pointlessness of communicating a lesson that an individual is unwilling or unready to learn."
"We know, for a fact, these latest cases are related to local transmission due to the island, area, address, last name, car, boat, work place, church, parties, meetings, restaurants, bars, families, daddy, siblings, cousins, nanny and potcakes.Nevermind that ALL visitors, with the exception of one young man, arriving by plane last week had tested negative within five days of arriving here. Hmmmm ... What happens if they return home testing positive?#19 I am home."
"-:- Message from Tripadvisor staff -:-This post has been removed at the author's request. The author may repost if desired.Posts on the Tripadvisor forums may be edited for a short period of time. Once the edit period has expired, authors may update their posts by removing and reposting them.To read more about editing your posts, please follow this link: http://www.tripadvisor.com/help/how_to_edit_your_postsRemoved on: 7:29 pm, August 08, 2020"
"#15 The State Department states ""Reconsider travel to the Turks and Caicos Islands due to health and safety measures and COVID-related conditions."" and ""The Centers for Disease Control and Prevention (CDC) has issued a level 3 Travel Health Notice for  the Turks and Caicos Islands due to COVID-19. "" There is zero mention in the State Department link provided that mentions changing the level to a 3 due to a crime increase.If you go to the CDC site most of the world is on level 3..https:/…map-and-travel-notices.html  "
"-:- Message from Tripadvisor staff -:-Tripadvisor staff removed this post because it did not meet Tripadvisor's forum guideline limiting each user to a single forums screen name.To review the Tripadvisor Forums Posting Guidelines, please follow this link: http://www.tripadvisor.com/pages/forums_posting_guidelines.htmlWe remove posts that do not follow our posting guidelines, and we reserve the right to remove any post for any reason.Removed on: 7:52 pm, August 08, 2020"
"There is a whole lot left out of that police report. That man was engaged to a local girl. They stopped to help someone she knew fix his ride. Those guys knew whose ride that was and tried to take out the dusty boi. Instead, they got the poor guy just trying to help out."
"#23I guess you don't consider staying safe from crime part of health and safety. Your problem, not mine. A vacation is not worth risking my life over."
"#14, #18 You posted a link to the CDC website, how about looking at the US State Department Website which is where Travel Advisories normally are? I'll add the link below:https:/…TurksandCaicosIslands.htmlThe US State Department has issued the TCI a Level 3 Reconsider Travel. In the Box on the Top, to the right of the warning, you will see letters in a circle --- One is a C for CRIME, the other is an H for Health and the C is actually listed First. Obviously, they are both relevant, and in my post #8 I said I believe that the increase was ""tied to"" which means it is a contributing factor. I stand by that opinion. Do you happen to know the nationality of the victim from August 5th?The ""C"" Bubble at the State Department says, among other things: ""Widespread Violent or Organized crime is present..."" Those are Facts. Now, I Do Not agree that the TCI ~ should ~ have a Level 3 alert for COVID OR Crime, but it is what it is.Re: #21 Obvi you're home... the WhereWhenHow Avi & Providenciales location sort of blows your cover... that said, even if you are a Full Time Island Resident, until this virus is more under control, you ~are~ Safer @ Home! ;-)Stay Home and Stay Safe!"
#27 the crime language was there when the TCI was at level 2.
"#27I linked to the U.S. State Department in my OP and frankly, I resent people telling me I am spreading misinformation and should do ""due diligence"" (not you, Dagny, you know who). Nobody else in here pointed out the change in status before my post. And I don't care what the Travel Advisory status is in other countries right now, I don't have a vacation booked in other countries."
"Lisa M you are getting push back because you insist the curfew is crime related and the level 3 advisory is crime related. There are not. They are both due to Covid, not crime. https://www.facebook.com/OfficeOfPremierTCI/"
"Happybubbles,Only you and someone from MN are giving me pushback. Countries and cities don't impose curfews unless they are attempting to shut down crime. You can continue to live in your little bubble of denial, but facts are facts and Dagny pointed them out quite clearly. Give it a rest. DeNile is not just a river in Egypt."
Lisa M and Dagny too. Read the Premiers statement of 7 August available on Facebook linked below. https://www.facebook.com/OfficeOfPremierTCI/
The level 3 travel advisory has to do with Covid. It is like that across the board.
"#31, #33 Think about what you are saying... there was a murder on August 5th, US State Department Threat Level increase on August 6th and the Premiere had a press conference on August 7th. As the Leader of a Tourist driven island, what is the responsible thing to say? That crime is out of hand and may get worse because the pandemic is leading to economic instability? Or to say that the Curfew is all COVID related (while also increasing police presence)? There is some precedent for a crime related curfew... remember last year when drive thru ATMS were turned off late night til early morning? I think it reasonable to imagine that crime is factoring in to some of these decisions. Does having a curfew so people can't hang out and drink well into the evening help stop the spread of COVID? Sure, but to say that the local leaders have not noticed or tried to formulate solutions to the crime problem is just arguing to argue.Look at what Trump said when the pandemic started... something like ""we have 15 cases, but this is going to go away, quickly... like a miracle... we closed the borders to China early"". Leaders/Politicians do not always tell the truth, the whole truth and nothing but the truth. I've said everything that needs to be said. I think people should have relevant information to make informed decisions, but I am not going to argue to argue. Peace Out. Stay safe and Stay home!"
"#32 ""Countries and cities don't impose curfews unless they are attempting to shut down crime.""This is a patently untrue statement. You would like people to believe that the crime has risen so there is now a level 3 advisory on the TCI due to crime. This is false. Not only false but misleading as the reason is Covid related."
"#35 and yet none of the crime activity this or last year changed the State Department level from 2 to 3. To site a single incidence one day prior to changing the level is not really sound logic or rhetoric either. So what was so special about this last murder on Provo that caused the State Department to immediately focus on the TCI and up the level to three? When the ""C"" for crime has been on their website for years?"
Pm and post 35. Everybody reading these. Don ever believe the suggestions from someone from from from Long Island with regards to visiting NYC. They are not the same. A lot of people......from the island (but not all) want to at like they know everything about the NYC.....but they don’t.....they live on Long Island. Not a bad place. But not NYC...........
"#37 There is another thread active now, this situation is also being discussed, the post is informative, it may even be enlightening :https:/…107538953"
"The Spin Doctors song "" Lil Miss can't be wrong "" keeps popping up in my head. Huh, go figure."
"#35 Dagny if crime were increasing don't you think we would hear about it? There is nothing in TCweekly, Sun, magnetic media etc. or Numbers for that matter. If you and Lisa M want to believe your own conspiracy theory have at it but promoting the notion that crime is so out of control they called a curfew is both uncalled for and dangerous."
"The entire Caribbean is stage 3, including anguilla that has had only 3 cases total and covid free for monthsState advisories don’t update within a couple of days of 1 crime happening, and don’t change it over 1 crimeThe true source, video from the the actual premier, you can hear the words come out of her mouth directly, Covid is the reason for the curfew. Some of you can’t see the true source when it hits you in the faceHow can you dispute the premiers own words on video? It’s not clearer, best true source than directly from premier. You can go to Facebook official page and listen for yourself. It can’t be any clearer!"
"Yup, I’m from MN. Giving someone “push back” because I offered a factual difference of why the travel advisory was changed. I’m guessing Anguilla’s change in advisory was due to violent crime as well. Probably same in the Caymen Islands. St. Lucia, Nevis, Aruba, etc....ALL CRIME. Again, the advisory change is Covid related. It’s seriously spelled out on the website very clearly. If certain individuals want to avoid travel due to crime or Covid related matters so be it. I’m a bit astonished that the same posters have literally over taken this forum. These same individuals post opinion as fact. And seem to never stop posting. Simply checking this forum periodically has most people acutely aware of who is unreliable."
#43You seem hyperfocused on Anguilla. Did they also impose a curfew?
"#41The changing of the Travel Advisory Level to a 3 and the implementation of a curfew within days of each other, is NOT a conspiracy theory. If TCI wants to bring back tourists, imposing a curfew on top of a Level 3 Travel advisory is not the way to do it. Simple as that."
How could there be a murder and then the travel advisory gets changed the next day? How fast do you think our government works? (Hint: not that fast.)
All the places to visit that are currently at a level 3 due to covid. https:/…map-and-travel-notices.html Turks and Caicos level 3 due to covid. https:/…coronavirus-turks-and-caicos
"From the State Department Travel Advisory:""Country Summary: The vast majority of crime occurs in Providenciales. Local medical care and criminal investigative capabilities are limited. ""We stay on Providenciales. I also planned a day trip to North & Middle Caicos, I hope I'll be able to get my money back for the ferry and jeep rental. You folks can go on and on and on about Mr. or Mrs. or Ms-C19, but at this point, I have survived lockdown in NY. I still follow all of the masking and sanitizing protocols. The risk of becoming infected in TCI from Covid-19 is not my main concern. CRIME is my main concern and reason for cancelling. Y'all can kneel at the alter of Dr. Fauci, but he has been wrong several times. I saw him sitting in the stands of that baseball field with his mask around his neck. Rules for thee but not for he. At this point, imho, Covid is just an excuse to control the masses and make people give up their freedoms. Disagree with me all you want, I really don't care. My PhD son-in-law (biomedical engineer) is working on a study of hydroxychloraquine with Northwell Health. It works. Had I decided to keep my reservations, I probably would have taken hydroxy as a prophylactic 2 weeks prior to our arrival. I know that roundabout near Beaches well. We always rent a car when we visit. Condolences to the family of the man who was murdered. There is also always the chance of stray bullets. Provo's police force is tiny. It shouldn't matter if the person murdered was a local or a tourist, they're dead just the same. And after 5 months of unemployment, there's no way you can tell me robberies haven't increased. I'd be willing to wager most go unreported because they know who is committing the robbery.So you can bash me all you want for my reasons for cancelling, have at it. This is a travel forum. I was a traveller to TCI with pending reservations. When my State Department says ""reconsider travel"" for whatever reasons (C, H) I reconsider. Besides, weren't half of you gloating over Americans not being allowed in a number of countries? I thought you'd be thrilled I'm cancelling .... LOL"
Make sure you wash that hydroxy down with a glass of bleach. Just to be doubly safe. (joking of course)Where would we be without the vast knowledge of your 4 trips and political insight.
"-:- Message from Tripadvisor staff -:-This post has been removed at the author's request. The author may repost if desired.Posts on the Tripadvisor forums may be edited for a short period of time. Once the edit period has expired, authors may update their posts by removing and reposting them.To read more about editing your posts, please follow this link: http://www.tripadvisor.com/help/how_to_edit_your_postsRemoved on: 8:54 am, August 09, 2020Edited: 8:54 am, August 09, 2020 "
Yes. I thinking canceling your trip is the best decision. Probably best if you don’t rebook either. We are not the place for you.
"#53Ah. So with your 30 posts and zero reviews, you speak for all of the hotels, resorts and restaurants on Provo? That's good to know. What is the name of your business so I know to avoid it when we do return?"
"OP: Thank you for reporting. I saw on one thread someone trying to tell you how to spend your discretionary income. Definitely not cool. Maybe they should pay for people’s trips? People on this forum seem to know more than the US State Dept. and other govt. officials and doctors.Dr. Jim: Thanks for your medical updates.All others, just go into 8/7/20.edition of TCI Sun newspaper, epaper.suntci.com; go to pages 6 and 7. There is a listing of all 2020 crimes. Probably not all.TCI weekly epaper also has 8/7/20 edition, has a listing under crime and court.TCI Magnetic Media also has several reports.Edited: 10:44 am, August 09, 2020 "
"Lady, you have an issue with the crime you think is so bad. I can tell you it isn’t going to get better anytime soon, so stay home. No need to spend money on a place you scared to be. You wouldn’t come to my place anyway, been my experience tourists stay in the hotel area and don’t come where they have too many of us hanging around. And with the things you say about my home, don ‘t want someone like you coming in and looking down your nose at my people.And I may only made 30 posts but we been watching this forum for a while now. I don’t speak for them Graceway boys. You think they care about us? No, they only care about they dollars . They don’t want to upset they guests by making them follow our laws and wear masks. What they worry about? They safe. We the ones in danger of getting sick. Trust me plenty people here not happy."
"#57: Such a shame you are going thru this. Recommend going to the appropriate officials and try to straighten out. It is your country, not ours. Go speak to whoever are the Grace Bay boys and the police. Again, it is your country. Tourists need to feel safe."
"There you are Numbers! You're welcome. I'm in the process of sending out emails to get my refunds. I think I'll call Delta tomorrow to see if they'd rather give me a credit or a refund, I'll take either."
"OP: For your review, wrote something on the American Airlines Return Flight Cancelled thread. It is what it is. You made a wise choice. Until things change, graveling is not a current pleasure coming from the New York area. And then, some do not understand, we spend $10-15,000 for all of this. Usually more if flying a family of five down. Way more. For 8 days, no cooking. Now 2 weeks, maybe. Part of the charm is dining in some of their restaurants and meeting people."
Nobackchat. I wouldn't want us in your country either. Especially now.
"Numbers,I would never fly United or American Airlines after the times they dragged folks (alive and dead) down their aisles in front of other passengers. Delta - the best, Jet Blue and Southwest are the only airlines I will fly, although I would try Icelandic Air if I can ever schedule a trip to Iceland.Edited: 12:43 pm, August 09, 2020 "
"OP: Wow. Never saw that. I had two girlfriends that were supervisors of flight attendants on long-haul flights at United so I sorta know the drill. What stories! Some of my posts have been taken down by TA. Sorry. Again, the truth always prevails and economic, business revenue matters. People need to get a grip on that one. I am a business woman. If the T&C residents do not like what is going on, it is their issue to go to the government officials and straighten out, not this forum. Also, those on this forum who opine, are they flying down to T&C, nope. They just want everyone else to, I have to assume they own property there so ..... n TA you are not suppose to advertise, well, they do in an Indiscreet way. Now, some might pay for advertisement which is getting TA to accept reservations of which they might receive 10% (not sure) of the accommodation rate. Who knows? Does not matter. Not safe currently flying plus a hassle.Glad you purchased a home generator system. They are great."
Lisa M....you mentioned I’m focused on Anguilla and asked if they have a curfew too. I didn’t ever mention Anguilla on its own but did indicate it’s also a level 3 advisory. And Anguilla isn’t reopening to tourists until Oct. 31st at this point. Just like all the other Caribbean destinations it was bumped to a 3 recently due to Covid.
