"Lisa M, Shusun the language ""Country Summary: The vast majority of crime occurs in Providenciales. Local medical care and criminal investigative capabilities are limited. "" is exactly the same language when the TCI was at level 2. While there is crime especially on Provo it rarely involves tourists. The TCI is still one of the safest destinations in the Caribbean. If you exercise common sense you will not have a crime problem visiting the TCI. The level 3 designation which virtually most locations is now at is due to Covid, not some drastic increase in crime. A Curfew in the TCI is not the same as a curfew in 1968 Detroit. With a small police force the only way to control crowding and gatherings is to have a curfew which running from 10:00 PM to 5:00 AM will have little impact on tourists. Lisa M be prepared to be shocked, shocked I tell you when you find out how much fuel your new home generator uses. Embrace the power outage, think of it as camping out. After Gloria on LI we were out of power for three weeks. When Ike hit GT we had no power for two months. Sorry the TCi won't see you this year."
"Happybubbles,We have street gas. I don't care how much it costs to run the generator if it saves a refrigerator full of food and runs the heat or A/C as needed."
"#66Hey, you were the one who brought up Anguilla for comparison, so I guess the answer is NO, they don't have a curfew. Thanks for playing."
"<< “ If you exercise common sense... “ >>Well, there’s yer problem right there.:-)"
#70Go make ice cubes. :-)
"#67: Your analogy against Lisa ... a joke. One’s primary residence is the most important. Flying for a vacation is another story. Most people go away, to get away, not deal with more issues. Do you now understand? I personally think it is great, entire home generator! Makes life easier and they can afford. Who wants to worry about all these things on vacation? Everyone, spend your hard-earn $$ the way you want. No one gave anyone the right to tell you how to spend your discretionary cash.I hope #67 has already flown down to T&C, staying for a month and spending their $$ there to help out the economy. They would love it. Go in season or pay the higher rates. It helps to add to the 10% mandatory service charge ... the workers can make some $$.Plenty on this forum that opine go during the “low season”.Edited: 7:11 pm, August 10, 2020 "
"Oh, even a better one. Everyone can boast to their friends and family, going to T&C. The world is aware that grace bay beach is number one and when they look up the rates for accommodations p, tax, service charges, expected tips and airfare, most cannot afford such an extravagant vacation. Some can, good for you. No jealousy here."
"#72 thank you for your insightful yet seemingly random stream of consciousness analysis. Completely wrong but insightful and entertaining none the less. The deduction that curfew means crime is simply not correct and unfortunately at least one other person has now bought into this false and ignorant notion. No I do not understand. Please do enlighten us all. I have no opinion about what Lisa M does with her money. I am just telling her that the fuel bill will be surprising. I lived on Long Island for over 42 years. Many people got home generators after Gloria and Sandy and universally the comments from these people was about how much fuel they use. I lived in Suffolk which does not have a lot of gas mains. So people got propane only to find out the tank was empty after two to three days and couldn't get it filled quickly either. That's it. Nothing more, nothing less. OK with you? We know you reserve unto yourself the right to tell people what to do with their money. #67 would never do this as he respects other people's decisions.#67 has been visiting the TCI on a regular basis for over 26 years but does not stay on Provo. #67 has waived rents due from an owned commercial rental property since January and for an entire year after Ike. Also 8 months after Maria and Irma. #67 has also donated to various charities in the TCI to the tune of over $5K post hurricane Ike. #67 has also put over $20K of his own money to date into the tenant business (that currently has no business) so staff can have a roof over their heads, food on the table and employment if things ever get back to normal. #67 routinely flies down for hurricanes to help people, friends and businesses set up for and rebuild after their passing. Hopefully these actions could be considered by yourself as helping out the economy. But I'll make sure to add to the 10% service charge next time I am there since I'm not so cheap as to tip just 10%. What have you done for the TCI lately other than to tell people not to go?"
62...you talking sense.
"-:- Message from Tripadvisor staff -:-Tripadvisor staff has removed this post because it did not meet Tripadvisor's forum guidelines with regards to off-topic chat. Please limit conversations to subject matter directly related to the host forum. For example: when in the London forum, please stick to topics that relate to travel within the London Metropolitan Area.Off-Topic Chatter is a forum for discussions gone afield from the topic of travel. Please note that the Off-Topic Chatter forum is un-moderated -- the Forum Posting Guidelines are not enforced, with the exception of pornographic images or text, hate speech, unauthorized re-prints of copyrighted text, and messages that promote or encourage illegal activities. Each user is expected to take responsibility for his or her own conduct.To review the Tripadvisor Forums Posting Guidelines, please follow this link: http://www.tripadvisor.com/pages/forums_posting_guidelines.htmlWe remove posts that do not follow our posting guidelines, and we reserve the right to remove any post for any reason.Removed on: 7:13 pm, August 10, 2020"
"#76: I have a second home in the area. I truly understand. Everyone just had plenty of damage. Have no idea who this bubbles person is but she does not pay your bills. Maybe she likes to spend other people’s $$. She loves Grand Turk, well, they have crime, losing $$ via cruise ships and their horses are dying because no one is taking care of them. What gives?You are spot on and Dr. Jim is, too. Maybe some day I shall meet you in Grace Bay. De iced, just staying t the Grace Bay club. If famiky comes, staying again at their estate section. I have no worries, everything close, no rental car and walk to the best restaurants via a rod or the beach. Great service, great amenities, etc. the other one is Pareot Cay or Seven Stars to make everything easy. Hartling Group, needs people supervising the staff. Shore club is absolutely beautiful but too far out of the way for the good restaurants if staying just six nights. They have issues with cabs. It is on TA reviews. I see they are recruiting for new staff. Yes, I read all the reports.Edited: 5:31 pm, August 09, 2020 "
"#74, while it’s none of our business, and you don’t have to defend yourself,Awesome and thank you!"
"#76 I never mentioned the price of natural gas. Perhaps you need to get out your reading comprehension glasses. My observation which was neutral and about the efficacy of small plant electric generation. It's remarkably inefficient which means nothing more than you may be surprised at how much it costs to run the unit. That's all. I'm sure you will enjoy the unit once it's in and running. The physics of power generation is not time dependent nor am I unfamiliar with using whole house generators. I have an 8KW here in Maine last used about 6 months ago. But I certainly do not miss the electric rates on LI which I left 4 years ago. Is that antiquated? Who cares? I'm not giving you advice. Be happy to is you want it. May as well try third person since Numbers still doesn't get it. Now even more so.Edited: 6:30 pm, August 09, 2020 "
"#77 the cause of the recent horse deaths are unknown. They are not the horses owned by Chukka who ran a tour for Carnival and abandoned them. Local volunteers are feeding these animals now. The horses that dies are all privately owned horses. The TCSPCA and the Gov't Vet are looking into why they died. They did not die from starvation. Want to help? Maybe donate some $$ to TCSPCA. But I suspect not. All talk. Crime ? Sure. Every place has crime. Lot less of it on GT than on Provo though. Thanks for the epiphany. Wow. You mean because the cruise terminal is shut down and the flights from Provo have now stopped for another three weeks this may effect tourism related income? Thanks Numbers, I never would have figured that out. Maybe if I had that map.......Both #76 and #77 could benefit from better reading comprehension skills. But I'll ask again.Numbers....What have you done for the TCI lately other than to tell people not to go?"
"Will write trip report upon return. Just got here Thursday with my husband and four kids. Booked before I thought things would go on this long and struggled on decision. Had Dr call Orders in- went thru hospital system where MyChart account is linked and the test was uploaded in 8 hours. Donned our masks and goggles on empty Delta flight, and currently at West Bay Club. Feel safer here than my town in CT. Guests wearing masks about property except while lying on lounge chair by pool or beach. They are doing an outstanding job. Few people here. We don’t roam around at night - have an early dinner at best. Dined at shark bite last night and were the only people on deck. Had an uneventful drive to grace way this afternoon where all were wearing masks. Security guard sprays your hands before you go in. Sunset is currently a level 10!"
#78 Blamona....Numbers needed to know as she alluded to me needed or perhaps was chiding me to go for a month so I could help the economy. I'd rather stay here for the rank hypocrisy being spewed by two of the posters here.
You didn’t see the videos of Chukka’s horse enclosure?
"TCKitty...that is wonderful to hear that guests are wearing masks at WBC! There was an earlier poster that stayed at SS stating masks were not required nor saw anyone while on the resort.Just curious, does WBC have signage up stating that masks are required?Enjoy your stay with your family!"
"#83 NoBackChat Thank you for posting on these forums. Please keep it up, A local perspective is very welcome. I have seen the video but the horses that recently made the TCWeekly news are not the same horses. There maybe some kind of disease or some kind of poison in the environment. No one knows yet. I wish Government would fine Chukka for the way they treat their horses and use the money to feed them . It's not the first time they've done it and there have been numerous complaints over the years about their treatment. It should not be solely up to volunteers to fix this problem."
TCKitty Thanks for sharing Great to hear from people who are actually THERE. Look forward to final trip report if you would be so kind to write one.
"I will check but they are so on point here with their set up to decrease contact. You scan your phone to QR code where you pull up all menus on phone. If you need anything at all you text from your phone to one number- when you want room cleaned, food drink- whatever. No buffet breakfast anymore but beautiful ready to order breakfast included. There is such a sense of respect here for each other it’s really nice to see the masks on everyone. Believe me- I was super high stress about traveling during pandemic. I normally fly direct on Jet Blue from JFK and back when I made reservation thought it would be better to fly out of local airport. I wasn’t thrilled with connecting through Atlanta but my connecting gate was directly across from first flight and there was barely anyone there. I travel for work and never went through that section - must have been international terminal."
I would be happy to! It’s our 20th year here and I have stayed all over but fell in love with WBC and have been here every August for ten years. Right now reminds my of what it was like ten years ago in August as far as number of people. Using the same caution here as I do while home and everyone has been super warm and welcoming everywhere we go.
Thanks TCKitty! It sounds like WBC is doing the best they can in this new travel world! I’m very impressed with the guidelines that WBC have taken to keep both staff and visitors safe. Enjoy!
"TCKittyMaybe start a new thread so your story doesn't get lost in all the inevitable clutter that the TCI Forums have devolved into? Yes I am guilty but not as expert as others. It so nice to hear a trip report instead of the ""don't go there"" nonsense. Glad you made it. Enjoy."
"-:- Message from Tripadvisor staff -:-Tripadvisor staff has removed this post because it did not meet Tripadvisor's forum guidelines with regards to off-topic chat. Please limit conversations to subject matter directly related to the host forum. For example: when in the London forum, please stick to topics that relate to travel within the London Metropolitan Area.Off-Topic Chatter is a forum for discussions gone afield from the topic of travel. Please note that the Off-Topic Chatter forum is un-moderated -- the Forum Posting Guidelines are not enforced, with the exception of pornographic images or text, hate speech, unauthorized re-prints of copyrighted text, and messages that promote or encourage illegal activities. Each user is expected to take responsibility for his or her own conduct.To review the Tripadvisor Forums Posting Guidelines, please follow this link: http://www.tripadvisor.com/pages/forums_posting_guidelines.htmlWe remove posts that do not follow our posting guidelines, and we reserve the right to remove any post for any reason.Removed on: 4:55 am, August 10, 2020"
Did I hijack? I was trying to point out that even thought there was a level 3 it seems very organized and calm here if you are a visitor.
TCKitty...great point by HappyBubbles. It would be wonderful if you would start a new thread with your great info. Love your positive experience on Provo but unfortunately it might be lost on this thread. It would be great if you could share separately!!
I was trying to calm people by pointing out a positive experience. I have been on this site for many years but I am not sure what happened- people were always friendly and helpful and is become so controversial. To me it’s a positive topic in general. I am always happy to share negatives and truths as well but it’s just gotten really weird here.
"#94 That is very altruistic, but no one needs to be ""calmed"". All this forum needs is the free and fair exchange of useful and up-to-date information. If I understood the intent of the OP, the point was to advise that as of August 6th, the US State Department had increased the threat level in the TCI to 3.I agree that your experience @ West Bay Club, especially contrasted with the reported experience at Seven Stars (link below) would be generally helpful to travelers, but I also agree that posting your mini-""Trip Report"" in a thread titled ""Level 3"", might not be the most generally useful.https://www.tripadvisor.com/ShowTopic-g14739…I still believe that everyone is safest right now @Home.Edited: 12:40 pm, August 10, 2020 "
#92 Not at all. It's a public forum. Good on ya.
Dagny “ free and fair exchange of up to date and useful information”. I am giving you just that from the island as we speak. I’m sorry it’s not a nightmare story but it is what it is- calm. I respect anyone’s decision about travel during the pandemic. I have been here before during “level 3’s as well due to crime and am hyper cautious about what I do. Hope that people coming on trip advisor who are not a part of this established group continue to find help here.
"#97... you are the only one who mentioned a ""nightmare"" of any kind.In fact, I posted a link to your thread in the thread about Seven Stars not requiring guests to wear masks while walking about the property. My intent is, and has always been, to support the free and fair exchange of information. I was telling you that your positive report might actually get lost in a thread titled ""Level 3"". I was amplifying your positive report. A lot of people drink the kool-aid that I have some sort of negative agenda, which couldn't be further from the truth. Review my post history, you will see that Seven Stars is my favorite resort, but if they are not keeping people safe, then maybe a little public shaming will lead them to make a policy change. That was my point and purpose... as it is always: traveler and resident Safety.You can read my words in black and white @ the link below:https:/…107548668Stay Safe and Stay Home!"
"Dagny- I saw that and it’s very nice you wrote that. Some of us don’t spend a ton of time on here so if we violate your rules of how you like threads written it would be kind not to bite that person’s head off. I was unaware I was hijacking a thread as Lisa from Long Island pointed out. People hop on here looking for information. It definitely seems like you all have your own group with your own rules on a public forum so forgive me for not knowing them. Safety is extremely important to me and I wanted to point out that currently I felt very safe.Edited: 9:07 pm, August 09, 2020 "
"Re: #99 I certainly have no ""group"" on this forum, nor do I have rules. Would it surprise you to learn that my post #8 on this thread, which violated no guidelines, was flagged as Inappropriate by the Community this morning, removed and reinstated? Additionally, did you notice that I did not post about the murder of the American on August 5th until other members, in earlier posts on this thread, were bullying the OP? Some of those posts are now removed, but that is what happened. If you support the free and fair exchange of information, then please continue to share your opinions and experiences, positive and/or negative, and I will continue to support you.Stay home and Stay safe!"
"#99 TCKitty... Please do not apologize. Wonderful to have a trip report You are not hijacking a public forum but unfortunately there are a few members here that think Trip Advisor is ""their"" personal property. I thought Lisa M was out of line but she is predictable which is why I suggested starting a new thread/topic. How DARE you step on her topic (sarcasm).People DO come here looking for exactly what you posted. Real honest information. The TA forums are supposed to be about travel info, just like you posted. But sadly most of the posts are from the same people, spouting the same negative opinions. People are not coming here to read pages and pages of regurgitated nonsense they are looking for exactly what you posted."
Thanks Dagny. This doesn’t feel free to me. It feels kind of stressful. I’m here now so if anyone needs help please reach out. Stay safe and stay sane!
Thanks Happybubbles. It’s been a while since I’ve spent a lot of time on here - I see what you are saying.
"I'm late in addressing this, but I'm so confused!On one hand we have #15 and #19, who works so hard for posts on TA, screenshot deleted posts and always working hard at reinstating her opinions. Someone working that hard has you believing what she says is fact, even when she's telling the Premier how to do her job. Speaks about crime and pandemic with such passion. When TCI was raised to level 3 I believe she believes it was 1 incident on the 5th, even when the entire world was raised to level 3 except Cambodia. She believe's so strongly that she almost makes me believe. She knows (yes knows) that TCI pandemic is spiked due to tourists. Such passion keeping up with posts I believe her!So the WHOLE world is upgraded to level 3 except Cambodia and the reason for TCI upgrade is suspect?Then we have #17 and #21. Lives on island 32 years. Is on the actual front lines. Knows many on island (hey it's a small island!) and knows the spike is traceable, and not to tourists.Such contradictions, who to believe?Then we have the boat parties with no social distancing or face covers. Coincidently cases increase, before borders are open.Then we have actually video straight from the premier (go to official FB page to see for yourself) and know that all cases except 2 are locals (her words not mine, sorry) and minister of health right after says majority of cases are Blue Hills, a non-tourist area, and islanders are not wearing face coverings. #17 works so hard reinstating posts, collecting old posts back up that were deleted at the time, making lists of what to do, so passionate that she almost convinced me!But #17 is so convincing that her opinion is the truth, that she debates #21 who lives there!So I think I just made up my mind, I'll believe #21 and the actual words of the premier.But thanks for trying!If we listen to the premier and minister of health, it sounds like islanders have a better chance of giving tourists Covid! I'm not confused anymore, just convinced myself to believe the person actually living on island."
I was thinking along the same lines Blamona. Thus why I am protecting myself in the exact same manner I would at home. I think the Premier has done an excellent job with tourists. It was really difficult getting in here and it s smart on her and the country’s part
"Simple answer..EVERYONE should wear masks. Why are you ( Blamona) ignoring the fact that tourists are not wearing them or asked to overall? I can’t believe how some people don’t understand. It’s what the premier has stated as also the Minister of Health.Edited: 9:55 pm, August 09, 2020 "
"I’m not ignoring the factsEVERYONE should wear masks, let’s be clearBut facts and opinions are different from each other as I stated as to where the cases are coming from and why it’s level 3And when did I say don’t wear a mask? Where did that come from?Again everyone should wear masks"
"Re: #104 and Others: Wishing, hoping and wanting something to be true, Does Not make it true.You know what is true? COVID-19 is spreading in the TCI, two weeks after Tourists were welcomed back, much more aggressively than before Tourists were welcomed back.Re: your relying on the Premier and the author of #17/21 to be the authority on COVID in the TCI, let me give you an analogy (I hope this makes things easier to understand):As of today, the US has almost 5 million cases and 161,000+ deaths. If Jane Smith, living on Main Street, Newton, Massachusetts USA thinks that those numbers are false, and that the virus is a political ploy/hoax that will go away the day after the election in November 2020, should we believe her because she LIVES in the USA? What if the US President tells us that we only have 15 cases and the virus will disappear quickly, like a miracle? Should we believe him? He IS the Leader of the Country, right?If the author of #17/21 lives on the island of Providenciales for 32 or 100 years, and states that ALL cases have known epidemiological links, and the Premier says that the transmission is local only, should we believe them? Like we should believe US Resident Jane Smith and the US President?Now, that said, do you believe US President Trump about COVID OR do you believe the US Centers for Disease Control (the CDC)? Because the TCI Health Department, which is close to the US CDC, states that the stats for ~only~ the past 3 days (I don't even have a Facebook account but I asked a contact who was giving me stats to get me an ""official"" source so I could post a link here) are:https://www.facebook.com/tcihealthpromotions8/9 19 new cases -- 18 known epidemiological link, 1 unknown8/8 27 new cases -- 21 known epidemiological link, 6 unknown8/7 29 new cases -- 18 known epidemiological link, 11 unknownThe website has more dates and more daily totals, with more unknown transmission.So, with all due respect to the Tourist based business owner/DE referenced in your post #104, I am going to get my stats from the TCI Health Department, like I'll get my stats from the US CDC, not Jane Smith or President Trump.And speaking of local spread coming from locals. Please direct me to the location of the Resort Staff Housing along Grace Bay Road. I know there was some staff housing built near Seven Stars, but, I believe that the rest of the staff employed in the majority of the Resorts on the island live in places on the Island where the virus is spreading. Just as I, and others, suspected. These workers are most likely taking the virus home from work as a potentially deadly present to their families.Would you like to share with the readers on the Forum how many of you posting on this thread/Forum own homes/property and/or businesses on the islands? How many work for the TCI government? I'll start... I own nothing in the TCI and choose to vacation there because I love the Ocean and the Residents (who I am trying to keep safe).Stay Home and Stay Safe!"
"To use #108 analogy, because #108 says it it must be trueWhen the ministry of health states majority of cases are in Blue Hills, and scolds residents there because they’re not wearing masks, and there’s videos of locals on boat parties not wearing masks, then going to work at a resort, logic will tell you your thinking is backwards—better chance of a local currently giving it to a tourist!You’re assuming and stating it as fact. You’re assuming because someone was not traceable it was a tourist. How do you know it wasn’t a local from blue hills who hasn’t worn a mask?See how that works?"
