"Quoting #104 author of #109:""Then we have #17 and #21. Lives on island 32 years. Is on the actual front lines. Knows many on island (hey it's a small island!) and knows the spike is traceable, and not to tourists.""""Spike is traceable""?! Huh?! Here are two more dates from TCI Health... 8/6 12 new cases -- 1 known epidemiological link, 11 unknown8/5 13 new cases -- 2 known epidemiological link, 11 unknown...that's 22 untraceable cases in those 2 days, added to the 18 other untraceable cases referenced in my post #104 over the past 3 days (but it's definitely local to local transmission, right? transmitting virus that was on the island pre-July 22nd. That's not just wishful thinking?).And, PS: 1) that's not how analogies work, and, 2) don't believe #108 because I posted it, believe the stats of the Health DepartmentStay home and Stay safe!Edited: 2:17 pm, August 10, 2020 "
"-:- Message from Tripadvisor staff -:-Tripadvisor staff removed this post at the original author's request.To review the Tripadvisor Forums Posting Guidelines, please follow this link: http://www.tripadvisor.com/pages/forums_posting_guidelines.htmlWe remove posts that do not follow our posting guidelines, and we reserve the right to remove any post for any reason.Removed on: 4:55 am, August 10, 2020"
"-:- Message from Tripadvisor staff -:-Tripadvisor staff has removed this post because it did not meet Tripadvisor's forum guidelines with regards to off-topic chat. Please limit conversations to subject matter directly related to the host forum. For example: when in the London forum, please stick to topics that relate to travel within the London Metropolitan Area.Off-Topic Chatter is a forum for discussions gone afield from the topic of travel. Please note that the Off-Topic Chatter forum is un-moderated -- the Forum Posting Guidelines are not enforced, with the exception of pornographic images or text, hate speech, unauthorized re-prints of copyrighted text, and messages that promote or encourage illegal activities. Each user is expected to take responsibility for his or her own conduct.To review the Tripadvisor Forums Posting Guidelines, please follow this link: http://www.tripadvisor.com/pages/forums_posting_guidelines.htmlWe remove posts that do not follow our posting guidelines, and we reserve the right to remove any post for any reason.Removed on: 12:33 pm, August 10, 2020"
OP: I am sure you saw. For others the newest e-papers of TCI Sun and TCI weekly lists all 2020 crimes year-to-date. TCI Magnetic Media also has several media announcements. This should help for no fake news.
Pages 6 and 7 of the TCI Sun e-newspaper has the listing.
"#114 The curfew is as follows per the Premier. ""Effective Monday, August 10, 2020, the Curfew on Providenciales will be from 10 PM to 5 AM each day, and from 8 PM to 5 AM on North Caicos and Parrot Cay."""
"A side note, Parrot Cay has no crime, yet has a curfew. Currently closed through October tooMy opinion, but that leads one to believe it’s covid related (as the previous curfew on Provo was covid related too)"
"#117: Old news. Anyone who knows where Parrot Cay is located knows there is no crime; a tad remote. That is why when flying into PLS one has to take a car service and then a ferry there. Added costs. Great place to unwind. Just some added info, great place to stay for four days and then move over to Provo before flying home. Grace Bay Club and Seven Stars are two great resorts.Edited: 11:40 am, August 10, 2020 "
"I stand corrected on the Provo curfew as reported in the TCI Sun. Also, it is for 3 weeks starting August 10th (today)."
"I would appreciate an apology, #108, for the completely unnecessary and vicious personal attack. Do you think comparing what a person says on this forum to what your country leader says will endear you to anybody? You have seriously gone too far.The curfew is Covid related.Not everything makes the newspaper.You and your Ilk would just LOVE what doesn’t.The recent spread of cases is within our communities and coincides perfectly with certain events.No visitors arrived with positive tests for CV-19.With exception of one."
"#119: Do tell. What did not make the newspapers? I am sure some crime. Realize some Covid issues, too. Your govt. is doing a good job because you do not have the medical facilities for all Covid cases. It is what it is. What a mess! Gotta love people on these forums saying come to T&C. Yes, a hassle and then all of us tourists miss the beautiful beach. Hopefully things will get settled by 2021."
"Re: #119 -- There was no personal attack, viscous or otherwise. The author of #104 & #109 was quoting you as an authority on COVID case transmission in the TCI. I was stating that you, by virtue of living on the Island, are no more an authority than Jane Smith living in the US. I was making an analogy.I was also comparing relying on the Statements of the TCI Premier (the Leader of the TCI) to the Statements of US President Donald Trump (the Leader of the US). Making another analogy... and making the point that what Leaders/Politicians say is not always 100% reliable.I then provided a link to the TCI Version of the US CDC which was providing data that, frankly, contradicted you and the author of #104/#109 and stating that I think that the data from TCI Health is more reliable than statements from either you or the Premier. See... no insult: personal, viscous, or otherwise. Just a misunderstanding, it seems.Another misunderstanding: I never said the Curfew was Not COVID related. Ever. What I did say was that there was some precedent for a crime related curfew (ex: the closing of the ATM because of crime last year), to show that the OP's linking of the 2 could be a reasonable conclusion and Not a malicious attempt to sully the reputation of the Island. I also suggested that imagining that the TCI Government thought that the Curfew could kill two birds with one stone (stopping the spread of COVID and reducing crime, which tends to happen in the later/overnight hours), would also Not be unreasonable. Side Note: This is similar to my stating that the Level 3 rise could be ""tied to"" the August 5th murder. Meaning: Even IF the Level 3 threat level IS as a result of COVID, that is Not to say that IF there was No COVID the Level would Not have been raised. I am sure that by the time the Level was raised on the 6th, the State Department knew about the American murdered on the 5th. That does not mean that the Murder on the 5th ~caused~ the threat level rise on the 6th, but I am arguing that it was almost definitely known, evaluated and considered and it Could Have been the reason for the increase (absent COVID and, even if there was an existing plan to raise to 3 because of COVID).I agree that the spread of cases AND the increase/spike in cases coincides perfectly with certain recent events, and I posit that the infection/positive case graph, to me, demonstrates that it is more likely than not (with COVID there can be no certainty) that the spike is due to the entry of Tourists. Google a TCI case graph and see for yourself. Hope this educates and clears up the confusion.Stay home and Stay safe!"
"My request (#120) for an apology stands.Your lengthy attempt at explanation does not even match what you said.The misunderstanding is yours. Nowhere is anyone standing me up as ‘authority’ ever, actually. You owe Blamona an apology.You did make a comparison to me and Trump in paragraph 6. You owe him an apology, too. Saying I lived here 100 years (?) a total exageration. And I never said “all the cases are traceable”, your total fabrication. Unknown links are simply that.Do you ever reread what you write? You could save yourself alot of misunderstandings about the misinformation. My request for an apology stands."
"-:- Message from Tripadvisor staff -:-Tripadvisor staff has removed this post because it did not meet Tripadvisor's forum guidelines with regards to off-topic chat. Please limit conversations to subject matter directly related to the host forum. For example: when in the London forum, please stick to topics that relate to travel within the London Metropolitan Area.Off-Topic Chatter is a forum for discussions gone afield from the topic of travel. Please note that the Off-Topic Chatter forum is un-moderated -- the Forum Posting Guidelines are not enforced, with the exception of pornographic images or text, hate speech, unauthorized re-prints of copyrighted text, and messages that promote or encourage illegal activities. Each user is expected to take responsibility for his or her own conduct.To review the Tripadvisor Forums Posting Guidelines, please follow this link: http://www.tripadvisor.com/pages/forums_posting_guidelines.htmlWe remove posts that do not follow our posting guidelines, and we reserve the right to remove any post for any reason.Removed on: 6:30 pm, August 10, 2020"
"#123 and #124: please go into tci magnetic media and really read the entire news clip of today. Maybe this can calm things down. Bottom line, Covid and how to enter PLS airport for a resident or tourist. Everyone is having a problem. Stay home; stay safe. Sorry, their economy is going to suffer for awhile."
"re #124 Must you continue the personal insults. I now need to be armed on a travel forum? I am a DE and used to be able to share my spare time and knowledge with persons who were actually looking for help with their vacation plans.1. The word authority appears no where. I do not and never have held myself out as such.2. (omit)3. Then make the point without exagerations.4. I stand by my words. Probably should have included the word SOME, but it is very obvious that not ALL are traced and known. Those that are nameless were just a face in the crowd.5. AND again I said “arrived with a positive test”. You are taking great liberty to add and twist my actual words.I do not need links to anything Turks and Caicos.Again I am asking for an apology."
"For anyone interested and following this thread because of the Level 3 due to COVID, the new positive numbers for August 11th-August 12th are:17 new cases.... 11 with epidemiological links and 6 with unknown transmission.I am not sure who the ""unknowns"", who are ""just a face in the crowd"", are (or what exactly that means), but anyone on the island (or planning to go), should make sure that they follow all appropriate health recommendations: wear a mask, distance, wash your hands, disinfect and take care of yourself and others.Stay home and Stay safe!"
"-:- Message from Tripadvisor staff -:-Tripadvisor staff removed this post because it did not meet Tripadvisor's forum guideline limiting each user to a single forums screen name.To review the Tripadvisor Forums Posting Guidelines, please follow this link: http://www.tripadvisor.com/pages/forums_posting_guidelines.htmlWe remove posts that do not follow our posting guidelines, and we reserve the right to remove any post for any reason.Removed on: 8:39 pm, August 18, 2020"
"20 a day!?? Woow, that seems like a lot for a very small population. That's off the charts if you look at larger populations."
Ya but 20??? That's huge. People in Turks have a very high ratio of Diabetes and hypertension.
"I can't imagine they were sent back. But, even with them still there , they can't reform the whole system. That ""hospital"" is a little shop of horrors ."
"#134: You have that one correct. One needs medivac. To be honest, when a medical condition is very serious, their govt. medivacs the patients out of the hospital, country. Known fact. To be honest, happens on several of the islands.Edited: 2:56 pm, August 13, 2020 "
"I just wanted to take a moment to update this thread, since there was a lot of discussion about the State Department Level 3 designation re: COVID and/or Crime. Just today, a local paint and supply store on Leeward Highway in Providenciales, announced that because of a rise in crime, it is closing indefinitely. The exact language announcing the closure is: ""Will be closed from today August 31st, 2020 until further notice due to the alarming increase in crime.""Here is a direct link:https://www.facebook.com/tcipaintsupplyI am adding the posts below, so it's clear that this is a Tourist board and Tourists shop for all types of things on the Island:Tourist looking for a pull-out couch:https://www.tripadvisor.com/ShowTopic-g14739…Tourist looking for a Blow-up Air Mattress and/or Blankets -- suggestions were KB Homes on Leeward and/or Do It Centrehttps://www.tripadvisor.com/ShowTopic-g14739…Staying Home is Safer!Edited: 6:07 pm, yesterday "
If you two hate the island so much don’t come back and leave this forum. You have to be the two most depressing people around.
Silly me... last time I was looking to buy a pull-out sofa while on vacation it never occurred to me to shop at a paint store.
"RJP, priceless"
"#137--Love IT, agree !!"
"RE: #138 I do not make the rules, but I have learned how to abide by them. I could have added this to the Safety and Security thread, but since I believed this was more timely and appropriate, I added the information here.Just like with the increase in COVID, many TCI residents are unhappy with the increase in crime. Residents are probably more frustrated than tourists b/c we can choose to vacation elsewhere, but the disease and crime spread is happening where the locals live.There was disagreement about crime on this thread. I just pointed to a local source that agreed that crime is getting out of hand. Reading all of the comments on the company's page is actually more informative than the Closure notice itself.PS: #137 TurksInsiders and #140 TCILover the screen names really do say it all.I love the TCIs but right now, Staying Home is Safer!"
"Dagny - What is the motivation? You are not more advanced or knowledgeable than many people here. I agree that posts should be forthcoming re: ownership and personal interests when posting recommendations and with openness but not over dramatization re; crime but you are just as guilty of those you seem to act against. I can’t help notice that your posts increase just as “numbers” decreased. And when “numbers” went on TA vacation early this year, Lisa M suddenly came alive. As someone noted, a lot of heads here. I’m sure more heads will come out. If you have an axe to grind just be honest but don’t play the role of as some sort of moderator/educator. You’re not providing a service at least to me as a traveler on this forum. You need to start backing your stuff up before your dig up your old posts to distract and deflect. Just sayin’ - one mass hole to another"
