"I asked this question on the Maui Forum it's just starting to pickup speed, so I thought I'd ask the same question here since so many visitors come to Las Vegas from overseas.Is the outbreak of the Corona Virus starting to altering your travel plans to Las Vegas?"
The Wuhan novel coronavirus (2019-nCoV) is not affecting my thoughts more than common flu. Common flu is causing more complications/deaths throughout the world than 2019-nCoV.I hope the current hype doesn't affect attendance or celebrations in Las Vegas. 2019-nCoV is no more of a consideration for me than common flu that might be happening in Las Vegas.
i must admit this has crossed my mind but as my flights are booked i will still be going unless the foreign office says otherwise
"Every time there is a new strain of the flu, hysteria breaks out. No, the outbreak of the coronavirus won't alter my travel plans."
Not at all. Why should it? I could always barricade myself at home until it's all over I suppose.
I was on the Strip over the past several days and many Chinese and Asian visitors are wearing masks. LAS airport and other airports in the US may start to restrict direct flights from China to the USA.This is a very popular time for Asians to visit Las Vegas with Chinese New Year. They bring a lot of $$$ to gamble. Time will tell on this.
"Asian gamblers from Asia no longer go to Las Vegas, they go Macau, casinos are booming there. The Asians you see in Las Vegas are Americans, nothing to do with Coronavirus."
"-:- Message from Tripadvisor staff -:-Tripadvisor staff removed this post because it did not meet Tripadvisor's forum guideline limiting each user to a single forums screen name.To review the Tripadvisor Forums Posting Guidelines, please follow this link: http://www.tripadvisor.com/pages/forums_posting_guidelines.htmlWe remove posts that do not follow our posting guidelines, and we reserve the right to remove any post for any reason.Removed on: 6:36 am, January 29, 2020Edited: 6:36 am, January 29, 2020 "
"""Asian gamblers from Asia no longer go to Las Vegas, they go Macau, casinos are booming there.The Asians you see in Las Vegas are Americans, nothing to do with Coronavirus.""Ummm...... No."
"Just the facts, ma’am.“ The number of Chinese tourists to the western U.S. state of Nevada has been booming in recent years, who have significantly contributed to the local economy, a tourism official said.Tourism remains Nevada's No.1 industry, driven greatly by the influx of Chinese, said Bethany Drysdale, chief communications officer of Nevada Division of Tourism, in a recent interview with Xinhua via email.Drysdale noted that the Silver State has witnessed an increase in Chinese visitation year over year since Nevada began to market travel to China in 2004.”https:/…index.html"
"What if there were Chinese visitors in Oroville, CA? Would you go to Vegas to eacape?"
I'm watching to see if it lowers hotel or flight prices temporarily.
"Would'nt change my trip to Vegas at all. I may be more aware of hand-washing after touching the slots or other things,but Im not worried at all. As said above,the flu thats here now is more concerning."
"No. I'll just keep drinking Corona Lights with lime and hope I don't get the regular flu, coronavirus, bronchitis, mono, or any other illness."
"@10 Lol, Chinese visitors to Oroville. Not worried no one visits Oroville."
"I will admit, to wondering if we know the true facts about the virus. 50m+ people under quarantine, building three 1,000 bed morgue like hospitals in 10 days and US officials being much more proactive about stopping the virus from reaching our shores than other previous viruses. The flu ""seems"" more concerning, so why don't we take all the above precautions to stop the flu???OK the tin foil hat fell off, time to travel to Vegas."
"Eh, one of the US patients is in a hospital 30 mins from me and reports to be doing ok in isolation. Am I any safer here than Vegas? While the death toll seem to be around 5% in China, maybe I'm just privileged in thinking as a middle age American with good insurance that I'd be OK."
"""Is the outbreak of the Corona Virus starting to altering your travel plans to Las Vegas?""No."
"""While the death toll seem to be around 5% in China, maybe I'm just privileged in thinking as a middle age American with good insurance that I'd be OK.""Huh?"
Trip is booked for April.....not going to change a thing and have no intentions of wearing a mask. You are more likely to get shot in Las Vegas than catching this and dying from it would be my guess.
"To Las Vegas? No. I'm not due there for awhile. But for my travel plans next week, yes, I'm concerned.I volunteer at LAX at arrivals in the Tom Bradley International Terminal. Last weekend, the number of people in masks, arriving passengers/crew and others, was enormous. Very sobering to see in person. We've received updates on how to deal with the issues (dealing with those who are ill, disinfecting workspace and hands frequently, etc.). Folks are understandably nervous.I have a compromised immune system, so I checked in with my doctor. She said I could travel, but to come in for a checkup as soon as I get back. And my sister, who I'm visiting, is a health professional. So I'll be in good company. But I'm still very aware of the scenario that's unfolding and also wonder what the full story may be."
"""You are more likely to get shot in Las Vegas than catching this and dying from it would be my guess.""Too soon in its potential to spread to make that statement. Lots can change in three months. Reference the ""Spanish"" flu epidemic of 1918. https:/…Spread"
"From CNN:How Wuhan coronavirus compares to SARSFrom CNN's James Griffiths and Julia HollingsworthMore than 6,000 people worldwide have been infected globally since the first confirmed case of the Wuhan coronavirus in December.By comparison, there were 8,098 confirmed cases of SARS between November 2002 to July 2003.To put this into context: It has taken less than two months to get infect around 75% of the number infected by SARS over a nine month period.Experts have previously estimated the Wuhan virus figures could still be vastly under-reported, making the novel coronavirus far more contagious, but also less deadly, than SARS so far.https:/…index.htmlSpreading much faster than SARS but as of now not as deadly. As of now the risk of getting this in the US is VERY SMALL."
"""Too soon in its potential to spread to make that statement. Lots can change in three months. Reference the ""Spanish"" flu epidemic of 1918. https:/…Spread""To compare an outbreak that happened in 1918 to 2020 is in my opinion very disingenuous. Knowledge on how to contain it and fight it is not even close. DNA sequencing was not possible. Now it is. That's just one piece that's possible now. Already working on a vaccine. Best guess it will be available in 3 months. Please don't be an alarmist."
"#22 versus #23, like punching yourself in the nose."
"And I still go back to the number of flu related deaths in the US in 2019. Adds a bit of context from my perspective. Not changing my plans a week from now. But everyone has their own comfort level.Cheers,Jay"
CNN? Fake news. Fox didn't even mention the corona virus.
FOX News??? for conservatives who still think the world is flat.One big issue with today's viruses is that people move around so much and so far that the speed of infection is still much faster than science.
"Mac with a swing and a miss.No, it won't affect our plans, at least until there is further evidence that it should.13"
Health district investigating possible coronavirus case in Clark Countyhttps://www.fox5vegas.com/news/local/health-…
Checkout this news article from NY Post.https:/…
"""Just the facts, ma’am.“ The number of Chinese tourists to the western U.S. state of Nevada has been booming in recent years, who have significantly contributed to the local economy, a tourism official said.Tourism remains Nevada's No.1 industry, driven greatly by the influx of Chinese, said Bethany Drysdale, chief communications officer of Nevada Division of Tourism, in a recent interview with Xinhua via email.Drysdale noted that the Silver State has witnessed an increase in Chinese visitation year over year since Nevada began to market travel to China in 2004.”https:/…index.html""According to the Las Vegas Visitor and Convention Authority, Asian/Asian American visitors in 2014 comprised 10% of all travelers. In 2018, that percentage dropped to 2%.https://assets.simpleviewcms.com/simpleview/…"
"No - but as it happens when this news broke I had just started reading The Stand, so was a little extra skeeved out. MIL is worried, but, she worries about everything. We will go in a couple weeks and just try to mind the hand sanitizer and drink plenty of whiskey."
"""SNHD said the patient was a Clark County resident traveling in China and came back to the United States Jan. 14.""OMG. We flew out of McCarran on Jan 15th! I think I'm almost dead already. Come to think of it, I *have* been awfully sniffly lately..."
">>>""SNHD said the patient was a Clark County resident traveling in China and came back to the United States Jan. 14.""OMG. We flew out of McCarran on Jan 15th! I think I'm almost dead already. Come to think of it, I *have* been awfully sniffly lately...<<<LOL :DThe local news in Las Vegas said Corona Beer sales are way down."
"Meanwhile, Corona beer gets a Google search (Corona beer virus!!!) increase.https:/…"
"-:- Message from Tripadvisor staff -:-Tripadvisor staff has removed this post because it did not meet Tripadvisor's forum guidelines with regards to off-topic chat. Please limit conversations to subject matter directly related to the host forum. For example: when in the London forum, please stick to topics that relate to travel within the London Metropolitan Area.Off-Topic Chatter is a forum for discussions gone afield from the topic of travel. Please note that the Off-Topic Chatter forum is un-moderated -- the Forum Posting Guidelines are not enforced, with the exception of pornographic images or text, hate speech, unauthorized re-prints of copyrighted text, and messages that promote or encourage illegal activities. Each user is expected to take responsibility for his or her own conduct.To review the Tripadvisor Forums Posting Guidelines, please follow this link: http://www.tripadvisor.com/pages/forums_posting_guidelines.htmlWe remove posts that do not follow our posting guidelines, and we reserve the right to remove any post for any reason.Removed on: 12:13 am, January 31, 2020"
The local news in Las Vegas said Corona Beer sales are way down. <<OMG. Good thing I don't drink Corona. It always gives me the most god awful headache.Wait a minute. Maybe my headaches were a sign all this time.
"If a Deer Tick bites you and you have the virus, you will have Corona and Lyme DiseaseInteresting piece of news, 6000 people on a Cruise Ship in Italy is now quarantined over the virus"
"-:- Message from Tripadvisor staff -:-Tripadvisor staff has removed this post because it did not meet Tripadvisor's forum guidelines with regards to off-topic chat. Please limit conversations to subject matter directly related to the host forum. For example: when in the London forum, please stick to topics that relate to travel within the London Metropolitan Area.Off-Topic Chatter is a forum for discussions gone afield from the topic of travel. Please note that the Off-Topic Chatter forum is un-moderated -- the Forum Posting Guidelines are not enforced, with the exception of pornographic images or text, hate speech, unauthorized re-prints of copyrighted text, and messages that promote or encourage illegal activities. Each user is expected to take responsibility for his or her own conduct.To review the Tripadvisor Forums Posting Guidelines, please follow this link: http://www.tripadvisor.com/pages/forums_posting_guidelines.htmlWe remove posts that do not follow our posting guidelines, and we reserve the right to remove any post for any reason.Removed on: 12:11 am, January 31, 2020"
"""Interesting piece of news, 6000 people on a Cruise Ship in Italy is now quarantined over the virus""This is what scares me the most, one person has flu symptoms and now I am quarantined until they figure out which virus they have. Not how I want to send my vacation."
"-:- Message from Tripadvisor staff -:-Tripadvisor staff removed this post because it did not meet Tripadvisor's forum posting guidelines with prohibiting self-promotional advertising or solicitation.We ask all of our members to keep their forum messages free of self-promoting advertisements or solicitation of any kind - members affiliated with any tourism-related business should not include commercial contact information or URLs in their forum messages.To review the Tripadvisor Forums Posting Guidelines, please follow this link: http://www.tripadvisor.com/pages/forums_posting_guidelines.htmlWe remove posts that do not follow our posting guidelines, and we reserve the right to remove any post for any reason.Removed on: 8:24 am, February 14, 2020"
#41 reported for spamming the forums.
“ ·#41 reported for spamming the forums.”#42 reported for being off topic.
No - - Flights booked / hotel booked and I am anxiously awaiting my trip in 75 days !
Nope. I can't WAIT for my Vegas trip in May.
Yes
#41 and #42 have been reported for too much reporting.
"This is nothing more than a bad case of the Flu. Like a Dr said on a national news site. Wash your hands don't touch your face after handling public rails, grocery carts etc.. Treat it like Flu season and you will be fine. with this scare I am taking advantage of all the great flight cost and hotel/casinos dropping there rates"
"""This is nothing more than a bad case of the Flu.""Not even close to accurate."
"The only thing that will stop my planned trip to Vegas at end of April is if the airlines stops the flight or the Hotels close down. Over 40,000 people have died from the flu and the most I have heard about that is here on this forum. I think a lot of this hype is politically motivated and do not plan at age 65 to stop doing what I enjoy."
Politically motivated? That’s some crazy theory ya got going on...The next thing you will tell us is that Matt Getz and the new chief of staff currently quarantined with possible Covid 19 were given it by MSM
"Haven't booked anything as of yet, but plan on being in Vegas at the end of October. Surely by then, the virus will be gone"
It has begun: https://www.ktnv.com/news/mgm-resorts-tempor…
"Wildhorse Casino in Oregon closed because an employee might have the virus. Despite all the efforts that the properties are making, any one can close abruptly because of one guest or employee"
"I'm slightly concerned, but more about if they issue a mandatory quarantine or something once we are there (we are from Boston) and will have the dogs with a sitter. We are visiting with my in-laws (who are in their 80s), but in better health than most 50 year-olds, so who knows. We are due to leave April 18; I'm sure a lot will change over the month."
“ Wildhorse Casino in Oregon closed because an employee might have the virus”And it reopened about 36 hours later. About a week ago.
"South Korea, one of the most infected nations, has one of the lowest fatality rates. South Korea can test 15,000/day.Look at them..then look at us."
"""We are visiting with my in-laws (who are in their 80s), but in better health than most 50 year-olds,"" - This is a ludicrous statement. They might be healthy, but due to their age alone are more susceptible to any illness.13"
"South Korea, one of the most infected nations, has one of the lowest fatality rates. South Korea can test 15,000/day.Look at them..then look at us.<<<I flew through Incheon airport last week, it was a ghost town. Landed in Atlanta, and it bustling busier than ever. Either SK is taking this too seriously, or we are taking it too lightly."
"Preliminary data indicates past the age of 79 there is a 30%+ chance that you will require hospitalization if you get COVID-19. That means a month on a ventilator letting you breathe. Ventilators that could be in short supply.At the very least be informed. The effects of aging on your lung's ability to fight off infection are not tied to health. While yes, good health is always helpful, it doesn't at all preclude them from the natural risk of aging.Another morbid consideration is the fact that you can be a carrier up to 14 days without symptoms. Do your parents have friends and family in a similar age range? If they infect them it could wipe them out. The first cluster in the US was in a nursing home in Washington where 33 got sick. To date NINETEEN have died.I know people want to live their lives, but some prudence is needed. Taking 80 year olds to a high risk environment like Vegas is something you really need to reconsider."
"-:- Message from Tripadvisor staff -:-This post has been removed at the author's request. The author may repost if desired.Posts on the Tripadvisor forums may be edited for a short period of time. Once the edit period has expired, authors may update their posts by removing and reposting them.To read more about editing your posts, please follow this link: http://www.tripadvisor.com/help/how_to_edit_your_postsRemoved on: 10:45 am, March 11, 2020"
"“ I know people want to live their lives, but some prudence is needed. Taking 80 year olds to a high risk environment like Vegas is something you really need to reconsider.”Agree, the lungs of an obese 30 year old are much more capable of withstanding a respiratory illness than a fit 80 barring no underlying condition. It would be challenging to find one pulmonologist that would argue the reverse. Tissue does degrade over time as cells replicate thousands of times over our lifetime."
"Testing like South Korea would likely bring the mortality rate from the virus down closer to a .6% rate. It would not likely change the number of deaths. If the implication is that SK is more effective at survival rates due to testing availability, that seems ignorant. SK has/had an explosion in symptomatic patients. They instituted draconian measures to arrest its spread. Personally if I had any health issue I would rather be treated here in the US than SK. Both drugs that are showing promise in treatment are made here in the US. At this point, selective testing seem prudent."
"Upstate Guy is providing excellent comments... Anyone ignoring the situation has their head in the sandEdited: 11:08 am, March 11, 2020 "
"The implication, James, is that we are behind and have inadequate testing."
DTC is providing excellent comments...Anyone ignoring the situation has their head in the sand
"I too have been questioning traveling, with their being very big gatherings and what not it seems harder to avoid. I am still planning on going on my trip in two weeks, but i am more scared to infect others. So i will follow instructions and disinfect rooms, airplane seats, etc. with recommended sprays. I will also wash my hands and clean my phone regularly. Everyone gives a different opinion on it. If the CDC puts travel recommendations between states then i will cancel.. I mean I think the panic the media is putting on it is really causing items to go scarce and putting Americans at risks of more problems then just the virus itself. Please people dont buy more than you can even go through in the year there is no point."
"""The U.S. spends more on healthcare than any high-income country, yet Americans have poor health outcomes and a worsening life expectancy when compared with other countries, according to a report from the The Commonwealth Fund.For the study, The Commonwealth Fund assessed the healthcare systems of 11 countries, including the U.S., based on these five areas: care process, access, administrative efficiency, equity and healthcare outcomes. Data was collected using international surveys of public and physicians, from 2015-2017.Here are the three things to know:1. The U.S. ranked last place among the 11 countries for health outcomes, equity and quality, despite having the highest per capita health earnings. 2. The U.S. also had the highest rate of mortality amenable to healthcare, meaning more Americans die from poor care quality than any other country involved in the study.3. Poor access to primary care in the U.S. has contributed to inadequate chronic disease prevention and management, delayed diagnoses and safety concerns, among other issues.""Edited: 11:37 am, March 11, 2020 "
"For those in high risk, consider the reality, vegas has a high percentage of international visitors, even casinos are starting to act adversely, like closing buffets to cancelling shows, sports events and conferences. They don't want to, but the writting is on the wall, this is a deadly virus with no cure and is unstoppable. Again if your in a high risk or not, keep up to date, watch the news on the CDC site, changing your plans is not easy but may save your life. Just my thoughts..."
"Mortality rate is inadequate measure of healthcare, survival rates are much more effective data set. We lead the world in survival rates. If you have cancer, heart issues, infectious diseases I wouldn’t want to go anywhere else. Culture including diet, lifestyle, how you count deaths all factor in. Blaming healthcare system is a fairly weak argument but this is a travel forum. I don’t find your comments nor Qdogpas comments informative, rational or relevant. You just seem ignorant and irrational."
"""Testing like South Korea would likely bring the mortality rate from the virus down closer to a .6% rate. It would not likely change the number of deaths.""If your low number is true it means it six times more deadly than the flu with no vaccine or treatment like Tamiflu available. That's the good news?"
"All medical experts say different, but James from Milwaukee is the person we need to listen to...kinda sounds like the windbag in the WH...."
"-:- Message from Tripadvisor staff -:-This post has been removed at the author's request. The author may repost if desired.Posts on the Tripadvisor forums may be edited for a short period of time. Once the edit period has expired, authors may update their posts by removing and reposting them.To read more about editing your posts, please follow this link: http://www.tripadvisor.com/help/how_to_edit_your_postsRemoved on: 12:27 pm, March 11, 2020Edited: 12:27 pm, March 11, 2020 "
"The only way to decrease the mortality rate is by preventing death, or the disease. That’s it....and that is a cure or a life extension."
"Congressional doctor predicts 75-150 million U.S. coronavirus cases, now clearly infected doesn’t mean all or even most cases will need medical attention...Many will be a symptomatic... But to listen to non experts saying this is a nothing burger is ludicrous"
"Think about this: there are some diseases where dying is inevitable. The US and say Country X look at it differently. The US spends alot of money on expensive diagnostic equipment whereas Country X doesn't agree with that. The patient is diagnosed earlier and then passes away 7 years later. The person in Country X feels a lump in year 5 and dies at year 7. However, the 5 yr survival rate is a win for the US, but not for Country X. The result, though, was the same. Except for the pain and suffering the patient from the US endured during the first 5 yrs of treatment, whereas the Country X patient had 2 yrs.Edited: 12:51 pm, March 11, 2020 "
"I just saw this on the news. We have a trip planned April 5 thru 10th. I have had a cold/flu? for about a week. No fever or other symptoms related to Covid, but I worry if we head off, if they don't cancel flights, and I still don't feel 100%..would they stop me from flying due to a cold?"
"""would they stop me from flying due to a cold?"" - Nobody will know you have a cold unless you tell them.13"
"The vaccine rate for the flu is the highest among the elders and they even have a special stronger vaccine for that population. So while the death rate for the average person may be the same as the flu, it will most likely be higher for the elderly. Plus the elderly could face the possible of getting both the flu and the virus and that double whammy could be the tipping point. My mom survived the 1st bout of cancer, but not the 2nd bout that followed before she could completely recover her strength."
"A cough or sneeze will certainly result in folks looking your way, but several people suffer from allergies and are coughing and sneezing all over! :)13"
"FWIW, many area hospitals are checking temperature of people prior to entering the front door...I would not be surprised, though unlikely, that airlines do so at some airports"
My job just issued a travel ban. No business travel outside of state and personal travel must be submitted to HR and then a possible home isolation depending on where you are going. I am thinking that Vegas will be an isolation! I'm waiting to see if JetBlue does anything before I make a decision and cancel my May 10 trip though. But right now I don't think I'm going. The thought of being in the airport with thousands of people scares me.But I will definitely reschedule as soon as things clear up. I love Vegas!
"Vegasbride, you do have plenty of time to make a decision... I wouldn’t go in the next few weeks, but who knows what 6 weeks brings!"
"Vegasbride and othersAnother risk. Earlier I mentioned I just flew through S Korea from Bali. On the way, I met a very healthy 40 yr old man that will have to take two weeks vacation time to self isolate."
Agreed with Qdogpa. You can take a wait and see approach with trips that far out. Weather could hopefully curtail it. We also should finally have mass testing up and running.
