"""We also should finally have mass testing up and running.""You do realize that under current operating policies that means mass quarantines, think millions & millions.Mild cases that are now unknown and don't cause a quarantine for everyone they came into contact will now require 100s to 1,000s of people to be quarantine."
"Yeah, that's why I'm not cancelling right now. Let's see what happens in the next few weeks, but after reading what zoobrew said... it's not looking too good!"
"""Testing like South Korea would likely bring the mortality rate from the virus down closer to a .6% rate. It would not likely change the number of deaths.""Yes it would. I have stated such. Its not minimizing the dangers of the virus... This is a legit troublesome bug. Easy to spread with no known antiviral or symptom modifying medication. My issue was/is with comparing the US testing to South Korea. South Korea has a very difficult time arresting its spread. I would not hold them up as a model of success right now. Some want to make it about US healthcare system or the administration. If you look at the countries that are struggling the most with the bug, many are ranked high on WHOs healthcare ranking system. Italy is number 2, France, Norway, Germany Switzerland etc. Constantly taking shots at the administration or healthcare system makes some feel good about themselves but not all that helpful on a travel forum."
"""Constantly taking shots at the administration or healthcare system makes some feel good about themselves but not all that helpful on a travel forum.""Yes, the current administration has just really been on top of this with the voice of reason coming from the very top. Well, I can dream can't I?"
"The windbag proclaimed weeks ago it was contained..His words, not mine ..Said it was NOT Inevitable to spread, his words, not mine..this differed from EVERY expert opinion, but he continued the drivel...At some point, one needs to be held accountable for his words and actions."
"I am impressed with NY's response so far. Transparent, proactive, and aggressive. I'm not always a fan of our Governor, but his response when asked about a restriction he imposed was perfect, ""It actually wasn't my call. I deferred to the doctors. This is a medical issue, we need to listen to the experts."" Perfect.Edited: 4:30 pm, March 11, 2020 "
"-:- Message from Tripadvisor staff -:-Tripadvisor staff has removed this post because it did not meet Tripadvisor's forum guidelines with regards to off-topic chat. Please limit conversations to subject matter directly related to the host forum. For example: when in the London forum, please stick to topics that relate to travel within the London Metropolitan Area.Off-Topic Chatter is a forum for discussions gone afield from the topic of travel. Please note that the Off-Topic Chatter forum is un-moderated -- the Forum Posting Guidelines are not enforced, with the exception of pornographic images or text, hate speech, unauthorized re-prints of copyrighted text, and messages that promote or encourage illegal activities. Each user is expected to take responsibility for his or her own conduct.To review the Tripadvisor Forums Posting Guidelines, please follow this link: http://www.tripadvisor.com/pages/forums_posting_guidelines.htmlWe remove posts that do not follow our posting guidelines, and we reserve the right to remove any post for any reason.Removed on: 12:12 am, March 12, 2020"
"I've been following this virus from it's infancy way before I even posted (Note Date of my original post). As much as we like to place blame on an administration for the way they handle a crisis let us not forget the complete failure of the Chinese government.Recent history has shown (SARS) that the Chinese government has been less then forth coming with informing the world of a possible pandemic situation.Least we forget the video made by Dr. Li Wenliang he informed the world about the virus and then paid for it with his life. This being an election year my bet is all Federal Government resources are going to be throw at containing, treating and finally a vaccine for this virus. If they screw it up then they will pay for it in November."
"-:- Message from Tripadvisor staff -:-Tripadvisor staff has removed this post because it did not meet Tripadvisor's forum guidelines with regards to off-topic chat. Please limit conversations to subject matter directly related to the host forum. For example: when in the London forum, please stick to topics that relate to travel within the London Metropolitan Area.Off-Topic Chatter is a forum for discussions gone afield from the topic of travel. Please note that the Off-Topic Chatter forum is un-moderated -- the Forum Posting Guidelines are not enforced, with the exception of pornographic images or text, hate speech, unauthorized re-prints of copyrighted text, and messages that promote or encourage illegal activities. Each user is expected to take responsibility for his or her own conduct.To review the Tripadvisor Forums Posting Guidelines, please follow this link: http://www.tripadvisor.com/pages/forums_posting_guidelines.htmlWe remove posts that do not follow our posting guidelines, and we reserve the right to remove any post for any reason.Removed on: 12:30 am, March 13, 2020"
"I don't really care about what news channel you watch. Nor the political party of those involved. Disease is not a political argument. I listen to the experts and monitor results. Not having testing ready despite months of warning is catastrophic. We still are a few days away from that and as a result we're now three weeks behind on everything. Considering the disease's progression we're likely looking at more than 10,000 untracked cases. This is going to make mitigation so much more difficult and on a scale many won't like. This is according to experts, and I could care less what political party they belong to."
First hand experience here in California during a crisis with current administration. I lived through the Campfire in Northern California FEMA did an exceptional job up here of getting aid to those in need. I've yet to hear a compliant of any kind about how the federal government has handled their business. On testing kits the Chinese government is to blame for the lack of mass production of corona virus testing kits.
"-:- Message from Tripadvisor staff -:-Tripadvisor staff has removed this post because it did not meet Tripadvisor's forum guidelines with regards to off-topic chat. Please limit conversations to subject matter directly related to the host forum. For example: when in the London forum, please stick to topics that relate to travel within the London Metropolitan Area.Off-Topic Chatter is a forum for discussions gone afield from the topic of travel. Please note that the Off-Topic Chatter forum is un-moderated -- the Forum Posting Guidelines are not enforced, with the exception of pornographic images or text, hate speech, unauthorized re-prints of copyrighted text, and messages that promote or encourage illegal activities. Each user is expected to take responsibility for his or her own conduct.To review the Tripadvisor Forums Posting Guidelines, please follow this link: http://www.tripadvisor.com/pages/forums_posting_guidelines.htmlWe remove posts that do not follow our posting guidelines, and we reserve the right to remove any post for any reason.Removed on: 3:22 pm, March 12, 2020"
"""Least we forget the video made by Dr. Li Wenliang he informed the world about the virus and then paid for it with his life.""He didn't pay for his comment with his life. He lost his life from the virus. Big difference."
"-:- Message from Tripadvisor staff -:-Tripadvisor staff has removed this post because it did not meet Tripadvisor's forum guidelines with regards to off-topic chat. Please limit conversations to subject matter directly related to the host forum. For example: when in the London forum, please stick to topics that relate to travel within the London Metropolitan Area.Off-Topic Chatter is a forum for discussions gone afield from the topic of travel. Please note that the Off-Topic Chatter forum is un-moderated -- the Forum Posting Guidelines are not enforced, with the exception of pornographic images or text, hate speech, unauthorized re-prints of copyrighted text, and messages that promote or encourage illegal activities. Each user is expected to take responsibility for his or her own conduct.To review the Tripadvisor Forums Posting Guidelines, please follow this link: http://www.tripadvisor.com/pages/forums_posting_guidelines.htmlWe remove posts that do not follow our posting guidelines, and we reserve the right to remove any post for any reason.Removed on: 8:59 am, March 12, 2020"
"Mitigation and containment of this virus scenario supersedes politics, or it should. We're so damned divided as a citizenry that we lose sight of real facts and numbers ( that are now changing by the hour), and the reality that we're chasing a viral rabbit with a sizable head start on us ( specifically with the late testing problem). Yeah, I'm aware that only the elderly and medically compromised are most at risk( they always are) and, thus far, this thing is nowhere near as widespread / lethal ( number of actual deaths) as the multi-organism flu strains of this past winter in the US. Yet, the potential virulence / spread of COVID-19 in the US is unknown, regardless of one's title; that's partially because of unknown infection cases that will emerge from the now ongoing testing procedures and the isolation / containment cascade in response to that. A large number of confirmed cases exhibit little or no symptoms. In that regard, when the testing is in full-swing, nobody knows how widespread this will be. In all probability for the grand majority of us who enjoy travel to Vegas, the life/ travel disruption aspect of this disease may be the worst overriding consequence, even if some of us were to get the bug. On the bright side, great hotel rates, airfares, and multiple other travel perks are already emerging..for when this situation subsides. We could view this next couple months as an ideal time to plan a bargain-filled Vegas trip..while we simultaneously come in here and argue about whose fault it is. Lovely.China made mistakes, Trump made mistakes, Europe made mistakes, my Uncle Clarence and Aunt Eola made mistakes, I made mistakes..all behind us and unchangeable. How are we going to contribute to solving this problem, even though there is indeed a unique hysteria that will continue to be associated with the cause/ effects? C'mon summer? Go to Vegas now? Punt? Beat the ears off the orange-tinted guy some more? The increasing summer heat might yield the best odds (nature's way), along with common sense precaution measures ( including containment/ dreaded quarantine) and paid attention to those who truly know what's going on."
At this point I can't even keep up. It's gotten crazier by the hour.I just wanna say stay safe every single one of you.
Yup..
"Approx. Total of U.S. confirmed cases thus so far - 1281.Approx. total number of deaths thus far - 36 - The key majority of which occurred within a nursing home (or homes) facility located in Washington State.Considering the fact we're most fortunate to have multitudes of medical staff (doctors/specialists/hospitals) readily avail. within the U.S. who can provide us the necessary skills &/or treatments when ill; most of us (other than for the elderly &/or with weak immune systems) have very little cause for alarm &/or fear of the Coronovirus. Most folks who contract the virus, will most likely experience mild symptoms of a cold, some bodily chills, coughing, as well a mild fever or temperature. It's extremely unfortunate whereas, most countries deeply lack the necessary medical staff, the skills, &/or treatments to effectively treat their people of these viruses. Which helps to explain the extraordinary high levels of confirmed Coronovirus cases &/or deaths being experienced outside the U.S. More oftener people are so extremely poor whereas, they'll forgo medical care due to the high cost(s) of treatment within their country. Thus the extremely high mortality rates outside the U.S."
"""Let’s see if Blotus shows up in Vegas tomorrow for the event he is supposed to speak at....maybe can bring Matt Getz with his gas mask""He cancelled."
"-:- Message from Tripadvisor staff -:-This post has been removed at the author's request. The author may repost if desired.Posts on the Tripadvisor forums may be edited for a short period of time. Once the edit period has expired, authors may update their posts by removing and reposting them.To read more about editing your posts, please follow this link: http://www.tripadvisor.com/help/how_to_edit_your_postsRemoved on: 3:07 am, March 12, 2020Edited: 3:07 am, March 12, 2020 "
"""what’s your vitea (criterium vitea when you look it up on dictionary.com)""Curriculum Vitae?"
It’s altering my plans. Have my reservations for April but considerable doubts on how this progresses. Plan on hiking the Smokies in 2 weeks but my employer ( hospital) may have other plans so that may change as well.
"Curriculum vitae” IPad Siri change ... It was unnecessary comment anyway. I changed it to more relevant CommentEdited: 3:18 am, March 12, 2020 "
"-:- Message from Tripadvisor staff -:-Tripadvisor staff removed this post because it did not meet Tripadvisor's forum guideline limiting each user to a single forums screen name.To review the Tripadvisor Forums Posting Guidelines, please follow this link: http://www.tripadvisor.com/pages/forums_posting_guidelines.htmlWe remove posts that do not follow our posting guidelines, and we reserve the right to remove any post for any reason.Removed on: 10:07 am, March 12, 2020"
"Every year a buddy and I go to Vegas for March Madness to bet on the college basketball games. This would have been our 10th straight year for this. I made my travel plans months ago. Yesterday I cancelled my trip. My major concern was that I would become infected with no symptoms, then bring the virus home and infect loved ones. The risk is too big; it's not worth it."
I have reservations for Early May. Wondering if I should cancel then rebook to try to get a better price. My airline ticket which is non-refundable has already dropped by 80% Maybe its not too late to save on the Hotel?
"The timeline seems to be similar everywhere it hits. Well here in NY we are 2 weeks ahead of Vegas and we're shutting things down fast. My bar now can run at only 50% capacity and likely be shut down in total in a matter of days.So heads up, this will be Vegas in 1-2 weeks.Edited: 3:47 pm, March 12, 2020 "
