"Already book the flight coming to Italy in mid September this year, this is my first time to Europe,consider the currently situation do you think is it doable to travel in Italy in September this year?As someone from Asia to travel here this year would risking to be treated differently ?Edited: 1:54 pm, March 29, 2020 "
"No one here - or, anywhere - has any idea.As to whether someone from Asia will be treated ""differently"" - again, there are unfortunate people everywhere and no one could promise something xenophobic won't happen.Edited: 2:11 pm, March 29, 2020 "
"I agree with MCat. My personal thought, though, is I would not travel to Italy (or anywhere) this year but of course no one knows that far ahead."
You will be burning the candle at both ends with three matches and three wicks. Playing with fire is not for you. Re-draw or reschedule your travel plans for Italy and do not undergo hasty preparations for going there in September and preserve your money and heath. The distance would be far too great for spending money on such an endeavor. Far too risky now to undertake an endeavor for drawing up travel plans which will not be feasible later. It is not doable from stand point of safety. Reschedule your travel plans for beyond this calendar year. Un-refundable costs make it not a wise decision. Remain informed about this situation later.
I think #3 is saying no don't even think about it this year.It'll be a long long before any kind of normality returns worldwide.Stay safe
"Just watching BBC World News, the UK Health spokesperson said that some level of shutdown and social isolation will probably last the next 6 months, although probably not at full shutdown levels. So that takes it into October. Considering that Italy is in worse condition than the UK (at least so far) we are adapting to the conclusion that our 40th Anniversary trip from Venice to Sicily is almost certainly a no go. As she said we will relook at the situation every 3 weeks but for our travel to be possible it would have to be for a miracle.We are in constant contact with friends in Teramo and so far all the news has been nothing but sad."
"in my opinion, looking at Italian news reports there having big issues with this virus, I don't see the Italian borders open for tourism from abroad well into the new year"
"holachica1, the county is dealing with the virus. According to reports the number of cases has slowed for the last several days so it looks like they may have a handle on it and have been able to contain iy so may very well see an end to this in the next month or two. When they do see an end to it and things get back to normal what they are going to need is tourists spending money there. What they don't need is someone on a travel forum trying to scare people away for the next year. We should stop giving our opinions on when things ""may"" get back to normal and simply go by official reports. People are on lock down, the number of new cases has slowed over the past several days and supplies and help are being flown in. Donna"
"I had booked to go to Thailand in 2004 I booked 3 days before the tsunami hit .I was going to cancel / contacted the hotel to find out what to do , they begged us to come .We went . If we had not the manager informed us later the bar across the road had only been able to feed his kids because of the 10 couples in the hotel the same with the local restaurants and a antique shop . So I would urge everyone to travel to Italy /Spain as soon as it all clear . Wishing everyone good health ."
"https:/…Since March 19th, new case have been above 5000 per day except for 1 day.It would be nice for anyone making statements as facts, to back them up. I am already booked for late September and HOPE to go. Also, I have been talking to my wife about booking the same trip we just missed (Tuscany), For late November.We all want the best. Italy is suffering. They will let us know when they are ready for tourists."
"-:- Message from Tripadvisor staff -:-Tripadvisor staff has removed this post because it did not meet Tripadvisor's forum guidelines with regards to off-topic chat. Please limit conversations to subject matter directly related to the host forum. For example: when in the London forum, please stick to topics that relate to travel within the London Metropolitan Area.Off-Topic Chatter is a forum for discussions gone afield from the topic of travel. Please note that the Off-Topic Chatter forum is un-moderated -- the Forum Posting Guidelines are not enforced, with the exception of pornographic images or text, hate speech, unauthorized re-prints of copyrighted text, and messages that promote or encourage illegal activities. Each user is expected to take responsibility for his or her own conduct.To review the Tripadvisor Forums Posting Guidelines, please follow this link: http://www.tripadvisor.com/pages/forums_posting_guidelines.htmlWe remove posts that do not follow our posting guidelines, and we reserve the right to remove any post for any reason.Removed on: 11:07 am, March 31, 2020Edited: 11:07 am, March 31, 2020 "
"Because this is a global pandemic and each country is managing & searching for real solutions differently, no one can possibly answer your question with knowledge or accuracy.As mentioned, each of us must wait until it is safe to travel, again.Edited: 2:33 pm, March 30, 2020 "
"haters just delete my post on this forum, 110% you will be travelling to Italy in September that's what my crystal ball says today I think it's giving great advice."
It’s not just when Italy opens its doors to tourism but when your own home country is healthy and therefore you are free to travel that should be the barometer. The last thing anyone wants is an infected person traveling to another country. It will take time for the world to recover....
Some posters seem to be disaster posters - showing up only when some terrible situations are occurring - and then post all the doomsday stuff they can think of - it seems like a bit of a compulsion People can read for themselves what is occurring - I doubt many aware adults are getting their news (let alone heeding advice from) about this tragic worldwide situation from a bunch of strangers on an anonymous travel forum
@14 people are posting fake news on this forum they are sugar-coating the situation in Italy it's not fair to those that have a question its an open forum as long as you follow the TA guidelines regular posters on this fourm are deleting post if it does not fill their agenda.
I haven’t noticed anybody “sugar coating” anything....
"so post #7 is not fake news ? looks like they got a handle on it so does NYC has a handle on it to date. @16 and the are 4 haters on this forum, I know how they are they just delete my post because it does not meet there agenda on this forum. ^^^Edited: 11:52 am, March 31, 2020 "
Maybe we could do something about this.Look at # 2https:/…world-hunger-statistics.html
"That is part of our dilemma, knowing how bad things are still and will be for quite awhile, and also wanting to be there to see friends and help revive the country. WE are keeping a close watch on the situation but not feeling very hopeful. Even after hitting the peak on the new cases there will still be many new cases as the curve gradually gets back down to zero. The peak is not the end. And to make it worse a former studnet of ours told us that her parents in Nanjing were able to go back to work after over 50 days os isolation in their apartment , but there has now been a jump in the new cases. Hopefully it will not last. So much we don't know about how this will play out. After a big flood in the 90s along the Iowa River we tried to go and visit as many restaurants as possible, but there once the flooding was gone, we knew what the situation was and there was no ongoing danger."
"There is no “fake news” in post #7. Just the truth of the current situation and a little hope for the future... nothing wrong with hoping, imho.Only one person appears to be spouting nonsense in this thread (and many other threads I’ve noticed of late). One small example of such nonsense being “110%”. There is no such thing..."
"-:- Message from Tripadvisor staff -:-Tripadvisor staff removed this post because it did not meet Tripadvisor's forum guideline limiting each user to a single forums screen name.To review the Tripadvisor Forums Posting Guidelines, please follow this link: http://www.tripadvisor.com/pages/forums_posting_guidelines.htmlWe remove posts that do not follow our posting guidelines, and we reserve the right to remove any post for any reason.Removed on: 1:03 pm, April 16, 2020"
"Since you already booked your flights, just keep yourself informed. If you want to book any accommodation, make sure they can be canceled without charge."
The government is implying that post Easter the lockdown will start being lifted in stages. I'd expect hotels to be near the end of the list but by summer everything tourist related might/hopefully will be open.Does that mean your airline will be flying? Many European airlines are grounded to at least then. Others might be bankrupt.Does that mean your country will have opened up?Final point depending on which guesses you listen to large parts of the Italian population have already had the virus and dealt with it. By summer it's likely the vast majority will have had it. No point keeping things closed.
"This article, originally posted by Raffaele, indicates things may be a long way off and depend on medication to fight the virus or a vaccine to protect against it: adnkronos.com/fatti/…I have a trip planned Sept 4 - Oct 6 to mark a milestone life event but increasingly feel it may not happen. At least not this year."
https://www.democracynow.org/2020/3/31/headl…There are reports that the number of cases has started to decrease each day. This is good news and may signal a change in the situation and that the confinement is working. Let's keep our fingers crossed.Donna
"Thank you for supporting Italy.I am sorry but is too early to tell when an exit strategy from quarantine will be possible. Not before the mid of April or after Easter if you prefer, will be possible to make an attendible prediction.It is not like turning the light on or off. When ever it'll be, the exit from lockdown will be gradual and not for everybody at the same time, plus not for every Region at the same time.Here is a good article to share, but I haven't done it before because is too early for anybody to make a predictionhttps://www.ilsole24ore.com/art/nuova-chiusu…Sorry, in Italian. Please, use an online translator"
"-:- Message from Tripadvisor staff -:-This post has been removed at the author's request. The author may repost if desired.Posts on the Tripadvisor forums may be edited for a short period of time. Once the edit period has expired, authors may update their posts by removing and reposting them.To read more about editing your posts, please follow this link: http://www.tripadvisor.com/help/how_to_edit_your_postsRemoved on: 6:55 pm, March 31, 2020Edited: 6:55 pm, March 31, 2020 "
I’ve been wanting to thank you Raffaele for your continuity in reporting and your wise observations....you have contributed a lot on this subject in the forums...stay strong and healthy...and my deep affection to Italy...
"Hopefully things are better by September, but no telling with how things are playing out right now."
booked my flight back in january to travel to barcelona then to rome for the beginning of june... not having high hopes at all that i will be heading to either places
I sure wish the best for one of my favorite countries. But we don't know what exactly will happen. Even for a cure the majority of experts say that a COVID-19 vaccine will happen earliest in 18 months. Another expert says it may be sooner should his vaccine trial work well with his subjects. Also the consensus is hinting that the virus may reappear in the fall/winter seasons.
"IMO, an accurate assessment of COVID-19 and the human toll / response to the virus well may be 10-15 years from now. The only thing each of us can do is listen/adhere to what experts, scientists and/or MDs advise. Their guidance will make the difference for many of us. God willing, politicians will echo what infectious disease specialists advise. Patience, adherence and do one thing each day that gives you joy.A solo/sola walk through the neighborhood or nearby park (adhering to 6' distance & using a face mask, of course); making a dish for dinner you love; baking Mom's cookies or brownies; making a cocktail or pouring a glass of wine with dinner (not the bottle); posting on a mirror the 3 things you're grateful for today each day - or tape that to doors for you & the family to read; play music; dance in the living room & have your children/spouse join you; email or call a friend/family you haven't seen in a while; read a book you haven't read in years; draw; sketch, pray, if you do, etc.This is the time we take care of ourselves, our family, friends & neighbors. May we all step up to the plate safely & remain safe & healthy throughout.FWIW, what helps me is remembering those who lived long before me through far more difficult circumstances than COVID-19. My ancestors walked this walk years ago and demonstrated how its done. May I/we honor their hard work & sacrifice today. My two cents,Globe"
"Your wise words are worth a lot more than two cents, Globe.I'm desperately sad that we can't travel to Italy or one of our other favourite countries, but there's nothing that can be done about that and both my wife and I are a bit fearful of going anywhere this year. Or, more likely, until there is a vaccine.But our feelings of sadness are insignificant when it comes to the world wide scale of suffering that this virus has caused."
"The only hope for a quicker change for the good than expected now might come from the start of summer. Like most corona viruses this one will hopefully go away when the days are longer so there is more UV light, the weather gets warmer and more humid. If it proves true, then there may be a fast drop off in late May-June. We can only hope this happens the way it does for seasonal flu. Unfortunately if it is seasonal, that could mean a return next late Fall-early winter when the flu season restarts. With lots of luck there might be a vaccine by then."
Also keep in mind they are having great results using hyroxychloroquine along with some other drugs. Let's keep our fingers crossed that this proves to be the drug that will combat this virus.Donna
"Hi DonnaThere are other drugs too. In Chieti, where I live, there is an important University of Medicine connected to the hospital. The first patient cured with Tocilizumab has been threatened and he recovered well. Here is the interviewhttps://www.ilcentro.it/chieti/chieti-parla-…Google translated""Still now I don't know where, how and when I contracted the virus, no matter how much it tried to give me answers. It just happened, and asking questions beyond a certain limit was not helpful. "" An ex-patient of Chieti's infectious diseases speaks. He won his battle against the virus: he was the first patient discharged in Abruzzo after being treated with the experimental drug Tocilizumab. He gave his consent and the journey began, now he can tell his experience. He does it in a video interview broadcast by the ASL Lanciano-Vasto-Chieti.He is 30 years old. ""When you're there you're afraid not only for yourself, he says, but for those who are at home and you are afraid of getting infected. I was tormented by the thought of being a cause of suffering for the people I love most and whom I never wanted to endanger, ""he says. ""There comes a time when you think of only one thing - remember - and that is that you have to improve your condition, only that is worth it. My life has definitely changed - he confides -, these are situations that make you think and I have had time to think about it in the hospital. And yes, I changed all right. Everyone should learn something these days, because everyone's life has changed. """
Grazie Raffaele for your encouraging post- stay safe and healthy.
"Hi ElenaListening to the news it seems the situation in NY is far from good.Please stay safe, take care and stay at home if you canCheers"
"It may be awhile before it is clear that any of the drugs that are being used are actually a cure or help promote a cure. so far they are only being used as part of a regimen of treatments and it will require more cases and comparisons to establish they are of use. it is possible that they have no effect at all in the recovery that could have been spontaneous or just the result of the rest of the treatment . hopefully we will know more in the next month from the studies Dt. Fauci who is the US expert is cautious about the value of hyroxychloroquine at this point. Especially since it only is used when the patient is already quite ill. A group of researchers in Ireland have completed a study which seem to show that a vaccine given for TB, malaria and measles in poorer countries seem to significantly reduce occurrence of the virus and the death rates by a factor of 10. If further study proves it true, it would be an available vaccine many months before a COVID19 vaccine is allowed on the market. Which would be really a great step forwatd."
"HiI'm hoping beyond hope that a major breakthough is announced soon for a vaccine. There are more than 20 vaccines currently in development. Trials are taking place in the UK using an anti-viral called Remdesivir. Apparently it's an Ebola drug, but seems to work against a wide variety of viruses.The trial for HIV drugs (Lopinavir and Ritonavir) is disappointing.Then there is an anti-malarial drug called Chloroquine. Apparently, it can kill the virus but the WHO says there is no real evidence of this.Eddie"
"While things will hopefully be much better by September, I think that until there is a vaccine and everyone is vaccinated, this virus will continue to be an issue, there will be periodic outbreaks, like during the polio years, and travel will be chancy.For example, there could be a sudden outbreak in your home area or at your destination. Countries, and when they start flying again, airlines, might impose new restrictions on travelers, requiring some sort of proof that you aren't infected and/or are not an asymptomatic carrier/spreader of the virus. Trip insurers will refuse to cover anything related to the virus, so you need to be okay with that if you were going to count on insurance.Edited: 7:29 pm, April 07, 2020 "
"I agree completely. I gave up the idea of booking a flight for this year, I think that for a long, long time, we will have to travel inside our countries. But vaccine will come soon or late.Well it's an occasion to get to know your country better, for example I still miss the little islands of Sicily. If not now, when? :)"
"As a follow-up to posting #41 above, I also see the public transportation issue as being a ""key"" to a resolution of this crisis. Flying in an airplane across the ocean (or even on a shorter flight) presents at a minimum the perception of danger to both flight attendants and passengers. Without assurances that everyone on board is free of Coronavirus, how many people will be willing to ""take the chance""? Will passengers be willing to wear a face mask for the entire duration of the flight? Will they be willing to refrain from eating for 12 hours? How comfortable will they be sitting next to a stranger? (Practicing social distancing on a passenger plane is economically not possible, unless ticket prices are tripled or quadrupled). I suspect that, in the future, boarding a commercial flight will require not only a passport or national identity card, but also proof of recent vaccination against Coronavirus (or perhaps the presence of antibodies). The other possibility would be to employ a super-fast Coronavirus test during passenger check-in at the airport, to establish negativity to the virus (even here, the rate of false negatives might be unacceptably high).In the final analysis, the Coronavirus crisis may adversely affect the airline industry for a long time, rendering the economics of air travel even more challenging. I suspect that the era of super-large passengers planes may be at an end. We may go back to smaller wide-bodied planes and single-aisle aircraft. And what happens if an effective vaccine is never found?"
"Bill Gates was on PBS Newshour last night and announced he was gettong several plants ready to produce a vaccine once one is shown to be effective and safe. His analysis is that there will be some semblance of normality in a few months but continued restrictions to guard against a second wave or recurrence when flu season returns. He does not feel things will be totally back to normal until next fall after a vaccine is widespread. (unfortunately for his charities anti-malarial program, the researchers in that area have been switched over to COVID19 vaccine research)."
"""And what happens if an effective vaccine is never found?""Everybody will catch it. The question is do you become immune after the infection."
"Re post #43, I have friends who took evacuation flights this week home to Europe from Asia wearing masks and gloves for 10+ hours having been permitted to board only after passing a rigorous health test both in advance and later at the gate. They both commented that this was possibly “the new norm” in airline travel. There was a spare seat between all passengers in economy so a 777 flew effectively with half the payload. They paid over the odds for their one way ticket but were so keen to get home, money wasn't an issue. However, if the same economics apply, it could potentially mean higher air fares for all going forward. In the same way that the terrorists won post 9/11 and various other attacks – as anyone in the queue at security will concede - clearly the virus has the upper hand now when it comes to travelling."
"Re post # 46:Your information is interesting; nevertheless, I would not compare an ""evacuation flight"" with future discretionary air travel. Will passengers be willing to wear face masks for up to 16 hours? For 8 hours? Will children be cooperative? Meals will need to be served (or passengers bringing their own food), which means people remove their masks and open their mouths. Leaving an empty seat between passengers is not sufficient: the two-meter social distancing norm requires leaving at least FOUR empty seats between passengers in economy class (each seat is less than 18 inches wide), and at least one or two open rows.Will passengers feel comfortable even if everyone wears a face mask? (Should one feel safe wearing a seat belt on a car with faulty breaks)?A recent news report stated that on an Alitalia 777-200, this means no more than 76 passengers for 293 seats, or an occupancy rate of roughly 25%. This is economically not feasible, unless air fares are TRIPLED. How much will passenger traffic decline under these conditions? What impact does this have on low-cost carriers? (I note that Lufthansa has permanently shut down its low-cost subsidiary Germanwings).It seems to be that, in the absence of an effective vaccine or instantaneous Coronavirus testing at the airport with a very low false negative rate, the future of air travel is very uncertain in the near term. Even the achievement of ""herd immunity"" may be insufficient, since nobody knows the duration of such ""immunity"" (or for that matter, the duration of any vaccine).The glory days of cheap air travel may be over."
"Per the new rules in Tuscany, we are not allowed to leave the house now without a mask. Although I have my own, the govt very kindly sent me some more through the mail this morning. I guess I can live with one over my mouth for maybe a couple of hours if sitting down doing nothing but beyond that they can cause an irritation, especially in people who may have an allergy sensitivity, nasal congestion. Do they work? Do they provide a false sense of security? I'm not qualified to say but I do know I will be wearing mine as required by law, possibly long after and definitely every time I fly in future. No question."
HiI just shared a video from a guy coming back home in Milano from New York.Interesting to know what it means to fly nowadayshttps:/…106305029Hope it helps
"# 48:I too am no expert. I do wonder, however, whether wearing a double surgical mask offers appreciably and demonstrably greater protection, especially in a closed environment such as a grocery store, medical waiting room, bus, metro, train or airplane? (This assuming that a double mask is tolerable)."
The idea behind the masks is to stop you infecting others. There is a study out of Iceland that found 50% of the people who tested positive had zero symptoms. A second large group had mild symptoms.People like that are wandering around with no idea
Until recently doctors here were saying only those who were showing symptoms or who had tested positive for the virus should be wearing a mask. They said no one else should wear a mask as it gives a false sense of security. They recently gave the recommendation that everyone should consider wearing a mask.Donna
