"If everybody wears a mask in closed environments, the odds of shedding the virus should decline, at least intuitively, possibly by double digits (?). This is especially important on public transportation such as buses, metros and trains. If the 50% rate of asymptomatic cases is even close to being accurate, this is a critical issue.Use of masks is more problematic on flights in excess of 5 hours, since people need to drink and eat. When they remove the masks and open their mouths, the risk of contagion increases. What if someone starts coughing or sneezing during meal time? Are other passengers willing to run this risk? Enforcing social distancing on airplanes is not economically efficient, since air fares would need to triple.Of course, certain venues such as restaurants, bars, cafes, bistros, nightclubs, gymnasiums, dance halls, etc. do not lend themselves to wearing masks. How will society deal with these venues?Other industries, such as leisure cruise ships, seem destined to go belly up, in the absence of an effective vaccine or immediate, strongly reliable testing.Then there is the question of governmental restrictions. Just today, for example, the Austrian foreign minister was reported to have said that Austria should not reopen its frontiers to non-residents until the Coronavirus pandemic significantly wanes WORLDWIDE. This means NO TOURIST ENTRIES!!!!"
"You only have to wear the mask when you are near people who might be breathing out, sneezing or coughing out the virus and to protect others from you blowing on them in case you might be infected (and not know it). If you are outside away from others you can not breath in or out any virus. If you are home alone there is nobody to infect you and nobody to infect. If you are with others and you have all hibernated for over 14 days you can't infect or be infected by the others who are also clear of virus. In those cases you do not need to wear the mask. In Paraguay where they are terrified of an outbreak because of the inadequate medical facilities and poverty conditions, you are required to wear a mask when you go outside the house. In fact some stores are spraying people's clothing down with alcohol before you can enter. In a few weeks, we should have tests to tell who has already had the virus and may be safe from infection in the future although it is not clear yet if they can still transmit the virus to others later on and how long the immunity, if any, will last. Who knows, airlines may have special flights for people who has passed those tests and can fly more like we did before (little restrictions). But there is so little we know about those who are asymptomatic and those with antibodies at this point. Otherwise I can not imagine people wanting to fly with the restrictions airlines are forced to require now in the middle of a pandemic. Many of the initial anti-terrorism rules were dropped or made lenient pretty quickly. The discouraging news is that the original study of the anti-malarial drug has been withdrawn because it was not done up to standards. Apparently patients who were not improving with the medication were taken off it and not counted in the study so it looked more effective than it was, if at all. Also the expert panel in DC are of the opinion that the virus is not seasonal so will not suddenly go away in May. And yet we went shopping today for the first time in over a week and found about 40% of the shoppers were not wearing masks or gloves. I guess it's up to the rest of us to try to stifle the epidemic."
"EddieandLynn-- Apparently the report about the use of that malaria drug has been withdrawn because it was learned that patients who were not doing any better on it, were taken off of it and the reported results only reflected those who did well while taking it (without clearly knowing why) and a few whose doctors didn't take them off it when it was not working. The med does have some side effects and it's availability for lupus patients is critical . A number of US doctors have been prescribing the med to people (mainly family) as a protective med despite the lack of evidence that it works for those who are sick or those not yet sick. In one case a Dentist wrote a RX for the med for a family member! So pharmacies are getting emptied."
"Andrew, could you please provide the link or a reference to the source confirming your statement below?“Apparently the report about the use of that malaria drug has been withdrawn because it was learned that patients who were not doing any better on it”"
"I have plane tickets for early Oct. Haven't booked hotels. We won't be going. Hope Delta will give me a credit, but I booked with awards points, so I might lose out,"
"Yes, Andrew, can you provide a link to this information because all the information I've read or heard has been the opposite. In fact, one administrator I spoke with the other day said patients in their hospital are doing well on the drug. One man was very sick and within 4 hours of receiving the drug was doing much better. She also stated the drug was only being used on those who were very sick but that those patients were responding very well to it. Donna"
"""You only have to wear the mask when you are near people who might be breathing out, sneezing or coughing out the virus and to protect others from you blowing on them in case you might be infected (and not know it).""Not here you don't, since earlier this week by law no one in Tuscany is allowed to leave their house for any purpose whatsoever without wearing a mask, a requirement that has been in place (I believe) for a while in Lombardia and the Veneto. So, taking rubbish to the bins at dead of night with zero chance of meeting anyone on the street, must wear a mask. Walking the dog at first light on a deserted footpath in open countryside, must wear a mask. And we're wearing them too. (I also wear latex gloves.)"
My local supermarket (Conad) is now mandating masks and gloves to go grocery shopping. The pharmacy when they have them will sell you up to two at a time. Reusing the same infected mask isn't a great idea. Making it impossible for people to go grocery shopping isn't a great one either.I get the impression somebody hasn't thought all this out.
Toosoon.
Many U.S. supermarkets no longer allow shoppers to bring in their own reusable shopping bags (paper or plastic) for fear of potentially spreading COVID-10. Businesses are doing their best to mitigate exposure to (for) all of usAnd agree with #62. We won't be able to travel abroad for quite a while.
"Andrew, could you please provide the link or a reference to the source confirming your statement below?Unfortunately this was reported on NPR radio or POTUS on Sirus XM. Was in the car at the time and don't remember which or the exact program But check these:https://www.heraldextra.com/news/local/govt-…INVESTORS DAILYBut the drug didn't pan out in the study, Evercore ISI analyst Umer Raffat said in a note to clients. He described the results as ""far from positive."" Of three key measures, just one favored the use of the malaria drugs in coronavirus treatment.""It really puzzles me why we're seeing inaccurate characterizations of clinical data,"" Raffat said. ""In my honest opinion, having an honest discussion around emerging clinical data would actually help the progress.""Covid-19 Study Doesn't Bode WellThe hydroxychloroquine study examined virological clearance — the medicine's ability to lower how much of the virus remains in the body. After a week, the placebo cleared 93% of the virus vs. 87% clearance for those who received hydroxychloroquine, Raffat said.Further, patients' temperatures normalized on the same day for both groups.Only radiological progression measured by CT scan favored hydroxychloroquine in coronavirus treatment. But the data are hard to interpret due to the small number of patients, Raffat said. He questioned the dosage and patients' baseline viral loads. That information wasn't disclosed."
"""""Many U.S. supermarkets no longer allow shoppers to bring in their own reusable shopping bags (paper or plastic) for fear of potentially spreading COVID-10.""""oUR ShopRite HAS TAKEN A DIFFERENT TACT. If you bring in your own bags, the cashier will not help to pack them You will have to do it yourself. If you agree to use the store plastic bags from the roll, the cashier or a bagger can do the bagging."
"Our former exchange student has texted me that they have been on lock-down since March 7 because the Health Minister recognized they were too poor to beat an epidemic and the only hope was to limit it as much as possible. Airports were closed quickly for departing and arriving planes They are allowed out only for medical reasons and food shopping. Yesterday she went to a small shop to buy milk and as well as requiring a mask to enter, they sprayed everyone down with 80% alcohol. Later that day her 70+ father was pulled over by the police and had to show them he had grocery bags in the trunk (boot) of the car so they didn't fine him"
"This is interesting to me. I brought my own two bags this week which haven't been touched in probably a year so that I wasn't touching a cart. I carried them through the store putting my food into them and then rebagging them myself. I would think that's safer than using bags other people may have touched and touching a cart that has been through multiple hands, no?"
https:/…https://news.yahoo.com/detroit-rep-says-hydr…Seems like there's a lot of competing information out there about the drug and its effectiveness. Donna
"Some, not all supermarkets in the UK are providing sanitiser or wipes at the trolley pick up point."
"Italian Prime Minister Giuseppe Conte held a press conference this evening, during which he announced a continuation of the ""lockdown"" until at least May 4, with only a few new exceptions.In answering a question, he specifically addressed the topic of tourism to note that it is currently not possible to reopen the country to tourism without rendering vain all the efforts heretofore expended to limit the spread of the virus. He did not specify WHEN tourism might be resumed, but implied that this would probably be among the LAST activities to start up again."
"September? After 1 hell of a month that has made our cities a DESERT we are only seeing the start of the path that leads to the flat part of the curve of contagion. As every expert repeats every day, if we reopen, it will start again. In order to restart activities, completely new rules have to be set. Everything has to be rearranged. Tourism as we know it will not exist anymore: would anyone ever board a plane, or a cruise ship? or have breakfast in a hotel? And anyway (as I wrote here after 1 day of lockdown) Italy will have to take strong decisions about borders. This is the real story, until the vaccine. And this is what Conte was meaning tonight."
"Pier, if it's any comfort the UK is shut down too.It's going to be a long time before we get back to any kind of normality, worldwide."
"**Tourism as we know it will not exist anymore: would anyone ever board a plane, or a cruise ship? or have breakfast in a hotel?**I will. Once this is under control and they have a vaccine for this virus I won't have any issues with things getting back to normal. To think that the world won't be the same again is, for me, a stretch.Donna"
"Here are some Australian documents sourced from medical journals, not newspapers, regarding the use of hydroxychloroquine. Unfortunately, it isn't showing signs of being as useful as first thought ( well at least what the American president was hopeful of). Such a vicious virus no wonder we are all ready to jump on any straw that might save us. They are clinical articles bu the main ideas are there :)https://www.thelancet.com/journals/lancet/article/PIIS0140-6736(20)30817-5/fulltexthttps://www1.racgp.org.au/newsgp/clinical/ma…Edited: 10:05 pm, April 10, 2020 "
"Here are some interesting articles in regards to medications being used/tested to treat Covid-19https://www.cnbc.com/2020/04/03/coronavirus-…https:/…https:/…coronavirus-trump-malaria-drug.htmlhttps://www.cnbc.com/2020/04/03/coronavirus-…https:/…https:/…therapeutic-options.htmlhttps:/…Unless you are on the Front Lines, a Licensed Doctor/Nurse currently practicing, or a Scientific Expert- no one else can really say with any certainty if these medicines can or do work- we can only hope and pray for a treatment/cure."
"I could not agree more with your post 73, Donna. I will be traveling in the future and firmly believe that our doctors and researchers all over the world will come up with the vaccine."
"Allowing tourists to travel in Italy will be the last step of many others to be taken before. 15% of the Italian economy relies on tourism and travels, not to say restaurants and other activities. Every single day without tourists is a big loss for a lot of people. Unfortunately, we are still only planning the first step of the lockdown exit strategy.If a vaccine or a reliable drug will not be available soon, in summer will only be possible to sunbath on the beach (maybe) but only wearing gloves and mask. Impossible to take a bath or to swim in a pool.The following is a nice interview to Professor Ricciuto about our future holidays, on residents and tourists future holidayshttps://www.ilmessaggero.it/salute/medicina/…Sorry, in Italian. Please, use an on line translator"
"Yes that sounds realistic, in the seaside town where I go in the south, for example, it seems beaches admissions will have to be 1/3 than before. How can they manage to survive I don't know. Sunbed and umbrella will cost a lot more I guess. At least some natural sites will be protected and respected a bit more... I'm ready to pay for that"
"Just a guess but I think there will have to be a full restructuring of the world s economy .If not the poor will not be able to survive .Even the middle class will not have the money they had after this .So I can see travel for holidays becoming a thing of the past .Much like the 1960sEdited: 5:03 am, April 12, 2020 "
Thanks RaffaeleNot disheartened .We have already been in touch with our friends in the Parco De Principle in Rome and the Excelsior in Venice .Informing them we will be coming over as soon as possible / safe
"HiA vaccine has been discovered at Oxford University and might be available by Sept. https:/…It's said that half of the UK population might have already had the virus without knowing too much about it and the government hopes to limit the death toll to less than 20k. If we assume no successful vaccine is found and lockdown continues indefinitely leading to the UK economy totally collapsing leaving debt, bankruptcy and poverty, it's thought that 150k will die from drug abuse, alcoholism, domestic violence and malnutrition etc.  This figure is a lot higher than the figure that might die from coronavirus therefore a compromised solution has to be found. The world's economies cannot possibly recover from this self-induced coma if the lockdown is not partially lifted sooner rather than later. My guess is that vulnerable people will remain in lockdown while the healthy under fifties, or whatever, go back to work and school. Eddie"
Trump said .We have to watch that the cure is not worse than the virus itself .Which I believe could be true .
"So, if the british government will start producing the vaccine before it is proven effective, and if they distribute it globally and if all other governments accept the vaccine not proven effective, we'll be reopening autumn 2020 and not in the commonly estimated 15 months. This is said in the interview.More or less I read something similar on newspaper here in Italy, one week after things got really scary, to tranquilize people.Edited: 10:07 am, April 12, 2020 "
"I really cannot see the British govt. starting mass production of an unproven vaccine, can you?"
"Eddie, I agree with your post wholeheartedly and fully trust Professor Gilbert’s team working on the vaccine. Kudos to her! Similar news about the vaccine are coming from many countries in the world (US, UK, Israel, France) and they give people much needed hope. We cannot and should not live in the lockdown mode forever. It is dangerous and destructive for all. Happy Easter and Happy Passover to all!Nora"
HiYes I can because these are desperate times and require desperate measures. Eddie
"Thanks Nora Happy Easter and Happy Passover to you and everyone. And Boris is out of hospital, hooray! Eddie"
"I just cannot see a govt. allowing an unproven vaccine to be used on the general population until All the testing has been done and it's proved to be safe, and have no long term detrimental effects.Remember thalidomide?"
"Haddaway if you questioned me, I don't believe it either, I was ironic. I have read dozens of interviews about how long for a worldwide vaccination. And about how long for reopening of borders, we can learn from how China's reacting now to the back wave.One thing is hope (or Faith) no comment on that, other thing is being silly. Anyway, funny how newsflow is organised the same in all countries.Edited: 11:17 am, April 12, 2020 "
Hydroxycholorquine is used on Lupus patients and is safe to use. There have been no side effects noted on the hundreds of cases of corona that it's been used on. The results on those patients is astounding. Hopefully this will be the answer.Donna
Sorry dbabe but there is no comprehensive or conclusive data on its efficacy . Trump seems to think that because it works with malaria then it will work with covid19. Malaria is a different organism than the Sars virus.Why is Trump apparently pushing hyroxychloroquine? Has he got shares in one of the drug companies?There is no research on its efficacy except a small french study with 20 patients which is hardly a large study.Sorry i have digressed from the question origially raisedAs with all drugs there are side effects
"There have been hundreds and hundreds of cases in different countries where they have used hydroxychloroquine and it's worked. I can't remember if it was New York or Maine but the drug was given to 350 of the worst patients and all of them recovered, many showing great improvement within hours. Why is everyone so against at least trying this drug? Why assume the President has some ulterior motive to suggesting it other than he wants to find a cure and this one seems promising?The President believes it will work because of the results doctors from around the world are sharing. Malaria is just ONE of the many things this drug treats. It's also used as a treatment for Lupus, which is why it was suggested in the first place. We don't have to agree on this. We are all sharing our opinions based on the information we've been given. Donna"
Hydroxychloroquine is only under investigation in clinical trials. Usually a drug only in testing isn't widely prescribed even if effective on other conditions.https:/…therapeutic-options.htmlVagabonda
"And about travel resuming...Prime Minister Conte extended the lockdown until 4 May during his 10 April press conference, and then indicated the hope for a gradual restart in the country.Conte specifically addressed the topic of tourism indicating the risk of infections increasing from those arriving from other countries, and so there will be no tourism until Italy is ready, and that's only after many other issues are first addressed.https:/…Then there's also conditions and restrictions in other countries to consider, the uncertainty of the airline industry, issues with social distancing during flights, and possible requirement to self-quarantine for 14 days on arrival.Vagabonda"
"Italy is my favorite country on earth. I’ve spent at least one month a year there for many years. Despite my deep longing to experience their culture, language, seeing people whom I have befriended there, food, Italian way of life, and wanting to spend money to help support the fruit and vegetable couple, the local hotels and apartment owners, and all the rest, it’s ultimately about their safety and ours. I have resigned myself to the idea that my travel to Italy will wait for 2021.I’ve been so saddened about the situation that this is the first time that I’ve come back to the Tripadvisor forum in a couple of months, hoping to see that Vagabonda and other Italian posters are hopefully healthy and coping well, as much as is possible.Edited: 12:55 pm, April 13, 2020 "
"Yes dbabe we don't have to agree but if you state "" there are hundreds and hundreds of different countries where they have used hydroxychloroquine and it's worked "" you need to back that statement up with evidence. Going back to original question , Italy I am sure will welcome back tourists from abroad when it is ready. I hope that everyone is continuing to stay well and safe."
"dbabe…..LOL,lol,lol,"
"Supermarkets vary so much. Our Shoprite now says that if you bring your own bags you will have to bag the groceries without help. If you chose the plastic bags (which are machine made and not touched up to that point, the cashier or bagboy will help. One market set up a system that can pick up carts, dunk them in antiseptic and rinse bins before putting the back for use. Our local Giant sprays down the carts before you can use them, which Costco does and makes sure nobody takes a cart from the parking lot that hasn't been resprayed. I did see the BBC interview with the Italian PM Conte. He also said that any reopening will come in stages and progress depending on infection rates. So it sounds like parts of the country may reopen or loosen up but could close again if there is a spike in cases because of the loosening. That happened in Singapore, after starting to reopen they had the highest one day spike so far. WE are thinking that even if tourism reopened and we figured we could be there and be careful enough to avoid contamination, our concern would still be the flights."
"#93 wow...I would expect a DE for Rome to stay on topic and not become a medical expert. The information posted is so very wrong and misleading. There are many many side effects for this drug that is being discussed for off label use. In fact it is counter-indicated for anyone with heart issues which are many victims of Covid. As others have indicated tourism for 2020 is not really going to happen.Edited: 6:49 pm, April 13, 2020 "
"From what I’ve read in the NY Times, the limited trials of this drug produced irregular heart beats and test trials were stopped. Now that’s just today’s news and everything changes daily. I do hold a different opinion than dbabe about Trumps motivation for pushing this untested drug but it is probably way off topic ..."
"Where's the usual protocol here for drug testing?A drug for one disease doesn't mean it's the drug of choice for another disease.And does anyone's non-medical ""belief"" matter??Would you place your life, the life of a family member, or the life of your children on that belief? What do you have to lose?Your life!!It isn't academic, and just a topic for discussion.There are real lives in those statistics that we read.I've lost family members during this pandemic.I can tell you firsthand that facts, information, testing and well-conducted studies that impact lives matter, and not politics.https://www.nytimes.com/article/coronavirus-…https://www.businessinsider.com/coronavirus-…Vagabonda"
"Hi- Dbabe has provided valuable information about Coliseum tickets etc over her many posts. However, I am in agreement with Chester9cat, bianco89, gene JMSH & Vagabonda in that I like my Medical information from a Medical Expert. Dr. Fauci is not certain of the benefits and efficacy of the drug mentioned. I trust in him and other professionals. Wishing all on this Forum to be safe and healthy. On topic, when Italy is safe and ready for me, I will be happy to return. Ci vediamo.Edited: 7:48 pm, April 13, 2020 "
"Hey Lana, It's great to hear from you, and yes, it's about our safety and yours.You aren't alone in staying away from the forums. It's been too painful for many of us, but we are beginning to slowly return, and even if we are healthy, we are not all coping perfectly.Some here have isolated since February in flats even without balconies. It's April. Spring! Arguably the most beautiful time of year here.Yes we are strong, and strong also in our belief that social separation is absolutely necessary to stop the spread of this virus, but it's spring, and many yearn for an escape from their flats, but still hold strong to do what is right.I tell family and friends to nourish bodies, minds and spirits.To be kind to themselves, to nourish, to connect with family and friends, and do what they need to do to get through this.Andrà tutto bene. Vagabonda"
"Yes, let's get medical information from medical experts.And even medical experts aren't always correct!But at least it's not a ""belief"".Feelings, beliefs, thoughts and facts.Where would you place your life, or the lives of your family?It's about testing, testing, testing, facts and information as best we have them.I have many medical professionals in my family. Many on the front-line of Covid-19 care. If you unfortunately contracted this virus, you would at least hope to encounter my family family members upon entering hospital for your care. They risk their lives for you every day. Some lack the required personal protective materials they need. Some don't return home for fear of contagion with family members.I spent hours today searching for personal protective materials for them so they can perform their jobs and protect themselves and the lives of their patients.It's not just an academic discussion here. Some of us are really living this pandemic,. And about travel??Well not until we have life here normalised, so stay tuned.Vagabonda"
