"I miswrote when I stated hundreds and hundreds of countries have used the medicine, what I meant to state was patients, not countries. As for backing up my statements:https://www.dailywire.com/news/france-offici…https:/…https:/…https://www.trustnodes.com/2020/03/29/italy-…These are just a few of the articles that can be read that explain the trials and the results. It looks promising. You don't have to agree with the trials or the results but these trials are ongoing so they should be mentioned. DonnaEdited: 8:54 pm, April 13, 2020 "
"Dbabe, you might want to read some current articles. Results are not as promising as we hoped."
"Hi and thanks Donna!We all hope for some light at the end of this long tunnel, some promise of a cure, a hope in a drug or vaccination, some normalcy to everyday life.We all want the same; the best for us all.But there's a method to testing and testing trials, medical journals so dry that the average person would never read, and also official medical sites posting facts, updates and information.Results will hopefully be promising, but the testing was seriously and significantly flawed.Let's leave these forums to travel.Vagabonda"
"And not to lose focus of what really matters here, lives and families....Heartfelt sympathy and best wishes to those worldwide impacted by this virus; new cases, loss of lives, and families suffering through it all.It's real for far too many.....Vagabonda"
"Over the last day or two, there have been negative feedback from multiple studies and groups regarding the use of chloroquine and hydroxychloroquine to treat the virus. Any medical trial is too early to say the drugs would be effective. At present, they should not be touted as a potential solution at all."
"Test, run studies with controls, and determine if this drug is effective for this virus.No guessing...Lives are at stake if you do.Vagabonda"
@Vagabonda-Amen! Hopefully the SCIENTISTS will guide us well to decide when we can return to Italy. Or even leave our homes.
"Yes, testing is the key. I've never said this was a miracle drug only that it looks very promising and that I hope it's the answer. There is a lot of testing being done so lets hope it proves to be the answer we are looking for. Donna"
HiSome people have faith in scientists finding the answer soon because 2021 bookings for cruise ships have risen by 40% recently compared to a similar period in 2019. Only 11% of these bookings were the result of Covid 19 cancellations so there is a huge surge of new interest. I guess the same will happen for hotels. The gist of it is below.https:/…Eddie
"Sorry but I find this hard to believe .Just because someone IE cruse ship companies puts this in a paper ,does not make it true .Edited: 12:05 pm, April 14, 2020 "
HiNo need to apologise. Just believe whatever you want to believe. Eddie
"Amazingly I have also heard that bookings are up for 2021 cruises, maybe the offers are too good for some die-hard cruisers to resist? I'm cautious of medical trials. The last time I tried a trial medication for HBP it was stopped after a year because it was causing sudden kidney failure. The time before a statin med trial ended after 8 months because the death rate from cardiac causes of those in it rose. For what it is worth, I just read in the Irish Times that an Oxford University research scientist says that they have developed a type of vaccine that they feel 80% certain will work and could be available by September. (our friends in Teramo luckily live in the country and are able to go out and work in their garden and also their grandmothers' local farms. But not being able to see family has made them lonely)Edited: 2:56 pm, April 14, 2020 "
"I have seen some big discounts for cruises, would that have any hearing on the reported upsurge in bookings?Let's hope that a vaccine is developed , tested, and found safe to use later this year.Until then, let's enjoy the enforced change of pace, no rushing hither and thither, no time to relax. The air is clearer, when we meet others out for their daily walk( all following the govt. guidelines ), people will stop to chat, at a safe distance of course. Make the best of it, go with the flow, and stay safe."
"The thing about having a great vaccine in 12 to 18 months is the mass won’t receive it by then. Front line workers first , then then everyone else.. I just recall years where it’s tough to find a flu vaccine, don’t get me started on shingles. Being able to manufacture this for billions of people will take time.Then being the guinea pig is scary....because we will all be that, really. Many people will just wait and see fir a year or two. Gosh, remember when that nsaid was pulled about 10 years ago?I think when everything is open and running, the criteria fir me will be the stats...how many new cases reported in the region I want to visit. Because think I cannot wait 3 years to travel waiting in a vaccine. Saying that, I’d Ike to have an antibody gets that is reliable to also make that decision.Edited: 8:50 am, April 15, 2020 "
Sorry for all the typos I’m not able to correct.
"Bear in mind that for international tourism to start up again, countries will need to reopen their borders, without imposing a 14-day quarantine, which won't work for tourists. I do not foresee this happening any time soon."
Sometime between 1995 and 2010 when we were living in Iowa there was a mass vaccination program for something. I remember getting our shots at a high school gym. That resulted in most of the state being inoculated in a week. I was just in touch with Truly Venice about our September 2020 apartment reservations. They are allowing reservations for the months to April 2021 to be changed without charge so we will be rescheduling ours for Sept 2021. Unfortunately the Fenice website does not have their opera schedule posted yet so it will be a guess as to best dates.
"As we struggle day to day in lockdown, holiday planning seems a bit out of scope.We all hope globally for a vaccine or treatment.Regarding cruises with Legionnaires Disease, norovirus, Covid-19, and cruise passengers stranded as countries deny disembarking, there is no discount, no bargain, no future credit, nor even a free paid cruise that would tempt.Vagabonda"
"I cannot imagine anyone wanting to put down money for a cruise at this point. The past few months showed the vulnerability and limits of cruise operation. Most importantly, nobody wants to risk being stranded and getting infected.Another risk is the cruise lines going bankrupt. They aren't receiving bailout money like some airlines. The only way they can raise capital is going through the stock market or bonds at this point. With negative cash flow though, who would want to invest?As to traveling this year, borders would have to become open again. Also, the initial people traveling are either ""must"" travelers or ones who are really brave. All countries worldwide will need at least several months to assess the impact of global passenger movement. I love to go places but I will not be in that first wave."
"sammy is right about the cruise lines being excluded from the COVID19 relief bills so far Mainly because they don't pay taxes in the US because they are foreign owned, do almost all their business activity outside of the US and employ only few US workers. They will benefit by the booking agencies being helped and eligible for loans. The WH is pushing to include them in any futures aid bill,"
"HiMore news about the Oxford University vaccine. Evidently, they are going to test the vaccine on people next week and hope to have a million doses ready by Sept with hundreds of millions of doses for use by the end of 2020. Obviously, nobody knows if it works or how long it will take to prove it works, or indeed, whether there will be side effects. https://www.bbc.co.uk/news/health-52329659Meanwhile, the finger-prick antibody tests evidently don't work on people under 40 because they don't produce enough antibodies to the virus. It's thought that their immune system uses something else to kill the virus. The UK government has ordered about 17 million of these home testing kits. I think the antibody kits are also going to be used all over the world. This test checks the blood for Coronavirus antibodies and if you've got them, you've had the disease and gained some immunity so you can hopefully go back to work. It's hoped that this test will help bring an end to the lock-down. The UK also ordered about 3.5 million kits from China and they don't work at all. The government is hoping to get the UK taxpayers money back. https:/…Eddie"
AlsoI booked a holiday about 8 months ago and only paid £100 deposit. I've only just paid the full amount. The holiday company is still hoping to start flights at the end of June. I live in hope but they assured me that I can postpone the holiday until it's safe to go or I can cancel it. I assume the same deal will be available on cruises. Eddie
I would have a big problem with cruise lines being bailed out. Carnival in particular really blew it in the early stages of Covid 19...money over safety and they continued to operate the ships until they reached a point whereby no port would take them. No excuses at all ....bad decisions.
"Eddie, I hope your holiday goes ahead,and that you enjoy it.I am still not holding my breath for a vaccine this year."
"There will be many deals when it's safer to travel.Most in Italy at the moment would be thrilled to just go beyond their own comune. I hope you and your family are safe and well Donna, and there was never any doubt of your good intentions.Recent studies indicate a lack of efficacy for hydroxychloroquine Covid-19 treatment, and side effects are significant.https://www.wsj.com/articles/french-drug-sur…https:/…index.htmlMany Covid patient recover without any drug interventions like hydroxychloroquine or remdesivir.We could all use a miracle!Vagabonda"
"Vagabonda, Miracle? Well you're probably best placed, have a word with the man in the Vatican!"
I think the Pope is praying his very heart out right now ... deeply touching even for a non-Catholic like me.
It seems our miracle lies with the Decreto #IoRestoaCasa: governo.it/it/…14278Vagabonda
Government is working on phase 2. A possible date is April 27th but not for allrainews.it/dl/rainews/articoli/Coronavirus-g…
Hello @ 133. Can you summarize for us or is the link available in English as well. We are outside of Boston and I do not see us reaching Phase 1 for at least 2-3 weeks. We are in the surge period now. My county alone has close to 5000 confirmed cases.My heart is hopeful to see Rome in September. I know many miracles need to happen.
"Hello electricgirl,The Ministero degli Affari Esteri posted the original decreto in English, but there were updates with further restrictions on 10 April.FAQs on the Italian Government's #ImStayingHome Decree:https://www.esteri.it/mae/it/ministero/norma…https://www.esteri.it/mae/it/ministero/norma…You might use this link for a Google translation of the updated 10 April decree.https://tinyurl.com/yb39r3mzAll the best to you and everyone!Vagabonda"
"Ciao Raffaele, Prime Minister Conte indicated the hope for a gradual restart at the 10 April press conference, and yes 27 April seems a possible date for Phase 2. https://www.ilsole24ore.com/art/fase-due-ipo…Vagabonda"
"Thank you VagabondaFanpage is online since March 30th reporting live news 24x24, 7x7, only on covid19https://www.youtube.com/watch?v=S-qo_HvnHE4Really stressful ;-)(Sorry, in Italian)"
"Easy to say, maybe difficult to do, but just go with the flow .We are where we are, relax, can't change it"
"Nothing is easy to say, and no one is relaxed.Vagabonda"
"Caro Raffaele,Yes, it's really very stressful. And it's not just about reporting national updates or planning trips for me, but about my family.Seven family members have been infected with this virus. I know you appreciate what this means to us all. One family member was admitted to hospital just yesterday.Two passed.One is is improving in hospital, but he has lost his wife.One is still alive after hospital/intensive care for 45 days, and moved to a rehabilitation center earlier this week for an undetermined amount of time.Two are exposed, and quarantined at home.Vagabonda"
"Very true words in your #140 post Vagabonda And, as ever, so terribly sorry and sad about your family losses and ongoing illnesses. It is just too much.Relax? In what universe....Edited: 6:09 pm, April 18, 2020 "
"OMG, Vagabonda... Seven of them... Sending my wishes of speedy recovery to your family members fighting this horrible ordeal. With love!Nora"
"You are always here MCat; always caring, always tuned, always fair, always supportive, and always comforting.Thank you!Your words are heartfelt, and you mean what you say.It is too much.Mornings, not so bad, but my nighttime the weight of it all feels heavy.V."
V... it’s too much...know that you are held by many...soft air...
"Yes Nora, and thanks to you, and thanks to CC for such gracious support all these years. I had written that CC even prior to your posting as I was writing when you posted.Our Sicily forums are really very special.I have never been personal on these forums, but these aren't typical times. Some posting here are still anticipating near future (May and June) holidays. Really ground yourselves a bit, and take a look at this devastating pandemic. Perhaps you aren't feeling the impact where you live, and that's why. Stats and numbers of illness and deaths aren't real for you. Be grateful for that. But borders are closed to travel. Quarantines are in place. Tourism travel is not permitted.This isn't a time for pleasurable travel.Italians can't leave their own municipalities, not even to the next nearby comune.We must print and carry documents for grocery shopping.I am a realist Nora, and there won't be recovery for five.Two have passed. It was just this time yesterday when I received notice of the last admitted to hospital, and he won't recover at least with any quality of life.Imagine 45 days in Intensive Care for another, and now rehabilitation for how long?? And she isn't elderly!One seems to have managed to save himself, and ""may"" return home, but without his wife.Two are young and strong, and should be fine (eventually), but they have lost immediate family, and they were controlled by authorities, and were unable to visit in hospital, or attend funerals.No closure for them.Many in my family have been in lockdown since February. We contact each other daily for updates. It's hardest for those in cities, and those with young children.It's spring! Everyone wants to enjoy the beauty of the season, the flowers, and the sunshine.And especially after months confined.One cousin in a city has a balcony. I told her, ""Well at least you have a balcony"" and she replied, ""Yes, but I don't know what to do on the balcony!""As MCat said, ""It's just too much!But we all respect #IoRestoaCasa!VagabondaEdited: 7:24 pm, April 18, 2020 "
"Many in tourism (hotels and B&Bs, tour companies, cookery schools, transfer services, agriturismi, vineyards.....) are hoping that tourists will wait for cancellations, and give them a chance.Obviously there would never be a good time for a pandemic, but this really couldn't come at a worse time for tourism in a seasonal destination like Sicily.Wineries and olive oil agriturismi attempt to compensate a bit by selling and shipping their products, and hope for loyal support from past clientele.These hardworking, long-standing, and often family businesses are fighting for their lives and future existence.Their work has disappeared. There's no date for when work will return.Many have relaxed cancellation policies for services paid, and they have offered opportunities to reschedule without penalty.Many have humbly asked guests for support during these hard times.Many wonder if they will survive in such uncertain times.Many have worked so hard for year at a business.And even for generations. Many carry generational family hopes on their shoulders. Many worry about their loyal and hardworking staff and families.And even with such uncertainly, they are still committed. They are still working hard. They are still working the land, and still hoping to generate change for our fragile environment and the hope that Sicily can sustain work for our youth, and keep our youth here.Every practicality for a tourist says to cancel bookings. And economies are fragile everywhere.But every cancellation diminishes hope here.Every booking that isn't cancelled gives time for this situation to settle; time to give so many small businesses a chance to survive.You each know your circumstances. You each know your budget, and what you can and can't do.You need to first consider your families and your personal situation.But then if it's within your budget, please know that your support would always be appreciated.We hope you'll return when the time is right. And we hope that will be soon.And no one can predict what will happen come September.Really best wishes to everyone during these extremely challenging times.Take care of yourselves and your families, and stay positive.A positive attitude will make it easier to get through this, benefit your families, and maybe get a better night's sleep.Vagabonda"
"VagabondaI just woke up when I opened TA forum. I like early morning to write but I was holding my breath reading your words. I really had no idea. I am so sorry for you. None of my family have problems. The situation in Abruzzo is not so bad.I only know some people who passed but not relatives. People I know in person, with a known face other than a number on a report.I have both my son 21 and my daughter 17, plus my wife, with me safely at home and I selfishly hope to keep this horror out of my door.This is for me writing on TA. To cope with fear. Reporting what I see is a necessity to keep myself busy during these endless empty days.Keep strongRaffaele"
"I do not know what to say, Vagabonda... One family and so many losses... You are right: it is not the time to travel... the wounds should heal first and sadly so many wounds will never heal. Please accept my deepest and heartfelt condolences... I know my tears will not help but they are streaming... Hoping to return to my beloved Italy next year. I know many of us, Italy fans, will be back to stay in our favorite hotels and B&Bs, eat in the restaurants we love, enjoy divine coffee and wine, and it might help a bit to revitalize struggling businesses. Stay strong, my dearest! My heart is always with you and with Italy...Raffaele, so glad to hear that your family is doing fine! Nora"
"Vagabonda - so very, very sorry to hear what has happened to your family, so incredibly tragic. Our deepest condolences. - David & Laura"
"It's always so hard to hear about the losses so many people are experiencing with friends and family. It is so variable by location. It is also hard to hear how difficult life has become for so many people, especially those areas of the world where there is so much poverty. Our exchange daughter in Paraguay keeps texting e about how hard it is to even go out without being stopped by the police to prove you are doing something allowed and essential. The other day they were almost arrested because her niece in the car was not wearing a mask and should not have been out of the house for any reason other than going to a doctor. There was no plan to have her leave the car and as they were only going to drop food off to grandmom and let her wave from the car. She usually drives around dressed like she is doing one of her complicated dental procedures It is a poor country and their only hope is to stop any significant viral spread from starting. But that means people who earn a pittance by daywork are not able to leave the house to find the few pennies needed to buy food. But amazingly they are not complaining about the sacrifices they are making for their fellow Paraguayans. I'm sure there are other areas of the world in the same situation. So it drives me mad to hear people here complain of not being able to go to their hairdresser or barber like it is a major sacrifice."
+1 Andrew P...
"Oh, V.My heart hurts so badly for you, your family and your fellow countrymen/women. What an unspeakable tragedy. What unimaginable loss. What tremendous grief. I am so very very sorry for you. We have canceled two trips, one to Paris (we were supposed to be there this week) because we foresaw the coming storm, and the other to Greece in September because we just cannot imagine how travel could possibly be appropriate for the foreseeable future. Not amidst the pain and wreckage of this horrible plague. And here in the US, people are out in the streets, some toting guns, demanding their golf games and haircuts. Stay well and stay safe, Vagabonda. You inhabit a small piece of my heart...mmg"
"V.,Just a quick thank you for your thoughts on ways to support our favorite merchants... I emailed Mandranova and they are happy to ship! While it is expensive, we are glad to be able to support them in these dark times. Are you aware of which vineyards are shipping? I looked on Planeta's site but couldn't find anything. Maybe I'll email them. mmgEdited: 7:03 am, April 21, 2020 "
Have the US tariff rises affected the prices of mail order wine or olive oil?The prices of Locatello Romano and Parmesan cheeses are definitely higher in the stores here.
"Vagabonda:I just read your postings concerning your family situation. I have no words to express my shock and grief for you. Your postings are evidence of how precious life and good health is to everyone, and we all must be mindful of this and thankful to be healthy for as long as this lasts."
#156 Locatello Romano? A cheese? Never heard about it in Rome.
"From a food website: ""Locatelli cheese is imported from Sardinia and the Lazio Province (which includes Rome) in Italy. The brand originated in 1860 by dairy farmer Mattia Locatelli in Ballabio, Italy.As the #1 importer of Italian cheese to the US, Locatelli’s tariff costs (which also get passed on to the consumers) are hefty. According to the 2017 US Tariff Schedule (yes, I looked it up), the tax rate for imported sheep cheese is 9.6%. If a regular tub of Pecorino cost $6, it’s now $6.58 plus the combined state and county taxes as well.The price you pay for aged, imported, and high quality begs the question:Is Locatelli Worth It?Although expensive, Locatelli Pecorino Romano cheese is worth the extra dollars every few months.""Of course prices for Italian cheese would not directly rise because of the tariff itself, but the cost of a number of goods that come from China have risen in cost here because of the tariff but then similar American made goods had their prices increased by American makers to take advantage of the market rpice increases."
"So sorry, Vagabonda, about your losses. It's heartbreaking.Like many of you, I have been too disheartened to visit the forums for awhile. Though in good health, I am 70 and am beginning to fear I will never see Europe again. This year I had planned a land and sea package to Alaska. That's been cancelled, and I am taking a refund rather than credit because who knows if the cruise industry will ever recover.We replaced our usual fall Europe trip with a visit to Montreal and Quebec City. Now that's not looking too hopeful either.Just checking in to see how others are doing. In bocca al lupo, everyone."
Recent article on predicting when Italy will reopen for tourism: https://www.wantedinrome.com/news/when-will-…
Hi VagabondaI hope you read the forum. I tried to write to you a PM but looks like you don't receive them thus I am writing here.It's more than 3 days since you wrote your last post. Given you are a constant and reassuring presence on the forum and knowing about your situation I am wondering if you are all right
"HiDifferent country but Madeira is supposedly planning to open some hotels in July or even June. Don't shoot me, I'm just the messenger:-)https://www.madeiraislandnews.com/2020/04/ho…Eddie"
"Hi eddie/lynne hope you are safe, i hope things get back to some sort of normality soon, i am usually in italy in may, Ischia, naples. Missing my forum chats with the regulars, and asking/ giving advice. Take care Mitch."
"Hi MitchcornwallYes, we are both fine and well, thank you, and hope you are too. I can't wait to talk about the best restaurants and hotels in Ischia and the area again. Incidentally, I had three long holidays in St Ives and the area but it was many a long year ago. Eddie"
"Alot of my work is in St ives, plenty of rich people owning property, we live in Falmouth the only town in Cornwall thats a all year round place. I have been traveling to Italy for years now, and have a soft spot for Naples, Ischia, Procida, we love the area. Sorrento and capri last year were nice, but has changed , and is expensive, but we still find it lovely."
Very sorry to hear this Vagabonda. My deepest condolences to you and and your family in this very difficult time.
"Dear Vagabonda,A quick message to say sincere condolences for your losses... may the others get better quickly, and the rest of you stay safe and well. Best wishes from Paris,Andrew"
"Dearest Vagabonda,I’ve been too saddened about Italy to check into Tripadvisor Italy forum recently. I just read that you have had seven family members afflicted. Two fatally-what heartbreak. I wish that I could hug you, take you for drinks so you could decompress. I’m sending hope and best wishes to you and your family. You’ve helped all of your TA family so much in innumerable ways. I am so so deeply sorry for your loss and your pain."
