"lol I cant name and shame but.... your links pretty appropriate, if you had bothered to read my message you will see I paid £189.00 for my Insurance last year in June please dont judge me by your own standards am a seasoned traveller visited every continent apart from the icy one and like to think am honest enough to take things at face value and get what am being sold my issue is with the slippery weasel way in which these Insurance providers hide clauses that you would assume ( which I wont again) would be included, again I am forced to quote to disarm the keyboard warriors from stay sures site""At the moment, the UK government has advised against all but essential travel abroad.This means that if you travel against this advice, your travel insurance policy will be made invalid and you won’t be able to claim if you needed to. This includes holidays in the UK.""and ""Disruption Extension cover as of midnight 13 March 2020. We aren’t able to sell any new policies with travel disruption cover until further notice.If you already have a policy including Travel Disruption Extension purchased before 11:59pm on the 13 March 2020, your cover will still be valid.""and""What will happen if I am refused boarding my flight home because of the coronavirus – am I covered by my travel insurance?If your airline doesn’t let you board your flight home, you’ll need to contact your airline or tour operator to get a refund or be offered an alternative flight.""so please tell me why this is not the worlds biggest con they make a song and dance about providing cover but in reality you have no cover if in December when your Holiday is due you still cant travel due to FCO guidelines what exactly are they offering other than medical and repatriation cover which I would expect any of these company's to offer if you fell ill whilst travelling provided you dont break FCO rulesEdited: 7:46 am, June 16, 2020 "
"Amazing how it's always the ""seasoned traveller"" that ends up getting themselves in a pickle."
"I will point out as well they do contradict themselves ""COVID-19: We are delighted to announce our policies cover Emergency Medical and Repatriation Expenses, if you get infected by COVID-19 whilst abroad; please note that this cover only applies to trips undertaken if the FCO have not advised against all or all but essential travel to your destination prior to your departure.Unfortunately, no cover will apply under any other section of the policy for cover claims related to any coronavirus (including COVID-19).""Yet if you cannot board due to a infection you need to take it up with your Airline or Agent for a refund or get an alternate flight"
"I've not come across a travel insurance in the UK which will cover anyone for having their visa cancelled and therefore unable to fly, or not having got a visa in the first place.I think you are blaming Covid for your insurance not paying out, but it must surely be that because you didn't have a visa that is the reason?"
"""so please tell me why this is not the worlds biggest con they make a song and dance about providing cover but in reality you have no cover if in December when your Holiday is due you still cant travel due to FCO guidelines""No insurance policy covers every circumstance. If you wanted a policy that covered against pandemics you could have easily found one."
"So you don't expect to understand WHAT you are buying before you hand over your money? (Reading what is and isn't covered). Sounds pretty foolish to me. Then to come onto a public internet forum and complain that what you bought that was laid out in a detailed descriptions wasn't what you thought you bought because you don't feel like you should have to educate yourself as to what you buy....Keep digging...If you believe that all insurance that you buy covers you for any eventuality then I would strongly advise you to educate yourself. Insurance ALWAYS contains a long list of what is NOT covered, and this is in every country that I know of. That applies to car, home, life, and travel insurance. I am kind of surprised that you didn't know that.So maybe this is a good learning experience - a life lesson if you like. Whether you think you should have to or not, ALWAYS read the terms and conditions of ANYTHING you buy, especially things like insurance or buying flight tickets from online travel agents, and especially the sections about what is,and isn't covered or any fees. It doesn't take that long when you focus on that part. Caveat Emptor - ""buyer beware"" applies."
"OMG do any of you actually read what your replying too?To repeatI had a visa, I had a 1 year Visa as it happens because we travel a couple of times a year to India my Visa was renewed 3 Days before the Indian Government cancelled all Visas 2 Weeks before we were going), at the time the FCO said we could travel, I was booked with a scheduled Airline not a charter my Hotel etc was booked via a Travel Agent as was my flight, the Agent has Abta and ATOL cover.The Scheduled flight was still running when we were due to goThe Hotel was open when we were due to doThe Visa was cancelled My Insurance would not pay out and I will quote ""because it is my responsibility to ensure I could travel"" The Travel agent cant do anything because at the time had we a valid visa we could have gone and yes you guessed it our terms and conditions say you must have appropriate insurance (thought we did) and you must ensure you have a valid Visa to travel( we did )Maybe now my frustration becomes clear?"
"""so please tell me why this is not the worlds biggest con they make a song and dance about providing cover but in reality you have no cover if in December when your Holiday is due you still cant travel due to FCO guidelines""No insurance policy covers every circumstance. If you wanted a policy that covered against pandemics you could have easily found one.No you cannot I have looked at my older policy Docs and the SAME clause has been added since the Ebola and MERs outbreak to them all, covid19 is simply added to avoid any doubt as the WHO did not call it a Pandemic until Feb, at that time it was officially not covered by travel insurance ask those poor souls who were trapped abroad what there insurance co did about getting them home or getting them treatment answer diddly squat because pandemics are not covered.I dont expect every eventuality to be covered am reasonable and expect fair and reasonable treatment in return for my hard earned insurance is a gamble I accept that your betting nothing happens to you but the odds are stacked way too high in the insurance sides favour, lets be realistic if they didnt make a good wedge they wouldnt offer it I accept that but if I need to make a legitimate claim I expect a legitimate outcome"
"<< OMG do any of you actually read what your replying too? >>Well, maybe if you used some capitalization and punctuation, especially periods, it would be a lot easier for people to understand what you are trying to say! I gave up trying to follow your rants.As others have said, there's no policy that will cover everything and everyone's individual situations. Who would have predicted a pandemic, which a lot of people are finding they are not covered for? TBH, it's not something most people would think to check for as we haven't had one since 1918, which means most of us are too young to even remember that. While it is not your fault that your Visa was cancelled, it's not the insurance company's fault either. If your policy didn't specifically cover the circumstances (cancelled Visa, no unnecessary travel advisories, etc.) then it's not surprising the insurance company will not pay out. Hard and expensive lesson to learn, but I don't see it being a scam or a con. Next time check all of the fine print before buying, even if it means having to read 36 pages!"
"""No you cannot I have looked at my older policy Docs and the SAME clause has been added since the Ebola and MERs outbreak to them all""I don't know what companies you are looking at but many, if not most, mainstream UK travel insurers will pay out for trips that are cancelled due to corona virus."
you have no idea what your talking about
"You don't need to take my word for, below is a list compiled by MSE which outlines what different companies cover. As you can see, most will reimburse you if FCO advices against travel to your destination due to corona virus. https:/…insurers"
"My annual policy covers me for covid cancellations provided the trip was booked before 28 March.When I renewed the policy this month, they took a note of all my trips booked before this date and confirmed in the event I cant travel due to covid/FCO advice I’m still covered.Not all policies are the same.In your earlier posts it sounded like you didn't get a visa. Were you clear with your insurer and hopefully the ombudsman.What does your policy say about being unable to travel fue to FCO advice?Mine covers me if i cant travel due to FCO advice. Were i to ignore that advice and travel then my policy would be invalid and i wouldn't be covered for anything."
"""the odds are stacked way too high in the insurance sides favour""Yes, of course. So why did you buy a policy? It's not like these highly restrictive terms and conditions are hidden - they are there for anyone to read when they take out the contract. They aren't a charity, they aren't there to be kind, compassionate or ""fair"", beyond sticking to the letter of the contract that you agreed to when you bought the policy.Just because something ""isn't your fault"" does not automatically put it in the scope of your insurance contract to cover.I repeat what I said earlier - your expectations as to what an insurance policy is and isn't are unrealistic.This whole pandemic has exposed many examples of unfairness in the system - these are extraordinary circumstances and many are losing because of it. I have had an insurance claim denied because of it - they stuck to the exact wording of the contract that I agreed to. I am out several thousand dollars as a result of this. I will in future, be looking for a policy which covers this sort of thing in future, if possible. But I'm not faulting the insurance company for sticking to the letter of the contract I agreed to."
"At the end of the day insurance companies are there to make money. They do this by providing a product which provides a customer with a set of defined benefits in return for the fee payable. If they have calculated the odds correctly, then they will pay out less than they take in. If, on the other, they have miscalculated then they could easily go bankrupt and be unable to pay anything after that point.Maybe that's what's really meant by the odds are stacked in favour of the insurance companies.Where things tend to go wrong is when people make assumptions about what they will get under what circumstances, instead of thoroughly checking it out. Then, when they realise that they aren't covered for this or that, they make a big fuss and start using words like scam, fraud, cheats and thieves.>>>Just because something ""isn't your fault"" does not automatically put it in the scope of your insurance contract to cover.<<<I completely agree. The purpose of insurance is not to cover absolutely everything. Very few people expected a global pandemic of such severity as we're enduring. I don't blame those who weren't concerned about such coverage when they chose their insurance, but neither should anyone blame the insurance companies if coverage was excluded."
"Oh Boy maybe its me but when I uy insurance that says ""cancellation, curtailment,"" I expect if I have to cancel due to unexpected reasons ( hence the insurance) they will honour this, when a clause is buried in the small print that effectivly gives the insurance company an out for ALL pandemics BEFORE that pandemic has been alerted or started then i class that as unfair, I class it as being too highly biased towards the provider, lets say you have an Accident on the way to work and then discover a clause that says if you have a dirty car your not covered that would be unfair, cars get dirty, people get ill and unfortunately we as a society have new illnesses developing all the Time, I have been going to India for almost 15 Years and always buy insurance online where possible as its easier so I have a copy of my old Docs, not all polices are from the same Company yet without fail each one when closely examined since the Ebola and SARS/MERS out break states no cover in the event of a pandemic, tell me how do i insure against that without spending more than I did on the Holiday, the answer is you cant, even the ones who claim they DO cover have a disclaimer to say they dont, that is unfair and in my opinion special notice should be called to these clauses which are very well hidden.I had a visa so I did what i needed to do it was cancelled that is not my fault I class that as an unavoidable action by the Indian Government, my Scheduled flight still flew again how was I supposed to use it with no Visa, its just blatantly unfair and frankly the Insurance companys will continue to rake in Billions each year whilst wriggling out of payouts because people like those who have come along and said its acceptable to act in the way they have been to a lot of folks keep handing over the money for them to profit even moreThats it am not bothering anymore I will take my complaint to the ombudsman with the thousands of others who have met the same response from these thievesEdited: 11:11 am, June 24, 2020 "
"I guess that American insurance is very different to the UK, Europe and Australia, since we simply wouldn't expect to be covered for everything. It is a well known fact that they will not cover you if your visa is cancelled, or you forgot to get one or if you get denied entry into a country - well known to most serious travellers anyway.Insurance companies, like all companies, have to make their money somewhere, and obviously mostly rely on people not making claims. Perhaps they also rely on a number of people not actually reading the small print. And since most people probably never make a claim in their lifetime of travelling, they will be the ones who are confident they're covered, probably haven't read the small print and don't keep a check on what their Foreign Office is saying about travel, they are rather blasé about insurance covering them.If you were in the UK and take them to court, I'm certain you wouldn't win. I don't know about the US to pass judgment, but good luck anyway as you'll need it, as I'm rather cynical you have a case."
"Trancetastic, you have just discovered that life is not fair. I didn't sign up for the restrictions imposed on us all, I can't travel or take a holiday worth bothering with, we are all just having to deal with it. Who can I sue ? You could try your luck suing the Indian government for cancelling the visa, the Chinese government for failing to contain the virus, or the UK insurance market for failing to predict a global pandemic. It could be worse ... you could have been allowed to travel and ended up in ICU in India with Covid 19. Basically a global pandemic is an unpredictable Act of God ( And I've always mistrusted his sense of humour) so unlikely to be covered by any standard travel insurance policy."
"Well I'm sorry I got that bit wrong, it must be because of the way it read. I thought trancetastic was from the US!"
"If your windshield was SO dirty you couldnt see through it and you didn't clean it and had an accident, yeah, I expect your insurer might say you are responsible"
"Ooooo -I love these I say ""Potato and you say Potato."" ""Math v Maths (contraction of mathematics) ""US versus standard English moments Northern traveller - in the UK windshields are called windscreens , hoods are bonnets and the trunk of a car is its boot! (but I agree with your point about not being able to see where oyu are driving)Edited: 12:29 pm, June 24, 2020 "
I love pedantics....
"My husband is a psychology lecturer and he bought one of these ""pedant"" T-shirts (which has a deliberate misspelling on it ) that he uses as an icebreaker when meeting new student groups - at a random moment he asks them to spot what is wrong with his T-shirt and says it is amazing how many have to read it several times over before they get it and some never do !Edited: 1:03 pm, June 24, 2020 "
"Well, apparently you left the discussion, but still:""Oh Boy maybe its me but when I uy insurance that says ""cancellation, curtailment,"" I expect if I have to cancel due to unexpected reasons ( hence the insurance) they will honour this""If the contract that you signed says that then yes, that is a reasonable expectation. If there are clauses in it that have unacceptable exceptions then you shouldn't buy it. It really is that simple."" when a clause is buried in the small print that effectivly gives the insurance company an out for ALL pandemics BEFORE that pandemic has been alerted or started then i class that as unfair,""Maybe but you agreed to it. Why did you agree to something that you consider so unfair? ""I class it as being too highly biased towards the provider, lets say you have an Accident on the way to work and then discover a clause that says if you have a dirty car your not covered that would be unfair, ""It's neither fair nor unfair - it's not a contract I would sign.""yet without fail each one when closely examined since the Ebola and SARS/MERS out break states no cover in the event of a pandemic""Yes that is typical - so they didn't just capriciously add this in for COVID-19. It's been there for a while.""tell me how do i insure against that without spending more than I did on the Holiday, the answer is you cant""Correct, so we have to set our expectations accordingly."" even the ones who claim they DO cover have a disclaimer to say they dont, that is unfair and in my opinion special notice should be called to these clauses which are very well hidden.""If they are written in plain language in the contract you agreed to then they aren't at ALL hidden.""Thats it am not bothering anymore I will take my complaint to the ombudsman with the thousands of others who have met the same response from these thieves""Good luck. This is contract law which I know differs from country to country, but I am guessing that no court is going to support the idea that something you agreed to is ""unfair"" and should therefore be ignored.But good luck on your quest."
