"I must admit that I took WLs post as a joke.It had a smiley face AND a winky face!! Its very hard sometimes to get irony and light hearted banter over in a post? Re Coronavirus, are they testing people in Spain? Both my daughter and grandson have what is obviously the virus, but 111 told her that she wont be tested.She is a teacher and the school needs to know? How will we ever have a true picture?"
"The 15 day lockdown came into law last night.hairdressers,dry cleaners chemists supermarkets tabacs can open. Trips to such places are allowed or going to and from work.otherwise people are required to stay off the streetsIts for the whole country tracey. There have been cases in almunecar and those in madrid decided to go towards murcia and and into andalucia and no doubt have brought the virus with them.so this is preventative.abit after the horse has bolted but better than nothing.not great for the last winter stay before the brexit transition period ends but it is what it is.hopefully it will help to slow/stop the spread"
Not sure keeping the hairdressers open is a good idea - an asymptomatic hairdresser is going to be a superspreader - but the Señoras must have their hair done!
"@Sheila post 110 They need to self isolate for 7 days Your daughter needs to go online to the NHS advice She does not need to call 111 but use the online tool If she requires a sick note , not necessary if she only needs to stay off for 7 days as she can self cert then 111 service can provide , she does not need to go to the GP or call the GP Does that help/ answer the queries I do work in the NHS so feel confident in providing info . However things are fast changing and therefore using the online service is best"
The peluquerias are allowed to stay open so that those unable to wash their own hair - the elderly or disabled - can go and get it done for them. I'm sure they'll do you a quick perm while you're there though.
"Post #18 what about a Shampoo and set?Edited: 6:40 am, March 15, 2020 "
Yeah I find keeping hairdressers the tobaconist and dry cleaners open an odd one. I would imagine some other businesses might be aggrieved by this.
"The unwritten (but generally observed) rule about not using emojis on TA forums is a welcome thing, it does help those of us with optical issues greatly. Please continue to observe it, thanks."
What about dental practice? More so for emergency than basic work.
"Marc, the quickest way to social breakdown would be to close the tobacconists!"
"Its a broad spectrum for what you are allowed to do. Anything thats deemed a necessity.Yeah there would be riots if they cant get their cigs. Or a big que at the Gib border smuggling even more than normalEdited: 7:01 am, March 15, 2020 "
"Ponymad thank you.My grandson (15) recovered after 5 days or so,my daughter is still in bed,I talk to her on WhatsApp video.Another daughter is leaving shopping on her doorstep.111 told her that info is changing every hour and nobody knows what they are doing!I am high risk(lung problems)etc so I am just taking all the precautions I can. My sister and I were planning to come out to Nerja March/April but now we will see what Autumn brings.Edited: 7:54 am, March 15, 2020 "
Gib is shut too.There will be some great hairdo`s if the hairdressers are observing the keep 1m apart rule lol.
"Post 127 sheilamary3, I'm sorry to hear that. If the NHS aren't wanting to hear from people with the virus how on earth can they gauge the number of cases?Stay safe & well."
"@Sheila Good news on your Grandson . Sure your daughter will be lots better soon . Not sure why 111 gave that message as , yes we expect protocols to change , however they have clear word patterns and pathways to follow which get updated . Should anyone start to feel Shortness of Breath and worsening they should call 111 not the GP , 111 will then arrange Care Wishing them all the best We can’t get over ourselves and pleased not confirmed flights . Will see what things look like in 2 months One thing for sure it’s going to be more difficult in the UK very soon"
"Edward sissorhands will come in handy at the hairdressers mantalk!So Gib has closed shops aswell? Wonder if they will shut the border or is ££ too important there.The uk doesnt want offical numbers as it thinks its in some sort of comp with the rest of europe and can pretend the problem isnt as bad there.the westminster goverment is obsessed with the economy and £££. The U.K is built on money and will leave it till the last minute to protect the economy rather than the public. In reality they just want to delay as much ad possible as the NHS cant handle a ""normal"" winter let alone mass illness. Hancock at last admits they dont have enough ventilators etc and will buy them off anyone!"
The streets of Nerja are being disinfected.Well done Nerja limpia!!!
Probably very strong stuff wanderingloiner. (hipoclorito)
"So you can have your hair done, buy fags and get your suit cleaned! I love Spain. ;)"
"Hey sorry for the bad news, I live here right now and you can’t go out into Nerja, only for Food and Medicines. All restaurants shut, all businesses apart from Pharmacies and Supermarkets. Once again im sorry, good luck on your trip ..."
"Hi there, as a resident here in Nerja, I am so sorry to say that as from Monday 16th March a total lock down has been ordered by the authorities for 15 days. That said, the police went around 2 days ago and closed down all the cafes, bars & restaurants etc."
"Posts 137 & 138, have you been living in bubbles? LOLIt was yesterday, not 2 days ago, that the bars & restaurants were closed down (approx. 5pm). Also the lockdown doesn't begin tomorrow (Monday) it has already begun!"
"To LDRML and Nick G - fortunately, even in the most dire of situations such as this, most other forums don't greet you in such a hostile and unfriendly manner.Thank you for your information. It's worth looking at the other forums and threads currently running as much of the information may have been duplicated or mentioned elsewhere. Stay safe."
Just as suspected!! LOL
"What a load of bollocksEdited: 5:01 pm, March 15, 2020 "
"Sorry, this was meant for one particular post and I assumed I’d responded directly, not in general. I’ll try to take it down as don’t want to offend general well meaning people"
"Ironic that some people are making light of the Spanish/local government decision to close down everything to slow the outbreak, yet their own home country government is doing F all. Funny!"
billyclub totally agree with you! And it is high time the UK did something significant
Just travelled back from there today after a lovely week there. The entire town went on lockdown from yesterday. Beaches are closed and the police are on full force.
"Surprised at the amount of people and cars out in nerja today while on the way to the supermarket. No poilce checkpoints.saw very few police about. Very difficult to inforce on a weekdayEdited: 8:02 am, March 16, 2020 "
"I've just flicked through all the Spanish webcams on Skyline and Earthcam and it's like a zombie movie without the zombies. There are cars and vans moving... and buses, but streets and beaches are pretty much empty. It's a very eerie thing to see. I watched the seafront cam in Fuengirola for 5 minutes and only 2 pedestrians walked by."
"Sudaft, I think it's very difficult for people to understand lockdown unless you are actually part of it. People are not allowed out of their homes unless to visit the supermarket or walk the dog etc, and then it must be just one person.Tonight the land borders will be closed too!"
Seen many cars with 2 people in today.lots of people walking about not carrying shopping etc! very discriminatory to those who dont drive.they are expected not to leave their house for at least two weeks.they cant even do their own shopping? its Probably going to be three going by what members of the goverment say aswell.Saw someone with an almost full on style world war one type gas mask on today. Had to stop myself from laughing. Well i guess it offers more protection than abit of cotton over your mouth thats prob full of germs and as said by the experts will do nothing at all to stop you getting infected. We certainly are living in strange times.
"Just read in the Olive Press (sorry I haven't got the link) that up to 12,000 people could lose their jobs in the hotel sector in Spain. Thats devistating!"
I would think it will be a lot more than 12000 people
You're correct. That was the figure for the Costa Del Sol.
And all the bars and restaurants/shop.the goverment is meeting today to discuss plans to help workers and business.
"I hope they do Loiner. Same with all other countries including UK, otherwise there's going to be hardship and a huge knock on effect."
"All bars and restaurants, beaches, shops and sport facilities are closed, open are only pharmacies and food shops. People must stay at home but may go shopping, to the bank or doctor. It is a ghost town, but no panic is seen. It is said that the closing will be at least until 16 April."
"Thought lock down was (15days) until 29th March, then a review is to be made :-(( x"
Thats correct 15 days until the 30th at the mo. By law they cant do more than 15. But a minister said yesterday that theres a chance it could go on for another week or so. It all depends on whether theres any drop in the numbers.what effect the lockdown has the amount diagnosed etc
"Although it effectively started earlier, the 15-day period runs from 08:00 Monday 16th March, and almost certainly will be extended. The figures coming out of Italy after 8 days are not encouraging."
"https:/…The Government warns that the state of alarm will have to be extended beyond 15 daysThe closing of the country's borders becomes one of the following measures to adoptCoronavirus live, latest newsQuim Torra tests positive for coronavirusVictor Ruiz de AlmirónVíctor Ruiz de AlmirónFOLLOWMADRID Updated:03/16/2020 22: 02hSAVE188RELATED NEWSDefense will also have the Army as Military Police and to build military campsDoubts and gaps about the 15 days of confinementThe Government recognizes that the state of alarm will have to be extended beyond the initial 15 days allowed by law and that are contemplated in the Royal Decree. An extension for which he will have to go through the Congress of Deputies but for which he has guaranteed the necessary supports because both PP and Citizens will support himIn an interview this morning on Radio Nacional de España, the Minister of Transport , José Luis Ábalos , acknowledged that this exceptional situation will have to be extended: ""It is fifteen days because it legally requires that it be fifteen days, but it is evident that we will have to extend the situation, we will see with what measures . In 15 days, I don't think we have the capacity to win this battle, ""he acknowledged.""Ábalos is one of the four ministers who make up the command bridge as delegated authorities in this crisis and below the Prime Minister. Today, he acknowledged that the hardening of the initiatives “will depend a lot on the capacity of the measures taken and their compliance. If we are all responsible and do not trivialize, obviously they will have more effects ».He acknowledged that they do not have a certain timetable regarding when this situation can end. But he anticipated more forceful initiatives: ""It is clear that if we do not take particularly harsh measures, slowing down the spread of the virus and the impact it is having on people's health and lives would have no effect.""In this idea of ​​taking tougher measures, the Interior Minister, Fernando Grande-Marlaska , another of these four delegated authorities, has clearly pointed out what one of these new measures would be: ""It is a real possibility that Spain closes its borders to fight against the spread of the virus, ""he said in an interview on Cadena Ser.In another interview on Spanish Television, the government spokesperson, María Jesús Montero , preferred to be more cautious about prolonging the state of alarm and said that there is no need to make hypotheses."
"Thanks for the info mantalkEdited: 1:49 pm, March 18, 2020 "
You`re welcome (courtesy of Google translate too lol)
We just returned to Nerja on March 15 and it was a ghost town. Do not go if you want to be confined to your hotel room. Police are roaming the streets.
All spanish hotels are been closed next week. The land border is closed to non nationals/residents and theres very few flights.so i doubt anyone has any intrest in coming here unless you are trying to get home
"The Spanish government has confirmed it has NOT given an order to close hotels in Spain from Tuesday 24 March.The BOE decree states ""in a constant and progressive"" way hotels and all type of accomodation should ""limit their activity"".Spanish Government confirmed that ""hotels are no longer accepting reservations and will attend to guests until their departure, doing everything possible to keep an orderly situation, without ultimatums or sudden closures"""
"-:- Message from Tripadvisor staff -:-This post has been removed at the author's request. The author may repost if desired.Posts on the Tripadvisor forums may be edited for a short period of time. Once the edit period has expired, authors may update their posts by removing and reposting them.To read more about editing your posts, please follow this link: http://www.tripadvisor.com/help/how_to_edit_your_postsRemoved on: 11:36 am, March 19, 2020Edited: 11:36 am, March 19, 2020 "
Your post just came up in a search I did. I imagine you know by now the situation in Spain and have cancelled your holiday. Just wanted to say sorry and hope you'll come when this is all over. Cause we will get through it and Nerja will need you. Nerja is going to do it really tough with its reliance on tourism. So sad for such a beautiful town.
Lots of conflicting information around as you know. I'm reading that they have signalled their intention to publish a ministerial order in the next days to close by the 24th March giving businesses a weeks notice to do so. https://www.europapress.es/nacional/noticia-… The UK travel advisory also said this when I looked earlier but now seems to have changed. Is the BOE you refer to from today ie dated 19/3? Not meaning to imply you're wrong. It's just so hard to keep up as things are constantly changing.
"apart from whether the details of the closure of hotels and campings is correct I just noticed that noone has actually told you the state of things here. Hotels are being commissioned in other parts of Spain for hospitalization of non serious cases. Govt can do so if they are needed in any zone. In all parts of Spain noone can leave their home/accommodation except to go to supermarket/food shops, pharmacy, medical/vet etc, ie only essential services. and can only go out alone. no couples unless one is disabled/cannot go out without help (there are some exceptions but tourists aren't among them), no groups no families. no going for a walk or run, nothing for recreation.no general shops bars or restaurants. can take dog out to pee but not to walk them far. (specific distance and time restrictions depend on the town). parks beaches and public spaces closed and patrolled by police and guardia. conditions dynamic and subject to change. apart from all that cases are growing at 25% and there are cases confirmed (I believe) in frigiliana, algarroba (1) and velez malaga. there are shortages of masks, gloves and hand sanitizer. not the place for a holiday right now."
"Also just saw this on a group https:/…The FCO advises all British travellers in Spain to contact their tour operator or airline as soon as possible, to arrange their return journey before 24 March."
"There are no confirmed or possible cases been reported in frigiliana or nerja. The last updated info from 4 days ago was 13 in cases the axarquia. 7 in velez,5 in rincon and one in algarrobo. There was also a few in almunecar who were health workers. Touch wood the east of malaga is doing far better than malaga and the west with a lesser population."
"Hope it stays that way for you, keep doing what you're doing to keep yourselves safe."
"Goverment just announced in a ""boletin"" that all hotels etc should close by the 26th"
"Post 170, wanderingloiner, a tough ask but fingers crossed that these measures work & we can stay clear of it. A bit of warmth / heat would help but that's not looking likely for the foreseeable future."
stay where you are
Looks like another 15 days of lockdownhttps://english.elpais.com/politics/2020-03-…
"Total lockdown, stay at home"
Surprised italy took so long. Day eight here.Ports and airports shut. Over 460 deaths in one day in spain today.a sad record
"All shops and businesses (except supermarkets, tobacconists and pharmacies) are closed - including bars, restaurants etc. The beaches are cordoned off and the police and army are patrolling the streets - fining anyone outdoors for no legitimate reason."
"Some businesses re opened on monday.construction, industry, gestors etc. As the economy was taken out of hibernation mode. there is more traffic on the roads now as infection rates continue to drop.the goverment is thinking about allowing kids outside before the 26th deadline.The legion based at ronda have been helping with roadblocks in nerja and the surrounding towns and helping at velez hospital. Only a handful of them."
Hi I’m a big fan of Nerja it is such a beautiful place. We have been there 5 times now. We had thought about moving there but after reading something on one of these forums I’m not so sure now. The person was saying that he lives in Nerja but was desperate to get back to the uk because he has been a victim of burglaries by the Nigerians that sell things on the beach and that he has been terrorised by them and having their property broken into!! Have you heard of such things happening? Thanks.
"Post 180""Have you heard of such things happening"" Nope. And the looky looky people (beach sellers) are from Senegal not Nigeria."
"Post #180It's well known that Nerja has had issues with drugs and robberies etc, and also late last year problems with the vagrants blighting the area, but I've not heard of the issue you're referring to. That doesn't mean to say that it's not happened - if you trust the source then one has to presume it's reliable.Many places are not the quiet idyllic resorts they once were unfortunately. Having said that, Nerja does have a lot to offer."
"I have not heard of any similar incidents to be fair but that doesn’t mean it’s not happened, At the moment there aren’t any sellers around as there are hardly any people around full stop so his problem may cease. I have never been subject to any crime in fact I haven’t even seen as much as a fight. In the summer I have heard of tourists having their bags snatched and then there are opportunistic thefts as people leave their phones and bags lying on tables outside. For me it certainly feels very safe and apart from some very bad driving in town it’s great! Try reading some of the local press online and you will be able to ascertain the crime levels and whats happening in Nerja and if it’s somewhere you could live or not."
Home breakins are issues at times. they will be when theres a huge amount of empty houses and holiday homes which are easy pickings for electronic goods and cash.Normally involves gangs who travel from one area to another.you get a cluster and then nothing.but they tend to be groups from morocco and eastern europe aswell as home grown.never heard of involvment by the lookie guys.The CDS still has its rep especially on the west coast but unless you are an irish or swedish etc etc gangster or highend drug lord then you should be ok!
"I think this old post from a year or 2 ago sums it up, https://www.tripadvisor.co.uk/ShowTopic-g315… Most places have some crime elements, mostly petty stuff like pickpocketing/bag snatch etc. Keep your wits about you and take the same precautions you would at home."
"Post 185. It certainly does sum it up! The man of infinite names ;-)) As for the ""Impact of Coronavirus"", Malaga province is now in Phase 1 (of 4) & some bars & restaurants are slowly reopening, also people are getting a little more freedom - but we'll have to wait a bit longer to see if that has had any impact on the virus."
"I do hope this doesnt refer to me Violette ""The man of infinite names ;-))"" semi friendly wink or not I can assure you since joining TA in 2008 as Mantalk it remains the ONLY name/profile or whatever else you wish to call it, that i have used."
"Post 187, not at all - you were not even on the page you referenced in your post..I assumed that you would be astute enough to understand the poster with infinite names."
