"In the midst of a deadly coronavirus outbreak centered around Wuhan in Hubei Province, China, two voyages on Spectrum of the Seas from Shanghai, China, have been been cancelled. These short “Best of Japan"" cruises were slated to depart today as well as on January 30.Jonathon Fishman, manager, corporate reputation, Royal Caribbean Cruises Ltd., told Travel Agent this morning: ""In light of the latest developments with the coronavirus outbreak in China, we are suspending the January 27 and January 31 sailings of Spectrum of the Seas, currently our only ship homeported in China. We are working with our guests to provide full refunds for the cancellation. The health and safety of our guests and crew is our primary concern, and we continue to work with the World Health Organization, the Centers for Disease Control, and government health authorities to monitor the situation.""Costa Cruises also cancelled last Saturday's cruise of Costa Serena from Tianjin....Read the link below for the complete article...https://www.travelagentcentral.com/cruises/m…Edited: 9:07 pm, January 27, 2020 "
"Kind of late for that kind of decision. Their guests are most likely already enroute. Now they have to re-book hotels, flights, etc with no lead time. If they are just getting a refund, they'll still have to spend big bucks. Hope they have travel insurance."
Surf I think you're correct.Very similar info to what I posted this morning (AEST) on this post.https:/…105149538
"Smart Traveller:""Overall advice level: Exercise normal safety precautions"""
"As of today the Aust Govt has advised people not to travel to China. This is not only due to the virus, but also due to the possibility that anywhere in China may be locked down and you may be stuck.We are due to leave from Singapore in April on a Princess cruise that is due to finish in Shanghai, which is the only Chinese port (not counting Hong Kong). I'll be interested to see what Princess do as it now appears Chinese ports will have to be cut. We were flying back to Aust from Shanghai after three days there post cruise so that will likely have to be changed...but I hope the cruise goes ahead. The last three ports were Nagasaki, Busan and finally Shanghai so I'm hoping they can rework those and we just finish in Japan. We have done a few cruises of late and I think this one is doomed. Last year we had this one booked and I had to cancel due to a hospital stay and now this.Edited: 4:25 pm, January 28, 2020 "
"@PerfectlyPerth #4 - regarding insurance, just about every company does not cover for epidemics such as viruses. I checked mine yesterday (CoverMore) and they don't. There is an exclusion paragraph about viruses, epidemics etc at the end of just about every item that they cover."
GraemeGCThe Circle Pacific leaves Sydney 15th April and has some of the same ports as your cruise - it will be interesting to see what Princess does.
"GraemeGCRe your post and insurance, does Covermore have a statement stating you can ""cancel for any reason"" ?"
I just received this article regarding trip insurance...https:/…coronavirus-travel-insurance-faqs
We are scheduled on the Crystal Symphony on February 15th. We have been told they are not canceling the cruise and we are not being offered refunds or vouchers for a future cruise. :-(
"That's still more than 2 weeks away mfb. It's a very fluid situation, no other lines have cancelled cruises that far in advance as yet either. It really will depend on how the situation develops. The cruise line isn't going to sail if the ports are closed, should the situation deteriorate further"
"Thanks JudyI don't know if many - or any - travel insurances offered in Australia have the ""cancel for any reason"" policy included."
MFBI saw they were not stopping in Hong Kong for embarkation are they assisting you for the new embarkation port ?
"lht,Where have you seen that Crystal have dropped Hong Kong? I have found no reference to that. I am sailing with them from HK 16 March."
"@DougOz - yes I did take the cancel for any reason option on my CoverMore policy. This option is a recent introduction from them and they are one of the few (perhaps only) companies that offer this in Australia at this point in time. After my cancer diagnosis, which is fortunately much improved, this option gives me far more benefit than I could get before.So yes, I am covered although I think cancel for any reason on CoverMore covers only 75% of the costs up to a $10k limit."
GraemeGCGood to know about that option - thanks for that info and best wishes for your continued improvement.
Cheers DougoOz. Immunotherapy is a wonder treatment if it works as it is for me. Of course people's health comes first but I hope our cruises happen. I'm just waiting to see what Princess do as it seems pretty clear that Shanghai will have to be replaced. The stop prior is Busan and I'm not sure if that port and airport is set up to start/finish cruises. I haven't been to Yokohama/Tokyo so I'm hoping they just finish there.I guess we just have to wait and see. I'm happy to just go where the cruise takes me and I'll adjust flights and accommodation as needs be.
"Frommy it was on the CC in the Crystal forum plus someone mentioned they checked into their PCPC account on the crystal website & it was noted that Taiwan is the new embarkation port This was for the Serenity scroll down the page https:/…Edited: 10:46 pm, January 28, 2020 "
a couple of news stories on CChttps://www.cruisecritic.com/news/5016/https://www.cruisecritic.com/news/5026/
Frommy Sorry I meant the change was for the Symphony
"""it was noted that Taiwan is the new embarkation port ""Ha ha. That was me. The roll call noted a change to the itinerary on the sign in page and I followed that up with Crystal directly then posted to the CC Crystal pages as well.Your information was posted a few hours before I became informed though. Thanks.Edited: 2:00 am, January 29, 2020 "
FROMMY as long as you got the info all is good
"The Holland America Westerdam, originally scheduled to depart 29 Feb 2020 from Shanghai had a China focused itinerary. As a result of the coronavirus spread, HA has just changed embarkation to Yokohama and canceled all Chinese ports except those on Taiwan. This results in dramatically different cruise than passengers had signed up for originally. Nonetheless, HA, citing its discretion under the ""safety"" provisions of the tickets sold, refuses to offer passengers an option to cancel for refunds and takes the position that passengers will forfeit the entirety of their cruise payments if they do not elect the alternative voyage unilaterally selected by Holland America. This alternative basically circles Japan for 30 days with two short stops in Korea.It is likely that there are passengers from mainland China who are booked on the cruise since it was originally scheduled to embark from Shanghai. However, Holland America informed me it will only use a questionnaire to screen for coronavirus for those not showing symptoms (such as a fever). Of course this can be a big problem for the passengers and crew of almost 4000 since the symptoms may not appear for up to 14 days but those infected are still contagious while not showing symptoms.This is in complete contrast to the way many reputable cruise lines have handled the crisis, where refunds are now offered when the cruise lines are unable to safely provide a China itinerary. This speaks volumes about Holland America's attitudes towards its customers and will certainly influence my decisions regarding selection of cruise lines in the future."
"Thanks for the links LHT - good information in there IMO.jrsedthanks for your information about HAL - interesting that they choose not to give people the option of cancelling with a refund or changing to a different itinerary.A recent thread on the Sydney (Australia) forum highlighting the need for Travel Insurance which covers ""cancel for any reason"". - https://www.tripadvisor.com.au/ShowTopic-g25…"
"-:- Message from Tripadvisor staff -:-Tripadvisor staff removed this post at the original author's request.To review the Tripadvisor Forums Posting Guidelines, please follow this link: http://www.tripadvisor.com/pages/forums_posting_guidelines.htmlWe remove posts that do not follow our posting guidelines, and we reserve the right to remove any post for any reason.Removed on: 2:42 am, February 22, 2020"
"Good info, jrsed, and welcome to the forum. Luckily, the cruise line has four weeks to gather more data on danger and to establish appropriate policies for vetting passengers."
We have received an email that our cruise on Sapphire Princess that was due to finish in Shanghai on 2 May will now not visit Shanghai and finish in Yokohama. I assume that the next cruise that was due to depart Shanghai will also be affected.
"GraemeYes it is affected. I saw a post on FB from another Aussie where Princess has offered them a full refund as has the airline, however the Agent he booked with wants to keep the lion's share of the monies paid !"
"@DougOz - no mention at all of a refund in the email I received from Princess. Just a simple advice about the disembarkation port change. Mind you, I am keen to do the cruise and don't want a refund if possible.If anything an upgrade as I expect plenty of cabins to become available as today is final payment day for most.Edited: 6:15 am, January 30, 2020 "
".Just had a newsflash that the Costa Smeralda is on lock-down at Civitavecchia with 7,000 people on board, as a Chinese couple have developed fevers and breathing difficulties - and so, potentially, the Coronavirus.."
i see on CC some lines are issuing statement that if you were in China in the last 30 days you will denied boarding & also if you have a temp of or more 38C or 101.4 F you will be denied boarding  I guess Costa did not screen their pax or they lied about being in China
Not included in standard policy it is an additional extra
"Yesterday, Princess put up a statement on their website about the Coronavirus indicating which ships have had a turnaround city change in lieu of Shanghai.Other sailings where Shanghai was a stop are being changed and in our case, we will most likely get another port in Japan.https:/…coronavirus-update.html"
The NZ Govt today advised that the NZ Border is closed to foreigners who have been to or transited China in the past 15 days. This policy will be reviewed every 48 hours.
Crystal have changed the embarkation port to Taiwan on 16 march
Have you been able to get any insurance cover or did you get insurance early?
"@enneiviv - I notice you are in Oz so just a general comment re insurance. You can out travel insurance any time up to the trip, although you are only covered for things booked after you take out the policy. If you are referring to Cancel for any Reason insurance, this has to be booked when you book the trip, or within a day or two I recall. You would have no chance of adding this now.Edited: 12:59 am, February 04, 2020 "
"I slightly disagree. You could certainly now purchase travel insurance, but it would be worthless if you tried to claim anything related to nCoV."
Japan has ordered Diamond Princess into quarantine after a passenger who disembarked in HK has been found positive to nCoV.https://tinyurl.com/tjaj8oy
@Frommy post #41 - I might have worded it badly but my point was that you cannot just add Cancel for any Reason coverage later on. It has to be purchased when you first purchase the policy.Otherwise anyone with any concerns about Coronavirus could now rush off and get Cancel for any Reason cover and then just cancel. I took out this cover for my Asian trip months ago when I booked and I am covered if I cancel - for any reason.
"Yes, but “cancel for any reason” usually is only 80% return but that’s way better than 0%.I have been buying it for several years, only costs a bit more, but worth the peace of mind to me."
"Graeme,My point was that the OP can still purchase it, but it would be as useless as t,ts on a bull. I agree with your points at #43, but I think you missed my point that you could buy insurance, not that you can't, and some silly people will actually do that. There have been several posting on the Air Travel and Cruises forums, and on my CC roll call for an upcoming Taipei/Japan cruise, who have seriously considered foolishly doing so."
there is an update on CC on what the various lines are doingseems some are not allowing pax that transitted through HK onboard https://www.cruisecritic.com/news/5016/
"@GraemeGC So if you not canceling the cruise, you will have to pay for new airfare from Tokyo yourself right? Since your policy is include cancel for any reason but you are not cancelling. Asking because I m on that cruise as well."
OZ 138 have you checked with your cruise line to see if they are offering some compensations for having to change flights to the new port of embarkation/disembarkation?
They do $250 per stateroom
"Oz138 post #47 - this is one of the rare cruises we have done where we used the Princess EZair option so the Singapore Airlines flights are booked through them. The email I received from Princess is that they will re-book the flights now from Tokyo and that there is no charge. If you are using a TA I'd get them to sort this out for you, if not, I'd be on to the airlines. A number are allowing people to change as the Govt now requests we do not go to China. If you were booked Singapore Airlines they have flights back from Tokyo via Singapore, which are similar times to what you would have had from Shanghai, and Qantas have direct flights from Tokyo to Brisbane every day. We are staying 4 days in Tokyo post cruise."
"@GraemeGCLucky you!! I booked with SA before I found out about Eziair.Called SA and they only waive change fee up to travel date 29 Feb. Will wait to see if SA will extend date otherwise will have to pay change fee plus price different. Now that all of this happened I read my PDS properly, I dont think I would be cover for flight change, delay or cancellation anyway.I m thinking of buying add on for this feature but not sure how will the new cover work since I have not purchased my new flight yet.I know if it related to to the virus I wont be cover. I am cover for medical and emergency and all that but now worry that if my flight delay or cancel and I cant get to the port in time and vice versa."
"@Oz138I think that for sure SIA will have to extend the date. It was 5 Feb initially and then they extended to 29 Feb. After all our Govt is saying don't go to China so I don't really think SIA have a choice. Of course the worry is that flights will fill up, but I doubt it. My calls to SIA would be quite frequent though until they changed the flights."
"Princess Diamond now has 10 pax testing positive for the Coronavirus. Hope does not get worse onboard.the good news is a person was released from the hospital having fully recovered, so it’s not guaranteed worst outcome."
Princess Cruises are horrible.Refuse to give even a credit for our Asia cruise March 12 that has every port infected with the coronavirus. Terrible customer service and attitude.No regard for their passengers. Do not seem to care they will lose so much future business because of the spread of ill will. Wow.
"Wander, welcome to the Cruise forum with your first post, What did your travel insurance say ?"
"Hang in there, Wander. The way things are going now, your cruise could end up being cancelled anyway, in which case you would get full refund. I would just wait and see what happens over next 2-3 weeks."
"Wander: Also note that w/regard to passengers whose cruises have been cancelled due to 14 day quarantine of Diamond Princess in Yokohama, Princess is apparently giving full refund PLUS credit for free future cruise. Am not sure I read that correctly as seems too good to be true, but you can check the press release yourself on the Princess website. So I wouldn't rush to cancel right now."
WANDER # 54Your cruise may not be cancelled but the itinerary may change a lot This situation is very fluid at the moment & if the ports have a high rate of illness due to the virus they will be changed people have to patient ..the cruise lines are all trying to keep their pax safe & finding new ports is not that easy in the current situation
QQ2 I believe it is just for the Feb 4 https:/…diamond-princess-update.html
"Thanks, yes I noticed that when I looked at it a second time."
"This is all well and good but there is more to a cruise than just the cruise. You have airline tickets that are difficult to get anything back on,especially at the last second. I called Singapore Air and they issued me a credit for a future flight without penalty,as they should have. You also have your life to live and schedules. They should have honored my request for a credit for a future cruise. I did not ask for a refund. Their complete lack of understanding of how to keep a customer is astounding to me. By refusing to simply issue a credit,how much future income have they lost from me,my family and others that I speak to?Edited: 12:39 pm, February 05, 2020 "
WANDERGood you got an air creditthe virus is changing circumstances of travellers by the minute If you cannot get any relief from travel insurance you are out of pocket if you cancel but doubtful the cruise line will cancel the cruise Many lines are scrambling to change the itineraries
"I booked the cruise because of the itinerary. I do not want another itinerary. Princess should have some common sense and do the right thing by it’s customers. I guess that is too much to ask.What is not too much is for them to know they will lose many future customers and that I will do everything in my power and through social media to make that happen. This is just not acceptable to me.They are being completely unreasonable and that will come with a cost.Edited: 2:42 pm, February 05, 2020 "
This is just my opinion I think all cruise lines should pull out of Asia for the foreseeable future Cancel all upcoming cruises there & take the ship for a deep clean then to another part of the World They could offer a refund & hope the company survives this Does not appear to be an end in sight with the virus still spreadingMore cases seem to be popping up dailyhttps:/…bda7594740fd40299423467b48e9ecf6Maybe not feasible with so many ships now but they need to do something
I think the cruise lines would be having some very serious managers meetings.The running cost of these ships would be mind boggling and just to say let’s go somewhere else would be a courageous decision.With SARS a few relocated to Australia but I think there’s a lot more ships in the equation now and australia is a small market.
"I am booked on Crystal Symphony for what originally was a round trip Hong Kong cruise, so my flights are to/from HKG as well as accommodation bookings. That cruise was diverted to sail from Keelung, Taiwan, and I decided to keep the HK arrangements taking additional flights HKG/TPE. As of today the Taiwan Centers for Disease Control have announced this:""Starting from February 6, travelers with a history of travel to China, Hong Kong and Macau are required to be under home quarantine after entering Taiwan. Nonetheless, travelers returning to Taiwan who were permitted to visit Hong Kong and Macau are required to conduct self-health management for 14 days.""I have referred this to Crystal, Sydney, who have relayed it to the head office for further advice.It would now be very good for us if the Australian Government issued a ""Do not travel"" warning for HK and for Crystal to cancel the cruise, but I would think there would be a snowballs chance in hell of that happening."
Diamond Princess is now up to 20 cases of the virus and total will probably go up...all passengers quarantined in cabins for 14 days...agree with 64...just get out of the market.
yes Surf good point 14 days at minimum.
time for the cruise lines to rethink Asia cruises for the next few months with all the changing of ports & people having to change flights ports not allowing ships that have been to HK and other ports I wonder if it is really worth all the agro for pax & the logistical nightmare the cruise line must be going through JMO
"@Iht28 - I can see where you are coming from but I hope they don't skip Asia, although I am coming from the position of someone who has an Asian cruise booked in April. Our cruise has already been changed from ending in Shanghai to Yokohama and that doesn't worry me at all.I have had to change my accommodation post cruise to Shanghai to Tokyo and my return flights but I certainly was not stressed about it. Quite easy to do.Of course things might change but it seems to me things are pretty well contained outside of China now. Just the way it is from my viewpoint at the moment."
The cruise lines have a simple solution called refunds or full credits.
Taiwan bans all cruise ships:https://www.reuters.com/article/us-china-hea…
"Wander770029""I booked the cruise because of the itinerary. I do not want another itinerary. ""... just as pretty much every cruiser does ...but if you read your Contract of Passage, the cruise line reserves the right to change the itinerary ... that's the chance you take when you book a cruise regardless of whether or not there's a Pandemic or not.FormmyThanks for the link re Taiwan ... I think it's a matter of time before more countries in SE Asia ban ships. Given that our cruise in has some 5 ports in Japan on it's intermarry in May this year, I suspect after the Diamond Princess they may change their tune...the only thing in our favour is that boarding for this cruise is Sydney however the next leg is from Yokohama !Re cancelling cruises ...It wouldn't surprise me if I hear of cancellations due to ""medical reasons"" ... easy enough if you do have a pre-existing medical issue and a sympathetic Dr !!"
Hi. I’ve just returned from a South Pacific Cruise on Carnival Splendor and unfortunately we had itinerary changes due to Coronavirus. I’m interested to know if the Carnival Spirit was able to visit Isle of Pines on it’s 11 night cruise January/February 2020 & would appreciate hearing from anyone who was a passenger on Spirit.
"Diamond Princess had been staying off shore in Port of Yokoahama until yesterday (Feb 5). She docked today in Daikoku Wharf for food and drink supply. Over 3,000 passengers and crews are requested on board. Passengers remain in their own cabin room. Meals are served to the room. Today, those in the room without window are permitted to leave room on the condition that they wear mask on and sanitize their hands for certain period of time. 20 infectious passengers and a crew were hospitalized on shore."
Holland America's Westerdam was refused to dock by the Philippines and Taiwan. It may be similar in Japan.
more newshttps://www.cruisecritic.com/news/5057/https://www.cruisecritic.com/news/5066/It is not looking good for cruises in South pacific either
Graeme I wish you luck with the cruise it seems more cases popping up daily even outside China Frommy I see Crystal is in limbo for now hope they find a port to dock at
"Well,we booked a cruise through Asia. Are they going to change the itinerary to the Caribbean?I do not believe they have that right and every scheduled port is infected,so I don’t think so.Again,that would be the absolute worst customer relations thing they could possibly do. It is one thing to slightly change an itinerary dues to weather and another when there is no safe option due to the coronavirus and all of the unknowns."
"Hey Princess,do you see a problem here? Unbelievable."
"Well boo hoo, Wander. Just suck it up like everyone else. It is not the fault of Princess and it is clearly stated in every cruise lines T & C's that there may be changes in itinerary due to circumstances beyond there control. If they can't provide a similar cruise from the same port it will be cancelled.I would not cancel the cruise and if you want a refund wait until they cancel and you will receive that and credits towards another cruise."
"Well the problem is I can care less if they think it is safe. So people just have to wait until the last second and now are in a world of hurt with flights,hotels,etc. If passengers have a legitimate concern for their health like a global health emergency, they should be accommodated. They can write all the fine print that is 100 pct skewered to their profit they want, it does not make it right.A business that does not offer good will to it’s customers will suffer. It is clear Princess will only act if forced by the government. That is their attitudeEdited: 3:29 pm, February 06, 2020 "
"Wander, obviously you’re new to cruising. Your moaning on and on changes nothing. You are unfamiliar with your own cruise contract you signed and agreed to. That’s your fault.You chose not to purchase travel insurance. Also your responsibility.The entire cruise industry is not going to change its business model MO because Wander just showed up on the scene and he knows better than anyone else what’s supposed to happen when Himself is displaced or inconvenienced. It’s only a global emergency.Of course, your travel plans are paramount to the cruise industry during this time.Do you even “get” how you are portraying yourself here ?Edited: 4:37 pm, February 06, 2020 "
