"I read on FB the other day about some people who had just arrived in Singapore for their cruise the day before departure only to learn the cruise was cancelled presumably while they were in transit. Consequently a long flight, a night or two additional so they could organise flights home, then sort out their cruise being cancelled and submit a claim.One thing's for sure ... this is such a fluid situation like we've not seen before (that I recall) and I would say that Princess and other cruise lines are throwing whatever resources they have into this issue as much as they can / as fast as they can / as changes occur.I do know that Princess sent out a bulk email to all passengers to inform them of changes several days ago - we did not receive an email however someone contacted one of the Princess offices and was told a lot of emails bounced - they dont know which ones - potentially thousands - and they were looking into their systems to see why this happened.Another thing has become clear to me ... many people do not look at their cruise line web site ... do not think to teach for ""coronavirus"" in the search box and seem to rely on travel advisory forums etc .. or wait for an email from their TA.By the way, friends are on the Sun Princess out of Perth heading via SE Asia to Cape Town and return. They departed on 24th Jan, first stop Singapore on 30th Jan, Phuket on 1st Feb, Colombo on 4th Feb, Seychelles on 8th Feb, Zanzibar on 11th Feb then denied entry into Madagascar on 13th Feb as it had been 12 days since they left Phuket.As I noted above, things change everyday even if you think you're ""safe"" and not affected by this virus."
"In terms of port charges/taxes refunds, my impression is that cruise lines put these into a separate account bucket (in their own accounts), and so refunds may be processed for these separately. It's not unusual for a port to be skipped even on an otherwise normal cruise because of weather, and port charges are refunded in those cases. Singapore has a significant count of coronavirus cases, with numerous examples of local spread, so many other ports seem to be getting jumpy about accepting ships which boarded in S'pore. I suspect Singapore, by nature of their geographic/political environment, has probably the most accurate picture of their coronavirus spread of anyplace in the world. I expect local port officials, even well away from Asia, are going to be *much* more picky about ship health reports before granting ""Pratique"" (clearance to use the port). Unfortunately, the cruise industry as a whole has a bad reputation (among those who pay attention) for norovirus and respiratory infection spread onboard ships. If a cruise line suddenly shows up asking for permission to dock their ship out of the normal schedule, local port officials will know it's because they got denied elsewhere and that they risk some awkward headlines in the local media.Edited: 7:32 pm, February 14, 2020 "
"Wall St Journal is reporting that US govt is going to evacuate all asymptomatic Americans (actually, I think also only those who WANT to leave) from Diamond Princess and fly them to US (likely Travis AFB in CA) on 2 flights, with possibly both leaving by Sunday. All will have 14 day quarantine in US, either at Travis or Lackland AFB in TX."
"Japan reported 67 new cases from Diamond Princess today (from NHK, equiv to BBC). There's also other spread in Japan, including a taxi driver in Okinawa who drove DP passengers when the ship stopped there.In the *really* bad news department, Malaysia has reported that one of the passengers from HAL Westerdam, who had gotten off in Cambodia and was flying home via Malaysia, has tested positive. Further flights of Westerdam passengers (at least via Malaysia) have been stopped. This was from Straits Times, a pretty sober and reliable news source in Singapore. This leaves most of the Westerdam passengers and crew stuck in a country with very limited medical resources."
"Yes -iht - we were on Silver Spirit. However we used a UK travel agent to book.SS are refunding the cost of the cruise back to the travel agent but it was the travel agent (SixStar) who packaged together the flights, hotels, etc..Legally we have no contract with Silversea, only with SixStar. I have emailed SixStar but so far had no esponse (I suspect they are inundated but some acknowledement would be useful). Silversea were refunding passengers who had booked direct but I have no idea whether than include arirfares & hotels.Silversea attempted to handle the repatriation flights but it was a complete shambles. When we had heard nothing for two full days we contacted our travel agent who then sorted out our flights home. Many other passengers did the same. Communication on the part of SS was shockingly bad - they could have saved themselves a lot of grief by keeping passengers informed better. On our second day in the port in Thailand (this would be 5/6 days after we were told the cruise was being aborted), knowing that everybody had to be off the ship by 4.30pm, there were still passengers who didn't know how they were getting home. Silversea took on the job but simply didn't have the resources to do it. They should have let everyone's travel agent deal with it from the outset. Our travel agent had already made three changes to the flights as the disembarkation point kept changing as we were denied entry. We understand that Silversea will be picking up any costs associated with the flight changes.Silversea told us we would get the 25% future cruise credit (the credit is 25% of what the travel agent paid for our cruise so we don't know exactly how much it would be and have nothing in writing to confirm the offer or the sum). I'm not sure it matters - I doubt we would sail with them in future & 25% isn't IMO generous for a completely ruined holiday. We aren't retirees and can't get back the annual leave we used, most of which was spent bobbing around waiting for a port to let us dock. We are partcularly annoyed as SS apparently denied boarding to Chinese passengers but allowed non-Chinese who had transited through China/HK to join the cruise. Those 12 passengers were the reason we were not allowed to dock in the Philippines or Taiwan. Even before we left Thailand Silversea had changed the disembarkation port so they had fair warning of problems ahead and didn't take the obvious step of denying boarding to the group who came via China which clearly increased the risk of being denied entry to other ports. It was hardly rocket science.There was a contingent onboard who thought SS were doing a great job, mostly SS loyalists - obviously they weren't the ones waiting for SS to sort out their flights or stressing about how they were going to get medication, etc.."
ANDMARThanks for the explanation I guess your travel agents work differently than here we book through the agent but all monies go to the cruise line directly not to the agentso if we were to cancel the $$ are returned to us not the TAToo bad you had such an ordeal It is not a good situation for any of the lines sailing in Asia now nor the pax stuck on ships for days Hope you get some resolution soon
"Princess have announced major changes to their cruises, including the cancellation of mine!https://www.princess.com/news/notices_and_ad…"
"lht, I'm not so sure it's that travel agents work differently. I think it's more that the legislative framework for holidays is very different here. The result is that relationships between agents, customers and lines are very different, and that also impacts on things like non refundable deposits."
ROJNot to go too far off topicbut just to understand so if the cruise lines cancel the cruise then the refund goes to the agent but not the pax then if the agent decides whether they want to refund the pax?? seems unfair
GRAEME too bad about the cancellation but in my opinion staying out of Asia for now might be a good thing I am not sure they have figured out how this virus is really transmitted
"Not quite. The money fr any cancellation where it was initially paid to the travel agent by the client is refunded to the travel agent, however, the travel agent must then refund this to the client. Maybe a small fee can be charged but only if that is in a contract at the time of booking, which is highly unlikely."
I think that there would be a lot of difference in the terms and conditions applied between genuine travel agents and the online ticket floggers.
I am booked on a 5 day cruise with Royal Caribbean going on 9th March 2020. Absolutely no idea if it will happen although they have cancelled their February cruises. Very frustrating as no idea really what is happening.
"Cathy - where are you sailing? RCCL is maintaining their updates on cancellations, status, etc via the website It's my understanding they've cancelled and redeployed the few Asian itineraries and ships they had.Cruises elsewhere in the world remain unaffected. The only March 9 RCCL cruise I see is one to the Bahamas - which currently (and for the foreseeable future) are totally unaffected. If I have the wrong sailing, I apologise.Monitor the RCCL website for updates, etc. They're the best source for any specifics."
"AndmarThat's a shame about SS not handling the matter as well as some other lines have been doing.Re ""Legally we have no contract with Silversea, only with SixStar"" ... you would have a contract with Silversea, however the contract you have with the Travel Agent over-rides the terms and conditions in the Silversea Terms and conditions to the extent that a Travel Agent can and often does charge cancellation fees whereas the cruise line may not. If you are buying a berth on a ship or a seat on a plane, you are still bound by the T&C of the carrier ... it's primarily the cancellation charges that you are obliged to pay the Agent."
DOUGOOZ I think SS was giving 100 % refund for the aborted cruise plus 25% off future cruise  Why would the TA be allowed to keep all of the refund ?I can see them keeping some of the refund if they are losing their commission in the deal but I would think that would be in the T & C of Six Star agency ??
"-:- Message from Tripadvisor staff -:-This post has been removed at the author's request. The author may repost if desired.Posts on the Tripadvisor forums may be edited for a short period of time. Once the edit period has expired, authors may update their posts by removing and reposting them.To read more about editing your posts, please follow this link: http://www.tripadvisor.com/help/how_to_edit_your_postsRemoved on: 4:58 pm, February 17, 2020Edited: 4:58 pm, February 17, 2020 "
LHTYes - you are correct ... sorry I misread the post ... but TA's here certainly can and do keep deposits if you cancel within time of the ship's T&C ... one I contacted in December said they can hang onto the deposit for 2 years because they wanted you to come back and buy another cruise from them !
DOUGOOZI do understand the penalties BEFORE the cruise but ANDMAR was on the ship when SS cancelled the rest of the cruise because the ports closing in fear of the virus I hope his/her TA will send the full refund to them
"lhtAgree ...Edited: 7:01 pm, February 17, 2020 "
"Thanks Doug - that's helpful and having checked our documentation again I can sea that Silversea is the principal as regards the cruise element. I'm still trying to find out what our position is overall - silence from the travel agent although I guess they are probably inundated with changes to itineraries. It isn't just the cruise fare I am concerned about but the flights (we don't fly long haul at the back!). I would like to think that they will be refunded too but I am not sure. The flights were organised by our travel agent, not Silversea. I have seen that Princess are allowing reasonable costs in addition to the cruise fare where they did not arrange flights. Our trip was a waste of time (& annual leave) - we managed only one port out of seven. We don't regard the time spent floating around at sea whilst they tried to find a port that would accept us as part of the holiday. As each port said no and Diamond Princess was quarantined in Yokohama we were worried the same was going to happen to us so pretty stressful. We also spent a lot of time chasing the amended flights home. It would be galling if we were hit for the flight costs in the circumstances.We have only a rough idea what the travel agent paid for the cruise (based on the discount figure on a future cruise which we were given) so it isn't clear what the refund from SS will be and whether the TA will take a portion of it as t would have been their primary profit (air bookings these days make little or nothing for the TA)."
Cruise line Silversea on May 5th out of Venice need to know if we should cancel my husband has an on going lung situation. thank you
Should we cancel with our insurance our trip from Venice cruise ship silversea may 5th he has lung situations
VITO that is something you should discuss with your Doctor You could check with SS to see if you can change or postpone the cruise without penalty Many lines are letting pax postpone cruises until a later date https:/…update-on-coronavirus.html
"We have a cruise booked out of Barcelona on a Spanish ship for next month. This cruise has three ports of call in Italy yet I can't find out what they are going to do for us and Vacations To Go is NOT helpful at all. They say they can only go by what the cruise company does. In other words...VACATIONS TO GO has no responsibility whatsoever to their customers. DO NOT USE THIS COMPANY. It will be too expensive in the long run.I asked Vacation To Go if I could postpone it for a year...NO, they said. Not a good company. Your welfare is of no importance to them. Friends who have booked cruises in Europe for later had no problems getting their refunds thru other agencies.Edited: 6:08 pm, March 12, 2020 "
OMG...I would and I would not hesitate a second to do it. These lung issues are scary for the patient.
"Marilyn, what cruise company are you with? Vacations to go is 100% correct, they can't dictate the supplier terms... having said that most cruise companies have at a minimum a rebooking policy"
MARILYN Have you checked the Cruise line site to see if they are offering any cancellations/FCC if you want to change your cruise?
more changes listed on CC check your cruise line for the final detailshttps://www.cruisecritic.com/news/5182/https://www.cruisecritic.com/news/5016/https://www.cruisecritic.com/news/5097/
"AVOID SILVERSEAS CRUISE GOING FORWARD> Massive stalling on refunds-if they can pay at all!. Surprise high hidden fees after 5 weeks too. Forget your airfare. I lasted one night in Auckland, NZ. Arrived 3/14/20. Cancelled 3/14/20. Home 3/15. I'm close to 70. $5,900 air. Promised refund for 5 weeks. My loyal rep a phoney. I'm Venetian Club. Then came huge hidden fees. So I put in dispute on Visa. Even after the vaccine, do u want to do business with this cruise line? (div of Royal Carib). PICK ANOTHER."
"Hi, Any news on a refund please- I am still waiting"
